,english,spanish
716,"page attended the okemos montessori school now called montessori radmoor in okemos michigan from  to  and graduated from east lansing high school in  he attended interlochen center for the arts as a saxophonist for two summers while in high school page holds a bachelor of science in computer engineering from the university of michigan with honors and a master of science in computer science from stanford university while at the university of michigan page created an inkjet printer made of lego bricks literally a line plotter after he thought it possible to print large posters cheaply with the use of inkjet cartridges—page reverse-engineered the ink cartridge and built all of the electronics and mechanics to drive it page served as the president of the beta epsilon chapter of the eta kappa nu fraternity and was a member of the  ""maize  blue"" university of michigan solar car team as an undergrad at the university of michigan he proposed that the school replace its bus system with a prt system which is essentially a driverless monorail with separate cars for every passenger he also developed a business plan for a company that would use software to b",south pierce es un territorio no organizado ubicado en el condado de pierce en el estado estadounidense de dakota del norte en el censo de  tenía una población de  habitantes y una densidad poblacional de  personas por km²[]​
717,the quarry reservoir llyn cob was once known as llyn owain lawgoch after the last male survivor of the princely house of the kingdom of gwynedd,karl hess toward liberty es un corto documental de  sobre el anarquista karl hess producido por roland hallé y peter w ladue esta película se hizo gracias a la valiosa ayuda de varios profesores y estudiantes de algunas universidades de estados unidos en  ganó el premio óscar al mejor corto documental[]​
718,"takis fotopoulos ""globalisation and the multi-dimensional crisis the inclusive democracy approach"" theomai journal no  nd semester  retrieved  january ",en  divac fue traspasado a los charlotte hornets a cambio de los derechos de kobe bryant aunque ya para entonces el pívot se había convertido en uno de los primeros jugadores europeos en causar impacto real en la nba junto al alemán detlef schrempf y el holandés rik smits después de jugar dos años para la franquicia entonces ubicada en carolina del norte el yugoslavo fichó como agente libre por los sacramento kings que ese mismo verano firmaron al ala-pívot chris webber y al base jason williams
719,"in the s he was a professor of philosophy at trier in  he was in cologne conducting astronomical observations and optical measurements and in  his work novem stellae circa jovem visae circa saturnum sex circa martem nonnullae ""nine stars seen around jupiter six around saturn several around mars"" appeared in  he published oculus enoch et eliae siue radius sidereomysticus a very influential work on optics and astronomy",publicado por primera vez en  en  salió una segunda versión mejorada ha sido traducido a diversos idiomas y está respaldado por varias organizaciones para el cuidado de la salud[]​
720,"ilex in latin means the holm-oak or evergreen oak quercus ilex despite the linnaean classification of ilex as holly as late as the th century in britain the term ilex was still being applied to the oak as well as the holly – possibly due to the superficial similarity of the leaves the name ""holly"" in common speech refers to ilex aquifolium specifically stems with berries used in christmas decoration by extension ""holly"" is also applied to the whole genus the origin of the word ""holly"" is considered a reduced form of old english holeġn middle english holin later hollen the french word for holly houx derives from the old low franconian *hulis middle dutch huls both are related to old high german hulis huls as are low germanlow franconian terms like hülse or hulst these germanic words appear to be related to words for holly in celtic languages such as welsh celyn breton kelenn and irish cuileann",también fue co-propietario de rattlebox studios en toronto ontario con el productor brian moncarz[]​ moneen basia lyjak y[the getaway plan son algunos de los artistas que han grabado en la instalación
721,"many students and teachers were enlisted during world war i which had a significant effect on life at columbia pupils in assembly regularly delivered patriotic ""four-minute speeches"" every room in the school had a full complement of war posters",main  a new genus of clubionoid spider from western australia arachnida araneomorphae australian entomological magazine vol p-
722,in the school year -  of the students were african american and  were caucasian within this black-and-white composition are found a variety of ethnic backgrounds including jamaican nigerian haitian african-american english french jewish polish italian and irish there has been much discussion regarding the racial academic achievement gap in the school district and the tracking is often cited as the most glaring example of a racial disparity,el concepto surgió históricamente en varias entidade políticas de europa y asia vinculándose con el concepto de imperio aunque trascendiendo de él
723,ilex  or holly is a genus of  to  species of flowering plants in the family aquifoliaceae and the only living genus in that family the species are evergreen or deciduous trees shrubs and climbers from tropics to temperate zones worldwide,los matrimonios arreglados entre señores feudales ciudades-estados y reinos como un medio para establecer alianzas políticas el comercio y la paz fueron comunes en la historia humana hasta el siglo xviii[]​[]​[]​
724,david kent born  is an australian music historian and pop culture writer kent produced the kent music report compiling the national music chart from may  to  it was known as the australian music report from  the music reports were a weekly listing of the national top  chart positions of singles and albums kents music reports were used by australian recording industry association aria as its official aria charts from mid- until july  when aria developed an in-house chart,los matrimonios arreglados eran los más comunes en todo el mundo hasta el siglo xviii[]​ por lo general los matrimonios estaban dispuestos por los padres abuelos u otros parientes algunas excepciones históricas son conocidas como los rituales de cortejo y esponsales durante el período renacentista de italia[]​ y los matrimonios gandharva en el período védico de la india[]​
725,maurice herzog sport complex including athletics training tracks football space archery practicing area gymnastic room climbing wall a table tennis room,durante los siete cursos que pasó en los ángeles fue desarrollando cada vez más su faceta como asistente llegando a promediar en la temporada -  pases a canasta por partido una impresionante estadística para un jugador de su tamaño y posición paralelamente también fue ganando cierta fama de teatrero pues se le acusaba de fingir demasiadas faltas cuando su cuerpo entraba en contacto con el de sus adversarios debido a ello el periodista español andrés montes le apodó vittorio gassman haciendo analogía entre el actor italiano del mismo nombre y las dotes interpretativas del yugoslavo[]​
726,hanna is currently on the board of victim support service and is patron of numerous local sporting clubs he was the longest-serving member of the seaview high school governing council and had been president of friends of glenthorne and the reynella business  tourism association,un manga spin-off ilustrado por ryota yuzuki comenzó a publicarse en kono manga ga sugoi web el  de agosto de  este manga presenta una historia original del autor
727,on  july  katsikas signed a year contract with the dutch club twente for an undisclosed fee twente coach alfred schreuder was pleased with this transfer as he could build on katsikas experience on  september  in the training katsikas has suffered a cruciate ligament rupture and he is going to undergo a surgery which makes him miss the remainder of the season the greek centre back is expected to stay on the sidelines for six to nine months missing potentially the start of twentes pre-season over the summer  on  august katsikas made his comeback in the awaygame against fc groningen,un complemento directo en voz activa se transforma en sujeto después de operar en la oración un cambio de diátesis esta transformación sólo puede ocurrir si el complemento directo desempeña su función típica de paciente o experimentador
728,one oj- modiﬁed in early  with an naca-type cowling and enclosed cockpits was delivered for trials as the xoj- but after a crash it was rebuilt and returned to service as an oj-,habiendo una gran sequía la gente del pueblo solicita ayuda a san isidoro por medio de una rogativa llevaron sus restos en procesión al llegar a la localidad del trobajo del camino a dos leguas de la ciudad la urna que contenía los restos de san isidoro empezó a pesar y los mozos que pujaban no podían con ella la dejaron en el suelo y empezó a llover copiosamente pero los restos del santo no se dejaban levantar del suelo
729,a capable rough-hewn leading man his toothy grin and lanky physique made him a perfect tough guy in numerous leading and supporting roles in westerns and action films such as the magnificent seven hell is for heroes the great escape charade our man flint in like flint duck you sucker and cross of iron coburn provided the voice of henry waternoose in the pixar film monsters inc,cribrostomoides es un género de foraminífero bentónico de la subfamilia recurvoidinae de la familia ammosphaeroidinidae de la superfamilia recurvoidoidea del suborden lituolina y del orden lituolida[]​ su especie tipo es cribrostomoides bradyi su rango cronoestratigráfico abarca el holoceno
730,"david kent was born in sydney australia he listened to local radio broadcasts of top hits such as ""rock around the clock"" by bill haley in ",- propaganda y agitación antisoviética y contrarrevolucionaria por lo menos  meses de prisión en las condiciones de agitación o guerra lo mismo que 
731,in  coburn starred in the zapata western duck you sucker with rod steiger and directed by sergio leone as an irish explosives expert and revolutionary who has fled to mexico during the time of the mexican revolution in the early th century this was not as highly regarded as leones four previous westerns but was hugely popular in europe especially france,el genio científico que dirige los intentos de reconstruir al gran general lo último en ingeniería robótica termina por convertirse en el estratega jefe del general cuando se proponen apoderarse del mundo
732,it is the location of foel grochan a slate quarry which together with hen chwarel and ceunant ddu formed the aberllefenni slate quarry which extracted rock from mediaeval times until the beginning of the st century,"en la antigüedad tardía y la edad media europea el nuevo contexto cultural y religioso del cristianismo se superpuso a la herencia cultural clásica grecorromana y el concepto de estado y sociedad del imperio romano de ese sincretismo surgió la oposición de dos poderes universales que se disputaban el dominium mundi ""dominio del mundi"" el pontificado y el imperio primero el imperio bizantino y desde el siglo ix el sacro imperio germánico teocracia y cesaropapismo fueron sus principios animadores"
733,the work of colston westbrook with los angeles police departments ccs criminal conspiracy section and the state of californias sacramento-based cii criminal identification and investigation unit and,el gobernador es el encargado de la administración del departamento es elegido por voto popular ejerciendo un periodo de cuatro años y quien también nombra su gabinete compuesto por sus secretarios las cuales son las siguientes
734,whats up chuck  award-winning investigative story about the curious relationship between big insurance and the california insurance commissioner chuck quackenbush,desde  la presencia de divac en la selección no fue permanente delegando su liderazgo en jugadores como dejan bodiroga o su delfín stojakovic no obstante fue partícipe de la última medalla olímpica del combinado yugoslavo -plata en atlanta - y de su último título -oro en el mundial de indianápolis de 
735,on november   the group released their sixth studio album set in stone set in stone peaked at no on the billboard reggae albums chart and spent  weeks on the chart it appeared on six billboard charts overall including no  on the billboard  no  on digital albums no  on heatseekers albums no  on independent albums and no  on the top album sales chart,se encuentra en los estados de río de janeiro são paulo rio grande do sul y santa catarina de brasil en la selva costera del atlántico en alturas de  a  metros como una orquídea de tamaño pequeño que prefiere el clima cálido y tiene un crecimiento de hábitos epífitas
736,her occupations include former director of marketing at chi-huan associates and mercenary she is a mutated humantechnology user and has been a member of the crimson cowls masters of evil joystick was a member of the thunderbolts which at the time also included atlas blizzard mach-iv photon radioactive man songbird and speed demon,por el contrario la prevención de los matrimonios arreglados le puede hacer daño a muchas personas que quieren casarse y pueden beneficiarse de la participación de los padres en la búsqueda y selección de un compañero por ejemplo willoughby sugiere[]​ que los matrimonios arreglados funcionan porque eliminan la ansiedad en proceso de encontrar el sr y la sra derecho los padres familiares y amigos proporcionan una perspectiva independiente cuando participan en el aprendizaje y la evaluación de la otra persona la historia pasada la conducta así como la compatibilidad mutua de la pareja willoughby sugiere además que los padres y la familia proporcionan más de la entrada en el proceso de investigación y selección a menudo proporcionan apoyo financiero para la boda la vivienda el apoyo emocional y otros recursos valiosos para la pareja ya que navegar más allá de la boda en la vida matrimonial y ayudan a criar a sus hijos
737,subject matter experts such as journalist robert moore author of the novel upon which the film is based along with david russell commodore british royal navy who tried to save the men from kursk and submarine expert ramsey martin are advising the filmmakers,el partido guatemalteco del trabajo trató de sostener la guerra popular prolongada en tres fases adoptada en el iii congreso del partido donde se estableció como opción única la utilización de todas las formas de lucha y lo confirmó un año después al definir que la lucha armada «es la que permitirá el acceso al poder» sin embargo ante los errores tácticos y estratégicos cometidos por la dirección del partido las far desautorizaron al pgt en  y decidieron reorganizarse y continuar solos en la lucha[]​ las far se separaron del pgt con un apoyo generalizado de los sectores juveniles no sólo por los errores tácticos y estratégicos del pgt sino que también por las diferencias frente a la cuestión indígena mientras que el pgt sostenía la clásica posición del comunismo ortodoxo afirmando que la pobreza de los indígenas era una consecuencia directa de las diferencias de clase social los jóvenes de las far adhiriendo al pensamiento de ernesto che guevara sostenían que los problemas de los indígenas no podían ser abordados solamente mediante los clásicos análisis de clase
738,andrew shue born  class of  actor best known for his leading role on the television series melrose place he also appeared in the  film gracie and served as producer for it,”relato romántico malogrado por la dirección balbuceante y equivocada que tiene su principal y primitivo error en la mala adaptación hecha del libro original”
739,weber pays special attention to brahmins and considers why they occupied the highest place in indian society for many centuries with regards to the concept of dharma he concludes that the indian ethical pluralism is very different both from the universal ethic of confucianism and christianity he notes that the varna system prevented the development of urban status groups,la european organization for civil aviation equipment abreviado eurocae y en español es una organización de uso común que se ocupa de crear estándares para la electrónica en la aviación la eurocae se creó en  en lucerna suiza si bien las oficinas de la eurocae están situadas en malakoff francia en las cercanías de parís
740,the news  review is a group of free alternative weekly newspapers published by chico community publishing inc of chico california the company publishes the chico news  review in chico california the sacramento news  review in sacramento california and the reno news  review in reno nevada,mary barrett dyer ? -  de junio de  fue una cuáquera inglesa que fue ahorcada en boston massachusetts por desacatar reiteradamente una ley que prohibía a los cuáqueros entrar en la colonia de massachusetts está considerada la última mártir religiosa de américa del norte
741,kent expanded his business and incorporated physical sales to supplement information from radio stations from  by  major record companies used his chart information in their advertising kents staff sent surveys to retail stores collated sales figures together with radio charts by states and then used his ranking system to assemble the national kent music report by  retail sales by survey was the main source of kents reports,en septiembre de  luego de su bajo rendimiento recurrentes lesiones y pocas actuaciones abandona la nba por lo que regresa a la liga acb en donde firma un contrato con el real madrid de baloncesto luego de que el barcelona descartara su fichaje pese a ser el apoderado de su ficha para aquel momento durante toda la temporada es un jugador clave para hacer historia y ganar los cinco títulos disputados[]​
742,john sutcliffe died  was a british fashion designer and fetish photographer famous in the s s and s as a designer of clothes for aficionados of leather rubber and pvc fetishism with an emphasis on rubber and leather catsuits cloaks and gasmasks,estaba subdividido en tres grandes bloques el más próximo al grao es el cañamelar que se extendía desde el riuet hasta la acequia de gasc o del gas[]​ el cabañal se extendía a continuación desde la acequia del gas hasta la acequia de los ángeles y la punta de francia desde la de los ángeles hasta la acequia de la cadena en el diccionario de madoz - aparece la siguiente descripción
743,in a closing prosecution statement that hardly made mention of hearst having been kidnapped prosecutor browning suggested hearst had taken part in the bank robbery without coercion browning also suggested to the jury that the female sla members being into feminism would not have allowed hearst to be raped he said that hearst having kept an olmec carving given to her by wolfe showed that she had lied about being subjected to rape by him,desde este instante las asociaciones de vecinos y plataformas que se oponían al plan iniciaron una serie de medidas legales en favor de la rehabilitación del barrio sin la prolongación de la avenida esta batalla legal mantendría el plan paralizado mientras que la degradación del barrio en las zonas afectadas por la misma no ha dejado de aumentar
744,"hamilton first played with grateful dead bassist phil lesh on march –  at leshs terrapin crossroads in san rafael ca as a member of phil and friends this was followed by another concert at terrapin crossroads on october   which was billed as ""east coast all-stars"" and a three night run on december – to close out  at the capital theatre in port chester ny billed as ""philrad""",la división estuvo completamente operativa desde el  de mayo con uniformes armamento y municiones proporcionados por las ss nazis pero con apenas  integrantes no tenía el tamaño esperado para una división de las waffen ss oficialmente estas divisiones comprendían al menos de  a  hombres ante tal situación esta unidad fue destinada aunque aún no estaba completa a las operaciones antipartisanas al norte de montenegro e igualmente contra los partisanos comunistas albaneses liderados por enver hoxha
745,back at fox coburn made a second flint film in like flint  which was popular but coburn did not wish to make any more he went over to paramount to make a western comedy waterhole no   and the political satire the presidents analyst  neither film performed particularly well at the box office but over the years the presidents analyst has become a cult film in  coburn was voted the twelfth biggest star in hollywood,su vida privada estuvo marcada por las continuas peleas y enemistades entre su familia y por la intensa rivalidad mantenida con sus colegas de pisa
746,vulnerable is the third posthumous album by marvin gaye recorded in sessions throughout  the album was a decade in the making first being worked on in  during sessions in new york with bobby scott reworked by gaye a decade later the album was originally going to be released in  under the title the ballads but was shelved two decades later motown released it under the title vulnerable including seven songs from the sessions and three alternate cuts,en  se anuncia su próxima incorporación junto con otros grandes baloncestistas entrenadores y dirigentes europeos en el prestigioso salón de la fama[]​
747,"the world branding forum is the organiser of the world branding awards an international award presented to some of the best global and national brands for their work and achievements in branding it is also the owner of the awards ""brand of the year"" logo which is a registered trademark",cuatro años más tarde el  de octubre de  y ya gobernando el partido popular en la comunidad valenciana la comisión de gobierno del ayuntamiento de valencia acuerda encargar la redacción de un plan de reforma interior pri del conjunto histórico protegido del cabanyal-canyamelar en la fase de presentación de sugerencias se presentaron  firmantes en contra del proyecto de prolongación de la avenida y solo  a favor[]​ sin embargo el ayuntamiento anunció un año más tarde que elegía la opción de la prolongación acodada y pasaba a denominarlo plan especial de protección y reforma interior pepri
748,coburns film debut came in  as the sidekick of pernell roberts in the randolph scott western ride lonesome he soon got a job in another western face of a fugitive ,los miembros de la eurocae provienen de las autoridades aeronáuticas internacionales ej easa caa lba fabricantes de aviones proveedores de servicios de seguridad aérea aerlolíneas operadores de aeropuertos y otras entidades afectadas el desarrollo de los documentos de la eurocae que utilizan la abreviatura ed es de carácteri voluntario eurocae actúa como un marco en el que diferentes grupos de trabajo de expertos del sector aeronáutico intercambian sus conocimientos para el desarrollo de estándares eurocae es el equivalente en europa a la rtca norteamiercana
749,in  page received an honorary doctorate from the university of michigan during a graduation commencement ceremony in  he was ranked th on the forbes list of billionaires and as the th richest person in the us,"julie benz comento que ""el embarazo fue el momento más emocionante de tanto de su personaje darla como el de su carrera"" ""descubrí que fue el momento más wow que tuve con ella siempre bromeábamos que podría embarazarse pero siempre fue broma""[]​"
750,linus yale jr improved upon his fathers lock in  using a smaller flat key with serrated edges that is the basis of modern pin-tumbler locks yale developed the modern combination lock in ,se especializó en poesía española del siglo xx y se licenció y doctoró en la universidad complutense con una tesis sobre la obra literaria de león felipe constitución simbóĺica de un universo poético  editó la poesía de este autor y también escribió amplios estudios sobre la obra de antonio buero vallejo leopoldo panero y ramón gómez de la serna recuperó y editó una novela inédita de pedro salinas el valor de la vida fue profesor titular de literatura española del siglo xx  catedrático  y jefe del departamento de filología española ii literatura española de la universidad complutense de madrid  dirigió el grupo de investigación temas y géneros de la literatura española en la edad de plata y su proyección realizó numerosas ediciones de poesía y teatro del siglo xx español revalorizando el de miguel de unamuno con sus ediciones y publicó abundantes artículos monográficos y reseñas sobre su especialidad particularmente para dicenda y compás de letras dirigiendo además varias tesis sobre literatura moderna española
