,english,spanish
253,full disclosure requires that full details of a security vulnerability are disclosed to the public including details of the vulnerability and how to detect and exploit it the theory behind full disclosure is that releasing vulnerability information immediately results in better security fixes are produced faster because vendors and authors are forced to respond in order to protect their system from potential attacks as well as to protect their own image security is improved because the window of exposure the amount of time the vulnerability is open to attack is reduced the issue of full disclosure was first raised in a th-century controversy over the revelation of lock-system weaknesses to the public according to a c hobbs,mascota de sutton es jenny la jirafa[]​ asiste a todos los partidos en casa y puede ser visto antes del saque inicial jenny lleva una camisa sutton united y ha sido conocido por usar una bufanda en invierno[]​ el  de octubre jenny participó en el  mascot grand national en hipódromo de huntingdon[]​ y terminó  º de  corredores[]​
254,"when goodrem was  years old her first manager glenn wheatley signed her to an artist development deal with independent label empire records to see if she possessed potential as a recording artist between june  to june  she worked with producers paul higgins and trevor carter on thirteen tracks for an album called delta which saw ""an ambitious -year-old keen to emulate the pop sound of the spice girls britney spears and mandy moore"" most tracks were written by carter although goodrem did co-write a couple of tracks including the sole-penned ""love"" goodrem did a photoshoot for the album some of the photos have surfaced and recorded a home-made style music video for the song ""say"" which has since leaked onto the internet higgins took the album to roadshow who offered to market and distribute the album but the deal was knocked back by goodrems parents in september  goodrem signed to sony music and the album was shelved a year later goodrem released her debut single ""i dont care"" and in late  released her breakthrough international hit ""born to try"" with many number ones to follow","""slow"" se convirtió en su tercer lanzamiento en llegar a la cima del billboard hot dance también un buen resultado en la lista de radiodifusión hot dance donde alcanzó el número siete la canción sin embargo no fue un éxito en el billboard hot  debutando en el número noventa y tres antes de alcanzar un máximo en el número noventa y uno gasto sólo tres semanas en la lista"
255,during his tenure at the mossad he helped carry out operation wrath of god the israeli response to the munich massacre and dealt with the lead up and aftermath of the yom kippur war in  after the german government refused to accept an israeli team during the munich hostage crisis zamir was sent to observe any activities he was at the fürstenfeldbruck airbase the night that the failed rescue attempt left all nine remaining israeli hostages dead zamir was interviewed about the incident in  when he spoke with the producer of one day in september a documentary on the massacre in it he strongly criticized the german rescue effort for its complete lack of coordination he had previously been interviewed on this subject for an nbc profile during their coverage of the  barcelona olympics and he has discussed the massacre several times since zamir currently resides in zahala a neighborhood in the north of tel aviv,para pasar la oración activa a pasiva hay que cambiar los constituyentes de las funciones sintácticas el complemento directo de la oración en voz activa pasa a ser el sujeto de la oración en voz pasiva mientras que el sujeto de la oración activa pasa a ser el complemento agente de la oración en voz pasiva ejemplo
256,over at columbia coburn was in a swinging sixties heist film duffy  which flopped he was one of several stars who had cameos in candy  then played a hitman in hard contract  for fox another flop,en  interpretó a ron meyers en la película provoked a true story la cual está ligeramente basada en la historia verdadera de kiranjit ahluwalia quien mató a su abusivo esposo
257,page is also interested in the socio-economic effects of advanced intelligent systems and how advanced digital technologies can be used to create abundance as described in peter diamandis book provide for peoples needs shorten the workweek and mitigate the potential detrimental effects of technological unemployment,la composición fue anotada en el catálogo personal de mozart el  de marzo de  y fue escrita en viena al parecer fue el encargo de un curioso aristócrata austriaco el conde joseph deym von stržitež el conde tuvo que huir de la ciudad en su juventud a consecuencia de un duelo pero más tarde regresó con el nombre de herr müller y fundó el kunstkabinett müller una especie de galería de arte en la rotenturmstrasse de viena en donde se exponían entre otras cosas las mascarillas de cera de josé ii de austria y después de su muerte del propio mozart deym poseía también varios curiosos órganos mecánicos movidos por mecanismos de relojería que interpretaban música cuando daban las horas
258,january   - the town of saganoseki was merged into the expanded city of ōita kita-amabe district was dissolved as a result of this merger,divac debutó con la selección senior de yugoslavia en  antes de desencadenarse los conflictos y tras un exitoso paso por las categorías inferiores incluida una medalla de oro en los juegos mundiales universitarios de  en su primera experiencia con la absoluta alcanzó la medalla de bronce en el campeonato del mundo de baloncesto celebrado en españa una presea que repetiría un año después en el eurobasket de grecia
259,in  while traveling to a peace summit between the united states china and russia air force one is hijacked by a domestic terrorist posing as a stewardess the president is given a tracking bracelet and his briefcase containing an audiotape describing the secret to using nuclear fusion for power generation handcuffed to his wrist he makes it to an escape pod and lands in manhattan just before air force one crashes killing everyone else aboard,mary dyer siguió viajando por nueva inglaterra para difundir la religión cuáquera por lo que volvió a ser arrestda en new haven connecticut después de su liberación fue a massachusetts para visitar a dos cuáqueros ingleses que habían sido arrestados ella fue arrestada y esta vez permanentemente desterrada de la colonia regresó a massachusetts por tercera vez con un grupo de cuáqueros para públicamente protestar contra la ley y desacatarla de nuevo fue arrestada y después sentenciada a muerte tras un proceso breve otros dos cuáqueros fueron ejecutados pero como el esposo de ella era amigo del gobernador john winthrop a ella se le concedió un aplazamiento de último minuto-- en contra de sus propios deseos ya que había rehusado arrepentirse y negar su fe cuáquera[]​
260,on the first anniversary of september th the sacramento news  review brought together musical acts from different faith groups around sacramento for a call for unity event to symbolize the citys acceptance of racial and religious diversity every year someone in the region was honored with a building unity award for their interfaith work in sacramento until  when the last call for unity event was held,las cabezadas es el nombre que recibe una ceremonia civil y religiosa que se celebra en la ciudad de león españa el domingo más próximo a la festividad de san isidoro que se celebra el día  de abril
261,on leaving colchester in the summer of  wright was appointed trainer-coach at guildford city after qualifying as an fa coach and physiotherapist wright would hold coaching positions at walsall and luton town before being appointed head coach of first division everton in september , trajo el éxito al club una vez más pero esta vez en la forma de la fa cup sutton latido hillingdon borough en el tercer round y pasó a jugar don revie vuelo s top leeds united uno de los mejores equipos de europa en ese momento en el borough sports ground el encuentro hizo que  espectadores se metieran en el terreno y sevilla con  partidos internacionales en el equipo ganó -
262,"as of july  the bloomberg billionaires index lists page as the th richest man in the world with an estimated net worth of $ billion at the completion of  fortune magazine named page its ""businessperson of the year"" declaring him ""the world’s most daring ceo""",• martínez arroyo emilio josé silva dos santos fabiane cristina  el cabanyal un patrimonio rescatado por la ciudadanía revista ph nº   pp -
263,rollin on the river began in  as a community concert series and has evolved into one of renos largest free summer music events rollin on the river is held in wingfield park an island amphitheater on the truckee river during the month of july and features both local and regional touring artists,en marzo de  durante los últimos meses del gobierno del coronel enrique peralta azurdia treinta y tres líderes del pgt y otros partidos de izquierda «desaparecieron» entre ellos víctor manuel gutiérrez y leonardo castillo flores documentos de la cia desclasificados en  revelaron que habían sido asesinados clandestinamente por las fuerzas armadas[]​
264,the indian social system was influenced by the concept of varna varna is not caste and caste is not varna this is a critical difference not understood by many it directly linked religious belief and the segregation of society into status groups weber goes on to describe the varna system the brahmins - priests the kshatriyas - warriors the vaishyas - merchants the shudras - laborers and the untouchables,badia calavena es una localidad y comune italiana de  habitantes[]​ ubicada en la provincia de verona una de las siete provincias de la región de véneto
265,garden state  the school is both shown and referenced in this zach braff film which was partly filmed in neighboring south orange new jersey and millburn new jersey,morongo valley se encuentra ubicado en las coordenadas °′″n °′″o según la oficina del censo la ciudad tiene un área total de  kilómetros cuadrados  mi² de la cual  kilómetros cuadrados  mi² es tierra y  kilómetros cuadrados  mi²  es agua
266,"""always on time"" is the second single by american rapper ja rule from his third studio album pain is love the song would feature american rb singer ashanti and was produced by irv gotti the song was written by  aurelius ja rule and irving lorenzo the song became a worldwide hit and was ashantis first hot  number one single and ja rules second","fue uno de los primeros profesionales de ajedrez en brasil junto a los maestros hélder câmara antônio rocha y herman claudius en los años  eran conocidos como los ""cuatro grandes"" del ajedrez brasileño segal llegó a alcanzar  puntos a la fide él era un jugador de ajedrez carismático y tenía una memoria prodigiosa segal siempre repite que el gran maestro gilberto milos fue el jugador de ajedrez más fuerte de brasil se enfrentó"
267,in september  as part of the continuum  artists series an exhibit of her work opened in new york city and the george gustav heye center of the national museum of the american indian the exhibit included blanket stories a sculpture made of two towers of wool blankets with each stack sewn together with a central thread she collected the blankets over several years including many hudsons bay point blankets that were given to native americans in trade by the hudsons bay company during the th century,en  participó en la inauguración del teatro de las artes de la ciudad de méxico interpretando el papel de roggiero en la histórica representación de ildegonda del compositor mexicano melesio morales pasaron  años para que dicha obra fuera reinterpretada[]​ la representación de ildegonda se grabó en discos compactos los cuales ganaron el premio del orfeo de oro otorgado por la academia del disco lírico de francia
268,johnson was born in cleveland ohio on july   the son of a cleveland lawyer homer h johnson he was descended from the jansen family of new amsterdam and included among his ancestors the huguenot jacques cortelyou who laid out the first town plan of new amsterdam for peter stuyvesant he attended the hackley school in tarrytown new york and then studied as an undergraduate at harvard university where he focused on learning greek philology history and philosophy particularly the work of the pre-socratic philosophers upon completing his studies in  he made a series of trips to europe visiting the landmarks of classical and gothic architecture and joined henry-russell hitchcock a prominent architectural historian who was introducing americans to the work of le corbusier walter gropius and other modernists in  he met german architect ludwig mies van der rohe who was at the time designing the german pavilion for the  barcelona international exposition the meeting formed the basis for a lifelong relationship of both collaboration and competition,el día  de marzo de  los sacramento kings reconocieron su trayectoria en la franquicia retirando su dorsal número  aprovechando la visita al arco arena de uno de sus ex equipos los hornets entrenados en ese momento por su ex compañero en los lakers byron scott y en donde jugaba por entonces stojakovic
269,"moreover many hundreds of hybrids and cultivars have been developed for garden use among them the very popular ""highclere holly"" ilex × altaclerensis i aquifolium × i perado and the ""blue holly"" ilex × meserveae i aquifolium × i rugosa hollies are often used for hedges the spiny leaves make them difficult to penetrate and they take well to pruning and shaping",por este motivo y desde aquella fecha el concejo de la ciudad de león decidió pagar u ofrecer todos los años un tributo a san isidoro por mediación de sus representantes así lo relata en sus crónicas que se conservan en el archivo lucas de tuy
270,in  a partnership with the north valley community foundation and matching small community donations has helped support investigative journalism in butte county california,"charles aznavour le escribió este hermoso poema ""ella tiene la voz de las palabras y el corazón cuerpo ansiedad la voz de la vehemencia de la felicidad parecía perdida y encontrada algunas veces la voz que aboga por el amor el amor a la acción es el realismo de su generación """
271,"from the name of his grandson c sabucius maior plotinus faustinus who set up an inscription in his memory it is clear his gentilicum is ""sabucius maior"" ""sabucius"" is a rare etruscan nomen anthony birley provides two other known individuals of that gens suggesting his origins lay in italy and not one of the provinces",su comandante en su primer y exitoso viaje fue el capitán de navío otto kähler en sus dos viajes apresó o hundió  trb y en ese concepto fue el crucero auxiliar alemán con más éxito en la segunda guerra mundial su misión fue atacar el tráfico marítimo en el sur del atlántico y la conexión entre buques militares británicos
272,"the palace brand was founded around  in england united kingdom by lev tanju who was part of a london-based skate crew known as the palace wayward boys choir tanju enlisted the assistance of friends like graphic designer fergus ""fergadelic"" purcell also design director at marc by marc jacobs and photographer will bankhead to launch the brand tanju explained in  ""i just wanted to make some skateboards that looked nice and skated nice""",como actriz ha trabajado para productoras como evil angel girlfriends films wicked brazzers sweetheart video naughty america mile high pure play media forbidden fruits films mile high digital sin o hard x
273,"hearst reported ""i spent fifteen hours going over my sla experiences with dr robert jay lifton of yale university dr lifton author of several books on coercive persuasion and thought reform  pronounced me a classic case which met all the psychological criteria of a coerced prisoner of war  if i had reacted differently that would have been suspect he said""", varias escuelas clandestinas han surgido en los pueblos fargebelle luzet chaudon y briges son escuelas mixtas y la moral de entonces les asesta un golpe grave orden del alcalde para el control y la represión pero los de briges y luzet permanecen hasta hoy
274,haddad initially followed the hanafi school of sunni jurisprudence after his conversion to islam but later adopted the shafii school of sunni jurisprudence he stated he did so because  he found it easier to study due to shaykh nuh keller’s reliance of the traveler  he found it more logical to practice because it is the main school of jurisprudence in lebanon and because it is the school his wife follows and  the founder of the school imam shafii was a member of the quraysh tribe the tribe of muhammad and muhammad had told his followers to hold fast to the quran and the members of his household,marty ally y buttons se encuentran en el camino con un robot que había contratado von rahymer el jefe de la torre de hierro se trata de jack acero un asesino con la misión de recuperar a ally aunque marty lo encaró no logra salvar a ally y jack acero se va con ella pero encontes apareció un robot que se presentó como gaff el protector de la familia eon le contró a marty la verdadera historia que él era el último descendiente de eon que charlie no era su padre verdadero y que tendría que prepararse para pelear con el general que está siendo reconstruido por sus seguidores después de pensarlo un rato y razonar marty llega a la conclusión de que si quiere salvar a ally primero debe aprender a controlar sus poderes por lo que acepta los tres ponen rumbo a la antigua casa de los eon donde estaba el último gran maestro
275,in tombstone wyatt finds out that ike clanton is trying to herd thousands of head of rustled mexican cattle but cannot as long as the earps control tombstones railway station morgan earp deforest kelley criticizes his brothers association with holliday but wyatt insists the gunslinger is welcome in tombstone as long as he stays out of trouble cotton the cowardly county sheriff from fort griffin offers wyatt a $ bribe about $ today if he allows the stolen cattle to be shipped but wyatt refuses he rides out to the clanton ranch returning young billy clanton dennis hopper to his mother after finding billy drunk wyatt informs ike that he has been made a us marshal and has legal authority in every county in the united states finding no recourse the clantons decide to ambush wyatt as he makes his nightly rounds but kill his younger brother james earp martin milner by mistake,los matrimonios consanguíneos están prohibidos por la ley en muchas partes de estados unidos y europa[]​ mientras que los matrimonios consanguíneos son comunes y culturalmente preferidos en países islámicos y por inmigrantes de países musulmanes en otras partes del mundo están culturalmente prohibidos o considerados indeseables en la mayoría de las sociedades cristianas hindúes y budistas[]​ los matrimonios arreglados consanguíneos eran comunes en las comunidades judías hasta el siglo xx pero se han reducido a menos del  en los tiempos modernos[]​[]​
276,the armistice of salonica also known as the armistice of thessalonica was signed on  september  between bulgaria and the allied powers in thessaloniki the convention followed after a request by the bulgarian government on  september asking for a ceasefire the armistice effectively ended bulgarias participation in world war i on the side of the central powers and came into effect on the bulgarian front at noon on  september the armistice regulated the demobilization and disarmament of the bulgarian armed forces,tolima al sureste de caldas va desde el valle del magdalena medio pasando por la cordillera central hasta llegar al parque natural los nevados está representado por  municipios  del tolima honda mariquita fresno herveo casabianca villahermosa y murillo y  de caldas la dorada victoria marquetalia manzanares marulanda manizales y villamaría
277,page is an investor in tesla motors he has invested in renewable energy technology and with the help of googleorg googles philanthropic arm promotes the adoption of plug-in hybrid electric cars and other alternative energy investments,su mejor amigo era dražen petrović con quien triunfó en la selección de yugoslavia se fueron juntos a estados unidos para ser de los primeros extranjeros que triunfaron en la nba su amistad se terminó por malentendidos políticos durante la desintegración de yugoslavia dražen petrović murió sin poder reconciliarse con vlade divac 
278, i do think the internet’s under much greater attack than it has been in the past governments are now afraid of the internet because of the middle east stuff and so they’re a little more willing to listen to what i see as a lot of commercial interests that just want to make money by restricting people’s freedoms but they’ve also seen a tremendous user reaction like the backlash against sopa i think that governments fight users’ freedoms at their own peril,miha zupan nacido el  de septiembre de  en kranj eslovenia es un jugador de baloncesto esloveno con  de estatura su puesto natural en la cancha es el de ala-pívot con una discapacidad auditiva desde nacimiento este ala-pívot es el primer baloncestista sordo en jugar en la euroliga[]​ actualmente juega en el csm oradea
279,they are extremely important food for numerous species of birds and also are eaten by other wild animals in the autumn and early winter the fruits are hard and apparently unpalatable after being frozen or frosted several times the fruits soften and become milder in taste during winter storms birds often take refuge in hollies which provide shelter protection from predators by the spiny leaves and food the flowers are sometimes eaten by the larva of the double-striped pug moth gymnoscelis rufifasciata other lepidoptera whose larvae feed on holly include bucculatrix ilecella which feeds exclusively on hollies and the engrailed ectropis crepuscularia,este trazado original pronto se vería modificado al construir las facultades de medicina y ciencias en  josé pedrós trata de adaptar la continuidad del paseo al cabañal mediante un enlace con el barrio en forma de herradura y un leve giro hacia el norte adaptándose a la malla del barrio el plan apenas llegó a ejecutarse en algunos tramos y en el cabanyal tan sólo el ensanche sobre la calle mediterráneo queda como recuerdo ya en  el colegio de arquitectos redacta un informe en el que se opone al proyecto y en especial a la creación de una gran avenida a través del cabanyal[]​
280,the delta goodrem unreleased tapes dispute involves unreleased material recorded by australian singer-songwriter delta goodrem in  and  goodrem recorded thirteen tracks for an album given the working title delta while signed to an artist development deal with the small independent label empire records in  after goodrem had achieved mainstream success empires owners attempted to shop the recordings to other labels though goodrem objected the dispute led to a lawsuit which was settled in mediation to the effect that the recordings would remain unreleased,la caballería blindada del general y las mejores tropas de primera línea usadas en la guerra robot gigantescos y ataviados con armaduras oscuras estos robots centauroides son casi invencibles en el combate cuerpo a cuerpo para el que usan electrovaras su líder es de color dorado y más fuerte que los demás son usados por el general para impedir el acceso a la torre de hierro aunque son finalmente derrotados por marty magnum shadow y gaff
281,david javerbaum class of  writer and producer head writer for the daily show writer for the onion david letterman and his own theatrical productions first runner-up in  jeopardy teen tournament,el equipo ha tenido varios éxitos tuvieron la experiencia de jugar en el wembley dos veces por la final de la fa copa amateur y una vez en la final de la fa trophy además el club se adjudica el torneo anglo-italian cup del  el club logró una hazaña en la fa cup cuando vencieron a coventry city en la tercera ronda en  es la última vez que un equipo que no disputa ninguna liga logra vencer a un equipo de la máxima categoría del fútbol inglés
282,"weber discussed what influence hinduism and buddhism had on the mundane activities and how they impacted the economy he noted the idea of unchanging world order consisting of the eternal cycles of rebirth and the deprecation of mundane world by the traditionalism of the varna system supported by the dharma the economic development is slowed as - according to weber - the ""spirit"" of the varna system worked against the development of capitalism",con la victoria de júlio de castilhos y la consecuente pacificación organizó un nuevo congreso federalista en porto alegre a partir de entonces prestó más atención a su vida en la estancia rincón pereyra que poseía en uruguay falleció repentinamente en una habitación de un hotel de montevideo
