,english,spanish
501,zvi zamir hebrew צבי זמיר‎ born zvicka zarzevsky born  was a major general in the israel defense forces and the director of the mossad from  to  born in poland zamir immigrated with his family to the then british mandate of palestine when only seven months old at the age of  zamir began his military career first as a soldier in the haganahs palmach a unit that included future israeli leaders among the likes of moshe dayan and yitzhak rabin during the  arab–israeli war zamir fought in the newly created israel defense forces after the war he continued climbing the chain of command eventually promoted to the commander of the southern command his final idf post before being appointed mossad director came in  when he was appointed the military attaché to london, debía de ser la temporada de la consagración de elissonde pero no fue así comenzó su temporada de nuevo en el tour de omán pero no repitió el éxito del año pasado y esta vez fue º en la clasificación general final en el tour de lain en el que el año pasado se llevó la clasificación de los jóvenes solo puso ser º
502,texas am hired kennedy in may  after mark turgeon left for the maryland head coaching job kennedy previously coached at am from - kennedy stated at the press conference that am is his destination job and he plans to retire there he was given the honors of sec mens basketball coach of the year in ,en su travesía se encuentran con gaff un robot nómada guardián de la familia eón cuya misión es proteger al puño a los miembros del clan eón e impedir que el cuerpo robot del malvado general se reconstruya en algún laboratorio secreto y lejano en compañía de ally marty emprende entonces un largo camino de instrucción y desarrollo propio del único ser humano capaz de desarrollar los heroicos planes que la familia eón le tenía reservados en donde de a poco se va transformando en el último heredero de la familia eón
503,philip johnson architectural drawings - bulk -held by the department of drawings  archives avery architectural  fine arts library columbia university,chile también está ansioso por establecer nuevos mercados de exportación en rusia por su creciente producción de arándanos ha expuesto al último espectáculo de ife en moscú por primera vez en - rusia sobrepasó a españa convirtiéndose en el tercer mayor mercado de exportación de frutas de chile con exportaciones globales al país principalmente manzanas y uvas de mesa creciendo en un  por ciento de  a  toneladas[]​
504,"avco embassy pictures the films financial backer preferred either charles bronson or tommy lee jones to play the role of snake plissken to carpenters choice of kurt russell who was trying to overcome the ""lightweight"" screen image conveyed by his roles in several disney comedies carpenter refused to cast bronson on the grounds that he was too old and because he worried that he could lose directorial control over the picture with an experienced actor at the time russell described his character as ""a mercenary and his style of fighting is a combination of bruce lee the exterminator and darth vader with eastwoods vocal-ness"" all that matters to snake according to the actor is ""the next  seconds living for exactly that next minute is all there is"" russell used a rigorous diet and exercise program in order to develop a lean and muscular build he also endeavored to stay in character between takes and throughout the shooting as he welcomed the opportunity to get away from the disney comedies he had done previously he did find it necessary to remove the eyepatch between takes as wearing it constantly seriously affected his depth perception",su resultado más destacado de la temporada llegó en la ruta del sur en el que logró un buen º puesto en la general además de ser º en su etapa reina entre bagnères-de-bigorre y val-louron y º en la etapa de saint-gaudens a castres también obtuvo un º puesto en la etapa reina del dauphiné liberé acabada en el col du béal sorprendentemente se quedó fuera del equipo del tour de francia en el que se veía como un buen complemento a thibaut pinot
505,ilex mucronata formerly the type species of nemopanthus is native to eastern north america nemopanthus was treated as a separate genus with eight species of the family aquifoliaceae now transferred to ilex on molecular data it is closely related to ilex amelanchier,mayoritariamente la población caldense es mestiza y blanca los pueblos y asentamientos indígenas ocupan el segundo lugar y por último las comunidades afro descendientes
506,orner along with actress cate blanchett was one of only two australians nominated for an oscar in  most commentators predicted that michael moores sicko would win the best documentary category however to the surprise of many orners taxi to the dark side which examines us torture practices in afghanistan iraq and guantanamo bay received the award,la tarjeta de fidelización o fidelidad que también se conoce como tarjeta de beneficios y descuentos o tarjeta de puntos es el soporte físico de programas que ofrecen bonificaciones descuentos premios etc al titular cuando consume productos de la empresa emisora de la tarjeta
507,the berliner joyce design a conventional biplane of mixed metal and fabric construction with staggered wings and the pilot and observer seated in tandem in open cockpits first flew in may  by that time the rival xok- was already destroyed in a crash following trials that lasted into  buaer awarded berliner-joyce a contract,impresionado con los buenos informes de pardo menéndez ordenó una segunda expedición el  de septiembre de  pardo partió de nuevo llevando aproximadamente entre  y  hombres en siguiendo el valle de catawba y las montañas de carolina del norte —y esta vez en tennessee— en busca de un camino seguro hasta las minas de plata de zacatecas durante el viaje fueron alimentados por los indios que había almacenados maíz exclusivamente para los españoles antes de regresar a jaora pardo se reunió con guatari mico y orata chiquini dos caciques femeninas después de una corta estancia en jaora en el fuerte san juan —donde supo que los nativos estaban disgustados por las demandas de comida mujeres y canoas de los españoles así como por la introducción de nuevas enfermedades— pardo se dirigió hacia las montañas para ayudar a moyano los españoles se detuvieron en tacoe cerca de asheville y en cauchi cerca de marshall antes de viajar hacia el este de tennessee donde se encontró con moyano y sus hombres que estaban encerrados en un fuerte pero ilesos más tarde viajando a través de las grandes montañas humeantes great smoky mountains pardo debido a un informe de u
508,inspired by his tempestuous relationships with his wives anna gordy and janis hunter gaye added more of a personal depth in the songs he recorded for the album,la ciudad ocupa una estrecha franja de tierra a lo largo de la costa oriental de la bahía de manila navotas está situada al norte de manila al oeste de malabón y al sur de obando en bulacan
509,all  tracks were written and produced by woodruff one of which features vocal by reggae singer half pint and one of which features vocals from woodruffs close friend tj oneill woodruff cowrote five of the tracks with oneill the two had spent time traveling abroad together in indonesia australia fiji thailand and new zealand starting in  finding mutual inspiration for songwriting,"también pueden funcionar como complemento directo sintagmas preposicionales encabezados por ""a"" si éste se refiere a personas animales u objetos animados y además esa oración carece de complemento indirecto"
510,president jimmy carters commutation of her federal sentence to the  months served freed hearst eight months before she would have had a parole hearing the  release was under stringent conditions and she remained on probation for the state sentence on the surplus store plea president ronald reagan reportedly gave serious consideration to pardoning hearst she recovered full rights when president bill clinton granted her a pardon on january   his last day in office,la década de  trajo mucho éxito para sutton aunque el equipo se dice que ha progresado fuera del campo los activos fueron transferidos a una sociedad de responsabilidad limitada algo que era inusual para la época además la tribuna principal que se construyó hoy cuenta con más de  espectadores no fue sino hasta george smith se convirtió en gerente de que el éxito devueltos el título de la liga ateniense fue ganado por tercera vez en  y el club ganó la londres senior cup por primera vez progresando en los años  bajo sid cann el período más exitoso de sutton en  el club llegó a wembley en la fa copa amateur pero perdió - ante el wimbledon
511,europacorp has international rights to the film which will be released through europacorps new distribution company red relativity europacorp distribution stxfilms will distribute it in the united states,ally es una chica prodigio cuyas capacidades son usadas por el duque von rhymer para descifrar unos códigos informáticos que permiten reactivar el destructivo arsenal del general que pronto revivirá para desatar una nueva guerra cuando ally se entera de la verdad huye de la torre de hierro lugar en donde pasó su infancia bajo la vigilancia del duque y se une a marty para vivir con él este largo recorrido a ciudad cristal
512,"in addition to ""dream warriors"" the single contained the songs ""back for the attack"" a previously unreleased track and ""paris is burning"" from the album breaking the chains",manfredo iv del vasto continuó la política que inició su padre centrada en el desarrollo del marquesado su padre convirtió a saluzzo en una ciudad libre gobernada por un alcalde en su nombre pero fue manfredo el que desarrolló un contrato que definía las normas y relaciones entre el marqués y la ciudad
513,two months after her release from prison hearst wed bernard lee shaw – a policeman whom she had met when he was part of a dozens-strong private security detail protecting her on bail the marriage lasted until his death in  they had two children gillian and lydia hearst-shaw hearst became prominent on the east coast society and charitable fundraising scene and was particularly involved with a foundation helping children suffering from aids,"el nombre de punta maldonado fue puesto en una clara alusión al poblado cercado de maldonado el cual se localiza dentro del mismo municipio posteriormente de la construcción de un faro el poblado empezó a ser conocido como ""el faro"""
514,b securing freedom of choice in a marketless moneyless and stateless ‘scarcity–society’ which has not yet achieved universal autarky self-sufficiency,la salsa incluye trufas y setas finamente picadas que proporcionan un aroma característico algunas recetas incluyen jamón finamente picado la pasta resultante se calienta en un medio graso como puede ser mantequilla o aceite en ciertas ocasiones se emplea la salsa périgord en combinación con otras salsas como puede ser la española
515,it is a member of the common stonechat superspecies but it is distinct together with its closest relative the madagascan stonechat s sibilla being insular derivatives of the african stonechat its ancestors probably diverged from the sub-saharan african lineage as it spread across the continent some - mya during the late pliocene,sakanagi es una niña de primaria bastante madura para su edad es fría y calculadora e increíblemente fuerte para combatir con otros hasta la muerte en un principio ella es una de las subordinadas de ruler admirándola como a una princesa pero después de que nemurin le dijera en sueños que cualquier niña puede ser una princesa ella planea un motín en contra de ruler para eliminarla y así ella quedar a cargo aunque en realidad lo lamenta y a menudo se pregunta cómo haría las cosas ruler al transformarse su aspecto es de una chica mayor de cabello rosado y con audífonos grandes su traje es parecido a un bañador su habilidad es transformarse y transformar todo en agua pudiendo evitar ataques y atravesar cualquier cosa sin embargo es vulnerable a la luz y el sonido por lo que una fuerte ráfaga la aturdiría reingresando a la normalidad aparentemente es una sociopata que no distingue bien entre el bien y el mal matando a otras chicas mágicas sin dudar o incluso sentir remordimiento alguno sin embargo parece haberse sentido un poco afectada por la muerte de tama ella es la décimo cuarta y última chica mágica en morir al ser asesinada por ripple como venganza de top spe
516,in  tom hamilton also began playing with joe russo dave dreiwitz marco benevento and scott metzger in a grateful dead tribute band called joe russos almost dead,este investigador británico formado en cambridge en biología y en antropología marcó pautas y nuevos enfoques que han trascendido a otros campos disciplinarios como la filosofía y la misma epistemología incluyó este concepto para explicar los fundamentos epistemológicos que propone anota lo siguiente
517,inclusive democracy id is a project that aims for direct democracy economic democracy in a stateless moneyless and marketless economy self-management democracy in the social realm and ecological democracy,pertenece al eje cafetero y a la región paisa fue creado en  fruto de la reforma a la división político- administrativa propuesta por el general rafael reyes prieto quien asumió la presidencia en  hasta  comprendió los territorios que ocupan los departamentos de risaralda y quindío que se segregaron a esta unión se le conoce popularmente como el viejo caldas el gran caldas o la mariposa verde
518,at the beginning of  kent music report was renamed as the australian music report it was used by major record companies in preference to arias own charts kent continued production of his music reports until  and sold off his interests in the australian music report which continued to the end of  when changes in technology such as barcoding enabled point-of-sale information to be sent directly to aria this meant that he could no longer compile reliable sales information,mary dyer y su esposo regresaron a inglaterra con roger williams y john clarke en  cuando mary dyer se unió a la sociedad religiosa de los amigos cuáqueros al oír los sermones del fundador de la sociedad george fox[]​ finalmente llegó a ser una predicadora cuáquera
519,"by the s he had formed the ""tim reynolds three"" or tr and had added other influences to his repertoire music from nine inch nails bob marley and marilyn manson in addition he continued to learn to play other instruments including the sitar sarod the mandello keytar tubular bells and other ""exotic"" instruments that are not commonly seen in western rock artists of the rock and roll musicians of the time",moyle p y j cech fishes an introduction to ichthyology a edición upper saddle river nueva jersey estados unidos prentice-hall año 
520,"in june  writer tamar lewin of the new york times wrote ""growing up growing apart"" a lengthy feature highlighting how an ethnically diverse trio struggled to maintain friendships and cope with teen life at columbia the story trailed aqeelah mateen an african-american muslim kelly regan an irish catholic and johanna perez-fox a puerto rican jew the group quickly became ambassadors for the school and for their respective ethnic groups the article wasnt controversial per se but directed national attention to the school district and to columbia specifically",en montecarlo los fiat abandonaron el lancia stratos de sandro munari venció consiguiendo así su tercer victoria consecutiva en la prueba monegasca segundo fue jean-claude andruet y tercero el español antonio zanini con un seat  en suecia fiasco para fiat markku alén volcó tras quedarse sin luces la prueba sería para el saab de stig blomqvist acompañado en el podio por los opel el cuarto puesto de simo lampinen situaba a fiat líder la clasficación en portugal los fiat no fallaron y la prueba fue un duelo entre el vencedor markku alén y ari vatanen hasta que este se salió en el duro rally safari fiat decidió mandar solo al stratos que finalizó tercero solo terminaron doce coches fiat se situó empate a puntos con ford la cual al verse con opciones decidió mandar a nueva zelanda a ari vatanen en contra de los planes iniciales[]​ en el rally de nueva zelanda una dura prueba de seis días y  tramos[]​ algunos con más de cien kilómetros el finlandés realizó una carrera memorable se salió en dos ocasiones perdiendo  minutos consiguió remontar hasta la segunda plaza a tan solo  de bachelli vatanen incluso llegó a superar a los tres fiat en algún tram
521,in - shealy was one of the political consultants hired by thomas ravenel of charleston in his unsuccessful multimillion-dollar run in the republican primary for us senate,"rodolfo perteneció al equipo de escritores y dio vida al personaje de “calixto” en el exitoso programa de televisión ""¡¡cachún cachún ra ra"" serie que se transmitió por el canal  de televisa durante los años de  a  bajo la producción de luis de llano macedo durante la barra de comedia"
522,at fox he was second-billed in the pirate film a high wind in jamaica  supporting anthony quinn he had a cameo in the loved one ,malpighi observó por primera vez células vivas y en  confirmó la existencia de las células en tejidos vegetales al mejorar la tecnología para construir microscopios cada vez más potentes los científicos lograron diferenciar la estructura interna de la célula comenzó sus estudios de medicina en la universidad de bolonia en  entró en la universidad a los  años que después abandonó por dos años por causas familiares y luego volvió a retomar en  a la edad de  años obtuvo el doctorado en medicina y filosofía en  ejerció como profesor auxiliar de anatomía en la misma universidad al poco tiempo se trasladó a la universidad de pisa como profesor de medicina teórica malpighi comenzó su amistad con giovanni alfonso borelli matemático naturalista y partidario prominente de la academia del cimento una de las primeras sociedades científicas del mundo en pisa permaneció durante cuatro años tras los cuales regresó a bolonia donde de nuevo ejerce como profesor de medicina y se dedica a la enseñanza de la medicina práctica
523,in val-de-bussy of marne-la-vallée bussy-saint-georges is from  the leading and main support of the built-up area as a real and independent new town french ville nouvelle with a unique status of local and new town the others towns decided to be organized around a common agglomeration system of new towns,matrimonios cuasi-organizados también llamados matrimonios asistidos donde los dos individuos dan independientemente consentimiento y tienen derecho a rechazar son una tema polémico activistas como charlotte bunch sugieren que los matrimonios arreglados por los padres y otros miembros de la familia por lo general asumen la preferencia heterosexual e implican presión emocional esto lleva a que algunos individuos consientan al matrimonio bajo presión[]​ bunch sugiere que los matrimonios deben ser autónomos
524,since minnesota state parks and trails are authorized by the state legislature some trails have been established in state statute yet no usable mileage has been constructed,rodica mateescu bucarest rumania  de marzo de  es una atleta rumana especializada en la prueba de triple salto en la que llegó a ser subcampeona mundial en []​
525,in october  business insider reported that pages paralyzed vocal cords are caused by an autoimmune disease called hashimotos thyroiditis and prevented him from undertaking google quarterly earnings conference calls for an indefinite period,la abreviatura cmorales se emplea para indicar a concepción morales torres como autoridad en la descripción y clasificación científica de los vegetales consulte el listado de todos los géneros y especies descritos por este autor en ipni
526,setareki tawake born  march  in kavala kadavu is a retired fijian rugby union player who was capped for fiji on  occasions he played as openside flanker or number  he played in two rugby world cups he was also a soldier,"es característica su iglesia parroquial dedicada a san pedro con un retablo barroco del siglo xviii próxima a la plaza mayor ""casa el palaciano"" fue escenario de algunas escenas de la película tasio  de montxo armendáriz"
527,the age distribution of the population as of  is children and teenagers – years old make up  of the population while adults – years old make up  and seniors over  years old make up ,en caso de guerra el rey convocaba a los caballeros y les pedía ayuda militar los caballeros y sus vasallos acudían con sus tropas y formaban una mesnada una reunión de mesnadas conformaban una hueste
528,dissatisfied with other documentaries made on the subject she produced a special for the travel channel titled secrets of san simeon with patricia hearst in which she took viewers inside her grandfathers mansion hearst castle providing unprecedented access to the property,el  de diciembre de  se incicia el movimiento por la separación de navotas y bangkulasi que eran entonces parte de tambobong los representantes de ambas localidades solicitaron al gobierno español la separación de sus barrios para formar un nuevo municipio objetivo que consiguieron el  de febrero de  cavada se convirtió en un municipio independiente[]​
529,"cyberpunk pioneer william gibson credits the film as an influence on his novel neuromancer ""i was intrigued by the exchange in one of the opening scenes where the warden says to snake you flew the gullfire over leningrad didnt you? it turns out to be just a throwaway line but for a moment it worked like the best sf where a casual reference can imply a lot"" popular videogame director hideo kojima has referred to the movie frequently as an influence on his work in particular the metal gear series solid snake is partially influenced by snake plissken in metal gear solid  sons of liberty snake actually uses the alias ""pliskin"" to hide his real identity during most of the game j j abrams producer of the  film cloverfield mentioned that a scene in his film which shows the head of the statue of liberty crashing into a new york street was inspired by the poster for escape from new york empire magazine ranked snake plissken  in their ""the  greatest movie characters"" poll","un capitán robot del cdf líder de sus tropas es un fornido robot con armadura azul similar a la que visten las tropas de tierra del cdf aunque aparentemente de un nivel superior que dispone de misiles múltiples de cañones en sus brazos y de una superarma dual especial llamada ""gigacañón tempestad"" magnum confía en su enorme potencia de fuego para atacar a distancia aunque también se lo ha visto luchar cuerpo a cuerpo posee una enorme resistencia física ya que es capaz de aguantar la mayoría de ataques de sus adversarios magnum es un guerrero extremadamente poderoso que se hace valer por haber derrotado a los adversarios más fuertes de hecho fue capaz de plantar cara a lluvia de los cuatro barones invencibles y de retener él solo al gigantor con su cañón también se ha enfrentado a scar saliendo victorioso a khan y al general contra el que no pudo hacer gran cosa debido a su inmenso poder"
530,by   women across the state officially belonged to local suffrage associations they joined the mwsa the nwp and other organizations their numbers and continued activities convinced lawmakers to act in  the minnesota legislature recognized womens right to vote in presidential elections the same year the legislature ratified the nineteenth amendment however the amendment did not take effect until  when it was ratified by two-thirds the required of the states,investigó en el papel de las papilas linguales y cutáneas en la fisiología del gusto y del tacto respectivamente y la capa más profunda de la piel que lleva su nombre epístolas anatómicas 
531,ivan lopez from mexico was originally scheduled to face crisanto pitpitunge from the philippines in a featured flyweight bout but crisanto pulled from the fight due to an injury jessie rafols also from the philippines was chosen as his replacement,se trata de un edificio compuesto de tres volúmenes una torre y dos cuerpos para vivienda que forman una planta rectangular irregular su construcción es de mampostería con refuerzo de sillar en los vértices la torre posee cuatro alturas es visible desde el exterior un considerable número de troneras y aspilleras para arma de fuego la entrada original a la torre se sitúa desde el interior de la casa adosada sin embargo muestra una apertura posterior directamente desde la calle el tejado de la torre está cubierto a dos aguas la entrada principal a todo el conjunto se realiza desde el cuerpo central siendo este el de menor altura muestra la fachada de este volumen un gran portalón con arco de medio punto realizado en sillar con una pequeña hornacina sobre él más arriba en el segundo piso se abre una ventana adintelada con bloques monolíticos en la parte lateral del conjunto en el tercer volumen se abren tres ventanas en vertical cada una en una altura y todas ellas adinteladas aunque de distinto tamaño[]​
