,english,spanish
0,in  johnson was awarded an american institute of architects gold medal in  he became the first recipient of the pritzker architecture prize the most prestigious international architectural award,en navidad de  poco después de que interpretó la canción en francés película papillon toi qui regarde la mer ella cantará la espléndida versión de gloria aleluya para una misa de medianoche celebrada por rtl
1,bussy-saint-georges has built its identity on a green model environment with parks and gardens they represent  hectares of integrated green spaces  kilometres  miles of soft connecting links  squares and parks in the city centre  pools and more than  trees today,según el censo de []​ había  personas residiendo en el municipio de homer la densidad de población era de  habkm² de los  habitantes el municipio de homer estaba compuesto por el   blancos el   eran afroamericanos el   eran de otras razas y el   eran de una mezcla de razas del total de la población el   eran hispanos o latinos de cualquier raza[]​
2,minnesotas state parks are spread across the state in such a way that there is a state park within  miles  km of every minnesotan the most recent park created is lake vermilion state park created in  currently the parks range in size from franz jevne state park with  acres  ha to saint croix state park with  acres  ha two parks include resources listed as national natural landmarks big bog state recreation area and itasca state park and six parks encompass national historic landmarks charles a lindbergh fort snelling mille lacs kathio st croix soudan underground mine and split rock lighthouse state parks  sites or districts across  minnesota state parks are on the national register of historic places nrhp including  parks with developments constructed by new deal-era job creation programs in the s,en la copa mundial de fútbol sub- de  pitó los partidos argentina vs méxico colombia vs malí de la primera fase en octavos de final pitó el partido brasil vs arabia saudita
3,nordahl road is a station served by north county transit districts sprinter light rail line it straddles the city limits of san marcos and escondido california with its mailing address in escondido the station is located between barham drive and auto park waynordahl road both of which intersect east mission road it consists of a single platform and track,ally y buttons encuentran el descodificador y ally se pone a descodificar códigos ally y chen pelean por el control del gigantor en el último piso de la torre de hierro gaff el capitán magnum y marty pelean contra el general entonces cuando el general ha vencido a todos menos a marty este consigue derrotarle el solo al mismo tiempo ally vence al doctor chen en la lucha por el control del gigantor y este huye después aparecen marty y buttons en el remolque con charly marty se acuerda que ese día era la conferencia de ally en el cdf la serie termina con la foto de todos juntos en el cdf
4,a talk by takis fotopoulos about the internationalization of the capitalist market economy and the project of inclusive democracy a talk given by takis fotopoulos at the university of vermont in  followed by a discussion in which murray bookchin dan chodorkoff and others take part video in  parts retrieved  january ,los primeros habitantes se establecieron cerca de  siendo un grupo de mixtecas zapotecas otomíes y olmecas tras la conquista de méxico la población fue encargada a sebastián y luisa narvaes se estableció como patrono a san andrés a quién se le creó una escultura en el siglo xvi el  de febrero de  el virrey luis de velasco y ruiz de alarcón otorgó un título en reconocimiento de las tierras comunales de los grupos originarios[]​
5,while running a campaign to elect his sister sherry martschink to lieutenant governor in  shealy with the help of robert kohn recruited unemployed black fisherman benjamin hunt jr to run for congress against republican arthur ravenel jr shealy sought to increase the turnout of white voters by playing to the racial fears of the south carolina electorate he promised hunt who had a prior drug arrest $ to run for congress and paid for his $ filing fee shealy paid for the fees with an unreported $ campaign contribution to his sister from laidlaw environmental services,serbia participará en los juegos olímpicos de parís  responsable del equipo olímpico es el comité olímpico de serbia así como las federaciones deportivas nacionales de cada deporte con participación
6,reynolds was born in wiesbaden germany where his father a career military man was stationed he says he hails from nowhere because the family moved so often his family lived many places including germany a farm in indiana an army base in alaska kansas and missouri where he lived longer than any other place until he was old enough to move away as an adult both parents were extremely devout christians and he says he grew up with christian music all around him however his older sister owned some albums from the beatles which he says even as a very young child he loved instantly playing air guitar to their music,los bitardos utilizan una faluche que es una gorra tradicional de los estudiantes de francia con cierto diseño y códigos característicos el faluche de los dignatarios bitardos está decorado con un chevrón junto con esta gorra los bitardos se ponen una capa cuyo color es indicativo de su rango dentro de la orden
7,"since the days of the revolution a one-room stone schoolhouse had stood on a grassy area known as the common located close to the present intersection of south orange avenue and academy street in maplewood in  this building blocked the construction of a new toll highway from newark to morristown the  ""proprietors and associates"" of the school met on august  of that year and resolved to erect a new school building near the site of the old one naming seven trustees to thereafter oversee the education of local children the resolution reflected ""the desire of the meeting that the said school should in the future have the name of columbian school of south orange""",el general empieza a controlar al gigantor gracias al doctor chen pero uno de sus secuaces se rebela khan el robot que ahbía atacado a marty en la torre de hierro dice al general que el gigantor es un arma indigna e intenta atacar al doctor chen pero el general lo destruye
8,"obreption and subreption both from the latin word reporeptum genitive meaning to creep or crawl the prefix ob- means ""towards against or in the way of"" sub- means ""under or close to"" are terms used in ancient roman law and in the canon law applied by the catholic church to species of fraud by which an ecclesiastical rescript is obtained",hay una diferencia en las tasas de divorcio observadas entre los distintos tipos de matrimonios arreglados las tasas de divorcio en los países islámicos con matrimonios consanguíneos arreglados como arabia saudita turquía egipto qatar jordania es de entre  a []​ en contraste con el menos del  de las tasas de divorcio en matrimonios arreglados no consanguíneos entre los amish hindúes y judíos ortodoxos
9,the boys soccer team was coached by gene chyzowych one of the most successful active scholastic soccer coaches in the nation the  boys soccer team won the north ii group iv state sectional championship with a − win over westfield high school in the tournament final,desde antes incluso de su retirada vlade divac ha formado parte de la estructura de diversos clubes de baloncesto a finales de  se convirtió en presidente del partizan de belgrado aunque debido a su ocupación como jugador en la nba fue su compatriota amigo y vicepresidente del equipo predrag danilović quien se hizo cargo en la práctica de las riendas de la escuadra además después de dar por finiquitada su carrera como jugador el ya ex pivot trabajó como scout para los lakers durante un año
10,aberllefenni is a village in the south of gwynedd wales it lies in the historic county of merionethshiresir feirionnydd in the valley of the afon dulas,alexandru segal con sólo doce años de edad ya se clasificó entre los jugadores de ajedrez de clase mundial en rumania convirtiéndose en campeón de la juventud después europeo sub- en  se ha ganado el campeón universitario participó en las finales nacionales y representó a brasil en varios eventos internacionales ganó io gran maestro alemán robert hübner y señaló con el gran maestro húngaro zoltán ribli el ganador del interzonal de las palmas
11,cornus canadensis canadian dwarf cornel canadian bunchberry quatre-temps crackerberry creeping dogwood is a species of flowering plant in the cornaceae dogwood family native to eastern asia japan korea northeastern china jilin province and the russian far east the northern united states colorado new mexico canada and greenland unlike its relatives which are for the most part substantial trees and shrubs c canadensis is a creeping rhizomatous perennial growing to about  cm  in tall,"la economía es fundamentalmente agrícola con cierto desarrollo industrial en la ciudad de san cristóbal mantiene un central azucarero en activo  de noviembre recientemente se ha iniciado con éxito el cultivo de la vid y la producción de vino a partir de uvas cosechadas en cuba de la marca ""bodegas san cristóbal""[]​[]​"
12,reynolds has a son josef born in february  with his wife linna in  he and girlfriend diane thomas had a daughter eura they resided in new mexico with her son jostin bileyu in  thomas moved with their children to north carolina tim followed to be near his daughter eura he currently resides in north carolina after living for  years in virginia and several years in new mexico on august st  reynolds married kristin nienkirchen in turks and caicos,«concepción morales torres» índice internacional de nombres de las plantas ipni real jardín botánico de kew herbario de la universidad de harvard y herbario nacional australiano eds
13,the other more probable account starts in  when schyrleus is born in reutte austria after joining the augustine order in  he is sent to the university at ingolstadt where he probably follows courses in astronomy and learns how to grind lenses following his graduation he does not return to his convent but enters the capuchin order which sends him to linz in  where he is to teach philosophy here he comes in the service of kurfürst philipp christoph von sötern the archbishop of trier and speyer who is held captive by the emperor ferdinand iii the archbishop sends him on a mission to negotiate with pope urban viii the emperor however seeing this diplomatic activity as a form of spying bans schyrleus from his lands in [] from here on both accounts of schyrleus life come together,el concepto hinduísta-budista de chakravartin es una perfecta ilustración del concepto de monarquía universal[]​[]​ la rueda que gira sin que nada la detenga simbolizando al goberante universal ideal sarvabhauma que gobierna ética y benevolentemente sobre el mundo entero
14,"there was a reaction to these changes complaints arose over so-called ""fads and frills""-inessentials said to be leading to the neglect of reading writing spelling and arithmetic new york papers read by local commuters campaigned for a return to the efficiency of the ""little old red schoolhouse"" but the changes were here to stay",el número total de hogares en el distrito era de   y el  eran familias en la cual el  tenían menores de  años de edad viviendo con ellos de todas las familias viviendo en el distrito solamente el  eran matrimonios del total de hogares en el distrito el  eran parejas que no estaban casadas mientras que el  eran parejas del mismo sexo el promedio de personas por hogar era de  []​
15,"""west coast reggae group stick figure debuts first-ever music video for fire on the horizon track exclusive premiere"" billboard november  ",los matrimonios concertados son debatidos activamente entre los estudiosos las cuestiones debatidas incluyen si los matrimonios arreglados se están utilizando para abusar del sistema de inmigración internacional si los matrimonios arreglados violan los derechos humanos en particular los derechos de la mujer[]​ si se producen matrimonios más estables para la crianza de los hijos la próxima generación[]​ y si hay más o menos amor y respeto en la relación para la pareja casada[]​
16,after a few months hearst provided information not on oath sworn testimony could have been used to convict her of sla activities to the authorities a bomb exploded at hearst castle in february after hearst testified that wolfe had raped her emily harris gave a magazine interview from prison alleging hearst retaining a trinket given to her by wolfe was an indication that she had been in a romantic relationship with him hearst said she had kept the stone carving because it seemed to be a pre columbian artifact of archeological significance harriss interpretation was used by the prosecutor james l browning jr and some jurors later said they regarded the carving which browning waved in front of them as powerful evidence that hearst was lying,esta obra contiene una traducción parcial derivada de manfredo iv di saluzzo de wikipedia en italiano concretamente de esta versión publicada por sus editores bajo la licencia de documentación libre de gnu y la licencia creative commons atribución-compartirigual  unported
17,the film introduces a romance involving wyatt earp and a fictional character based on lottie deno which played no factor in the actual gunfight nor did anything to advance the films plot,la orden del bitardo es presidida por el grand maistre gran maestre está formada de una parte por dignatarios como los commandeurs comendadores y chevaliers caballeros y de otra parte por los novices novicios y las chabousses los estudiantes ingresan a la orden del bitardo como novicios luego de que ha demostrado que es digno de confianza se dice que el estudiante se encuentra capacitado para ser un dignatario
18,with the national team he played in the  world cup qualifiers in australia where iraq finished second behind the hosts the  and  asian cups in thailand and iran and in the olympic qualifiers in  and  douglas was also an important part of the iraqi army team that won the  and  cism world military championship,bryant trabajó en a train of incidents  y en war brides  filme que significó el debut de su esposa alla nazimova aunque era homosexual bryant se había casado con ella en  fue un matrimonio de conveniencia pues ella era lesbiana bryant y nazimova firmaron un contrato con metro pictures en  y trabajaron juntos en varios filmes entre ellos revelation out of the fog y billions en  nazimova fundó nazimova productions compañía para la cual bryant empezó a dirigir la pareja produjo en  una adaptación al cine de la obra de oscar wilde salomé sin embargo la asociación de byrant con nazimova tuvo poca duración pues salomé fue un fracaso de público y nazimova productions quebró bryant no volvió a trabajar en el cine por lo que volvió a broadway poco después de dejar hollywood bryant y nazimova se divorciaron aparentemente debido a que su unión de conveniencia ya no era necesaria
19,former deathwish professional antwuan dixon was imprisoned in mid- and stated in a july  thrasher magazine interview—conducted by reynolds and ellington—that he was scheduled to be released on august   dixon also explained that he may be released earlier,"segal ha creado muchas expresiones en el ajedrez entre ellos ""passadinha segalesca"" una especie de golpe táctico al final donde los peatones se sacrifican para promover uno de la dama"
20,nangal jiwan is a village in nakodar in jalandhar district of punjab state india it is located  kilometres  mi from nakodar  kilometres  mi from kapurthala  kilometres  mi from district headquarter jalandhar and  kilometres  mi from state capital chandigarh the village is administrated by a sarpanch who is an elected representative of village as per panchayati raj india,censo de  viven en thueyts  jóvenes  eran agricultores hijos de los agricultores un panadero hijo de un panadero y un zapatero de todos estos jóvenes  sabían leer escribir contar uno no sabía leer y  eran analfabetos once cuyo nivel educativo es desconocido el servicio militar tuvo una mala reputación había catorce solicitudes de exención o de reforma uno de ellos fue escrito a petición de éste todos los demás de oficio en  seis inscritos es difícil obtener toda la información pues el método de selección ha cambiado
21,demotic ownership of productive resources is a kind of ownership which leads to the politicisation of the economy the real synthesis of economy and polity this is so because economic decision making is carried out by the entire community through the demotic assemblies where people make the fundamental macro-economic decisions which affect the whole community as citizens rather than as vocationally oriented groups eg workers as eg in parecon at the same time workers apart from participating in the demotic decisions about the overall planning targets would also participate in the above broad sense of vocationally oriented groups in their respective workplace assemblies in a process of modifyingimplementing the democratic plan and in running their own workplace,la idea de paseo al mar la actual avenida blasco ibáñez ha condicionado especialmente la vida de los vecinos del cabañal el primer proyecto fechado es de  pero no es hasta inicios de  cuando se manifiesta el interés municipal de crear una nueva vía de comunicación además de camino del grao actual avenida del puerto que aproxime las playas a la burguesía valenciana
22,several romance languages use the latin word acrifolium turned into aquifolium in modern time so italian agrifoglio occitan grefuèlh etc,su primera campaña en estados unidos resultó satisfactoria pues disputó todos los partidos de la temporada regular - aunque sólo  como titular- y fue incluido en el quinteto ideal de rookies además se convirtió rápidamente en un jugador muy popular y querido por el público pese a sus iniciales dificultades idiomáticas
23,"in october  the american civil liberties union filed a complaint against columbia high school and the south orange-maplewood school district in relation to its academic leveling and disciplinary systems stating that the overuse of discipline and ""zero-tolerance"" policy and implicit racial bias within the level selection system violate title vi of the civil rights act of  and section  of the rehabilitation act of  claims were made that the suspension rate for black students was five times higher than that for white students in a classroom environment in which black students were significantly underrepresented in ap and honors classes",a su vez contra la sentencia del tsj de madrid de  el ministerio de cultura y la generalitat valenciana interpusieron recurso ante el tribunal supremo y éste tuvo que resolver el procedimiento cuya existencia había obviado el año anterior la propia sentencia reconoce el error en su redacción
24,sohail played a big role in pakistans world-cup triumph in  famously telling ian botham that he might want to send his mother-in-law in to bat referring to bothams statement that he wouldnt send even his mother-in-law to pakistan after botham was controversially given out for nought in the final sohails most infamous moment on the cricket field however was in the  world cup quarter final against arch rival india in bangalore sohail was captaining the side in pursuit of a relatively large target of  in  overs with opening partner saeed anwar he got pakistan off to a flying start with the score at  for one and saeed anwar  back in the pavilion sohail smashed a delivery from indian seamer venkatesh prasad through the covers for four both players exchanged words and sohail unnecessarily pointed his finger aggressively at prasad the next delivery clean-bowled him and triggered a batting collapse which ultimately lost the game and eliminated pakistan from the competition,empresas coaligadas se trata de la denominada tarjeta de fidelización multipatrocinador también conocida como programa de multifidelización de marcas y es una fórmula de gran éxito comercial en todo el mundo compañías de diferentes sectores se agrupan para premiar a sus clientes con descuentos beneficios puntos canjeables por viajes y regalos por la compra de sus productos o servicios
25,takis fotopoulos talk on the multidimensional crisis and inclusive democracy oxford university november  video in  parts part  talk part  talkdiscussion part  discussion retrieved  january ,esta obra contiene una traducción derivada de cathorops puncticulatus de wikipedia en catalán publicada por sus editores bajo la licencia de documentación libre de gnu y la licencia creative commons atribución-compartirigual  unported
26,"by june  google had indexed one billion internet urls or uniform resource locators making it the most comprehensive search engine on the web at the time the company cited nec research institute data in its june  press release stating that ""there are more than  billion web pages online today"" with google ""providing access to  million full-text indexed web pages and  million partially indexed urls"""," a  dayzac es defensor de los pobres en  el conde de blou y el juez jean durand participan en la contra revolución camp de lalevade et camp de jalès creación de una escuela y una comunidad religiosa de las ""hermanas de la presentación"" en  por marie rivier"
27,back in the us he made another film with blake edwards the thriller the carey treatment  it was badly cut by mgm and was commercially underwhelming so too was the honkers  where coburn played a rodeo rider,"""heaven in the back seat"" canción que fue autorizada para la película a nightmare on elm street  the dream child y lanzado como un single el vídeo musical contó con extractos de la película"
28,it cannot be too earnestly urged that an acquaintance with real facts will in the end be better for all parties some time ago when the reading public was alarmed at being told how london milk is adulterated timid persons deprecated the exposure on the plea that it would give instructions in the art of adulterating milk a vain fear milkmen knew all about it before whether they practiced it or not and the exposure only taught purchasers the necessity of a little scrutiny and caution leaving them to obey this necessity or not as they pleased,una vez que la pelea termina sorpresivamente los chicos son noqueados por una nube de gas naranja que los adormecería antes de caer marty divisa a lo lejos unos robots
29,the lever tumbler lock which uses a set of levers to prevent the bolt from moving in the lock was perfected by robert barron in  his double acting lever lock required the lever to be lifted to a certain height by having a slot cut in the lever so lifting the lever too far was as bad as not lifting the lever far enough this type of lock is still currently used today,platyrhiza es un género monotípico de orquídeas epifitas su única especie platyrhiza quadricolor barbrodr  es originria del sur de brasil
30,"burial ground met with a positive critical response with a number of critics noting the mixing of upbeat reggae and dub according to the reggae review ""original bass-heavy one drop beats are consistent throughout the album as are the subtle nuancesand sometimes not so subtle nuancesof dub stick figures digits remain firmly on the pulse of roots reggaedub music"" the pier stated ""the album represents a new milestone in stick figures musical growth and innovative abilities with more layering instrumental transcendence and lyrical complexity [than their previous albums]""",casó con manuel oreilly y calvo de la puerta iv conde de buenavista iii conde de oreilly a su muerte el título de conde del castillo quedó vacante y finalmente caducado
