1339,46,TV,True,English words map to the same Chinese word,"By using the Internet we | can make new pen friends overseas, and create clubs , and societies. Now a message can travel quicker and it is also worldwide . sending letters takes about a week from Hong Kong to the U.K., but network , eg. e.g. E-mail . , is much faster. require Require the time The time required is only a few minutes. Now we | can even create a club on Yahoo, which is free. Modern technology saves us a lot of time and brings us many benefits when we use it in the right way, but some bad way to e.g. send virus to break down network . ",VERB VERB ADJ,"By using the Internet we | could make new pen friends overseas, and create clubs , and societies. Now a message can travel quicker and it is also worldwide . sending letters takes about a week from Hong Kong to the U.K., but network , eg. e.g. E-mail . , is much faster. require Require the time The time required is only a few minutes. Now we | could even create a club on Yahoo, which is free. Modern technology saves us a lot of time and brings us many benefits when we use it in the right way, but some bad way to e.g. send virus to break down network . ",VERB VERB ADJ,True,True
547,94,RP,False,Inappropriate capitalization in the middle of sentence,"I ran back home for help. I phoned the police | and told them the whole story. A strange thing happened to me, when I got back to that man. The car and the man were not there anymore. Where could they be? I was wondering. ",CCONJ VERB PRON,"I ran back home for help. I phoned the police | And told them the whole story. A strange thing happened to me, when I got back to that man. The car and the man were not there anymore. Where could they be? I was wondering. ",CCONJ VERB PRON,True,False
1324,31,TV,True,Chinese generally expresses actions in present tense,"During the week we | decided where we wanted to go , we . We all agreed to listen to music so then we | decided to go to your musical show and listen to ""Over the Rainbow"". ",VERB ADV PRON,"During the week we | decide where we wanted to go , we . We all agreed to listen to music so then we | decide to go to your musical show and listen to ""Over the Rainbow"". ",VERB ADV PRON,True,True
1884,162,MD,True,Chinese has no articles and doesn't use classifiers in this situation,"We have booked the hotel for the group. It is the ""Palace Hotel"", which is about 10 miles away from our College , the . The hotel will have a coach to pick the group up from the airport on | the 19th of June and then take the group to | the Conference and return to | the hotel every day. ",DET NOUN ADP,"We have booked the hotel for the group. It is the ""Palace Hotel"", which is about 10 miles away from our College , the . The hotel will have a coach to pick the group up from the airport on | 19th of June and then take the group to | Conference and return to | hotel every day. ",NOUN ADP PROPN,True,True
787,45,RA,False,Using 'It' incorrectly,"| I was really pleased to receive your letter yesterday , you . You asked me about rules ; , both in my home and at my school , . I am very happy to tell you about this. ",PRON VERB ADV,"| It was really pleased to receive your letter yesterday , you . You asked me about rules ; , both in my home and at my school , . I am very happy to tell you about this. ",PRON VERB ADV,True,False
2673,30,UV,False,Unnecessary verb added,"The activities are quite hard to choose really, because you have a lot of choices which | I like. But I think I will choose Basketball and Photography, because basketball is the only sport I can play well. Photography is a very interesting activity, and is not too hard to do either. ",PRON VERB PUNCT,"The activities are quite hard to choose really, because you have a lot of choices which | is I like. But I think I will choose Basketball and Photography, because basketball is the only sport I can play well. Photography is a very interesting activity, and is not too hard to do either. ",VERB PRON VERB,True,False
429,48,FD,False,Wrong determiner used,"Last night, when I went into my house it was quite silent. I felt there might be something that had gone wrong. I found my parents sitting in | an armchair . I could see sadness in my father's eyes. My mother came over to me and said softly, ; "" My dear, your father's company has just gone bankrupt', then she couldn't help crying. When I heard this bad news, I was very depressed because father worked quite hard for his company. My father always remembered his responsibility was to provide a good salary to his workers to provide his workers with a good salary , which is the aim of his life. ",DET NOUN PUNCT,"Last night, when I went into my house it was quite silent. I felt there might be something that had gone wrong. I found my parents sitting in | a armchair . I could see sadness in my father's eyes. My mother came over to me and said softly, ; "" My dear, your father's company has just gone bankrupt', then she couldn't help crying. When I heard this bad news, I was very depressed because father worked quite hard for his company. My father always remembered his responsibility was to provide a good salary to his workers to provide his workers with a good salary , which is the aim of his life. ",DET NOUN PUNCT,True,False
2623,24,UC,False,Overcorrection,"Concerning the activities that you have listed . Some , some of them I am really interested in , especially painting. Since I was young, my dad has always taken me to life drawing, so now it has become one of my hobbies. And I think , it will be nice to draw beautiful landscapes of the place. Beside drawing, swimming is my favourite as well. When I was in high school, I joined the swimming club. And I also participated in a few swimming competitions. Although I'm not the best, | I have a lot of confidence at it. ",PRON VERB DET,"Concerning the activities that you have listed . Some , some of them I am really interested in , especially painting. Since I was young, my dad has always taken me to life drawing, so now it has become one of my hobbies. And I think , it will be nice to draw beautiful landscapes of the place. Beside drawing, swimming is my favourite as well. When I was in high school, I joined the swimming club. And I also participated in a few swimming competitions. Although I'm not the best, | but I have a lot of confidence at it. ",CCONJ PRON VERB,True,False
1754,32,MD,True,Chinese has no articles and doesn't use classifiers in this situation,"I think people in the future will probably wear helmets with oxygen gas well provided . It is because of the increasing size of | the population and the shortage of oxygen gas in the atmosphere. They will also wear water-proof, ultra-violet proof ultra-violet-proof and other dangerous liquid-proof dangerous-liquid-proof clothes to protect themselves. These clothes have to be made of something light, comfortable to wear and protective. All the above ideas are needed to make them bear no burden when wearing these specially designed clothes. ",DET NOUN CCONJ,"I think people in the future will probably wear helmets with oxygen gas well provided . It is because of the increasing size of | population and the shortage of oxygen gas in the atmosphere. They will also wear water-proof, ultra-violet proof ultra-violet-proof and other dangerous liquid-proof dangerous-liquid-proof clothes to protect themselves. These clothes have to be made of something light, comfortable to wear and protective. All the above ideas are needed to make them bear no burden when wearing these specially designed clothes. ",NOUN CCONJ DET,True,True
698,30,RY,False,General grammar rules confusion,Yours | sincerely,ADV _ _,Yours | faithfully,ADV _ _,True,False
1649,78,MP,True,Chinese uses commas to mark the end of a complete thought,"Moreover, I am good at playing basketball , in . In fact, I am the captain in the basketball team | , which is one of the best teenage teams in my city, and I also like singing. I play piano very well. Two of my friends and I have a band , we . We sometimes perform in my school club. ",PUNCT DET VERB,"Moreover, I am good at playing basketball , in . In fact, I am the captain in the basketball team | which is one of the best teenage teams in my city, and I also like singing. I play piano very well. Two of my friends and I have a band , we . We sometimes perform in my school club. ",DET VERB NUM,True,True
2247,30,DN,False,Overcorrection,I am very pleased about the prize I just won in your competition. Thank you for choosing me. Here is some further information about myself and a few | enquiries.,NOUN PUNCT _,I am very pleased about the prize I just won in your competition. Thank you for choosing me. Here is some further information about myself and a few | enquirement.,NOUN PUNCT _,True,False
2096,101,RV,True,,"Here I have some questions which I would like to ask , what . What kind of clothes | will I need? How much do I need for the Camp? ",VERB PRON VERB,"Here I have some questions which I would like to ask , what . What kind of clothes | should I need? How much do I need for the Camp? ",VERB PRON VERB,True,True
2680,37,UV,False,Contraction with verb error,"But , during any peak season, like Christmas , holidays or even during weekends . Then , then I can say | I definitely don't feel it is enjoyable . Because , because of the crowds. For me I think , it is not shopping but a kind of suffering . Especially , especially , queuing up for twenty minutes just to pay or waiting for the salesgirl to get the right size . So sometimes I don't think shopping is enjoyable, and if there is any big holiday, I would rather stay at home and watch television. ",PRON ADV VERB,"But , during any peak season, like Christmas , holidays or even during weekends . Then , then I can say | I'm definitely don't feel it is enjoyable . Because , because of the crowds. For me I think , it is not shopping but a kind of suffering . Especially , especially , queuing up for twenty minutes just to pay or waiting for the salesgirl to get the right size . So sometimes I don't think shopping is enjoyable, and if there is any big holiday, I would rather stay at home and watch television. ",PRON VERB ADV,True,False
2275,58,DN,False,Equivalent word exists but is not used,"And , there should be a robotic servant in everyone's home. So there'll be no need for people to do the | housework. There will be no beds at home because some pills will be invented to prevent people becoming sleepy. If you're tired, the pill can give you vitamins, proteins and make you refreshed. ",NOUN PUNCT ADV,"And , there should be a robotic servant in everyone's home. So there'll be no need for people to do the | household work. There will be no beds at home because some pills will be invented to prevent people becoming sleepy. If you're tired, the pill can give you vitamins, proteins and make you refreshed. ",NOUN NOUN PUNCT,True,False
1829,107,MD,True,Chinese has no articles and doesn't use classifiers in this situation,"Concerning the date when I would like to travel, it will be nice to go on | the 1st of July . Because , because my summer holidays start at | the end of June. And I need a few days to prepare my stuff. ",DET NOUN ADP,"Concerning the date when I would like to travel, it will be nice to go on | 1st of July . Because , because my summer holidays start at | end of June. And I need a few days to prepare my stuff. ",NOUN ADP PROPN,True,True
1809,87,MD,True,Chinese has no articles and doesn't use classifiers in this situation,"First of all, I am a high school student, so I only have four weeks' vacation in July. I would like to travel in July. Secondly, for me, the best way to live in | the outdoors is in tents, because that is a good chance to acquire a lot of knowledge about | the planets and | the animals as well. ",DET NOUN VERB,"First of all, I am a high school student, so I only have four weeks' vacation in July. I would like to travel in July. Secondly, for me, the best way to live in | outdoors is in tents, because that is a good chance to acquire a lot of knowledge about | planets and | animals as well. ",ADV VERB ADP,True,True
166,81,FN,True,Missing plural,"And , there should be a robotic servant in everyone's home. So there'll be no need for people to do the housework. There will be no beds at home because some pills will be invented to prevent people becoming sleepy. If you're tired, the pill can give you | vitamins, proteins and make you refreshed. ",NOUN PUNCT NOUN,"And , there should be a robotic servant in everyone's home. So there'll be no need for people to do the housework. There will be no beds at home because some pills will be invented to prevent people becoming sleepy. If you're tired, the pill can give you | vitamin, proteins and make you refreshed. ",NOUN PUNCT NOUN,True,True
329,81,RN,False,Equivalent word exists but is not used,"Firstly, I am being the representative of my class to thank you for organising a good programme in London, especially the visit to the Science Museum and National Art Gallery. We know that it is a good chance for us to learn more different things and we can widen our knowledge in the Science Museum. In addition, we can appreciate and enjoy the art in the National Art Gallery. Unfortunately, I know that most of the students have already visited these two places before. So we decided to choose another | event which have seen as an entertainment . It is the LONDON FASHION AND LEISURE SHOW. The show will be held at the Central Exhibition Hall, London. The date is Tuesday March 14, from 10.00-19.00. It shows the latest fashions, including leisure and sports wear. In spite of this, there are also make-up and hairstyles, which attract girls most . ",NOUN DET VERB,"Firstly, I am being the representative of my class to thank you for organising a good programme in London, especially the visit to the Science Museum and National Art Gallery. We know that it is a good chance for us to learn more different things and we can widen our knowledge in the Science Museum. In addition, we can appreciate and enjoy the art in the National Art Gallery. Unfortunately, I know that most of the students have already visited these two places before. So we decided to choose another | programme which have seen as an entertainment . It is the LONDON FASHION AND LEISURE SHOW. The show will be held at the Central Exhibition Hall, London. The date is Tuesday March 14, from 10.00-19.00. It shows the latest fashions, including leisure and sports wear. In spite of this, there are also make-up and hairstyles, which attract girls most . ",NOUN DET VERB,True,False
1567,274,TV,True,Will and would map to the same word in Chinese,"Finally, if you want to visit this building I | would recommend you stay at a hotel not far from the memorial Hall called the Hyatt Hotel. It only takes about five minutes if you walk. I hope you will all have a great time in Taiwan and I hope you will enjoy the building. ",VERB VERB PRON,"Finally, if you want to visit this building I | will recommend you stay at a hotel not far from the memorial Hall called the Hyatt Hotel. It only takes about five minutes if you walk. I hope you will all have a great time in Taiwan and I hope you will enjoy the building. ",VERB VERB PRON,True,True
1810,88,MD,True,Chinese has no articles and doesn't use classifiers in this situation,"First of all, I am a high school student, so I only have four weeks' vacation in July. I would like to travel in July. Secondly, for me, the best way to live in | the outdoors is in tents, because that is a good chance to acquire a lot of knowledge about | the planets and | the animals as well. ",DET NOUN VERB,"First of all, I am a high school student, so I only have four weeks' vacation in July. I would like to travel in July. Secondly, for me, the best way to live in | outdoors is in tents, because that is a good chance to acquire a lot of knowledge about | planets and | animals as well. ",ADV VERB ADP,True,True
1655,84,MP,True,Chinese uses commas to mark the end of a complete thought,"Shopping, for most the people it is very important Shopping is very important for most people because you need to get the stuff you need or you want. For some people it may be a way to relax , after you have been to work or school. So it is a thing you will enjoy most of the time, but still have something you will not enjoy it . It depends on what is the place and the aim you are shopping . For example | , some people always shop to get food or stuff they need in everyday life , they . They won't enjoy this kind of shopping, because it is not getting what they want. The place where you are shopping is also very important. For example | , in HK all the areas have lots of people it won't let you feel good of the noise and times when you are shopping . Because , because there are too many people it makes you want to stay home and you won't enjoy shopping. ",PUNCT DET NOUN,"Shopping, for most the people it is very important Shopping is very important for most people because you need to get the stuff you need or you want. For some people it may be a way to relax , after you have been to work or school. So it is a thing you will enjoy most of the time, but still have something you will not enjoy it . It depends on what is the place and the aim you are shopping . For example | some people always shop to get food or stuff they need in everyday life , they . They won't enjoy this kind of shopping, because it is not getting what they want. The place where you are shopping is also very important. For example | in HK all the areas have lots of people it won't let you feel good of the noise and times when you are shopping . Because , because there are too many people it makes you want to stay home and you won't enjoy shopping. ",DET NOUN ADV,True,True
255,7,RN,False,Spelling error,"Weapons are designed to kill and defend in a | fight , in . In the Second World War so many Germans were killed , also . Also many people died in other regions . , e.g. the English. ",NOUN PUNCT ADV,"Weapons are designed to kill and defend in a | fright , in . In the Second World War so many Germans were killed , also . Also many people died in other regions . , e.g. the English. ",NOUN PUNCT ADV,True,False
901,2,W,False,Order is incorrect in Chinese and English,"The last thing is about the ticket. It was excellent to have one reasonably-priced reasonably priced weekend ticket for all events, because it is convenient and normally young people do not have a lot of money, so I hope next year the ticket will | also be like this. ",ADV VERB ADP,"The last thing is about the ticket. It was excellent to have one reasonably-priced reasonably priced weekend ticket for all events, because it is convenient and normally young people do not have a lot of money, so I hope next year the ticket will | be also like this. ",VERB ADV ADP,True,False
1276,59,MT,True,Chinese doesn't use the word in this context,"All of us want to go to the show , the . The generation who are the same age as us all like make-up, become beautiful , and it's important that it will be free for students and just be showed | for one day. So, we don't want to miss this chance. ",ADP NUM NOUN,"All of us want to go to the show , the . The generation who are the same age as us all like make-up, become beautiful , and it's important that it will be free for students and just be showed | one day. So, we don't want to miss this chance. ",NUM NOUN PUNCT,True,True
2385,95,RT,False,Misusing preposition,"The topical class is similar to speaking and listening but the materials are more up-dated up to date . The teacher uses video , and pictures to teach students about festivals, sports, museums, etc. It is popular | with the students. ",ADP DET NOUN,"The topical class is similar to speaking and listening but the materials are more up-dated up to date . The teacher uses video , and pictures to teach students about festivals, sports, museums, etc. It is popular | by the students. ",ADP DET NOUN,True,False
587,10,AGV,False,Spelling error,"Unfortunately, Pat wasn't very good at keeping secrets. Now everybody in the class knew my mum was a cleaner and teased me for having that kind of mum. I was so sad about it and did not forgive Pat even though she | apologises thousands of times. ",VERB NOUN ADP,"Unfortunately, Pat wasn't very good at keeping secrets. Now everybody in the class knew my mum was a cleaner and teased me for having that kind of mum. I was so sad about it and did not forgive Pat even though she | apologise thousands of times. ",VERB NOUN ADP,True,False
1604,33,MP,True,Chinese sentence structure differs from English,"Unfortunately, Pat wasn't very good at keeping secrets. He was so kind that he couldn't resist telling Janet that she was going to be killed by Mr Brown | . After doing that, Pat left the room. Janet was so nervous that she couldn't stop her heart beating quickly. She went downstairs quietly and closed the door as soon as she went into her room. At that moment a lot of things appeared in her mind, which seemed like they had just happened yesterday. ""Why did Mr Brown want to kill me?"" she said to herself | . ""I am just a servant in this castle , . I love him so much and I don't want anything from him although he is the owner of this castle."" It seemed as if a shadow came in through the window and disappeared quickly. Everything in the room was quiet except the sound of the clock, as if everything was going to die. She was so frightened and sad that she had no energy. She fell onto the floor and wept, while nobody could help her. ",PUNCT ADP VERB,"Unfortunately, Pat wasn't very good at keeping secrets. He was so kind that he couldn't resist telling Janet that she was going to be killed by Mr Brown | After doing that, Pat left the room. Janet was so nervous that she couldn't stop her heart beating quickly. She went downstairs quietly and closed the door as soon as she went into her room. At that moment a lot of things appeared in her mind, which seemed like they had just happened yesterday. ""Why did Mr Brown want to kill me?"" she said to herself | ""I am just a servant in this castle , . I love him so much and I don't want anything from him although he is the owner of this castle."" It seemed as if a shadow came in through the window and disappeared quickly. Everything in the room was quiet except the sound of the clock, as if everything was going to die. She was so frightened and sad that she had no energy. She fell onto the floor and wept, while nobody could help her. ",ADP VERB DET,True,True
2702,59,UV,True,Modal used for polite speech,"Finally, on the last day, I suggest you | go to the market in town during the 3-hour gap. It is a nice place to buy British-style gifts for your family and friends. You could also enjoy the tea at the cafés nearby. ",VERB ADP DET,"Finally, on the last day, I suggest you | could go to the market in town during the 3-hour gap. It is a nice place to buy British-style gifts for your family and friends. You could also enjoy the tea at the cafés nearby. ",VERB VERB ADP,True,True
2256,39,DN,True,"Chinese verbs, adjectives, and nouns sometimes are the same","The activities are quite hard to choose really, because you have a lot of | choice which I like. But I think I will choose Basketball and Photography, because basketball is the only sport I can play well. Photography is a very interesting activity, and is not too hard to do either. ",NOUN DET PRON,"The activities are quite hard to choose really, because you have a lot of | chose which I like. But I think I will choose Basketball and Photography, because basketball is the only sport I can play well. Photography is a very interesting activity, and is not too hard to do either. ",NOUN DET PRON,True,True
1435,142,TV,True,Chinese generally expresses actions in present tense,"The place where we worked was a football pitch; we spent 3 days setting up the stage, the equipment, and the lights. In fact, there | was nothing very important I did, because we were not the right people to do it. I only put the speakers in the right places, or helped the engineers test the lights. ",VERB NOUN ADV,"The place where we worked was a football pitch; we spent 3 days setting up the stage, the equipment, and the lights. In fact, there | is nothing very important I did, because we were not the right people to do it. I only put the speakers in the right places, or helped the engineers test the lights. ",VERB NOUN ADV,True,True
2648,5,IV,False,Spelling error,I'm | writing to express my feeling and opinion about the International Arts Festival which was held a few days ago.,VERB PART VERB,I'm | writting to express my feeling and opinion about the International Arts Festival which was held a few days ago.,VERB PART VERB,True,False
2290,0,RT,True,Chinese conventions conflict with English,"I went to your annual international art festival. Most of the events I went to were good, but I feel that the festival could be even better next year. So, I am writing to you with some of my opinions and suggestions. I hope it might help | with next year's festival. ",ADP ADJ NOUN,"I went to your annual international art festival. Most of the events I went to were good, but I feel that the festival could be even better next year. So, I am writing to you with some of my opinions and suggestions. I hope it might help | for next year's festival. ",ADP ADJ NOUN,True,True
1135,27,RQ,False,Quantifier would not be used in this context in Chinese,I am sorry to cause you inconvenience. I hope it doesn't cause | any trouble if you accept my suggestion.,DET NOUN ADP,I am sorry to cause you inconvenience. I hope it doesn't cause | some trouble if you accept my suggestion.,DET NOUN ADP,True,False
