1482,218,TV,True,Context carries tense rather than verb.,"In the future, every child might have a laptop. And instead of going to school, why not let school come to you? We will be learning at home using computers and discs. They will never have to leave the house or wake up so early. Another way our home could be different in the future is probably the utilities we | will be using. We might not need maids to do housework anymore as they can easily be replaced with a robot, a machine, or something else with the same purpose. ",VERB VERB VERB,"In the future, every child might have a laptop. And instead of going to school, why not let school come to you? We will be learning at home using computers and discs. They will never have to leave the house or wake up so early. Another way our home could be different in the future is probably the utilities we | are using. We might not need maids to do housework anymore as they can easily be replaced with a robot, a machine, or something else with the same purpose. ",VERB VERB PUNCT,TV VERB VERB PUNCT,True,True
1769,81,MD,True,Chinese has no articles and doesn't use classifiers in this situation,"Then I'd like to choose the tents for my accommodation when at Camp California. I think sleeping in a tent is more fun than other . Also, during my stay at Camp, there are two activities I can choose , for . For one of them I will choose Basketball because it is the sport I play most , . I and my friend used to win the first place in | the school-wide match when we were at school. And for the other one, I think painting will be a good idea; painting is one of my hobbies and I've been studying it since I was 5 years old and now I'm still doing it when I have some free time. ",DET NOUN PUNCT,"Then I'd like to choose the tents for my accommodation when at Camp California. I think sleeping in a tent is more fun than other . Also, during my stay at Camp, there are two activities I can choose , for . For one of them I will choose Basketball because it is the sport I play most , . I and my friend used to win the first place in | school-wide match when we were at school. And for the other one, I think painting will be a good idea; painting is one of my hobbies and I've been studying it since I was 5 years old and now I'm still doing it when I have some free time. ",NOUN PUNCT ADJ,MD NOUN PUNCT ADJ,True,True
283,46,RN,True,Chinese would use word in the given context,"Another thing is I would like to ask you some questions about the | stay , . What's the weather like? What kind of clothes shall I take? And how much does it cost per night to stay in a Hotel? Thanks for your help. ",NOUN PUNCT PUNCT,"Another thing is I would like to ask you some questions about the | journey , . What's the weather like? What kind of clothes shall I take? And how much does it cost per night to stay in a Hotel? Thanks for your help. ",NOUN PUNCT PUNCT,RN NOUN PUNCT PUNCT,True,True
2277,26,RT,True,Chinese conventions conflict with English,"A week later, when I was still in a bad mood, my form teacher, Mrs Brown, talked about jobs in our English lesson. She told us there were numerous types of job in the world. Some offered a high salary while some did not. However, they are equally important for our society. 'Who wants to be a doctor?' She asked. Many students raised their hands. 'Who wants to be a lawyer?' Again, many students put up their hand. But when she asked who wanted to be a cleaner, nobody raised his hand and I felt so ashamed that I lowered my head. 'Cleaner is a very good job.' Mrs Brown said in a loud voice. 'If there were no cleaners, who would clean the school for us , who ? Who would keep the environment nice and tidy . ? ' Suddenly, all my classmates applauded and smiled | at me with respect. The teacher also grinned and I was so impressed and repeated the words in my heart: 'All jobs have the same importance.' ",ADP PRON ADP,"A week later, when I was still in a bad mood, my form teacher, Mrs Brown, talked about jobs in our English lesson. She told us there were numerous types of job in the world. Some offered a high salary while some did not. However, they are equally important for our society. 'Who wants to be a doctor?' She asked. Many students raised their hands. 'Who wants to be a lawyer?' Again, many students put up their hand. But when she asked who wanted to be a cleaner, nobody raised his hand and I felt so ashamed that I lowered my head. 'Cleaner is a very good job.' Mrs Brown said in a loud voice. 'If there were no cleaners, who would clean the school for us , who ? Who would keep the environment nice and tidy . ? ' Suddenly, all my classmates applauded and smiled | to me with respect. The teacher also grinned and I was so impressed and repeated the words in my heart: 'All jobs have the same importance.' ",ADP PRON ADP,RT ADP PRON ADP,True,True
637,76,AGV,False,3rd person plural verb form used instead of 3rd person singular form,The following | is some information about the International student conference.,VERB DET NOUN,The following | are some information about the International student conference.,VERB DET NOUN,AGV VERB DET NOUN,True,False
1973,17,RV,True,,"During the week we decided where we wanted to go , we . We all agreed to listen to music so then we decided to | go to your musical show and listen to ""Over the Rainbow"". ",VERB ADP DET,"During the week we decided where we wanted to go , we . We all agreed to listen to music so then we decided to | come to your musical show and listen to ""Over the Rainbow"". ",VERB ADP DET,RV VERB ADP DET,True,True
1821,133,MD,True,Chinese has no articles and doesn't use classifiers in this situation,"Shopping is not always enjoyable. I don't really like shopping. Sometimes when I'm bored and can't find something else to do . , I go look round | the shops. When I see some clothes in the window I like, I go in and try them on. But I always find they do not look nice on me. The other thing I don't like going shopping is at the weekend. All the shops are full of people, and people treat the items like rubbish . Hanging , hanging them everywhere after they have tried them on and found that they did not suit them. ",DET NOUN PUNCT,"Shopping is not always enjoyable. I don't really like shopping. Sometimes when I'm bored and can't find something else to do . , I go look round | shops. When I see some clothes in the window I like, I go in and try them on. But I always find they do not look nice on me. The other thing I don't like going shopping is at the weekend. All the shops are full of people, and people treat the items like rubbish . Hanging , hanging them everywhere after they have tried them on and found that they did not suit them. ",NOUN PUNCT ADV,MD NOUN PUNCT ADV,True,True
1763,75,MD,True,Chinese has no articles and doesn't use classifiers in this situation,To: The teacher of | the English class,DET ADJ NOUN,To: The teacher of | English class,ADJ NOUN _,MD ADJ NOUN _,True,True
2234,56,IN,True,Missing plural,"Every day, something changes and we become more modern. Companies use computers instead of books, dentists use modernized electric tools instead of just a pair of | pliers , even . Even homes are affected. From letters to emails, from gas stoves to electric stoves and microwaves , but . But we aren't just going to stop here are we? No, in the future, the present will be the past and those things now new to us will be old, outdated and changed. ",NOUN PUNCT ADV,"Every day, something changes and we become more modern. Companies use computers instead of books, dentists use modernized electric tools instead of just a pair of | plier , even . Even homes are affected. From letters to emails, from gas stoves to electric stoves and microwaves , but . But we aren't just going to stop here are we? No, in the future, the present will be the past and those things now new to us will be old, outdated and changed. ",NOUN PUNCT ADV,IN NOUN PUNCT ADV,True,True
2307,57,RT,True,"""of"" maps to the gentive/possessive marker 的 in Chinese","I thought that I would have a great time there, but I was really disappointed with that evening. You said there would be stars such as Danny Brook and Tina Truelove, whose music is my favourite, but the musicians were actually some other people whose names I had never heard of. In the advertisement | for the show, you said it would begin at 19.30 , actually . Actually it was delayed 45 minutes. The discounts on tickets that you mentioned did not exist. It made things worse that our visit to your theatre restaurant, which had already been closed because of a lack of customers, was cancelled. Really, what a letdown! ",ADP DET NOUN,"I thought that I would have a great time there, but I was really disappointed with that evening. You said there would be stars such as Danny Brook and Tina Truelove, whose music is my favourite, but the musicians were actually some other people whose names I had never heard of. In the advertisement | of the show, you said it would begin at 19.30 , actually . Actually it was delayed 45 minutes. The discounts on tickets that you mentioned did not exist. It made things worse that our visit to your theatre restaurant, which had already been closed because of a lack of customers, was cancelled. Really, what a letdown! ",ADP DET NOUN,RT ADP DET NOUN,True,True
1216,18,MT,True,Chinese doesn't use the word in this context,"How are you? I went | to the musical show ""Over the Rainbow"" at your theatre last week. I have got a few things to complain about regarding your theatre. The first thing is in your note it says that you have Danny Brook in the show. But in the show, there was another actor. I was so disappointed, because I came from far away to see Danny Broke. In the note it also says that the show starts at 19:30, and so I went in at 19:25. The show started at 20:15, which means it wasted one hour of my time. The note says that are discounts available there are discounts available on tickets , but I bought my ticket and your people told me that there is no discount on the tickets. When the show had finished . , I decided to go and visit your theatre restaurant , . But I went there and it was closed for some reason. I was really hungry and I went to another restaurant as soon as I could. The note says that your perfect evening out, I thought I could get my money back, with your poor service and all my reasons, but it was not ask for money back . ",ADP DET ADJ,"How are you? I went | the musical show ""Over the Rainbow"" at your theatre last week. I have got a few things to complain about regarding your theatre. The first thing is in your note it says that you have Danny Brook in the show. But in the show, there was another actor. I was so disappointed, because I came from far away to see Danny Broke. In the note it also says that the show starts at 19:30, and so I went in at 19:25. The show started at 20:15, which means it wasted one hour of my time. The note says that are discounts available there are discounts available on tickets , but I bought my ticket and your people told me that there is no discount on the tickets. When the show had finished . , I decided to go and visit your theatre restaurant , . But I went there and it was closed for some reason. I was really hungry and I went to another restaurant as soon as I could. The note says that your perfect evening out, I thought I could get my money back, with your poor service and all my reasons, but it was not ask for money back . ",DET ADJ NOUN,MT DET ADJ NOUN,True,True
1097,7,AGQ,True,Phrases map to the same Chinese phrase,"Other than the Internet , there is also | a lot of modern technology which is changing our daily life. For example, we can go to Mars and do some research. So, we know much more about our universe. Some modern technology is also put into the transport system . For example, trains can go faster and aeroplanes can travel faster. ",DET NOUN ADP,"Other than the Internet , there is also | many modern technology which is changing our daily life. For example, we can go to Mars and do some research. So, we know much more about our universe. Some modern technology is also put into the transport system . For example, trains can go faster and aeroplanes can travel faster. ",ADJ ADJ NOUN,AGQ ADJ ADJ NOUN,True,True
2247,69,CN,False,Number disagreement,4. | Transport,NOUN _ _,4. | Transports,NOUN _ _,CN NOUN _ _,True,False
759,33,DA,False,Using your instead of yours for sign offs,| Yours sincerely,PRON ADV _,| Your sincerely,DET ADV _,DA DET ADV _,True,False
1961,5,RV,False,,"Anyway, in my country, generally, children are free at home, but it also depends on their parents. For me, I don't have rules at home , - I just don't | make trouble for my family , that's . That's all. ",VERB NOUN ADP,"Anyway, in my country, generally, children are free at home, but it also depends on their parents. For me, I don't have rules at home , - I just don't | take trouble for my family , that's . That's all. ",VERB NOUN ADP,RV VERB NOUN ADP,True,False
1804,116,MD,True,Chinese has no articles and doesn't use classifiers in this situation,"Lastly, I have some questions to ask you. Since I have never been to | the U.S.A, I know nothing about it. Would you like to tell me how much I should take with me as pocket money and what should I wear at that time of year? ",DET PROPN PUNCT,"Lastly, I have some questions to ask you. Since I have never been to | U.S.A, I know nothing about it. Would you like to tell me how much I should take with me as pocket money and what should I wear at that time of year? ",PROPN PUNCT PRON,MD PROPN PUNCT PRON,True,True
1956,0,RV,False,,"I went to your annual international art festival. Most of the events I went to were good, but I feel that the festival could be even better next year. So, I am writing to you with some of my opinions and suggestions. I hope it | might help with next year's festival. ",VERB VERB ADP,"I went to your annual international art festival. Most of the events I went to were good, but I feel that the festival could be even better next year. So, I am writing to you with some of my opinions and suggestions. I hope it | may help with next year's festival. ",VERB VERB ADP,RV VERB VERB ADP,True,False
2112,156,RV,True,,"Finally, we would like to get your permission to go , maybe . Maybe if it is possible that you can change your programme, we | can go to your college any time after Tuesday. We're sorry to cause you trouble. ",VERB VERB ADP,"Finally, we would like to get your permission to go , maybe . Maybe if it is possible that you can change your programme, we | may go to your college any time after Tuesday. We're sorry to cause you trouble. ",VERB VERB ADP,RV VERB VERB ADP,True,True
521,81,RP,True,Punctuation error related to Spelling errors (missing space),"| Every day, something changes and we become more modern. Companies use computers instead of books, dentists use modernized electric tools instead of just a pair of pliers , even . Even homes are affected. From letters to emails, from gas stoves to electric stoves and microwaves , but . But we aren't just going to stop here are we? No, in the future, the present will be the past and those things now new to us will be old, outdated and changed. ",DET NOUN PUNCT,"| Everyday, something changes and we become more modern. Companies use computers instead of books, dentists use modernized electric tools instead of just a pair of pliers , even . Even homes are affected. From letters to emails, from gas stoves to electric stoves and microwaves , but . But we aren't just going to stop here are we? No, in the future, the present will be the past and those things now new to us will be old, outdated and changed. ",ADV PUNCT NOUN,RP ADV PUNCT NOUN,True,True
2554,5,RC,False,Incorrect/incomplete expression used,"To help us to live happily, scientists can easily predict the changes on earth , so | that we can have time to prepare or defend ourselves from natural disasters. ",ADP PRON VERB,"To help us to live happily, scientists can easily predict the changes on earth , so | than we can have time to prepare or defend ourselves from natural disasters. ",ADP PRON VERB,RC ADP PRON VERB,True,False
688,36,RY,True,English words map to the same Chinese word,"On the other hand, after shopping you'll get tired and maybe you can't afford your credit card. For instance, you wanted to buy everything which you saw, and after that, you don't know how much you have spent. If you are going shopping someone can easily steal your wallet when you are looking at some interesting things. It would be | really awful. ",ADV ADJ PUNCT,"On the other hand, after shopping you'll get tired and maybe you can't afford your credit card. For instance, you wanted to buy everything which you saw, and after that, you don't know how much you have spent. If you are going shopping someone can easily steal your wallet when you are looking at some interesting things. It would be | very awful. ",ADV ADJ PUNCT,RY ADV ADJ PUNCT,True,True
1167,45,UD,False,Overcorrection,"You wanted to hear about my experience at the pop concert which I enjoyed helping at last month? I must say that was | great fun , . I'd never had this kind of experience before. Before the concert actually started I had to give out lots of leaflets , they . They were lists of pop bands and groups which would appear in the concert in order, and some information about their performance and backgrounds. After that, I had to help people who had a ticket but couldn't find their seat. During the concert, I didn't have a lot to do, so I had a chance to see most of the performance , that . That was excellent. I was excited that I had a closer look at so many famous pop stars. During the break time I did give a lot of directions to people who couldn't find the toilet, and gave people information such as where they could have a cup of coffee. That was a bit boring, but it was part of my job. ",ADJ NOUN PUNCT,"You wanted to hear about my experience at the pop concert which I enjoyed helping at last month? I must say that was | a great fun , . I'd never had this kind of experience before. Before the concert actually started I had to give out lots of leaflets , they . They were lists of pop bands and groups which would appear in the concert in order, and some information about their performance and backgrounds. After that, I had to help people who had a ticket but couldn't find their seat. During the concert, I didn't have a lot to do, so I had a chance to see most of the performance , that . That was excellent. I was excited that I had a closer look at so many famous pop stars. During the break time I did give a lot of directions to people who couldn't find the toilet, and gave people information such as where they could have a cup of coffee. That was a bit boring, but it was part of my job. ",DET ADJ NOUN,UD DET ADJ NOUN,True,False
646,85,AGV,True,3rd person singular form used isntead of 3rd person plural verb form,"Secondly, the end-of-conference party will be held at the college's main hall, from 8:00 pm to 11:30 pm on 20th June. There will be various kinds of food and drinks provided. Moreover, students can dance and enjoy different sorts of music, for instance, rock, jazz, pop, garage and so on. Furthermore, I suggest you and the students wear pub-wears to it, as they | are suitable for dancing. ",VERB ADJ ADP,"Secondly, the end-of-conference party will be held at the college's main hall, from 8:00 pm to 11:30 pm on 20th June. There will be various kinds of food and drinks provided. Moreover, students can dance and enjoy different sorts of music, for instance, rock, jazz, pop, garage and so on. Furthermore, I suggest you and the students wear pub-wears to it, as they | is suitable for dancing. ",VERB ADJ ADP,AGV VERB ADJ ADP,True,True
2176,220,RV,True,,"As for the end-of-conference party, it will be on the morning of the last day, starting at 9:00. All the students and staff will | attend together in the hall. They can play games and talk about their personal experiences. The main aim of this is to strengthen the friendship among all these pupils coming from all over the world. So it would be fine if you wore casual clothes and looked smart. ",VERB ADV ADP,"As for the end-of-conference party, it will be on the morning of the last day, starting at 9:00. All the students and staff will | join together in the hall. They can play games and talk about their personal experiences. The main aim of this is to strengthen the friendship among all these pupils coming from all over the world. So it would be fine if you wore casual clothes and looked smart. ",VERB ADV ADP,RV VERB ADV ADP,True,True
2527,8,UY,True,Chinese would use word in this context,"To be honest, I would like you to return the money | to me. And explain what had happened. ",ADP PRON PUNCT,"To be honest, I would like you to return the money | back to me. And explain what had happened. ",ADV ADP PRON,UY ADV ADP PRON,True,True
796,70,RA,False,that vs which confusion,"We have already booked a 4-star hotel - the Palace Hotel, which is near the River Thames, in Walton-on-Thames. It is not far away from the station so we will go there by train. The end-of-conference party will be held in an Indian restaurant, | which is next to the hotel. It is supposed to be from 7 pm to 11 pm. Also there are some competitions and exciting games after dinner and a disco is also provided. You can wear anything you like , we . We would like you just to be yourself and have fun. ",DET VERB ADJ,"We have already booked a 4-star hotel - the Palace Hotel, which is near the River Thames, in Walton-on-Thames. It is not far away from the station so we will go there by train. The end-of-conference party will be held in an Indian restaurant, | that is next to the hotel. It is supposed to be from 7 pm to 11 pm. Also there are some competitions and exciting games after dinner and a disco is also provided. You can wear anything you like , we . We would like you just to be yourself and have fun. ",DET VERB ADJ,RA DET VERB ADJ,True,False
1299,26,TV,True,Chinese generally expresses actions in present tense,I am sorry to say that I | did not enjoy the evening at your theatre at all. I hope you can pay me the money back as compensation. I am waiting for your reply.,VERB ADV VERB,I am sorry to say that I | do not enjoy the evening at your theatre at all. I hope you can pay me the money back as compensation. I am waiting for your reply.,VERB ADV VERB,TV VERB ADV VERB,True,True
1892,204,MD,True,Chinese has no articles and doesn't use classifiers in this situation,"Welcome to London. You asked me about an interesting building to visit. In my opinion , I recommend | the British Museum. One of the reasons is you can learn almost everything about British history there. ",DET PROPN PROPN,"Welcome to London. You asked me about an interesting building to visit. In my opinion , I recommend | British Museum. One of the reasons is you can learn almost everything about British history there. ",PROPN PROPN PUNCT,MD PROPN PROPN PUNCT,True,True
563,123,UP,False,Overcorrection,"As well as all the treasures, statues and historical paintings...there are also | restaurants and modern galleries. When you are tired after looking around you might want to buy drinks or something to eat, or if you are fed up with historical things, you might as well just pop into the modern gallery to see things which are more modern. ",NOUN CCONJ ADJ,"As well as all the treasures, statues and historical paintings...there are also | restaurant's and modern galleries. When you are tired after looking around you might want to buy drinks or something to eat, or if you are fed up with historical things, you might as well just pop into the modern gallery to see things which are more modern. ",NOUN PART CCONJ,UP NOUN PART CCONJ,True,False
686,34,RY,True,English words map to the same Chinese word,"| Lastly there are some things I need to clarify, that is, such as what type of clothes and how much money I need to bring. ",ADV ADV VERB,"| At last there are some things I need to clarify, that is, such as what type of clothes and how much money I need to bring. ",ADP ADJ ADV,RY ADP ADJ ADV,True,True
2070,114,RV,False,,"I would prefer a tent rather than a log cabin because I have been told that the Californian summer is hot and dry so, because a tent's wind circulation is better, it would create a comfortable coolness. The two activities I would like to do are basketball and surfing. I have played basketball for 5 years in an amateur team and still play on a playground regularly so my skills are good. On the other hand, I am a complete beginner at surfing. This sport has always attracted me due to its contact with the sea and the great sensations it provides and I believe this is the perfect opportunity to | introduce myself to this exciting sport , . I still have some questions to ask you: ",VERB PRON ADP,"I would prefer a tent rather than a log cabin because I have been told that the Californian summer is hot and dry so, because a tent's wind circulation is better, it would create a comfortable coolness. The two activities I would like to do are basketball and surfing. I have played basketball for 5 years in an amateur team and still play on a playground regularly so my skills are good. On the other hand, I am a complete beginner at surfing. This sport has always attracted me due to its contact with the sea and the great sensations it provides and I believe this is the perfect opportunity to | initiate myself to this exciting sport , . I still have some questions to ask you: ",VERB PRON ADP,RV VERB PRON ADP,True,False
