1210,12,MT,True,Chinese doesn't use the word in this context,"| As for the colours, I think metallic colours, especially silver, will be the most popular. As different kinds of fabrics will be invented &amp; and the clothings will never be just cotton as always been seen . Maybe paper can also be a fabric used to make clothing and for those who like to wear new clothes every day. They can be thrown away after wearing them and are light enough to be carried around whenever you want to change what you're wearing. ",ADP ADP DET,"| For the colours, I think metallic colours, especially silver, will be the most popular. As different kinds of fabrics will be invented &amp; and the clothings will never be just cotton as always been seen . Maybe paper can also be a fabric used to make clothing and for those who like to wear new clothes every day. They can be thrown away after wearing them and are light enough to be carried around whenever you want to change what you're wearing. ",ADP DET NOUN,MT ADP DET NOUN,True,True
880,59,AGN,True,Number error,"Apart from the main Hall, there are also lots of other galleries. In these galleries there are Historical paintings , and antique furniture which Chiang used. These | treasures are very old, even older than the history of America. All these treasures were brought over to Taiwan by Chiang during the defeat in China. They are all being well looked after. ",NOUN VERB ADV,"Apart from the main Hall, there are also lots of other galleries. In these galleries there are Historical paintings , and antique furniture which Chiang used. These | treasure are very old, even older than the history of America. All these treasures were brought over to Taiwan by Chiang during the defeat in China. They are all being well looked after. ",NOUN VERB ADV,AGN NOUN VERB ADV,True,True
1003,29,MA,True,Chinese is a pro-drop language,"Also, what kind of clothes shall I bring with me? How much money is | it appropriate to bring? ",PRON ADJ PART,"Also, what kind of clothes shall I bring with me? How much money is | appropriate to bring? ",ADJ PART VERB,MA ADJ PART VERB,True,True
1096,6,CQ,True,Phrases map to the same Chinese phrase,"The most important development is the Internet , which is connected to the whole world's computers by telephone lines. You can send a letter to your friend by e-mail instead of writing it on a piece of paper and sending it by post. It just takes you a few minutes. How convenient it is! There are also | many more advantages , you . You can buy something in a supermarket by only a mail order , you . You don't need to leave your home. ",ADJ ADJ NOUN,"The most important development is the Internet , which is connected to the whole world's computers by telephone lines. You can send a letter to your friend by e-mail instead of writing it on a piece of paper and sending it by post. It just takes you a few minutes. How convenient it is! There are also | much more advantages , you . You can buy something in a supermarket by only a mail order , you . You don't need to leave your home. ",ADV ADJ NOUN,CQ ADV ADJ NOUN,True,True
258,21,RN,False,Spelling error,"Science and technology can give us a better lifestyle or better food. For example, once people had to walk from one place to another, but now we can use science and technology to produce a lot of | petrol vehicles and we can travel faster with them. We can also produce more and better food by using science and technology . , e.g. by using science to put all the good parts of two plants into one plant. We can also use technology to produce more food and help them grow faster. ",NOUN NOUN CCONJ,"Science and technology can give us a better lifestyle or better food. For example, once people had to walk from one place to another, but now we can use science and technology to produce a lot of | petrel vehicles and we can travel faster with them. We can also produce more and better food by using science and technology . , e.g. by using science to put all the good parts of two plants into one plant. We can also use technology to produce more food and help them grow faster. ",NOUN NOUN CCONJ,RN NOUN NOUN CCONJ,True,False
2578,29,UC,False,Overcorrection,"Firstly, I'm very glad to hear from you. Thank you for organising the programme for our class , . I think you have thought a long time about | how we should study during these three days. We have seen your programme, and like all of those , especially the Science Museum , it . It will be good for us to increase our knowledge, and so on. ",ADV PRON VERB,"Firstly, I'm very glad to hear from you. Thank you for organising the programme for our class , . I think you have thought a long time about | that how we should study during these three days. We have seen your programme, and like all of those , especially the Science Museum , it . It will be good for us to increase our knowledge, and so on. ",DET ADV PRON,UC DET ADV PRON,True,False
2434,186,RT,False,Word omitted even though in the Chinese translation it would be there,I'm looking forward to seeing you | at the conference.,ADP DET NOUN,I'm looking forward to seeing you | on the conference.,ADP DET NOUN,RT ADP DET NOUN,True,False
1712,24,MD,True,Chinese has no articles and doesn't use classifiers in this situation,"By using | the Internet we can make new pen friends overseas, and create clubs , and societies. Now a message can travel quicker and it is also worldwide . sending letters takes about a week from Hong Kong to | the U.K., but network , eg. e.g. E-mail . , is much faster. require Require | the time The time required is about only a few minutes. Now we can even create a club in on Yahoo, which is free. Modern technology save saves us alot a lot of times time and give gives brings us many benefits when we use it in the right way, but some bad way to e.g. send virus to break down network . ",DET NOUN PRON,"By using | Internet we can make new pen friends overseas, and create clubs , and societies. Now a message can travel quicker and it is also worldwide . sending letters takes about a week from Hong Kong to | U.K., but network , eg. e.g. E-mail . , is much faster. require Require | time The time required is about only a few minutes. Now we can even create a club in on Yahoo, which is free. Modern technology save saves us alot a lot of times time and give gives brings us many benefits when we use it in the right way, but some bad way to e.g. send virus to break down network . ",NOUN PRON VERB,MD NOUN PRON VERB,True,True
2589,40,RC,False,Incorrect/incomplete expression used,"Last but not least, it is a good kind of entertainment. Maybe you think that playing basketball , and going to cinemas and discos are much better | than staying at home sitting in front of an object. However, televisions can bring you the fun that other activities can't. If sometimes I don't want to go out and I don't want to be lonely, it's easy, I just turn on the television and enjoy myself. ",ADP VERB ADP,"Last but not least, it is a good kind of entertainment. Maybe you think that playing basketball , and going to cinemas and discos are much better | that staying at home sitting in front of an object. However, televisions can bring you the fun that other activities can't. If sometimes I don't want to go out and I don't want to be lonely, it's easy, I just turn on the television and enjoy myself. ",DET VERB ADP,RC DET VERB ADP,True,False
196,22,R,False,Confusion of phrase meaning and usage,"I am a student at Portsmouth College and the end of this term is 23 June, so I can only travel in July. I wonder if it is all right | to come at that time. And concerning my accommodation . , I would prefer to stay in a log cabin, because it is more comfortable. I would like to relax there and enjoy the atmosphere in which I will be living . ",PART VERB ADP,"I am a student at Portsmouth College and the end of this term is 23 June, so I can only travel in July. I wonder if it is all right | for that time. And concerning my accommodation . , I would prefer to stay in a log cabin, because it is more comfortable. I would like to relax there and enjoy the atmosphere in which I will be living . ",ADP DET NOUN,R ADP DET NOUN,True,False
1351,79,TV,False,Error made sense in the original context,I | expect to receive my money back within two days. Otherwise I would like to take further action.,VERB PART VERB,I | expected to receive my money back within two days. Otherwise I would like to take further action.,VERB PART VERB,TV VERB PART VERB,True,False
1562,25,MP,True,Chinese uses commas to mark the end of a complete thought,"Poisonous chemical compounds | , e.g. gases , and liquids, are created too , they . They have been used to kill people , most . Most of them produce radiation | , which can disable a person, mostly harming their brain and their bodies | , and it can also cause death. ",PUNCT ADJ NOUN,"Poisonous chemical compounds | e.g. gases , and liquids, are created too , they . They have been used to kill people , most . Most of them produce radiation | which can disable a person, mostly harming their brain and their bodies | and it can also cause death. ",ADJ NOUN PUNCT,MP ADJ NOUN PUNCT,True,True
2579,30,MC,True,Chinese does not use conjunctions to join clauses,"One day, I passed by a river in accident , . I saw there were a lot of people playing in the river. Suddenly, I heard a cry of ""Help, help"" in the distance. In a while , lots of passed-by passersby crowded at the river-side riverside . To my surprise, nobody went in to save that boy who was shouting, | but just stood there, like lots of "" champ "". I started thinking about it , after . After all, either had I never done this task before, or trained . I was just 15 years old. Finally, I jumped into the river , . I really knew that was dangerous, but I didn't think about anything except ""justify"" this word . I also really hated those people who stood there all the time. ",CCONJ ADV VERB,"One day, I passed by a river in accident , . I saw there were a lot of people playing in the river. Suddenly, I heard a cry of ""Help, help"" in the distance. In a while , lots of passed-by passersby crowded at the river-side riverside . To my surprise, nobody went in to save that boy who was shouting, | just stood there, like lots of "" champ "". I started thinking about it , after . After all, either had I never done this task before, or trained . I was just 15 years old. Finally, I jumped into the river , . I really knew that was dangerous, but I didn't think about anything except ""justify"" this word . I also really hated those people who stood there all the time. ",ADV VERB ADV,MC ADV VERB ADV,True,True
864,43,AGN,True,Number error,"Every day, something changes and we become more modern. Companies use computers instead of books, | dentists use modernized electric tools instead of just a pair of pliers , even . Even homes are affected. From letters to emails, from gas stoves to electric stoves and microwaves , but . But we aren't just going to stop here are we? No, in the future, the present will be the past and those things now new to us will be old, outdated and changed. ",NOUN VERB VERB,"Every day, something changes and we become more modern. Companies use computers instead of books, | dentist use modernized electric tools instead of just a pair of pliers , even . Even homes are affected. From letters to emails, from gas stoves to electric stoves and microwaves , but . But we aren't just going to stop here are we? No, in the future, the present will be the past and those things now new to us will be old, outdated and changed. ",NOUN NOUN VERB,AGN NOUN NOUN VERB,True,True
2746,91,FV,False,Passive voice used incorrectly,"Firstly, I'm very glad to hear from you. Thank you for | organising the programme for our class , . I think you have thought a long time about how we should study during these three days. We have seen your programme, and like all of those , especially the Science Museum , it . It will be good for us to increase our knowledge, and so on. ",VERB DET NOUN,"Firstly, I'm very glad to hear from you. Thank you for | being organised the programme for our class , . I think you have thought a long time about how we should study during these three days. We have seen your programme, and like all of those , especially the Science Museum , it . It will be good for us to increase our knowledge, and so on. ",VERB VERB DET,FV VERB VERB DET,True,False
1637,100,MP,True,Chinese uses commas to mark the end of a complete thought,"In my opinion | , nowadays | , shopping is not always enjoyable. ",PUNCT ADV PUNCT,In my opinion | nowadays | shopping is not always enjoyable.,ADV NOUN VERB,MP ADV NOUN VERB,True,True
188,11,R,True,Phrases map to the same Chinese phrase,"Considering all the above points, I would like to ask for some money | back. I will consider taking this complaint to court if I do not receive an acceptable explanation from the theatre. Thank You. ",ADV PUNCT PRON,"Considering all the above points, I would like to ask for some money | return. I will consider taking this complaint to court if I do not receive an acceptable explanation from the theatre. Thank You. ",NOUN PUNCT PRON,R NOUN PUNCT PRON,True,True
96,11,FN,True,Missing plural,Modern technology plays an important role in our | lives. I am hoping to devote myself to its development.,NOUN PUNCT PRON,Modern technology plays an important role in our | life. I am hoping to devote myself to its development.,NOUN PUNCT PRON,FN NOUN PUNCT PRON,True,True
586,22,AGV,False,3rd person plural verb form used instead of 3rd person singular form,The real show is really very different to what | is described in the advertisement. I am unsatisfied and would like to ask for some money back. Please would you also change the advertisement to the level of the actual facts.,VERB VERB ADP,The real show is really very different to what | are described in the advertisement. I am unsatisfied and would like to ask for some money back. Please would you also change the advertisement to the level of the actual facts.,VERB VERB ADP,AGV VERB VERB ADP,True,False
193,17,R,False,Confusion of phrase meaning and usage,"Science and technology can also be used | to produce some materials, e.g. steel or iron, which are used in our buildings , they . They can make them stronger and hard to destroy. ",PART VERB DET,"Science and technology can also be used | for some materials, e.g. steel or iron, which are used in our buildings , they . They can make them stronger and hard to destroy. ",ADP DET NOUN,R ADP DET NOUN,True,False
1779,91,MD,True,Chinese uses classifiers instead of articles in this case,"Music is | a traditional subject in our school , everyone . Everyone in our school can play at least one instrument, so music lessons should be filmed to show music is part of our school's daily life. ",DET ADJ NOUN,"Music is | traditional subject in our school , everyone . Everyone in our school can play at least one instrument, so music lessons should be filmed to show music is part of our school's daily life. ",ADJ NOUN ADP,MD ADJ NOUN ADP,True,True
564,0,AGV,True,Not applying the 3rd person present tense suffix -s,"Therefore, she came to the river every day and talked about everything with the golden fish. They were very close friends. After half a year, the golden fish suddenly | disappears . Sara was very sad. She sat and cried by the river. Then somebody called her name: ""Sara... Sara... look at me... I'm standing on your left-hand side."" Sara remembered the golden fish. It had suddenly become human, a little boy. After a few days they got married. They had a wonderful life together. ",VERB PUNCT PROPN,"Therefore, she came to the river every day and talked about everything with the golden fish. They were very close friends. After half a year, the golden fish suddenly | disappear . Sara was very sad. She sat and cried by the river. Then somebody called her name: ""Sara... Sara... look at me... I'm standing on your left-hand side."" Sara remembered the golden fish. It had suddenly become human, a little boy. After a few days they got married. They had a wonderful life together. ",VERB PUNCT PROPN,AGV VERB PUNCT PROPN,True,True
965,83,W,True,Sentence could be valid in Chinese,"We have already booked a 4-star hotel - the Palace Hotel, which is near the River Thames, in Walton-on-Thames. It is not far away from the station so we will go there by train. The end-of-conference party will be held in an Indian restaurant, which is next to the hotel. It is supposed to be from 7 pm to 11 pm. Also there are some competitions and exciting games after dinner and a disco is also provided. You can wear anything you like , we . We would like you | just to be yourself and have fun. ",ADV PART VERB,"We have already booked a 4-star hotel - the Palace Hotel, which is near the River Thames, in Walton-on-Thames. It is not far away from the station so we will go there by train. The end-of-conference party will be held in an Indian restaurant, which is next to the hotel. It is supposed to be from 7 pm to 11 pm. Also there are some competitions and exciting games after dinner and a disco is also provided. You can wear anything you like , we . We would like you | to be just yourself and have fun. ",PART VERB ADV,W PART VERB ADV,True,True
157,72,FN,True,Missing plural,"I think that the journalists' only aim is money, because they know that if they publish famous people's private | lives they will earn lots of money selling the magazine or the newspaper. But they don't consider the problems the rumours may cause the famous family or couple. Sometimes the journalists' aim isn't the money: there are some journalists who may try to spoil a politician's or film star's career only because they are jealous. ",NOUN PRON VERB,"I think that the journalists' only aim is money, because they know that if they publish famous people's private | life they will earn lots of money selling the magazine or the newspaper. But they don't consider the problems the rumours may cause the famous family or couple. Sometimes the journalists' aim isn't the money: there are some journalists who may try to spoil a politician's or film star's career only because they are jealous. ",NOUN PRON VERB,FN NOUN PRON VERB,True,True
892,9,W,True,Adjective/modifier precedes described object,Modern technology plays an important role in our lives. I am hoping to devote myself to | its development.,DET NOUN PUNCT,Modern technology plays an important role in our lives. I am hoping to devote myself to | the development of it.,DET NOUN ADP,W DET NOUN ADP,True,True
1355,83,TV,False,This person is overusing auxiliaries/modal verbs,"Secondly, the show was meant to start at 19:30 but it started at 20:15. I | was waiting for 45 minutes. The poster also told me that I could visit the theatre restaurant after the show. As you know the show started late, so, I was not able to go to the theatre restaurant because it closed before the show finished. ",VERB VERB ADP,"Secondly, the show was meant to start at 19:30 but it started at 20:15. I | have been waiting for 45 minutes. The poster also told me that I could visit the theatre restaurant after the show. As you know the show started late, so, I was not able to go to the theatre restaurant because it closed before the show finished. ",VERB VERB VERB,TV VERB VERB VERB,True,False
1861,173,MD,True,Chinese has no articles and doesn't use classifiers in this situation,"First of all, the efficiency of society has been improved. When shopping, we don't need to wait for the cashier to take every article's note by hand. When booking a flight, we can just make a phone call to any agency, and get it done in one minute. Secondly, instead of looking up tons of books to get the information that we need, we can very easily search for it on the Internet or on the local network. It's very often heard , that someone , who has a rare illness , has had an operation at a foreign institute , which he found via the Internet. Moreover, with computer networks, it is possible for people to work from home, making projects, controlling operations or having conferences. Lastly the way of communications has also changed. Instead of traditional telecommunications, we can talk by, e-mail or even see each other with the help of | a computer network. ",DET NOUN NOUN,"First of all, the efficiency of society has been improved. When shopping, we don't need to wait for the cashier to take every article's note by hand. When booking a flight, we can just make a phone call to any agency, and get it done in one minute. Secondly, instead of looking up tons of books to get the information that we need, we can very easily search for it on the Internet or on the local network. It's very often heard , that someone , who has a rare illness , has had an operation at a foreign institute , which he found via the Internet. Moreover, with computer networks, it is possible for people to work from home, making projects, controlling operations or having conferences. Lastly the way of communications has also changed. Instead of traditional telecommunications, we can talk by, e-mail or even see each other with the help of | computer network. ",NOUN NOUN PUNCT,MD NOUN NOUN PUNCT,True,True
1719,31,MD,True,Chinese has no articles and doesn't use classifiers in this situation,"However, things are recycled from time to time. So do the objective of wearing clothes . I imagine that , people in the future, for example 100 years from now, will wear clothes for protection like people did in the past. People in the past wore clothes to protect themselves from the cold air, hot weather and strong wind. On the other hand, people in the future will probably wear clothes to protect themselves from the polluted air and water, the harmful ultra-violet rays from the sun and all the dangerous and poisonous gases or chemicals which are | the product of a developed and full-grown country. ",DET NOUN ADP,"However, things are recycled from time to time. So do the objective of wearing clothes . I imagine that , people in the future, for example 100 years from now, will wear clothes for protection like people did in the past. People in the past wore clothes to protect themselves from the cold air, hot weather and strong wind. On the other hand, people in the future will probably wear clothes to protect themselves from the polluted air and water, the harmful ultra-violet rays from the sun and all the dangerous and poisonous gases or chemicals which are | product of a developed and full-grown country. ",NOUN ADP DET,MD NOUN ADP DET,True,True
2366,117,RT,True,Chinese doesn't use the word in this context; Preposition that makes most sense to Chinese speakers is used,"I would prefer a tent rather than a log cabin because I have been told that the Californian summer is hot and dry so, because a tent's wind circulation is better, it would create a comfortable coolness. The two activities I would like to do are basketball and surfing. I have played basketball for 5 years in an amateur team and still play on a playground regularly so my skills are good. On the other hand, I am a complete beginner | at surfing. This sport has always attracted me due to its contact with the sea and the great sensations it provides and I believe this is the perfect opportunity to introduce myself to this exciting sport , . I still have some questions to ask you: ",ADP NOUN PUNCT,"I would prefer a tent rather than a log cabin because I have been told that the Californian summer is hot and dry so, because a tent's wind circulation is better, it would create a comfortable coolness. The two activities I would like to do are basketball and surfing. I have played basketball for 5 years in an amateur team and still play on a playground regularly so my skills are good. On the other hand, I am a complete beginner | concerning surfing. This sport has always attracted me due to its contact with the sea and the great sensations it provides and I believe this is the perfect opportunity to introduce myself to this exciting sport , . I still have some questions to ask you: ",VERB NOUN PUNCT,RT VERB NOUN PUNCT,True,True
