,sentence,correct,tags,tags_trigram,poss,poss_trigram,en,es,model_result
0,The firemen arrived ten minutes later.,True,DT NNS VBD CD NNS RB . ,DT NNS VBD,DET NOUN VERB NUM NOUN ADV PUNCT ,DET NOUN VERB,63.14484160132063,65.76383414070344,False
1,Arrived the firemen ten minutes later.,False,VBD DT NNS CD NNS RB . ,VBD DT NNS,VERB DET NOUN NUM NOUN ADV PUNCT ,VERB DET NOUN,63.14484160132063,65.76383414070344,True
2,Yesterday played very well the children.,False,NN VBD RB RB DT NNS . ,VBD RB RB,NOUN VERB ADV ADV DET NOUN PUNCT ,VERB ADV ADV,65.56457321438768,68.13958610852481,True
3,Played very well the children yesterday.,False,VBN RB RB DT NNS NN . ,VBN RB RB,VERB ADV ADV DET NOUN NOUN PUNCT ,VERB ADV ADV,66.59497986660949,68.73169261400821,True
4,Yesterday the children played very well.,True,NN DT NNS VBD RB RB . ,DT NNS VBD,NOUN DET NOUN VERB ADV ADV PUNCT ,DET NOUN VERB,65.56457321438768,68.1395861085248,False
5,The children played very well yesterday.,True,DT NNS VBD RB RB NN . ,DT NNS VBD,DET NOUN VERB ADV ADV NOUN PUNCT ,DET NOUN VERB,65.56457321438768,68.13958610852481,False
6,Often she has helped.,False,RB PRP VBZ VBN . ,RB PRP VBZ,ADV PRON VERB VERB PUNCT ,ADV PRON VERB,42.128110866017344,42.70783633057554,True
7,She often has helped.,False,PRP RB VBZ VBN . ,RB VBZ VBN,PRON ADV VERB VERB PUNCT ,PRON ADV VERB,42.128110866017344,42.70783633057554,True
8,They live in the house white.,False,PRP VBP IN DT NN JJ . ,NN JJ .,PRON VERB ADP DET NOUN ADJ PUNCT ,NOUN ADJ PUNCT,67.75071402476189,70.63068938066584,True
9,Can you lend me a ball of tennis?,False,MD PRP VB PRP DT NN IN NN . ,NN IN NN,VERB PRON VERB PRON DET NOUN ADP NOUN PUNCT ,NOUN ADP NOUN,89.49176143290865,91.27735960071074,True
10,The Club of Bridge of the University of Cambridge.,False,DT NNP IN NNP IN DT NNP IN NNP . ,NNP IN NNP,DET PROPN ADP PROPN ADP DET PROPN ADP PROPN PUNCT ,PROPN ADP PROPN,103.97879802853416,110.46131116905771,True
11,They gave to Sam the book.,False,PRP VBD IN NNP DT NN . ,IN NNP DT,PRON VERB ADP PROPN DET NOUN PUNCT ,ADP PROPN DET,66.61866046170118,69.25978340017993,True
12,They gave the book to Sam.,True,PRP VBD DT NN IN NNP . ,IN NNP .,PRON VERB DET NOUN ADP PROPN PUNCT ,ADP PROPN PUNCT,66.61866046170118,69.25978340017993,False
13,They took to the hospital her mother.,False,PRP VBD IN DT NN PRP$ NN . ,NN PRP$ NN,PRON VERB ADP DET NOUN DET NOUN PUNCT ,NOUN DET NOUN,76.6194180498581,79.48299313257586,True
14,Mrs Smith speaks very well English.,False,NNP NNP VBZ RB RB NNP . ,RB RB NNP,PROPN PROPN VERB ADV ADV PROPN PUNCT ,ADV ADV PROPN,65.59050228705951,68.7263988597377,True
15,Keep tidy Britain.,False,VB JJ NNP . ,VB JJ NNP,VERB ADJ PROPN PUNCT ,VERB ADJ PROPN,33.24205107359544,34.62523003913305,True
16,John has bought the books?,True,NNP VBZ VBN DT NNS . ,NNP VBZ VBN,PROPN VERB VERB DET NOUN PUNCT ,PROPN VERB VERB,54.507462483516356,57.022299958505315,False
17,Has bought the books John?,False,VBZ VBN DT NNS NNP . ,VBZ VBN DT,VERB VERB DET NOUN PROPN PUNCT ,VERB VERB DET,54.507462483516356,57.022299958505315,True
18,Mary came?,True,NNP VBD . ,NNP VBD .,PROPN VERB PUNCT ,PROPN VERB PUNCT,20.390646942897803,21.261768380733205,False
19,When Mary came?,False,WRB NNP VBD . ,WRB NNP VBD,ADV PROPN VERB PUNCT ,ADV PROPN VERB,28.58994510126134,25.75460938174739,False
20,Came Mary?,False,VBD NNP . ,VBD NNP .,VERB PROPN PUNCT ,VERB PROPN PUNCT,20.390646942897803,21.261768380733205,True
21,"Mary, when came?",False,"NNP , WRB VBD . ",WRB VBD .,PROPN PUNCT ADV VERB PUNCT ,ADV VERB PUNCT,39.501116053551726,37.155412633330585,False
22,Who did kill Oswald?,False,WP VBD VB NNP . ,VBD VB NNP,PRON VERB VERB PROPN PUNCT ,VERB VERB PROPN,39.3712606344653,40.291454550423744,True
23,Who Oswald killed?,False,WP NNP VBD . ,WP NNP VB,PRON PROPN VERB PUNCT ,PRON PROPN VERB,28.58388588638513,29.20698058679125,True
24,Who killed to Kennedy?,False,WP VBD IN NNP . ,VBD IN NNP,PRON VERB ADP PROPN PUNCT ,VERB ADP PROPN,40.522957241374066,41.93136793033396,True
25,Who Kennedy killed?,False,WP NNP VBD . ,WP NNP VBD,PRON PROPN VERB PUNCT ,PRON PROPN VERB,28.58388588638513,29.20698058679125,True
26,Did they went?,False,VBD PRP VBD . ,VBD PRP VBD,VERB PRON VERB PUNCT ,VERB PRON VERB,29.10753379958581,29.37203469996685,True
27,Do they went?,False,VBP PRP VBD . ,VBP PRP VBD,VERB PRON VERB PUNCT ,VERB PRON VERB,30.132454476429853,30.77851962777389,True
28,Do she goes?,False,VBP PRP VBZ . ,VBP PRP VBZ,VERB PRON VERB PUNCT ,VERB PRON VERB,31.26048339998621,32.37761442184163,True
29,Does she goes?,False,VBZ PRP VBZ . ,VBZ . _,VERB PRON VERB PUNCT ,VERB PUNCT _,31.36359164669853,32.570224288102324,True
30,"They're coming tomorrow, no?",False,"PRP VBP VBG NN , UH . ",UH . _,PRON VERB VERB NOUN PUNCT INTJ PUNCT ,INTJ PUNCT _,59.84422306340578,58.20672276179944,False
31,"You have a car, no?",False,"PRP VBP DT NN , UH . ",", UH .",PRON VERB DET NOUN PUNCT INTJ PUNCT ,PUNCT INTJ PUNCT,61.74696701754166,62.047357725630796,True
32,Peter not found the key.,False,NNP RB VBD DT NN . ,RB VBD DT,PROPN ADV VERB DET NOUN PUNCT ,ADV VERB DET,54.86794724427682,57.25516342637263,True
33,Peter not has found the key.,False,NNP RB VBZ VBN DT NN . ,RB VBZ VBN,PROPN ADV VERB VERB DET NOUN PUNCT ,ADV VERB VERB,66.24325804330348,68.91996559524617,True
34,I no understand.,False,PRP RB VBP . ,RB VBP .,PRON ADV VERB PUNCT ,ADV VERB PUNCT,31.77772074383472,32.449519089509046,True
35,Those no.,False,DT UH . ,DT UH .,DET INTJ PUNCT ,DET INTJ PUNCT,18.038306543829354,17.060580547407255,False
36,Green no.,False,NNP NN . ,NNP NN .,PROPN NOUN PUNCT ,PROPN NOUN PUNCT,23.05568198788986,24.069222679599658,True
37,Here no.,False,RB UH . ,RB UH .,ADV INTJ PUNCT ,ADV INTJ PUNCT,17.167199491997632,15.637441332071695,False
38,I not saw nobody.,False,PRP RB VBD NN . ,RB VBD NN,PRON ADV VERB NOUN PUNCT ,ADV VERB NOUN,42.634710335231226,43.32408932989081,True
39,I didn't see nobody.,False,PRP VBD RB VB NN . ,NN . _,PRON VERB ADV VERB NOUN PUNCT ,NOUN PUNCT _,53.42208508331139,54.408563293523294,True
40,Tom not helps her never.,False,NNP RB VBZ PRP RB . ,RB VBZ PRP,PROPN ADV VERB PRON ADV PUNCT ,ADV VERB PRON,53.916742200849704,55.574896798238115,True
41,Tom doesn't help her never.,False,NNP VBZ RB VB PRP RB . ,PRP RB .,PROPN VERB ADV VERB PRON ADV PUNCT ,PRON ADV PUNCT,64.70411694892988,66.65937076187059,True
42,I waited but anybody came.,False,PRP VBD CC NN VBD . ,NN VBD .,PRON VERB CCONJ NOUN VERB PUNCT , NOUN VERB PUNCT,51.47809447571454,52.50906084839853,True
43,Maria cans cook.,False,NNP NNS VBP . ,NNS VBP .,PROPN NOUN VERB PUNCT ,NOUN VERB PUNCT,32.423823818848646,34.19624317104575,True
44,Do you can swim?,False,VBP PRP MD VB . ,VBP PRP MD,VERB PRON VERB VERB PUNCT ,VERB PRON VERB,41.62363354595726,41.878375210204624,True
45,May you come tomorrow?,False,MD PRP VB NN . ,MD PRP VB,VERB PRON VERB NOUN PUNCT ,VERB PRON VERB,43.26374791410528,43.27934458126402,True
46,She could find the key.,False,PRP MD VB DT NN . ,MD VB DT,PRON VERB VERB DET NOUN PUNCT ,VERB VERB DET,54.996996456590345,55.8470841276571,True
47,She had to win the match.,False,PRP VBD TO VB DT NN . ,VBD TO VB,PRON VERB PART VERB DET NOUN PUNCT ,VERB PART VERB,64.32525428441383,66.67879739920022,True
48,They will can do it next week.,False,PRP MD MD VB PRP JJ NN . ,MD MD VB,PRON VERB VERB VERB PRON ADJ NOUN PUNCT ,VERB VERB VERB,75.13911541775579,74.94574859479647,False
49,She went up the stairs.,True,PRP VBD RP DT NNS . ,VBD RP DT,PRON VERB PART DET NOUN PUNCT ,VERB PART DET,50.75780047009535,48.48700424055722,True
50,She went up the book.,False,PRP VBD RP DT NN . ,VBD RP DT,PRON VERB PART DET NOUN PUNCT ,VERB PART DET,51.6314545392291,49.24006954624055,False
51,They were waiting.,True,PRP VBD VBG . ,PRP VBD VBG,PRON VERB VERB PUNCT ,PRON VERB VERB,29.72116316468652,28.625538413206204,True
52,They were waiting the bus.,False,PRP VBD VBG DT NN . ,VBG DT NN,PRON VERB VERB DET NOUN PUNCT ,VERB DET NOUN,53.33632197541216,53.47433312778811,True
53,Mary laughed.,True,NNP VBD . ,NNP VBD .,PROPN VERB PUNCT ,PROPN VERB PUNCT,20.390646942897803,21.261768380733205,False
54,What did she laugh?,False,WP VBD PRP VB . ,VB . _,PRON VERB PRON VERB PUNCT ,VERB PUNCT _,38.8712722679048,38.928120000335,True
55,Football likes me.,False,NN VBZ PRP . ,NN VBZ PRP,NOUN VERB PRON PUNCT ,NOUN VERB PRON,32.90059776813422,33.77858379290103,True
56,"Do they want some money? Yes, they want.",False,"VBP PRP VB DT NN . UH , PRP VBP . ",VBP . _,VERB PRON VERB DET NOUN PUNCT INTJ PUNCT PRON VERB PUNCT ,VERB PUNCT _,104.09110080721963,105.50868676280676,True
57,"Do you want to go? No, I don't want.",False,"VBP PRP VB TO VB . UH , PRP VBP RB VB . ",VB . _,VERB PRON VERB PART VERB PUNCT INTJ PUNCT PRON VERB ADV VERB PUNCT ,VERB PUNCT _,122.94489513257841,124.8205351968887,True
58,I like to get up early; I'm used.,False,PRP VBP TO VB RP RB : PRP VBP VBN . ,VBN . _,PRON VERB PART VERB PART ADV PUNCT PRON VERB VERB PUNCT ,VERB PUNCT _,100.39192718571907,98.62549173815573,False
59,"Are they coming? No, I don't think.",False,"VBP PRP VBG . UH , PRP VBP RB VB . ",VB . _,VERB PRON VERB PUNCT INTJ PUNCT PRON VERB ADV VERB PUNCT ,VERB PUNCT _,101.16858807549656,100.53159696184409,False
60,Look! It rains!,False,VB . PRP VBZ . ,PRP VBZ .,VERB PUNCT PRON VERB PUNCT ,PRON VERB PUNCT,42.44724203639029,43.65393890343664,True
61,Do I come tomorrow?,False,VBP PRP VB NN . ,VBP PRP VB,VERB PRON VERB NOUN PUNCT ,VERB PRON VERB,43.58486426950208,44.670447890272825,True
62,I wait for you at home.,False,PRP VBP IN PRP IN NN . ,VBP IN PRP,PRON VERB ADP PRON ADP NOUN PUNCT ,VERB ADP PRON,67.34941558448858,69.45958157504785,True
63,I see her this evening.,False,PRP VBP PRP DT NN . ,VBP PRP DT,PRON VERB PRON DET NOUN PUNCT ,VERB PRON DET,55.204521416995796,56.57854643435554,True
64,How long are you working in your present job?,False,WRB RB VBP PRP VBG IN PRP$ JJ NN . ,VBP PRP VBG,ADV ADV VERB PRON VERB ADP DET ADJ NOUN PUNCT ,VERB PRON VERB,94.20202875920856,92.15781782452412,False
65,It's a long time that I live here.,False,PRP VBZ DT JJ NN WDT PRP VBP RB . ,VBP RB .,PRON VERB DET ADJ NOUN DET PRON VERB ADV PUNCT ,VERB ADV PUNCT,96.90046135495113,97.73234912716484,True
66,When has she received the letter?,False,WRB VBZ PRP VBD DT NN . ,VBZ PRP VBD,ADV VERB PRON VERB DET NOUN PUNCT ,VERB PRON VERB,62.05001969223135,60.31276520963066,False
67,Today I've finished work early because I've started at seven o'clock this morning.,False,NN PRP VB VBN NN RB IN PRP VB VBN IN CD NN DT NN . ,VB VBN NN,NOUN PRON VERB VERB NOUN ADV ADP PRON VERB VERB ADP NUM NOUN DET NOUN PUNCT ,VERB VERB NOUN,166.73411771607715,170.9572775057315,True
68,"When we were young, we were playing a lot of tennis.",False,"WRB PRP VBD JJ , PRP VBD VBG DT NN IN NN . ",VBD VBG DT,ADV PRON VERB ADJ PUNCT PRON VERB VERB DET NOUN ADP NOUN PUNCT ,VERB VERB DET,127.43933589149886,126.0244422868512,False
69,"When I was a teenager, I was having a motorbike.",False,"WRB PRP VBD DT NN , PRP VBD VBG DT NN . ",VBD VBG DT,ADV PRON VERB DET NOUN PUNCT PRON VERB VERB DET NOUN PUNCT ,VERB VERB DET,115.95260847312905,114.11520592561186,False
70,She wasn't knowing that he had died.,False,PRP VBD RB VBG IN PRP VBD VBN . ,VBD RB VBG,PRON VERB ADV VERB ADP PRON VERB VERB PUNCT ,VERB ADV VERB,82.66031646213644,82.4586672932567,False
71,Come you tomorrow!,False,VB PRP NN . ,PRP NN .,VERB PRON NOUN PUNCT ,PRON NOUN PUNCT,33.34306836940953,33.79036209314341,True
72,"When Mary will get here, tell her to come in.",False,"WRB NNP MD VB RB , VB PRP TO VB RP . ",MD VB RB,ADV PROPN VERB VERB ADV PUNCT VERB PRON PART VERB PART PUNCT ,VERB VERB ADV,112.26066876441851,107.3335853267615,False
73,I use to do a lot of exercise.,False,PRP VBP TO VB DT NN IN NN . ,VBP TO VB,PRON VERB PART VERB DET NOUN ADP NOUN PUNCT ,VERB PART VERB,89.17115658448736,93.09072483873878,True
74,The house built itself before the war.,False,DT NN VBD PRP IN DT NN . ,VBD PRP IN,DET NOUN VERB PRON ADP DET NOUN PUNCT ,VERB PRON ADP,79.06004755277752,82.32041060335095,True
75,They were given bikes for Christmas.,True,PRP VBD VBN NNS IN NNP . ,PRP VBD VBN,PRON VERB VERB NOUN ADP PROPN PUNCT ,PRON VERB VERB,64.25903972555264,66.00468592290932,False
76,Polly was owed a lot of money.,True,NNP VBD VBN DT NN IN NN . ,VBD VBN DT,PROPN VERB VERB DET NOUN ADP NOUN PUNCT ,VERB VERB DET,78.07406925232324,81.18171298185241,False
77,The lecture was very bored.,False,DT NN VBD RB JJ . ,JJ . _,DET NOUN VERB ADV ADJ PUNCT ,ADJ PUNCT _,54.97508013049348,57.21958447905149,True
78,I'm very interesting in Polish films.,False,PRP VBP RB JJ IN JJ NNS . ,JJ IN JJ,PRON VERB ADV ADJ ADP ADJ NOUN PUNCT ,ADJ ADP ADJ,77.28685750966237,80.20707342373669,True
79,To smoke is bad for you.,False,TO VB VBZ JJ IN PRP . ,TO VB VBZ,PART VERB VERB ADJ ADP PRON PUNCT ,PART VERB VERB,65.05810035809945,67.90607338631847,True
80,It's difficult learn English.,False,PRP VBZ JJ VBP NNP . ,VBP NNP .,PRON VERB ADJ VERB PROPN PUNCT ,VERB PROPN PUNCT,53.715159725501486,55.9183704973422,True
81,Let us to see.,False,VB PRP TO VB . ,TO VB .,VERB PRON PART VERB PUNCT ,PART VERB PUNCT,42.28059499851985,43.44087577892845,True
82,The food is more important than the art.,False,DT NN VBZ RBR JJ IN DT NN . ,DT NN .,DET NOUN VERB ADV ADJ ADP DET NOUN PUNCT ,DET NOUN PUNCT,88.33229473209141,89.74010200120048,True
83,Do you like the big dogs?,False,VBP PRP VB DT JJ NNS . ,DT JJ NNS,VERB PRON VERB DET ADJ NOUN PUNCT ,DET ADJ NOUN,65.72536334871938,68.23771069507232,True
84,"That is the yours, and this is the mine.",False,"DT VBZ DT NNS , CC DT VBZ DT NN . ",DT NN .,DET VERB DET NOUN PUNCT CCONJ DET VERB DET NOUN PUNCT ,DET NOUN PUNCT,111.91279029107599,118.48216877487292,True
85,We used to live in one flat; now we live in one house.,False,PRP VBD TO VB IN CD JJ : RB PRP VBP IN CD NN . ,CD NN .,PRON VERB PART VERB ADP NUM ADJ PUNCT ADV PRON VERB ADP NUM NOUN PUNCT ,NUM NOUN PUNCT,146.66717295876313,151.1867041917316,True
86,Do you have car?,False,VBP PRP VB NN . ,VB NN .,VERB PRON VERB NOUN PUNCT ,VERB NOUN PUNCT,43.58486426950208,44.670447890272825,True
87,Her sister is dentist.,False,PRP$ NN VBZ NN . ,NN . _,DET NOUN VERB NOUN PUNCT ,NOUN PUNCT _,43.40134372285162,45.36512807538568,True
88,I have ones nice American friends.,False,PRP VBP NNS JJ JJ NNS . ,NNS JJ JJ,PRON VERB NOUN ADJ ADJ NOUN PUNCT ,NOUN ADJ ADJ,65.4939008631269,67.86607561164195,True
89,The table is dirty.,True,DT NN VBZ JJ . ,NN VBZ JJ,DET NOUN VERB ADJ PUNCT ,NOUN VERB ADJ,45.240967563396474,47.67407894206171,False
90,"Clean her, please.",False,"VB PRP , UH . ","VB PRP ,",VERB PRON PUNCT INTJ PUNCT ,VERB PRON PUNCT,38.67738705480363,37.40295117755198,False
91,"They showed me two models, and I bought the small.",False,"PRP VBD PRP CD NNS , CC PRP VBD DT JJ . ",JJ . _,PRON VERB PRON NUM NOUN PUNCT CCONJ PRON VERB DET ADJ PUNCT ,ADJ PUNCT _,115.19339516011992,117.84870649634493,True
92,I am more old than my sister.,False,PRP VBP RBR JJ IN PRP$ NN . ,RBR JJ IN,PRON VERB ADV ADJ ADP DET NOUN PUNCT ,ADV ADJ ADP,72.8471815248228,72.28611291090489,False
93,Barcelona is the more large city of Catalonia.,False,NNP VBZ DT RBR JJ NN IN NNP . ,RBR JJ NN,PROPN VERB DET ADV ADJ NOUN ADP PROPN PUNCT ,ADV ADJ NOUN,87.06467936066434,88.4676423094403,True
94,Rosa isn't French. Is Spanish.,False,NNP VBZ RB NNP . VBZ JJ . ,VBZ JJ .,PROPN VERB ADV PROPN PUNCT VERB ADJ PUNCT ,VERB ADJ PUNCT,75.8215776178441,79.69085155984108,True
95,Have gone home because wanted to go to bed.,False,VBP VBN RB IN VBD TO VB IN NN . ,VBP VBN RB,VERB VERB ADV ADP VERB PART VERB ADP NOUN PUNCT ,VERB VERB ADV,97.147584365034,101.22539308156315,True
96,Was raining.,False,VBD VBG . ,VBD VBG .,VERB VERB PUNCT ,VERB VERB PUNCT,19.047379811597708,18.20070545188409,False
97,That's the man who he lives next door to us.,False,DT VBZ DT NN WP PRP VBZ JJ NN IN PRP . ,IN PRP .,DET VERB DET NOUN PRON PRON VERB ADJ NOUN ADP PRON PUNCT ,ADP PRON PUNCT,120.68090752558086,125.11483479227869,True
98,I saw she.,False,PRP VBD PRP . ,VBD PRP .,PRON VERB PRON PUNCT ,VERB PRON PUNCT,30.564441929426106,30.3232667919666,False
99,They know we.,False,PRP VBP PRP . ,PRP . _,PRON VERB PRON PUNCT ,PRON PUNCT _,31.58936260627016,31.729751719773645,True
100,How many cakes is it in the cupboard?,False,WRB JJ NNS VBZ PRP IN DT NN . ,PRP IN DT,ADV ADJ NOUN VERB PRON ADP DET NOUN PUNCT ,PRON ADP DET,87.06137662894454,86.8441301104462,False
101,Who is it? Am I.,False,WP VBZ PRP . VBP NN . ,VBP NN .,PRON VERB PRON PUNCT VERB NOUN PUNCT,VERB NOUN PUNCT,61.976812400130555,63.67581811118042,True
102,They enjoyed very much.,False,PRP VBD RB RB . ,RB RB .,PRON VERB ADV ADV PUNCT ,ADV ADV PUNCT,41.61494155764404,42.187634492759535,True
103,She complained herself.,False,PRP VBD PRP . ,PRP . _,PRON VERB PRON PUNCT ,PRON PUNCT _,30.564441929426106,30.3232667919666,False
104,I showered me and went out.,False,PRP VBD PRP CC VBD RP . ,PRP CC VBD,PRON VERB PRON CCONJ VERB PART PUNCT ,PRON CCONJ VERB,58.39560471272894,55.14567964254602,False
105,Mary washed the hair.,False,NNP VBD DT NN . ,DT NN .,PROPN VERB DET NOUN PUNCT ,DET NOUN PUNCT,44.005805753623456,46.1105630953151,True
106,Bill cut himself the finger.,False,NNP VBD PRP DT NN . ,PRP DT NN,PROPN VERB PRON DET NOUN PUNCT ,PRON DET NOUN,54.67958910671226,56.53539605663722,True
107,Sara and Joe had both got his shoes wet.,False,NNP CC NNP VBD DT VBN PRP$ NNS JJ . ,PRP$ NNS JJ,PROPN CCONJ PROPN VERB DET VERB DET NOUN ADJ PUNCT ,DET NOUN ADJ,95.6153793329291,99.55025429579901,True
108,The my cousin is in Portugal.,False,DT PRP$ NN VBZ IN NNP . ,DT PRP$ NN,DET DET NOUN VERB ADP PROPN PUNCT ,DET DET NOUN,66.3655250717344,70.1643673085435,True
109,The girls we saw looked quite happy.,True,DT NNS PRP VBD VBD RB JJ . ,NNS PRP VBD,DET NOUN PRON VERB VERB ADV ADJ PUNCT ,NOUN PRON VERB,73.99208463769703,76.36495300401266,False
110,Did you like the woman we spoke to?,True,VBD PRP VB DT NN PRP VBD IN . ,VBD IN .,VERB PRON VERB DET NOUN PRON VERB ADP PUNCT ,VERB ADP PUNCT,86.12292206646936,88.45452368304603,False
111,They have gone for buy a film.,False,PRP VBP VBN IN VB DT NN . ,IN VB DT,PRON VERB VERB ADP VERB DET NOUN PUNCT ,ADP VERB DET,77.50446604244641,80.02828215501441,True
112,We are going to have the house painted.,True,PRP VBP VBG TO VB DT NN VBN . ,TO VB DT,PRON VERB VERB PART VERB DET NOUN VERB PUNCT ,PART VERB DET,85.42796142507741,86.8780942843748,False
113,We are going to make paint the house.,False,PRP VBP VBG TO VB NN DT NN . ,TO VB NN,PRON VERB VERB PART VERB NOUN DET NOUN PUNCT ,PART VERB NOUN,87.06258981784764,89.09344207775781,True
114,They refused helping their neighbours.,False,PRP VBD VBG PRP$ NNS . ,VBG PRP$ NNS,PRON VERB VERB DET NOUN PUNCT ,VERB DET NOUN,50.02203840335896,49.88385035132966,False
115,I'll never forget to see that accident.,False,PRP MD RB VB TO VB DT NN . ,TO VB DT,PRON AUX ADV VERB PART VERB DET NOUN PUNCT ,PART VERB DET,86.67857484459459,88.92325331268844,True
116,She explained me the problem.,False,PRP VBD PRP DT NN . ,PRP DT NN,PRON VERB PRON DET NOUN PUNCT ,PRON DET NOUN,54.179600740151756,55.17206150654849,True
117,They suggested Jim to take the job.,False,PRP VBD NNP TO VB DT NN . ,NNP TO VB,PRON VERB PROPN PART VERB DET NOUN PUNCT ,PROPN PART VERB,75.49902600406314,78.46696491061107,True
118,I am asking that they go.,False,PRP VBP VBG IN PRP VBP . ,IN PRP VBP,PRON VERB VERB ADP PRON VERB PUNCT ,ADP PRON VERB,63.60073444970085,64.0613294430075,True
119,They ordered her that she should go.,False,PRP VBD PRP IN PRP MD VB . ,PRP IN PRP,PRON VERB PRON ADP PRON VERB VERB PUNCT ,PRON ADP PRON,73.88535093027973,74.04594354858452,True
120,They ordered her that she went.,False,PRP VBD PRP IN PRP VBD . ,PRP IN PRP,PRON VERB PRON ADP PRON VERB PUNCT ,PRON ADP PRON,62.394171860752344,62.94608796615378,True
121,I want that you don't go.,False,PRP VBP IN PRP VBP RB VB . ,IN PRP VBP,PRON VERB ADP PRON VERB ADV VERB PUNCT ,ADP PRON VERB,75.41974610008519,77.56329915513575,True
122,I want that you not go.,False,PRP VBP IN PRP RB VBP . ,IN PRP RB,PRON VERB ADP PRON ADV VERB PUNCT ,ADP PRON ADV,64.63237135200501,66.47882519150329,True
123,The captain ordered the soldiers that they didn't retreat.,False,DT NN VBD DT NNS IN PRP VBD RB VB . ,IN PRP VBD,DET NOUN VERB DET NOUN ADP PRON VERB ADV VERB PUNCT ,ADP PRON VERB,109.05278494562582,113.27002046168,True
124,I don't know where does Mary live.,False,PRP VBP RB VB WRB VBZ NNP VB . ,VBZ NNP VB,PRON VERB ADV VERB ADV VERB PROPN VERB PUNCT ,VERB PROPN VERB,83.07044426481275,81.97217119258914,False
125,They asked me how much did I earn.,False,PRP VBD PRP WRB JJ VBD PRP VB . ,VBD PRP VB,PRON VERB PRON ADV ADJ VERB PRON VERB PUNCT ,VERB PRON VERB,80.72267801807308,77.55160415134746,False
126,They took to their mother to the hospital.,False,PRP VBD IN PRP$ NN IN DT NN . ,IN PRP$ NN,PRON VERB ADP DET NOUN ADP DET NOUN PUNCT ,ADP DET NOUN,88.55848940484701,92.20738047611856,True
127,For what have you come?,False,IN WP VBP PRP VB . ,IN WP VBP,ADP PRON VERB PRON VERB PUNCT ,ADP PRON VERB,51.83526429973779,53.05899227168475,True
128,I don't know who they're working for.,True,PRP VBP RB VB WP PRP VBP VBG IN . ,VBG IN .,PRON VERB ADV VERB PRON PRON VERB VERB ADP PUNCT ,VERB ADP PUNCT,93.44348963192171,94.23561594375552,False
129,Who does Fred sit next to?,True,WP VBZ NNP VB RB IN . ,RB IN .,PRON VERB PROPN VERB ADV ADP PUNCT ,ADV ADP PUNCT,63.30050240366396,65.75953701909171,False
130,"After to see the film, we went for a meal.",False,"IN TO VB DT NN , PRP VBD IN DT NN . ",TO VB DT,ADP PART VERB DET NOUN PUNCT PRON VERB ADP DET NOUN PUNCT ,PART VERB DET,122.72972675740772,128.3771700524507,True
131,They are into the room.,False,PRP VBP IN DT NN . ,IN DT NN,PRON VERB ADP DET NOUN PUNCT ,ADP DET NOUN,56.46980941889594,58.878100816576115,True
132,We stopped in the crossroads.,False,PRP VBD IN DT NNS . ,IN DT NNS,PRON VERB ADP DET NOUN PUNCT ,ADP DET NOUN,54.571234672918116,56.71855058308576,True
133,She works like a waitress.,False,PRP VBZ IN DT NN . ,IN DT NN,PRON VERB ADP DET NOUN PUNCT ,ADP DET NOUN,56.572917665608244,59.07071068283682,True
134,They seem as their mother.,False,PRP VBP IN PRP$ NN . ,IN PRP$ NN,PRON VERB ADP DET NOUN PUNCT ,ADP DET NOUN,54.0291799159765,56.040683345801,True
135,This park was designed for the Catalan architect Gaudi.,False,DT NN VBD VBN IN DT JJ NN NNP . ,IN DT JJ,DET NOUN VERB VERB ADP DET ADJ NOUN PROPN PUNCT ,ADP DET ADJ,101.08822240067431,105.50204109233522,True
136,They stayed there during three months.,False,PRP VBD RB IN CD NNS . ,IN CD NNS,PRON VERB ADV ADP NUM NOUN PUNCT ,ADP NUM NOUN,63.01619156780647,64.81732503666969,True
137,I've got two news for you.,False,PRP VB VBN CD NN IN PRP . ,CD NN IN,PRON VERB VERB NUM NOUN ADP PRON PUNCT ,NUM NOUN ADP,75.51926889967766,76.5272034417335,True
