,sentence,correct,error_type,tags,tags_trigram,ud,ud_trigram,en,es
0,The firemen arrived ten minutes later.,True,_,DT NNS VBD CD NNS RB . ,DT NNS VBD,DET NOUN VERB NUM NOUN ADV PUNCT ,DET NOUN VERB,74.70046186342564,73.95751141292868
1,Arrived the firemen ten minutes later.,False,W,VBD DT NNS CD NNS RB . ,VBD DT NNS,VERB DET NOUN NUM NOUN ADV PUNCT ,VERB DET NOUN,74.70046186342564,73.95751141292868
2,Yesterday played very well the children.,False,W,NN VBD RB RB DT NNS . ,VBD RB RB,NOUN VERB ADV ADV DET NOUN PUNCT ,VERB ADV ADV,76.40161144085873,75.60523337344465
3,Played very well the children yesterday.,False,W,VBN RB RB DT NNS NN . ,VBN RB RB,VERB ADV ADV DET NOUN NOUN PUNCT ,VERB ADV ADV,76.40161144085873,75.60523337344465
4,The children played very well yesterday.,True,_,DT NNS VBD RB RB NN . ,DT NNS VBD,DET NOUN VERB ADV ADV NOUN PUNCT ,DET NOUN VERB,76.40161144085873,75.60523337344465
5,Often she has helped.,False,W,RB PRP VBZ VBN . ,RB PRP VBZ,ADV PRON VERB VERB PUNCT ,ADV PRON VERB,49.939632372665855,48.47243608545718
6,She often has helped.,False,W,PRP RB VBZ VBN . ,RB VBZ VBN,PRON ADV VERB VERB PUNCT ,PRON ADV VERB,49.939632372665855,48.47243608545718
7,They live in the house white.,False,W,PRP VBP IN DT NN JJ . ,NN JJ .,PRON VERB ADP DET NOUN ADJ PUNCT ,NOUN ADJ PUNCT,76.16093544861448,76.22025026071597
8,Can you lend me a ball of tennis?,False,UT,MD PRP VB PRP DT NN IN NN . ,NN IN NN,VERB PRON VERB PRON DET NOUN ADP NOUN PUNCT ,NOUN ADP NOUN,101.89870861298121,101.49940911603953
9,The Club of Bridge of the University of Cambridge.,False,UT,DT NNP IN NNP IN DT NNP IN NNP . ,NNP IN NNP,DET PROPN ADP PROPN ADP DET PROPN ADP PROPN PUNCT ,PROPN ADP PROPN,113.30134560983501,113.81971200297603
10,They gave to Sam the book.,False,W,PRP VBD IN NNP DT NN . ,IN NNP DT,PRON VERB ADP PROPN DET NOUN PUNCT ,ADP PROPN DET,76.04471555694919,75.91735575423367
11,They gave the book to Sam.,True,_,PRP VBD DT NN IN NNP . ,IN NNP .,PRON VERB DET NOUN ADP PROPN PUNCT ,ADP PROPN PUNCT,76.04471555694919,75.91735575423367
12,They took to the hospital her mother.,False,W,PRP VBD IN DT NN PRP$ NN . ,NN PRP$ NN,PRON VERB ADP DET NOUN DET NOUN PUNCT ,NOUN DET NOUN,89.93948433723162,90.2555992690048
13,Mrs Smith speaks very well English.,False,W,NNP NNP VBZ RB RB NNP . ,RB RB NNP,PROPN PROPN VERB ADV ADV PROPN PUNCT ,ADV ADV PROPN,73.6870179745361,72.05321761000036
14,Keep tidy Britain.,False,W,VB JJ NNP . ,VB JJ NNP,VERB ADJ PROPN PUNCT ,VERB ADJ PROPN,37.611274513197316,36.89005419859626
15,John has bought the books?,True,_,NNP VBZ VBN DT NNS . ,NNP VBZ VBN,PROPN VERB VERB DET NOUN PUNCT ,PROPN VERB VERB,64.49312242599788,63.389115082580346
16,Has bought the books John?,False,W,VBZ VBN DT NNS NNP . ,VBZ VBN DT,VERB VERB DET NOUN PROPN PUNCT ,VERB VERB DET,64.49312242599787,63.389115082580346
17,Mary came?,True,_,NNP VBD . ,NNP VBD .,PROPN VERB PUNCT ,PROPN VERB PUNCT,25.299176822857724,24.525435783904605
18,When Mary came?,False,W,WRB NNP VBD . ,WRB NNP VBD,ADV PROPN VERB PUNCT ,ADV PROPN VERB,37.29721960002263,36.22760278874314
19,Came Mary?,False,W,VBD NNP . ,VBD NNP .,VERB PROPN PUNCT ,VERB PROPN PUNCT,25.299176822857724,24.525435783904605
20,"Mary, when came?",False,W,"NNP , WRB VBD . ",WRB VBD .,PROPN PUNCT ADV VERB PUNCT ,ADV VERB PUNCT,49.91061340790391,48.85673030188519
21,Who did kill Oswald?,False,UV,WP VBD VB NNP . ,VBD VB NNP,PRON VERB VERB PROPN PUNCT ,VERB VERB PROPN,50.137467394175246,48.83199298882799
22,Who Oswald killed?,False,MV,WP NNP VBD . ,WP NNP VB,PRON PROPN VERB PUNCT ,PRON PROPN VERB,37.03416836999182,36.36828111313273
23,Who killed to Kennedy?,False,UT,WP VBD IN NNP . ,VBD IN NNP,PRON VERB ADP PROPN PUNCT ,VERB ADP PROPN,49.95406897799246,49.51738833125318
24,Who Kennedy killed?,False,W,WP NNP VBD . ,WP NNP VBD,PRON PROPN VERB PUNCT ,PRON PROPN VERB,37.03416836999182,36.36828111313273
25,Did they went?,False,TV,VBD PRP VBD . ,VBD PRP VBD,VERB PRON VERB PUNCT ,VERB PRON VERB,37.94158959550096,36.77026908061865
26,Do they went?,False,TV,VBP PRP VBD . ,VBP PRP VBD,VERB PRON VERB PUNCT ,VERB PRON VERB,37.94158959550096,36.77026908061865
27,Do she goes?,False,AGV,VBP PRP VBZ . ,VBP PRP VBZ,VERB PRON VERB PUNCT ,VERB PRON VERB,37.94158959550096,36.77026908061865
28,Does she goes?,False,AGV,VBZ PRP VBZ . ,VBZ . _,VERB PRON VERB PUNCT ,VERB PUNCT _,37.94158959550096,36.77026908061865
29,"They're coming tomorrow, no?",False,_,"PRP VBP VBG NN , UH . ",UH . _,PRON VERB VERB NOUN PUNCT INTJ PUNCT ,INTJ PUNCT _,71.052450941127,67.80482180477026
30,"You have a car, no?",False,_,"PRP VBP DT NN , UH . ",", UH .",PRON VERB DET NOUN PUNCT INTJ PUNCT ,PUNCT INTJ PUNCT,70.8282182125115,68.40385728696366
31,Peter not found the key.,False,X,NNP RB VBD DT NN . ,RB VBD DT,PROPN ADV VERB DET NOUN PUNCT ,ADV VERB DET,63.38786617897935,62.62757021172362
32,Peter not has found the key.,False,X,NNP RB VBZ VBN DT NN . ,RB VBZ VBN,PROPN ADV VERB VERB DET NOUN PUNCT ,ADV VERB VERB,76.49116520316278,75.09128208741889
33,Those no.,False,X,DT UH . ,DT UH .,DET INTJ PUNCT ,DET INTJ PUNCT,20.164953549923926,18.13095250380639
34,Green no.,False,X,NNP NN . ,NNP NN .,PROPN NOUN PUNCT ,PROPN NOUN PUNCT,25.407458082063073,25.398943973301172
35,Here no.,False,X,RB UH . ,RB UH .,ADV INTJ PUNCT ,ADV INTJ PUNCT,19.28393003152089,16.77037215075627
36,Maria cans cook.,False,AGV,NNP NNS VBP . ,NNS VBP .,PROPN NOUN VERB PUNCT ,NOUN VERB PUNCT,38.5107571062465,37.86265584899643
37,Do you can swim?,False,UV,VBP PRP MD VB . ,VBP PRP MD,VERB PRON VERB VERB PUNCT ,VERB PRON VERB,51.044888619684386,49.23398095631391
38,They will can do it next week.,False,UV,PRP MD MD VB PRP JJ NN . ,MD MD VB,PRON VERB VERB VERB PRON ADJ NOUN PUNCT ,VERB VERB VERB,88.30355814054684,86.77866476532552
39,She went up the stairs.,True,_,PRP VBD RP DT NNS . ,VBD RP DT,PRON VERB PART DET NOUN PUNCT ,VERB PART DET,62.2233251064775,58.43040647519224
40,She went up the book.,False,MT,PRP VBD RP DT NN . ,VBD RP DT,PRON VERB PART DET NOUN PUNCT ,VERB PART DET,62.2233251064775,58.43040647519224
41,They were waiting.,True,_,PRP VBD VBG . ,PRP VBD VBG,PRON VERB VERB PUNCT ,PRON VERB VERB,37.94158959550096,36.77026908061865
42,Mary laughed.,True,_,NNP VBD . ,NNP VBD .,PROPN VERB PUNCT ,PROPN VERB PUNCT,25.299176822857724,24.525435783904605
43,What did she laugh?,False,MT,WP VBD PRP VB . ,VB . _,PRON VERB PRON VERB PUNCT ,VERB PUNCT _,49.676581142635044,48.61311440984678
44,Football likes me.,False,_,NN VBZ PRP . ,NN VBZ PRP,NOUN VERB PRON PUNCT ,NOUN VERB PRON,38.0498708547063,37.64377727001522
45,"Do you want to go? No, I don't want.",False,MT,"VBP PRP VB TO VB . UH , PRP VBP RB VB . ",VB . _,VERB PRON VERB PART VERB PUNCT INTJ PUNCT PRON VERB ADV VERB PUNCT ,VERB PUNCT _,144.79158381867205,135.75675906126128
46,I like to get up early; I'm used.,False,MA,PRP VBP TO VB RP RB : PRP VBP VBN . ,VBN . _,PRON VERB PART VERB PART ADV PUNCT PRON VERB VERB PUNCT ,VERB PUNCT _,123.0833916884546,113.31959637379461
47,"Are they coming? No, I don't think.",False,MA,"VBP PRP VBG . UH , PRP VBP RB VB . ",VB . _,VERB PRON VERB PUNCT INTJ PUNCT PRON VERB ADV VERB PUNCT ,VERB PUNCT _,120.39389683828534,115.56916533827766
48,Look! It rains!,False,TV,VB . PRP VBZ . ,PRP VBZ .,VERB PUNCT PRON VERB PUNCT ,PRON VERB PUNCT,50.55498340338224,49.399396593760706
49,I wait for you at home.,False,MV,PRP VBP IN PRP IN NN . ,VBP IN PRP,PRON VERB ADP PRON ADP NOUN PUNCT ,VERB ADP PRON,75.6246636178417,75.78483703548424
50,I see her this evening.,False,MV,PRP VBP PRP DT NN . ,VBP PRP DT,PRON VERB PRON DET NOUN PUNCT ,VERB PRON DET,62.66392869740832,62.549369957132
51,How long are you working in your present job?,False,TV,WRB RB VBP PRP VBG IN PRP$ JJ NN . ,VBP PRP VBG,ADV ADV VERB PRON VERB ADP DET ADJ NOUN PUNCT ,VERB PRON VERB,113.26032002712772,112.0882961460883
52,It's a long time that I live here.,False,TV,PRP VBZ DT JJ NN WDT PRP VBP RB . ,VBP RB .,PRON VERB DET ADJ NOUN DET PRON VERB ADV PUNCT ,VERB ADV PUNCT,112.95643448466417,112.14261461024611
53,When has she received the letter?,False,TV,WRB VBZ PRP VBD DT NN . ,VBZ PRP VBD,ADV VERB PRON VERB DET NOUN PUNCT ,VERB PRON VERB,76.03027895162258,74.87240350843767
54,Today I've finished work early because I've started at seven o'clock this morning.,False,UV,NN PRP VB VBN NN RB IN PRP VB VBN IN CD NN DT NN . ,VB VBN NN,NOUN PRON VERB VERB NOUN ADV ADP PRON VERB VERB ADP NUM NOUN DET NOUN PUNCT ,VERB VERB NOUN,189.74330381302295,188.00699226489525
55,"When we were young, we were playing a lot of tennis.",False,TV,"WRB PRP VBD JJ , PRP VBD VBG DT NN IN NN . ",VBD VBG DT,ADV PRON VERB ADJ PUNCT PRON VERB VERB DET NOUN ADP NOUN PUNCT ,VERB VERB DET,151.9255419125504,150.65903392440703
56,"When I was a teenager, I was having a motorbike.",False,TV,"WRB PRP VBD DT NN , PRP VBD VBG DT NN . ",VBD VBG DT,ADV PRON VERB DET NOUN PUNCT PRON VERB VERB DET NOUN PUNCT ,VERB VERB DET,139.57260990977807,138.20805564948358
57,She wasn't knowing that he had died.,False,TV,PRP VBD RB VBG IN PRP VBD VBN . ,VBD RB VBG,PRON VERB ADV VERB ADP PRON VERB VERB PUNCT ,VERB ADV VERB,100.80112257616746,98.39181238419627
58,Come you tomorrow!,False,UA,VB PRP NN . ,PRP NN .,VERB PRON NOUN PUNCT ,PRON NOUN PUNCT,38.0498708547063,37.64377727001522
59,"When Mary will get here, tell her to come in.",False,TV,"WRB NNP MD VB RB , VB PRP TO VB RP . ",MD VB RB,ADV PROPN VERB VERB ADV PUNCT VERB PRON PART VERB PART PUNCT ,VERB VERB ADV,135.5423207171597,125.24064195761437
60,I use to do a lot of exercise.,False,TV,PRP VBP TO VB DT NN IN NN . ,VBP TO VB,PRON VERB PART VERB DET NOUN ADP NOUN PUNCT ,VERB PART VERB,101.45810502205038,97.38044563409977
61,The house built itself before the war.,False,MV,DT NN VBD PRP IN DT NN . ,VBD PRP IN,DET NOUN VERB PRON ADP DET NOUN PUNCT ,VERB PRON ADP,89.93948433723162,90.2555992690048
62,They were given bikes for Christmas.,True,_,PRP VBD VBN NNS IN NNP . ,PRP VBD VBN,PRON VERB VERB NOUN ADP PROPN PUNCT ,PRON VERB VERB,76.26894828556469,75.31832027204027
63,Polly was owed a lot of money.,True,_,NNP VBD VBN DT NN IN NN . ,VBD VBN DT,PROPN VERB VERB DET NOUN ADP NOUN PUNCT ,VERB VERB DET,90.62460331738733,89.87544236579262
64,To smoke is bad for you.,False,FV,TO VB VBZ JJ IN PRP . ,TO VB VBZ,PART VERB VERB ADJ ADP PRON PUNCT ,PART VERB VERB,74.46797585004445,70.00787656071911
65,It's difficult learn English.,False,FV,PRP VBZ JJ VBP NNP . ,VBP NNP .,PRON VERB ADJ VERB PROPN PUNCT ,VERB PROPN PUNCT,62.44956508451483,61.19661140351965
66,Let us to see.,False,FV,VB PRP TO VB . ,TO VB .,VERB PRON PART VERB PUNCT ,PART VERB PUNCT,49.23597755170421,44.494150927907015
67,The food is more important than the art.,False,UD,DT NN VBZ RBR JJ IN DT NN . ,DT NN .,DET NOUN VERB ADV ADJ ADP DET NOUN PUNCT ,DET NOUN PUNCT,102.51463325760201,102.47953935930687
68,Do you like the big dogs?,False,UD,VBP PRP VB DT JJ NNS . ,DT JJ NNS,VERB PRON VERB DET ADJ NOUN PUNCT ,DET ADJ NOUN,76.34433386479726,75.53485491829079
69,"That is the yours, and this is the mine.",False,UD,"DT VBZ DT NNS , CC DT VBZ DT NN . ",DT NN .,DET VERB DET NOUN PUNCT CCONJ DET VERB DET NOUN PUNCT ,DET NOUN PUNCT,128.22889726619735,127.91331595141729
70,Do you have car?,False,MD,VBP PRP VB NN . ,VB NN .,VERB PRON VERB NOUN PUNCT ,VERB NOUN PUNCT,51.15316987888974,50.107489145710474
71,Her sister is dentist.,False,MD,PRP$ NN VBZ NN . ,NN . _,DET NOUN VERB NOUN PUNCT ,NOUN PUNCT _,52.405525886528935,52.200899363767576
72,I have ones nice American friends.,False,RQ,PRP VBP NNS JJ JJ NNS . ,NNS JJ JJ,PRON VERB NOUN ADJ ADJ NOUN PUNCT ,NOUN ADJ ADJ,75.88564651877425,75.71023416449036
73,The table is dirty.,True,_,DT NN VBZ JJ . ,NN VBZ JJ,DET NOUN VERB ADJ PUNCT ,NOUN VERB ADJ,51.506043293479735,51.228297713367404
74,"Clean her, please.",False,RA,"VB PRP , UH . ","VB PRP ,",VERB PRON PUNCT INTJ PUNCT ,VERB PRON PUNCT,44.73757163355479,42.003889863983176
75,"They showed me two models, and I bought the small.",False,M,"PRP VBD PRP CD NNS , CC PRP VBD DT JJ . ",JJ . _,PRON VERB PRON NUM NOUN PUNCT CCONJ PRON VERB DET ADJ PUNCT ,ADJ PUNCT _,134.19408362757844,133.3354532593581
76,I am more old than my sister.,False,IJ,PRP VBP RBR JJ IN PRP$ NN . ,RBR JJ IN,PRON VERB ADV ADJ ADP DET NOUN PUNCT ,ADV ADJ ADP,88.15897822577938,87.92241726555451
77,Barcelona is the more large city of Catalonia.,False,IJ,NNP VBZ DT RBR JJ NN IN NNP . ,RBR JJ NN,PROPN VERB DET ADV ADJ NOUN ADP PROPN PUNCT ,ADV ADJ NOUN,100.81574227599387,100.20301975274508
78,Rosa isn't French. Is Spanish.,False,MA,NNP VBZ RB NNP . VBZ JJ . ,VBZ JJ .,PROPN VERB ADV PROPN PUNCT VERB ADJ PUNCT ,VERB ADJ PUNCT,87.52188792110121,85.74678450048145
79,Have gone home because wanted to go to bed.,False,MA,VBP VBN RB IN VBD TO VB IN NN . ,VBP VBN RB,VERB VERB ADV ADP VERB PART VERB ADP NOUN PUNCT ,VERB VERB ADV,114.75700832949197,108.91633085624066
80,Was raining.,False,MA,VBD VBG . ,VBD VBG .,VERB VERB PUNCT ,VERB VERB PUNCT,26.206598048366864,24.92742375139052
81,That's the man who he lives next door to us.,False,UA,DT VBZ DT NN WP PRP VBZ JJ NN IN PRP . ,IN PRP .,DET VERB DET NOUN PRON PRON VERB ADJ NOUN ADP PRON PUNCT ,ADP PRON PUNCT,138.8248641460228,138.76962021784797
82,I saw she.,False,RA,PRP VBD PRP . ,VBD PRP .,PRON VERB PRON PUNCT ,VERB PRON PUNCT,36.57328211845161,36.14940253415152
83,They know we.,False,RA,PRP VBP PRP . ,PRP . _,PRON VERB PRON PUNCT ,PRON PUNCT _,36.57328211845161,36.14940253415152
84,How many cakes is it in the cupboard?,False,AGV,WRB JJ NNS VBZ PRP IN DT NN . ,PRP IN DT,ADV ADJ NOUN VERB PRON ADP DET NOUN PUNCT ,PRON ADP DET,101.37055850916816,101.25963733064634
85,Who is it? Am I.,False,RA,WP VBZ PRP . VBP NN . ,VBP NN .,PRON VERB PRON PUNCT VERB NOUN PUNCT,VERB NOUN PUNCT,75.50155523390511,74.57946198808067
86,They enjoyed very much.,False,MA,PRP VBD RB RB . ,RB RB .,PRON VERB ADV ADV PUNCT ,ADV ADV PUNCT,48.83437612564732,47.71089121460046
87,She complained herself.,False,UA,PRP VBD PRP . ,PRP . _,PRON VERB PRON PUNCT ,PRON PUNCT _,36.57328211845161,36.14940253415152
88,I showered me and went out.,False,UA,PRP VBD PRP CC VBD RP . ,PRP CC VBD,PRON VERB PRON CCONJ VERB PART PUNCT ,PRON CCONJ VERB,72.44044875973819,67.76833138228159
89,Bill cut himself the finger.,False,RA,NNP VBD PRP DT NN . ,PRP DT NN,PROPN VERB PRON DET NOUN PUNCT ,PRON DET NOUN,63.124814948948526,62.76824853611322
90,Sara and Joe had both got his shoes wet.,False,RA,NNP CC NNP VBD DT VBN PRP$ NNS JJ . ,PRP$ NNS JJ,PROPN CCONJ PROPN VERB DET VERB DET NOUN ADJ PUNCT ,DET NOUN ADJ,113.34964387147959,112.30953988851643
91,The my cousin is in Portugal.,False,UD,DT PRP$ NN VBZ IN NNP . ,DT PRP$ NN,DET DET NOUN VERB ADP PROPN PUNCT ,DET DET NOUN,77.18879030538304,77.1372577828942
92,The girls we saw looked quite happy.,True,_,DT NNS PRP VBD VBD RB JJ . ,NNS PRP VBD,DET NOUN PRON VERB VERB ADV ADJ PUNCT ,NOUN PRON VERB,88.34237664196215,87.23702192312933
93,Did you like the woman we spoke to?,True,_,VBD PRP VB DT NN PRP VBD IN . ,VBD IN .,VERB PRON VERB DET NOUN PRON VERB ADP PUNCT ,VERB ADP PUNCT,101.79042735377585,100.62590092664296
94,We are going to have the house painted.,True,_,PRP VBP VBG TO VB DT NN VBN . ,TO VB DT,PRON VERB VERB PART VERB DET NOUN VERB PUNCT ,PART VERB DET,101.5332221790278,95.82154210227802
95,We are going to make paint the house.,False,MT,PRP VBP VBG TO VB NN DT NN . ,TO VB NN,PRON VERB VERB PART VERB NOUN DET NOUN PUNCT ,PART VERB NOUN,101.64150343823316,96.69505029167458
96,They refused helping their neighbours.,False,FV,PRP VBD VBG PRP$ NNS . ,VBG PRP$ NNS,PRON VERB VERB DET NOUN PUNCT ,VERB DET NOUN,64.03223617445768,63.17023650359913
97,I'll never forget to see that accident.,False,FV,PRP MD RB VB TO VB DT NN . ,TO VB DT,PRON AUX ADV VERB PART VERB DET NOUN PUNCT ,PART VERB DET,94.99832920897967,94.39624268180644
98,She explained me the problem.,False,MT,PRP VBD PRP DT NN . ,PRP DT NN,PRON VERB PRON DET NOUN PUNCT ,PRON DET NOUN,62.66392869740832,62.549369957132
99,They suggested Jim to take the job.,False,W,PRP VBD NNP TO VB DT NN . ,NNP TO VB,PRON VERB PROPN PART VERB DET NOUN PUNCT ,PROPN PART VERB,87.52250192933523,82.95584225909684
100,I am asking that they go.,False,W,PRP VBP VBG IN PRP VBP . ,IN PRP VBP,PRON VERB VERB ADP PRON VERB PUNCT ,ADP PRON VERB,75.69978077481913,74.22593350366247
101,They ordered her that she should go.,False,W,PRP VBD PRP IN PRP MD VB . ,PRP IN PRP,PRON VERB PRON ADP PRON VERB VERB PUNCT ,PRON ADP PRON,87.4347723219532,86.06877883289062
102,They ordered her that she went.,False,W,PRP VBD PRP IN PRP VBD . ,PRP IN PRP,PRON VERB PRON ADP PRON VERB PUNCT ,PRON ADP PRON,74.33147329776978,73.60506695719536
103,I want that you don't go.,False,X,PRP VBP IN PRP VBP RB VB . ,IN PRP VBP,PRON VERB ADP PRON VERB ADV VERB PUNCT ,ADP PRON VERB,87.69782355198402,85.92810050850102
104,I want that you not go.,False,X,PRP VBP IN PRP RB VBP . ,IN PRP RB,PRON VERB ADP PRON ADV VERB PUNCT ,ADP PRON ADV,74.59452452780059,73.46438863280576
105,The captain ordered the soldiers that they didn't retreat.,False,X,DT NN VBD DT NNS IN PRP VBD RB VB . ,IN PRP VBD,DET NOUN VERB DET NOUN ADP PRON VERB ADV VERB PUNCT ,ADP PRON VERB,128.14412516276337,126.88519002523387
106,I don't know where does Mary live.,False,UV,PRP VBP RB VB WRB VBZ NNP VB . ,VBZ NNP VB,PRON VERB ADV VERB ADV VERB PROPN VERB PUNCT ,VERB PROPN VERB,100.3401509968719,97.1637507498956
107,They asked me how much did I earn.,False,UV,PRP VBD PRP WRB JJ VBD PRP VB . ,VBD PRP VB,PRON VERB PRON ADV ADJ VERB PRON VERB PUNCT ,VERB PRON VERB,98.82501218145704,96.98645703430037
108,They took to their mother to the hospital.,False,UT,PRP VBD IN PRP$ NN IN DT NN . ,IN PRP$ NN,PRON VERB ADP DET NOUN ADP DET NOUN PUNCT ,ADP DET NOUN,102.85938494523228,103.40470648712525
109,For what have you come?,False,W,IN WP VBP PRP VB . ,IN WP VBP,ADP PRON VERB PRON VERB PUNCT ,ADP PRON VERB,62.59648175063569,61.76222162796723
110,I don't know who they're working for.,True,_,PRP VBP RB VB WP PRP VBP VBG IN . ,VBG IN .,PRON VERB ADV VERB PRON PRON VERB VERB ADP PUNCT ,VERB ADP PUNCT,112.53611412330154,110.2346577134244
111,Who does Fred sit next to?,True,_,WP VBZ NNP VB RB IN . ,RB IN .,PRON VERB PROPN VERB ADV ADP PUNCT ,ADV ADP PUNCT,75.0554107793408,73.68326721178697
112,"After to see the film, we went for a meal.",False,FV,"IN TO VB DT NN , PRP VBD IN DT NN . ",TO VB DT,ADP PART VERB DET NOUN PUNCT PRON VERB ADP DET NOUN PUNCT ,PART VERB DET,139.87046573350023,136.2214277232509
113,I've got two news for you.,False,CN,PRP VB VBN CD NN IN PRP . ,CD NN IN,PRON VERB VERB NUM NOUN ADP PRON PUNCT ,NUM NOUN ADP,86.1049552337563,85.15388673738161
