1993,62,UT,False,Omitted,"I have booked a hotel not far from our school. The hotel is called the Epsom Down Hotel. Your plane will arrive in England by 9:00. There will be a coach waiting for you, and the driver will be next to the information desk. You should arrive at the hotel by 11:00. You will then have an hour to check in and unpack all your luggage. The conference will start on time at 12:30, so I would suggest you leave the hotel by 12:00. The best way to get to the conference is to follow | the college road and turn left toward the end , you . You then keep going straight , you . You will eventually see the main entrance to the college. When you get into the college you can just ask any boys in the college where to go from then. They all know where the conference is and when. ",DET NOUN NOUN,"I have booked a hotel not far from our school. The hotel is called the Epsom Down Hotel. Your plane will arrive in England by 9:00. There will be a coach waiting for you, and the driver will be next to the information desk. You should arrive at the hotel by 11:00. You will then have an hour to check in and unpack all your luggage. The conference will start on time at 12:30, so I would suggest you leave the hotel by 12:00. The best way to get to the conference is to follow | along the college road and turn left toward the end , you . You then keep going straight , you . You will eventually see the main entrance to the college. When you get into the college you can just ask any boys in the college where to go from then. They all know where the conference is and when. ",ADP DET NOUN,True,False
1690,119,MP,True,Chinese sentence structure differs from English,"Every day, something changes and we become more modern | . Companies use computers instead of books, dentists use modernized electric tools instead of just a pair of pliers , even . Even homes are affected. From letters to emails, from gas stoves to electric stoves and microwaves , but . But we aren't just going to stop here are we? No, in the future, the present will be the past and those things now new to us will be old, outdated and changed. ",PUNCT NOUN VERB,"Every day, something changes and we become more modern | companies use computers instead of books, dentists use modernized electric tools instead of just a pair of pliers , even . Even homes are affected. From letters to emails, from gas stoves to electric stoves and microwaves , but . But we aren't just going to stop here are we? No, in the future, the present will be the past and those things now new to us will be old, outdated and changed. ",NOUN VERB NOUN,True,True
729,61,RY,False,General grammar rules confusion,| sincerely,ADV _ _,| faithfully,ADV _ _,True,False
662,85,AGV,True,3rd person singular form used isntead of 3rd person plural verb form,"Secondly, the end-of-conference party will be held at the college's main hall, from 8:00 pm to 11:30 pm on 20th June. There will be various kinds of food and drinks provided. Moreover, students can dance and enjoy different sorts of music, for instance, rock, jazz, pop, garage and so on. Furthermore, I suggest you and the students wear pub-wears to it, as they | are suitable for dancing. ",VERB ADJ ADP,"Secondly, the end-of-conference party will be held at the college's main hall, from 8:00 pm to 11:30 pm on 20th June. There will be various kinds of food and drinks provided. Moreover, students can dance and enjoy different sorts of music, for instance, rock, jazz, pop, garage and so on. Furthermore, I suggest you and the students wear pub-wears to it, as they | is suitable for dancing. ",VERB ADJ ADP,True,True
2584,16,MY,True,Relative adverb missing,"Additionally, men never like shopping , while . While their wives are doing the shopping they sit in the car or read a newspaper. They would be happy if there were sports and leisure facilities in the supermarket. | Then they'll change their mind. Instead of hating shopping they would enjoy shopping. ",ADV PRON AUX,"Additionally, men never like shopping , while . While their wives are doing the shopping they sit in the car or read a newspaper. They would be happy if there were sports and leisure facilities in the supermarket. | They'll change their mind. Instead of hating shopping they would enjoy shopping. ",PRON AUX VERB,True,True
291,43,RN,True,Chinese would use word in the given context,"I'm happy to hear that I have won the first prize. Here is the information you want from me. Firstly, I can only go in July . Because , because I'm on holiday at that | time. I think I would prefer the accommodation at Camp California is in tents . Because , because it is more safe, and I wouldn't like to be in the log cabins. ",NOUN PUNCT PRON,"I'm happy to hear that I have won the first prize. Here is the information you want from me. Firstly, I can only go in July . Because , because I'm on holiday at that | moment. I think I would prefer the accommodation at Camp California is in tents . Because , because it is more safe, and I wouldn't like to be in the log cabins. ",NOUN PUNCT PRON,True,True
1889,167,MD,True,Chinese has no articles and doesn't use classifiers in this situation,"What a big person , who invented the light, Einstein was Einstein was, who invented light . He created another day after sunset , people . People use it to do anything they want to do , . We believe we can't live without light today, especially in | the city , we . We have a long time to spend on our activities after | the Sun goes to bed. We definitely need light to keep on . I dare say, without light, our life would go into a dark, dark hell. ",DET NOUN PUNCT,"What a big person , who invented the light, Einstein was Einstein was, who invented light . He created another day after sunset , people . People use it to do anything they want to do , . We believe we can't live without light today, especially in | city , we . We have a long time to spend on our activities after | Sun goes to bed. We definitely need light to keep on . I dare say, without light, our life would go into a dark, dark hell. ",NOUN PUNCT PRON,True,True
2390,100,RT,False,Chinese doesn't use the word in this context; Word omitted even though in the Chinese translation it would be there,"First of all, I am a high school student, so I only have four weeks' vacation | in July. I would like to travel | in July. Secondly, for me, the best way to live in the outdoors is in tents, because that is a good chance to acquire a lot of knowledge about the planets and the animals as well. ",ADP PROPN PUNCT,"First of all, I am a high school student, so I only have four weeks' vacation | on July. I would like to travel | on July. Secondly, for me, the best way to live in the outdoors is in tents, because that is a good chance to acquire a lot of knowledge about the planets and the animals as well. ",ADP PROPN PUNCT,True,False
1909,187,MD,True,Chinese has no articles and doesn't use classifiers in this situation,"First of all, in my opinion, TV has a great educational function, and it also makes the world smaller. You can just sit at home and you can know what is happening all over the world at that moment. I would rather watch the news on TV instead of reading a newspaper or listening to | the radio because the news on TV is vivid . ",DET NOUN ADP,"First of all, in my opinion, TV has a great educational function, and it also makes the world smaller. You can just sit at home and you can know what is happening all over the world at that moment. I would rather watch the news on TV instead of reading a newspaper or listening to | radio because the news on TV is vivid . ",NOUN ADP DET,True,True
2007,12,RV,False,,"At my home, there are many rules, because I'm careless, so I am not allowed to smoke at home either: and I'm not allowed to use the telephone, because last year I | ran up a £1000 bill for one month , my . My parents were very angry with me, so they told me I am not to use the telephone any more , oh . Oh , how poor ! ",VERB PART DET,"At my home, there are many rules, because I'm careless, so I am not allowed to smoke at home either: and I'm not allowed to use the telephone, because last year I | made a £1000 bill for one month , my . My parents were very angry with me, so they told me I am not to use the telephone any more , oh . Oh , how poor ! ",VERB DET SYM,True,False
1734,12,MD,True,Chinese has no articles and doesn't use classifiers in this situation,"At my home, there are many rules, because I'm careless, so I am not allowed to smoke at home either: and I'm not allowed to use | the telephone, because last year I ran up a £1000 bill for one month , my . My parents were very angry with me, so they told me I am not to use | the telephone any more , oh . Oh , how poor ! ",DET NOUN PUNCT,"At my home, there are many rules, because I'm careless, so I am not allowed to smoke at home either: and I'm not allowed to use | telephone, because last year I ran up a £1000 bill for one month , my . My parents were very angry with me, so they told me I am not to use | telephone any more , oh . Oh , how poor ! ",NOUN PUNCT ADP,True,True
118,33,FN,True,Missing plural,"Science and technology can also be used to produce some materials, e.g. steel or iron, which are used in our | buildings , they . They can make them stronger and hard to destroy. ",NOUN PUNCT PRON,"Science and technology can also be used to produce some materials, e.g. steel or iron, which are used in our | building , they . They can make them stronger and hard to destroy. ",NOUN PUNCT PRON,True,True
494,41,RP,True,Word not capitalized,"The most important development is the | Internet , which is connected to the whole world's computers by telephone lines. You can send a letter to your friend by e-mail instead of writing it on a piece of paper and sending it by post. It just takes you a few minutes. How convenient it is! There are also many more advantages , you . You can buy something in a supermarket by only a mail order , you . You don't need to leave your home. ",NOUN PUNCT DET,"The most important development is the | internet , which is connected to the whole world's computers by telephone lines. You can send a letter to your friend by e-mail instead of writing it on a piece of paper and sending it by post. It just takes you a few minutes. How convenient it is! There are also many more advantages , you . You can buy something in a supermarket by only a mail order , you . You don't need to leave your home. ",NOUN PUNCT DET,True,True
467,14,RP,False,Inappropriate capitalization in the middle of sentence,"Second, | modern technology makes communication much easier and more enjoyable. With the spreading use of the Internet, people living in different parts of the world can chat with each other via the web. And , we can also share important information with other people. The development of information technology has changed the world into ""a global village"". ",ADJ NOUN VERB,"Second, | Modern technology makes communication much easier and more enjoyable. With the spreading use of the Internet, people living in different parts of the world can chat with each other via the web. And , we can also share important information with other people. The development of information technology has changed the world into ""a global village"". ",ADJ NOUN VERB,True,False
1792,70,MD,True,Chinese has no articles and doesn't use classifiers in this situation,"In my opinion, women really enjoy shopping. It seems a human activity during their spare time . However, we are going to change from the traditional system to ""e-shopping"". It is new for customers. With technology they can switch on the computer and click everything they want. Therefore, it looks like a service and is also boring for | the customer. I think most men dislike shopping. They are always waiting for a long time for women to finish their shopping. ",DET NOUN PUNCT,"In my opinion, women really enjoy shopping. It seems a human activity during their spare time . However, we are going to change from the traditional system to ""e-shopping"". It is new for customers. With technology they can switch on the computer and click everything they want. Therefore, it looks like a service and is also boring for | customer. I think most men dislike shopping. They are always waiting for a long time for women to finish their shopping. ",NOUN PUNCT PRON,True,True
2342,52,RT,False,Chinese doesn't use the word in this context; Misunderstanding of word usage/meaning,"1. First of all, I was really furious | about watching a show starring a different actor, instead of Danny Brook . , whose name was given in the advertisement. Besides this, the show started almost 45 minutes later than it was meant to start. ",ADP VERB DET,"1. First of all, I was really furious | of watching a show starring a different actor, instead of Danny Brook . , whose name was given in the advertisement. Besides this, the show started almost 45 minutes later than it was meant to start. ",ADP VERB DET,True,False
2698,55,UV,True,Chinese conventions conflict with English,"The party will be | in the Palace Hotel. The Hotel is very close to the Town Hall. From Park Square, just go straight. You can see the sign for the hotel. ",ADP DET PROPN,"The party will be | take place in the Palace Hotel. The Hotel is very close to the Town Hall. From Park Square, just go straight. You can see the sign for the hotel. ",VERB NOUN ADP,True,True
1639,68,MP,True,Chinese uses commas to mark the end of a complete thought,"Also | , what kind of clothes shall I bring with me? How much money is it appropriate to bring? ",PUNCT DET NOUN,Also | what kind of clothes shall I bring with me? How much money is it appropriate to bring?,PRON NOUN ADP,True,True
2618,19,MC,True,Chinese does not use conjunctions to join clauses,"The topical class is similar to speaking and listening but the materials are more up-dated up to date . The teacher uses video , | and pictures to teach students about festivals, sports, museums, etc. It is popular with the students. ",CCONJ NOUN PART,"The topical class is similar to speaking and listening but the materials are more up-dated up to date . The teacher uses video , | pictures to teach students about festivals, sports, museums, etc. It is popular with the students. ",NOUN PART VERB,True,True
2321,31,RT,True,Preposition that makes most sense to Chinese speakers is used,"Modern technology has changed my daily life in two ways. First with a lot of advanced techniques being put | to practical use, our living conditions are becoming more and more convenient and comfortable. When we look around the house, it is easy to find things like : a microwave oven, TV set, computer , etc. All these items of equipment are applications of modern science. When you are planning to travel, you can choose a train, car or even a plane as your means of transportation. Without the development of modern technology, it may take you several years to reach your destination. ",ADP ADJ NOUN,"Modern technology has changed my daily life in two ways. First with a lot of advanced techniques being put | into practical use, our living conditions are becoming more and more convenient and comfortable. When we look around the house, it is easy to find things like : a microwave oven, TV set, computer , etc. All these items of equipment are applications of modern science. When you are planning to travel, you can choose a train, car or even a plane as your means of transportation. Without the development of modern technology, it may take you several years to reach your destination. ",ADP ADJ NOUN,True,True
116,31,FN,False,Number disagreement,"How are you? I went to the musical show ""Over the Rainbow"" at your theatre last week. I have got a few things to complain about regarding your theatre. The first thing is in your note it says that you have Danny Brook in the show. But in the show, there was another actor. I was so disappointed, because I came from far away to see Danny Broke. In the note it also says that the show starts at 19:30, and so I went in at 19:25. The show started at 20:15, which means it wasted one hour of my time. The note says that are discounts available there are discounts available on tickets , but I bought my ticket and your people told me that there is no discount on the tickets. When the show had finished . , I decided to go and visit your theatre restaurant , . But I went there and it was closed for some | reason. I was really hungry and I went to another restaurant as soon as I could. The note says that your perfect evening out, I thought I could get my money back, with your poor service and all my reasons, but it was not ask for money back . ",NOUN PUNCT PRON,"How are you? I went to the musical show ""Over the Rainbow"" at your theatre last week. I have got a few things to complain about regarding your theatre. The first thing is in your note it says that you have Danny Brook in the show. But in the show, there was another actor. I was so disappointed, because I came from far away to see Danny Broke. In the note it also says that the show starts at 19:30, and so I went in at 19:25. The show started at 20:15, which means it wasted one hour of my time. The note says that are discounts available there are discounts available on tickets , but I bought my ticket and your people told me that there is no discount on the tickets. When the show had finished . , I decided to go and visit your theatre restaurant , . But I went there and it was closed for some | reasons. I was really hungry and I went to another restaurant as soon as I could. The note says that your perfect evening out, I thought I could get my money back, with your poor service and all my reasons, but it was not ask for money back . ",NOUN PUNCT PRON,True,False
25,25,RJ,True,"Chinese verbs, adjectives, and nouns sometimes are the same","How are you? I went to the musical show ""Over the Rainbow"" at your theatre last week. I have got a few things to complain about regarding your theatre. The first thing is in your note it says that you have Danny Brook in the show. But in the show, there was another actor. I was so | disappointed, because I came from far away to see Danny Broke. In the note it also says that the show starts at 19:30, and so I went in at 19:25. The show started at 20:15, which means it wasted one hour of my time. The note says that are discounts available there are discounts available on tickets , but I bought my ticket and your people told me that there is no discount on the tickets. When the show had finished . , I decided to go and visit your theatre restaurant , . But I went there and it was closed for some reason. I was really hungry and I went to another restaurant as soon as I could. The note says that your perfect evening out, I thought I could get my money back, with your poor service and all my reasons, but it was not ask for money back . ",ADJ PUNCT ADP,"How are you? I went to the musical show ""Over the Rainbow"" at your theatre last week. I have got a few things to complain about regarding your theatre. The first thing is in your note it says that you have Danny Brook in the show. But in the show, there was another actor. I was so | disappointing, because I came from far away to see Danny Broke. In the note it also says that the show starts at 19:30, and so I went in at 19:25. The show started at 20:15, which means it wasted one hour of my time. The note says that are discounts available there are discounts available on tickets , but I bought my ticket and your people told me that there is no discount on the tickets. When the show had finished . , I decided to go and visit your theatre restaurant , . But I went there and it was closed for some reason. I was really hungry and I went to another restaurant as soon as I could. The note says that your perfect evening out, I thought I could get my money back, with your poor service and all my reasons, but it was not ask for money back . ",ADJ PUNCT ADP,True,True
2473,183,RT,True,Chinese conventions conflict with English,"When I was small, we lived in country yard , . I remember, we used to have oil lamps which used a cotton string dipping in the oil in the small bottle and made it burned the tip of the cotton string to give us light during the night , it . It gave very little light , and there were many things we couldn't do | in the light from the oil lamps because the light range was very small . There was not any light outside our house, and no light on the road or field either. I was always very scared whenever or wherever I was . , because most places . Covered covered by dark, dark and dark . This scary dark is still affecting my life now. I never stay out after dark today except accompanying by my family. ",ADP DET NOUN,"When I was small, we lived in country yard , . I remember, we used to have oil lamps which used a cotton string dipping in the oil in the small bottle and made it burned the tip of the cotton string to give us light during the night , it . It gave very little light , and there were many things we couldn't do | under the light from the oil lamps because the light range was very small . There was not any light outside our house, and no light on the road or field either. I was always very scared whenever or wherever I was . , because most places . Covered covered by dark, dark and dark . This scary dark is still affecting my life now. I never stay out after dark today except accompanying by my family. ",ADP DET NOUN,True,True
2210,215,RV,True,,"Moreover, the TV is great company for people who live alone or feel alone. I like to | turn on the TV when I stay at home. Someone is talking, laughing, crying on there, so join them , you . You will feel much better than you would just by yourself. Some TV programmes are enjoyable! ",VERB PART DET,"Moreover, the TV is great company for people who live alone or feel alone. I like to | open the TV when I stay at home. Someone is talking, laughing, crying on there, so join them , you . You will feel much better than you would just by yourself. Some TV programmes are enjoyable! ",VERB DET NOUN,True,True
2378,88,RT,True,Chinese conventions conflict with English,"If I get two choices, I would like to go swimming and take photographs. Because I grew up in a town that is a seaside city . , I started training | in 1996, and I have never given it up. In particular, it was really good for my health during the growth period . Photography is my hobby . I can remember that I used to take photographs of the exhibitions or during the holidays. It will be nice for my memories when I am older. In addition, it could show people how nice the places I have been are and the views I have got . Therefore, I would like to do those two activities. ",ADP NUM PUNCT,"If I get two choices, I would like to go swimming and take photographs. Because I grew up in a town that is a seaside city . , I started training | since 1996, and I have never given it up. In particular, it was really good for my health during the growth period . Photography is my hobby . I can remember that I used to take photographs of the exhibitions or during the holidays. It will be nice for my memories when I am older. In addition, it could show people how nice the places I have been are and the views I have got . Therefore, I would like to do those two activities. ",ADP NUM PUNCT,True,True
70,70,RJ,False,Misunderstanding of word usage/meaning,"First of all, the efficiency of society has been improved. When shopping, we don't need to wait for the cashier to take every article's note by hand. When booking a flight, we can just make a phone call to any agency, and get it done in one minute. Secondly, instead of looking up tons of books to get the information that we need, we can very easily search for it on the Internet or on the local network. It's very often heard , that someone , who has a | rare illness , has had an operation at a foreign institute , which he found via the Internet. Moreover, with computer networks, it is possible for people to work from home, making projects, controlling operations or having conferences. Lastly the way of communications has also changed. Instead of traditional telecommunications, we can talk by, e-mail or even see each other with the help of a computer network. ",ADJ NOUN PUNCT,"First of all, the efficiency of society has been improved. When shopping, we don't need to wait for the cashier to take every article's note by hand. When booking a flight, we can just make a phone call to any agency, and get it done in one minute. Secondly, instead of looking up tons of books to get the information that we need, we can very easily search for it on the Internet or on the local network. It's very often heard , that someone , who has a | special illness , has had an operation at a foreign institute , which he found via the Internet. Moreover, with computer networks, it is possible for people to work from home, making projects, controlling operations or having conferences. Lastly the way of communications has also changed. Instead of traditional telecommunications, we can talk by, e-mail or even see each other with the help of a computer network. ",ADJ NOUN PUNCT,True,False
1031,40,MA,True,Chinese is a pro-drop language,I received your letter yesterday. I really thank | you for the opportunity your organisation has given me to go to the U.S.A.,PRON ADP DET,I received your letter yesterday. I really thank | for the opportunity your organisation has given me to go to the U.S.A.,ADP DET NOUN,True,True
