2297,46,RT,True,Chinese doesn't use the word in this context; Preposition that makes most sense to Chinese speakers is used,"In my opinion, I think In my opinion, clothes will be a lot different in 100 years' time. New materials will be invented and new styles will be created either by designers or people themselves, which will lead to changes in fashion, but in addition materials will probably still be used such as denim, which was invented ages ago in America. And people nowadays still use denim as a common material . If you walk out on to the street now, you will probably see more than half the people wearing clothes that are made | of denim, which is incredibly surprising! ",ADP NOUN PUNCT,"In my opinion, I think In my opinion, clothes will be a lot different in 100 years' time. New materials will be invented and new styles will be created either by designers or people themselves, which will lead to changes in fashion, but in addition materials will probably still be used such as denim, which was invented ages ago in America. And people nowadays still use denim as a common material . If you walk out on to the street now, you will probably see more than half the people wearing clothes that are made | with denim, which is incredibly surprising! ",ADP NOUN PUNCT,RT ADP NOUN PUNCT,True,True
1313,41,TV,True,Chinese generally expresses actions in present tense,"Weapons are designed to kill and defend in a fight , in . In the Second World War so many Germans were killed , also . Also many people | died in other regions . , e.g. the English. ",VERB ADP ADJ,"Weapons are designed to kill and defend in a fight , in . In the Second World War so many Germans were killed , also . Also many people | die in other regions . , e.g. the English. ",VERB ADP ADJ,TV VERB ADP ADJ,True,True
2038,82,RV,False,,"I was glad to hear the news from you and thank you very much! When you mentioned the period of my travelling I'm afraid I am only free in July . Because , because I go on holiday in July, naturally, and I have two terms in June and August. Therefore, I hope that you can | agree to a suitable arrangement between you and me. Furthermore, I would like to stay in log cabins, which I feel are a more American style of accommodation. In addition, it should not be too hot inside during July. ",VERB ADP DET,"I was glad to hear the news from you and thank you very much! When you mentioned the period of my travelling I'm afraid I am only free in July . Because , because I go on holiday in July, naturally, and I have two terms in June and August. Therefore, I hope that you can | make to a suitable arrangement between you and me. Furthermore, I would like to stay in log cabins, which I feel are a more American style of accommodation. In addition, it should not be too hot inside during July. ",VERB ADP DET,RV VERB ADP DET,True,False
572,8,AGV,False,3rd person plural verb form used instead of 3rd person singular form,"Now I'm a mother of two children. They are both in school. Compared to my experience, I want to give them a more open attitude about everything. I want to be a mother to them and a friend to them. But at school, although I hope the teacher doesn't give students so much homework, and doesn't forbid the opposite voice of the students, there | is nothing I can do because of our culture. It's quite sad. ",VERB NOUN PRON,"Now I'm a mother of two children. They are both in school. Compared to my experience, I want to give them a more open attitude about everything. I want to be a mother to them and a friend to them. But at school, although I hope the teacher doesn't give students so much homework, and doesn't forbid the opposite voice of the students, there | are nothing I can do because of our culture. It's quite sad. ",VERB NOUN PRON,AGV VERB NOUN PRON,True,False
1785,97,MD,True,Chinese has no articles and doesn't use classifiers in this situation,"You wanted to hear about my experience at the pop concert which I enjoyed helping at last month? I must say that was great fun , . I'd never had this kind of experience before. Before the concert actually started I had to give out lots of leaflets , they . They were lists of pop bands and groups which would appear in the concert in order, and some information about their performance and backgrounds. After that, I had to help people who had a ticket but couldn't find their seat. During the concert, I didn't have a lot to do, so I had | a chance to see most of the performance , that . That was excellent. I was excited that I had a closer look at so many famous pop stars. During the break time I did give a lot of directions to people who couldn't find the toilet, and gave people information such as where they could have a cup of coffee. That was | a bit boring, but it was part of my job. ",DET NOUN PART,"You wanted to hear about my experience at the pop concert which I enjoyed helping at last month? I must say that was great fun , . I'd never had this kind of experience before. Before the concert actually started I had to give out lots of leaflets , they . They were lists of pop bands and groups which would appear in the concert in order, and some information about their performance and backgrounds. After that, I had to help people who had a ticket but couldn't find their seat. During the concert, I didn't have a lot to do, so I had | chance to see most of the performance , that . That was excellent. I was excited that I had a closer look at so many famous pop stars. During the break time I did give a lot of directions to people who couldn't find the toilet, and gave people information such as where they could have a cup of coffee. That was | bit boring, but it was part of my job. ",NOUN PART VERB,MD NOUN PART VERB,True,True
2532,13,MY,True,Relative adverb missing,"Sometimes, when you shop on the street , you will see a lot of things that you like, and you can't buy them once , | then maybe you will feel very sad. And then, you may save money for the things you like, nothing to do, just for the poor things what you like so funny, isn't it? ",ADV ADV PRON,"Sometimes, when you shop on the street , you will see a lot of things that you like, and you can't buy them once , | maybe you will feel very sad. And then, you may save money for the things you like, nothing to do, just for the poor things what you like so funny, isn't it? ",ADV PRON VERB,MY ADV PRON VERB,True,True
1872,184,MD,True,Chinese has no articles and doesn't use classifiers in this situation,"We have already booked a 4-star hotel - | the Palace Hotel, which is near the River Thames, in Walton-on-Thames. It is not far away from the station so we will go there by train. The end-of-conference party will be held in an Indian restaurant, which is next to the hotel. It is supposed to be from 7 pm to 11 pm. Also there are some competitions and exciting games after dinner and a disco is also provided. You can wear anything you like , we . We would like you just to be yourself and have fun. ",DET PROPN PROPN,"We have already booked a 4-star hotel - | Palace Hotel, which is near the River Thames, in Walton-on-Thames. It is not far away from the station so we will go there by train. The end-of-conference party will be held in an Indian restaurant, which is next to the hotel. It is supposed to be from 7 pm to 11 pm. Also there are some competitions and exciting games after dinner and a disco is also provided. You can wear anything you like , we . We would like you just to be yourself and have fun. ",PROPN PROPN PUNCT,MD PROPN PROPN PUNCT,True,True
1589,52,MP,True,Chinese uses commas to mark the end of a complete thought,"It said in the advertisement that the singers are Danny Brook and Tina Truelove. However, there was a different | , unknown actor in that. The show started late | , at 20:15 | , which was very different from '19.30' as shown . There was no discount at all | , which was in contrast with 'Discounts Available'. After the show, I wanted to have something in the theatre restaurant and found it was closed for no reason. ",PUNCT ADJ NOUN,"It said in the advertisement that the singers are Danny Brook and Tina Truelove. However, there was a different | unknown actor in that. The show started late | at 20:15 | which was very different from '19.30' as shown . There was no discount at all | which was in contrast with 'Discounts Available'. After the show, I wanted to have something in the theatre restaurant and found it was closed for no reason. ",ADJ NOUN ADP,MP ADJ NOUN ADP,True,True
295,58,RN,True,English words map to the same Chinese word,"Shopping , is becoming a popular way of killing time nowadays. In some people's opinion, shopping and spending money is a kind of | amusement and they can even get self-satisfaction satisfaction from it. ",NOUN CCONJ PRON,"Shopping , is becoming a popular way of killing time nowadays. In some people's opinion, shopping and spending money is a kind of | fun and they can even get self-satisfaction satisfaction from it. ",NOUN CCONJ PRON,RN NOUN CCONJ PRON,True,True
1262,65,MT,True,Grammatical to exclude or include the word in Chinese,"I am writing to you | about your advertisement for the ""London Fashion"" and ""Leisure Show"". Thank you for organising this excellent programme, especially the Leisure show, which is very interesting to us. So all of our class would like to go to the show during their three days in London. But there is a problem which I hope you can solve. ",ADP DET NOUN,"I am writing to you | your advertisement for the ""London Fashion"" and ""Leisure Show"". Thank you for organising this excellent programme, especially the Leisure show, which is very interesting to us. So all of our class would like to go to the show during their three days in London. But there is a problem which I hope you can solve. ",DET NOUN ADP,MT DET NOUN ADP,True,True
2192,14,DN,True,"Chinese verbs, adjectives, and nouns sometimes are the same","Considering all the above points, I would like to ask for some money back. I will consider taking this | complaint to court if I do not receive an acceptable explanation from the theatre. Thank You. ",NOUN ADP NOUN,"Considering all the above points, I would like to ask for some money back. I will consider taking this | complains to court if I do not receive an acceptable explanation from the theatre. Thank You. ",VERB ADP NOUN,DN VERB ADP NOUN,True,True
1943,50,UT,True,Chinese would use word in the given context,"All of us want to go on this trip, but some of my classmates saw an advertisement for the London Fashion and Leisure Show, and we would all like to go there. It is from 10 am to 7 p.m. , it It is about the latest fashion, leisure and sports wear, make-up and hairstyles , all . All of us are really interested, and it is free for students to get in as well. It is a really good opportunity to go because most of us are studying fashion design, and we can learn loads of things | there. So would you please reschedule the visit to the Science Museum for Wednesday afternoon, and we can cancel our shopping and free time, so we can go to the fashion show on Tuesday. ",ADV PUNCT ADV,"All of us want to go on this trip, but some of my classmates saw an advertisement for the London Fashion and Leisure Show, and we would all like to go there. It is from 10 am to 7 p.m. , it It is about the latest fashion, leisure and sports wear, make-up and hairstyles , all . All of us are really interested, and it is free for students to get in as well. It is a really good opportunity to go because most of us are studying fashion design, and we can learn loads of things | in there. So would you please reschedule the visit to the Science Museum for Wednesday afternoon, and we can cancel our shopping and free time, so we can go to the fashion show on Tuesday. ",ADV ADV PUNCT,UT ADV ADV PUNCT,True,True
818,92,UA,False,general grammar rules confusion,"I think it is a great opportunity because I am sure we will enjoy ourselves. But I wonder if the timetable could be changed, which would be perfect. As you know, all of us want to join the programme, so if some students go to the Science Museum, they will miss the wonderful show. For that reason, I suggest that you could change the activities. In my opinion, we would be better going to the show instead of the science museum and shopping , also . Also we can go to the Science Museum on 15th March, | instead of having some free time in the afternoon. ",ADV ADP VERB,"I think it is a great opportunity because I am sure we will enjoy ourselves. But I wonder if the timetable could be changed, which would be perfect. As you know, all of us want to join the programme, so if some students go to the Science Museum, they will miss the wonderful show. For that reason, I suggest that you could change the activities. In my opinion, we would be better going to the show instead of the science museum and shopping , also . Also we can go to the Science Museum on 15th March, | which instead of having some free time in the afternoon. ",DET ADV ADP,UA DET ADV ADP,True,False
580,16,AGV,True,3rd person singular form used isntead of 3rd person plural verb form,"There are a lot of differences between the details of the musical show in the advertisement and the ones it actually was . Firstly the stars in the advertisement were Danny Brook and Tina Truelove, while there were different actors in the musical show. Secondly time starts at 19:30 on the leaflet but it actually started at 20:15. Thirdly it said there were discounts available in the advertisement , however . However , there | were not any at all. Finally it said we could visit your theatre restaurant after the show but it was closed because your excuse of being used at that moment . ",VERB ADV DET,"There are a lot of differences between the details of the musical show in the advertisement and the ones it actually was . Firstly the stars in the advertisement were Danny Brook and Tina Truelove, while there were different actors in the musical show. Secondly time starts at 19:30 on the leaflet but it actually started at 20:15. Thirdly it said there were discounts available in the advertisement , however . However , there | was not any at all. Finally it said we could visit your theatre restaurant after the show but it was closed because your excuse of being used at that moment . ",VERB ADV DET,AGV VERB ADV DET,True,True
1343,71,TV,False,Incorrect auxiliary used,I recently had a holiday in London and | went to your musical show 'Over the Rainbow' but found it very disappointing.,VERB ADP DET,I recently had a holiday in London and | had been to your musical show 'Over the Rainbow' but found it very disappointing.,VERB VERB ADP,TV VERB VERB ADP,True,False
2410,161,RT,False,Chinese doesn't use the word in this context,"It was two years ago , my classmates and I . My classmates and I went on a leadership trip | to London. This trip was organised by our form tutor , he . He wanted to test if we trusted each other and worked in a team, and the trip lasted for 3 days. The first days were fine , we . We just had to do some teamwork things. ",ADP PROPN PUNCT,"It was two years ago , my classmates and I . My classmates and I went on a leadership trip | in London. This trip was organised by our form tutor , he . He wanted to test if we trusted each other and worked in a team, and the trip lasted for 3 days. The first days were fine , we . We just had to do some teamwork things. ",ADP PROPN PUNCT,RT ADP PROPN PUNCT,True,False
533,93,RP,True,Chinese uses commas to mark the end of a complete thought,"I was thinking 'what should I do?' I hadn't got my mobile phone with me and I was halfway between my school and home. At that time he was unconscious | . I kept asking myself ' | Should I wake him up or try to use my dubious first aid skills to help with him."" I was struggling because I knew if I didn't help him, he would die in a short time. ",VERB PRON VERB,"I was thinking 'what should I do?' I hadn't got my mobile phone with me and I was halfway between my school and home. At that time he was unconscious, I kept asking myself ' | should I wake him up or try to use my dubious first aid skills to help with him."" I was struggling because I knew if I didn't help him, he would die in a short time. ",VERB PRON VERB,RP VERB PRON VERB,True,True
1789,101,MD,True,Chinese has no articles and doesn't use classifiers in this situation,"As far as I know, English people are really surprised at | the Chinese students' advanced level in Maths, as well as their knowledge of politics. This is a good opportunity to see how they learn in class. As it is expected, painting lesson is an amazing one . You can find students using traditional Chinese ink to draw and write. ",DET ADJ NOUN,"As far as I know, English people are really surprised at | Chinese students' advanced level in Maths, as well as their knowledge of politics. This is a good opportunity to see how they learn in class. As it is expected, painting lesson is an amazing one . You can find students using traditional Chinese ink to draw and write. ",ADJ NOUN PART,MD ADJ NOUN PART,True,True
881,60,AGN,True,Number error,"As well as all the treasures, | statues and historical paintings...there are also restaurants and modern galleries. When you are tired after looking around you might want to buy drinks or something to eat, or if you are fed up with historical things, you might as well just pop into the modern gallery to see things which are more modern. ",NOUN CCONJ ADJ,"As well as all the treasures, | statue and historical paintings...there are also restaurants and modern galleries. When you are tired after looking around you might want to buy drinks or something to eat, or if you are fed up with historical things, you might as well just pop into the modern gallery to see things which are more modern. ",NOUN CCONJ ADJ,AGN NOUN CCONJ ADJ,True,True
550,110,RP,True,Punctuation error related to Spelling errors (missing space),"Nowadays people have become used to watching television programmes | every day. The TV is so important that you can see one in every home, and it is an essential item for everyone. ",DET NOUN PUNCT,"Nowadays people have become used to watching television programmes | everyday. The TV is so important that you can see one in every home, and it is an essential item for everyone. ",ADJ PUNCT DET,RP ADJ PUNCT DET,True,True
242,2,RN,True,English words map to the same Chinese word,"You mentioned the rules at home and at school in the letter. This reminds me of what I experienced during my teenage years. In my country the children go to secondary school when they are in the first year of being a teenager. You know, this age is the troublesome age, boys have too much energy and girls want to fall in love with someone. They always annoy the schoolteacher and their parents. As a result of this, the teachers make very strict rules at school, such as students aren't allowed to speak to each other in class. They have to finish homework within a limited time. They cannot oppose the teacher, girls are not allowed to wear make-up or wear any | jewellery. At home, in my experience, my parents didn't allow me to go out in the evening and gave me a lot of homework to do, even in the holiday. They also forbade me to have a boyfriend. I think it is not just what happened in my home, many of my friends had the same experience. ",NOUN PUNCT ADP,"You mentioned the rules at home and at school in the letter. This reminds me of what I experienced during my teenage years. In my country the children go to secondary school when they are in the first year of being a teenager. You know, this age is the troublesome age, boys have too much energy and girls want to fall in love with someone. They always annoy the schoolteacher and their parents. As a result of this, the teachers make very strict rules at school, such as students aren't allowed to speak to each other in class. They have to finish homework within a limited time. They cannot oppose the teacher, girls are not allowed to wear make-up or wear any | accessories. At home, in my experience, my parents didn't allow me to go out in the evening and gave me a lot of homework to do, even in the holiday. They also forbade me to have a boyfriend. I think it is not just what happened in my home, many of my friends had the same experience. ",NOUN PUNCT ADP,RN NOUN PUNCT ADP,True,True
1540,3,MP,True,Chinese sentence structure differs from English,"Therefore, she came to the river every day and talked about everything with the golden fish. They were very close friends. After half a year, the golden fish suddenly disappeared. Sara was very sad. She sat and cried by the river. Then somebody called her name: ""Sara... Sara.. | . look at me.. | . I'm standing on your left-hand side."" Sara remembered the golden fish. It had suddenly become human, a little boy. After a few days they got married. They had a wonderful life together. ",PUNCT VERB ADP,"Therefore, she came to the river every day and talked about everything with the golden fish. They were very close friends. After half a year, the golden fish suddenly disappeared. Sara was very sad. She sat and cried by the river. Then somebody called her name: ""Sara... Sara.. | look at me.. | I'm standing on your left-hand side."" Sara remembered the golden fish. It had suddenly become human, a little boy. After a few days they got married. They had a wonderful life together. ",VERB ADP PRON,MP VERB ADP PRON,True,True
1700,12,MD,True,Chinese has no articles and doesn't use classifiers in this situation,"At my home, there are many rules, because I'm careless, so I am not allowed to smoke at home either: and I'm not allowed to use | the telephone, because last year I ran up a £1000 bill for one month , my . My parents were very angry with me, so they told me I am not to use | the telephone any more , oh . Oh , how poor ! ",DET NOUN PUNCT,"At my home, there are many rules, because I'm careless, so I am not allowed to smoke at home either: and I'm not allowed to use | telephone, because last year I ran up a £1000 bill for one month , my . My parents were very angry with me, so they told me I am not to use | telephone any more , oh . Oh , how poor ! ",NOUN PUNCT ADP,MD NOUN PUNCT ADP,True,True
2466,4,M,True,Chinese conventions conflict with English,"This happened on Thursday afternoon. When everyone finished their lunch, they all got into their classrooms quickly because they all knew that the headmaster walked round the school every Thursday. But some naughty students in my class were throwing paper aeroplanes when the teacher was writing something on the board. Unfortunately, one of the paper planes flew out of the window and hit the headmaster's head. Everyone was laughing and the headmaster's face was full of anger. He then punished Jon but the one who did it was Tim so Jon was very angry and he said something bad about the headmaster to us. Pat heard that and he went to see the headmaster straight after school. The headmaster went to see Jon and Tim and punished | them for their bad behaviour. ",PRON ADP DET,"This happened on Thursday afternoon. When everyone finished their lunch, they all got into their classrooms quickly because they all knew that the headmaster walked round the school every Thursday. But some naughty students in my class were throwing paper aeroplanes when the teacher was writing something on the board. Unfortunately, one of the paper planes flew out of the window and hit the headmaster's head. Everyone was laughing and the headmaster's face was full of anger. He then punished Jon but the one who did it was Tim so Jon was very angry and he said something bad about the headmaster to us. Pat heard that and he went to see the headmaster straight after school. The headmaster went to see Jon and Tim and punished | their bad behaviour. ",DET ADJ NOUN,M DET ADJ NOUN,True,True
682,30,RY,False,General grammar rules confusion,Yours | sincerely,ADV _ _,Yours | faithfully,ADV _ _,RY ADV _ _,True,False
