,Unnamed: 0,error_type,Negative transfer?,Likely reason for mistake,correct_sentence,correct_trigram_ud,incorrect_sentence,incorrect_trigram_ud,type_and_trigram_ud,nlt,result
472,30,RP,False,Punctuation error related to Spelling errors (extra spaces),"What will clothes be like 100 years from now? What do you think models will wear on the | catwalks? Will they wear anything? Who knows? Nowadays, people look at fashion magazines or get opinions from their friends to help them to decide what to wear on different occasions. ",NOUN PUNCT VERB,"What will clothes be like 100 years from now? What do you think models will wear on the | cat walks? Will they wear anything? Who knows? Nowadays, people look at fashion magazines or get opinions from their friends to help them to decide what to wear on different occasions. ",NOUN VERB PUNCT,RP NOUN VERB PUNCT,True,False
1786,98,MD,True,Chinese has no articles and doesn't use classifiers in this situation,"You wanted to hear about my experience at the pop concert which I enjoyed helping at last month? I must say that was great fun , . I'd never had this kind of experience before. Before the concert actually started I had to give out lots of leaflets , they . They were lists of pop bands and groups which would appear in the concert in order, and some information about their performance and backgrounds. After that, I had to help people who had a ticket but couldn't find their seat. During the concert, I didn't have a lot to do, so I had a chance to see most of the performance , that . That was excellent. I was excited that I had a closer look at so many famous pop stars. During | the break time I did give a lot of directions to people who couldn't find | the toilet, and gave people information such as where they could have a cup of coffee. That was a bit boring, but it was part of my job. ",DET NOUN NOUN,"You wanted to hear about my experience at the pop concert which I enjoyed helping at last month? I must say that was great fun , . I'd never had this kind of experience before. Before the concert actually started I had to give out lots of leaflets , they . They were lists of pop bands and groups which would appear in the concert in order, and some information about their performance and backgrounds. After that, I had to help people who had a ticket but couldn't find their seat. During the concert, I didn't have a lot to do, so I had a chance to see most of the performance , that . That was excellent. I was excited that I had a closer look at so many famous pop stars. During | break time I did give a lot of directions to people who couldn't find | toilet, and gave people information such as where they could have a cup of coffee. That was a bit boring, but it was part of my job. ",NOUN NOUN PRON,MD NOUN NOUN PRON,True,True
2062,106,RV,True,,"Lastly, could you please tell me what kind of clothes and how much money I should | take and do I have to buy insurance myself? ",VERB CCONJ VERB,"Lastly, could you please tell me what kind of clothes and how much money I should | prepare and do I have to buy insurance myself? ",VERB CCONJ VERB,RV VERB CCONJ VERB,True,True
2753,98,FV,False,Incorrectly using past tense,"However, journalists should not only think about commercial value , because morality and principles are also concerned. Of course, if everyone paid less attention or interest , the situation would be better. I remember in August 1997 Princess Diana | dying in the car crash was one of the most disastrous examples. ",VERB ADP DET,"However, journalists should not only think about commercial value , because morality and principles are also concerned. Of course, if everyone paid less attention or interest , the situation would be better. I remember in August 1997 Princess Diana | died in the car crash was one of the most disastrous examples. ",VERB ADP DET,FV VERB ADP DET,True,False
1251,54,MT,True,Grammatical to exclude or include the word in Chinese,"1. English lesson. Because students in the English class are from all over the world . We , we can talk | about everybody's feelings | about living and studying in a foreign country. ",ADP NOUN PART,"1. English lesson. Because students in the English class are from all over the world . We , we can talk | everybody's feelings | living and studying in a foreign country. ",NOUN PART NOUN,MT NOUN PART NOUN,True,True
2708,53,FV,True,"Missing ""to"" for to-infinitive non-finite subordinate clauses","I believe that most busy people want | to go shopping the quick and easy way . Because , because they don't like waiting for payment and wasting time . Therefore, they would like to use ""e-shopping"", which is getting better for their time . ",PART VERB VERB,"I believe that most busy people want | go shopping the quick and easy way . Because , because they don't like waiting for payment and wasting time . Therefore, they would like to use ""e-shopping"", which is getting better for their time . ",VERB VERB DET,FV VERB VERB DET,True,True
2618,25,UV,False,Unnecessary auxiliary added,"I saw all the members of the band backstage, how | they changed their make-up, hairstyle etc. They were even making jokes with me and other staff. I was impressed when they kept saying "" thank-you thank you "" to the staff. Indeed, they cannot succeed without their help, can they? I was lucky to have this chance and able to learn how they work behind the scenes. All in all, it was a once-a-lifetime once-in-a-lifetime experience. ",PRON VERB DET,"I saw all the members of the band backstage, how | did they changed their make-up, hairstyle etc. They were even making jokes with me and other staff. I was impressed when they kept saying "" thank-you thank you "" to the staff. Indeed, they cannot succeed without their help, can they? I was lucky to have this chance and able to learn how they work behind the scenes. All in all, it was a once-a-lifetime once-in-a-lifetime experience. ",VERB PRON VERB,UV VERB PRON VERB,True,False
2467,5,M,True,Chinese does not distinguish between mass and coun nouns,"Modern technology has changed my daily life in two ways. First with a lot of advanced techniques being put to practical use, our living conditions are becoming more and more convenient and comfortable. When we look around the house, it is easy to find things like : a microwave oven, TV set, computer , etc. All these | items of equipment are applications of modern science. When you are planning to travel, you can choose a train, car or even a plane as your means of transportation. Without the development of modern technology, it may take you several years to reach your destination. ",NOUN ADP NOUN,"Modern technology has changed my daily life in two ways. First with a lot of advanced techniques being put to practical use, our living conditions are becoming more and more convenient and comfortable. When we look around the house, it is easy to find things like : a microwave oven, TV set, computer , etc. All these | equipment are applications of modern science. When you are planning to travel, you can choose a train, car or even a plane as your means of transportation. Without the development of modern technology, it may take you several years to reach your destination. ",NOUN VERB NOUN,M NOUN VERB NOUN,True,True
887,4,ID,False,This expression doesn't exist in Chinese,"OK, just here . I look forward to hearing from you soon. | All the best and good luck. ",DET DET ADJ,"OK, just here . I look forward to hearing from you soon. | All the best wishes and good luck. ",DET DET ADJ,ID DET DET ADJ,True,False
718,66,RY,True,English words map to the same Chinese word,"When I was small, we lived in country yard , . I remember, we used to have oil lamps which used a cotton string dipping in the oil in the small bottle and made it burned the tip of the cotton string to give us light during the night , it . It gave very little light , and there were many things we couldn't do in the light from the oil lamps because the light range was very small . There was | not any light outside our house, and no light on the road or field either. I was always very scared whenever or wherever I was . , because most places . Covered covered by dark, dark and dark . This scary dark is still affecting my life now. I never stay out after dark today except accompanying by my family. ",ADV DET NOUN,"When I was small, we lived in country yard , . I remember, we used to have oil lamps which used a cotton string dipping in the oil in the small bottle and made it burned the tip of the cotton string to give us light during the night , it . It gave very little light , and there were many things we couldn't do in the light from the oil lamps because the light range was very small . There was | no any light outside our house, and no light on the road or field either. I was always very scared whenever or wherever I was . , because most places . Covered covered by dark, dark and dark . This scary dark is still affecting my life now. I never stay out after dark today except accompanying by my family. ",DET DET NOUN,RY DET DET NOUN,True,True
1130,8,UD,False,Overcorrection,"You mentioned the rules at home and at school in the letter. This reminds me of what I experienced during my teenage years. In my country the children go to | secondary school when they are in the first year of being a teenager. You know, this age is the troublesome age, boys have too much energy and girls want to fall in love with someone. They always annoy the schoolteacher and their parents. As a result of this, the teachers make very strict rules at school, such as students aren't allowed to speak to each other in | class. They have to finish homework within a limited time. They cannot oppose the teacher, girls are not allowed to wear make-up or wear any jewellery. At home, in my experience, my parents didn't allow me to go out in the evening and gave me a lot of homework to do, even in the holiday. They also forbade me to have a boyfriend. I think it is not just what happened in my home, many of my friends had the same experience. ",ADJ NOUN ADV,"You mentioned the rules at home and at school in the letter. This reminds me of what I experienced during my teenage years. In my country the children go to | the secondary school when they are in the first year of being a teenager. You know, this age is the troublesome age, boys have too much energy and girls want to fall in love with someone. They always annoy the schoolteacher and their parents. As a result of this, the teachers make very strict rules at school, such as students aren't allowed to speak to each other in | the class. They have to finish homework within a limited time. They cannot oppose the teacher, girls are not allowed to wear make-up or wear any jewellery. At home, in my experience, my parents didn't allow me to go out in the evening and gave me a lot of homework to do, even in the holiday. They also forbade me to have a boyfriend. I think it is not just what happened in my home, many of my friends had the same experience. ",DET ADJ NOUN,UD DET ADJ NOUN,True,False
2235,57,DN,True,"Chinese verbs, adjectives, and nouns sometimes are the same","Firstly, I am being the representative of my class to thank you for organising a good programme in London, especially the | visit to the Science Museum and National Art Gallery. We know that it is a good chance for us to learn more different things and we can widen our knowledge in the Science Museum. In addition, we can appreciate and enjoy the art in the National Art Gallery. Unfortunately, I know that most of the students have already visited these two places before. So we decided to choose another event which have seen as an entertainment . It is the LONDON FASHION AND LEISURE SHOW. The show will be held at the Central Exhibition Hall, London. The date is Tuesday March 14, from 10.00-19.00. It shows the latest fashions, including leisure and sports wear. In spite of this, there are also make-up and hairstyles, which attract girls most . ",NOUN ADP DET,"Firstly, I am being the representative of my class to thank you for organising a good programme in London, especially the | visiting to the Science Museum and National Art Gallery. We know that it is a good chance for us to learn more different things and we can widen our knowledge in the Science Museum. In addition, we can appreciate and enjoy the art in the National Art Gallery. Unfortunately, I know that most of the students have already visited these two places before. So we decided to choose another event which have seen as an entertainment . It is the LONDON FASHION AND LEISURE SHOW. The show will be held at the Central Exhibition Hall, London. The date is Tuesday March 14, from 10.00-19.00. It shows the latest fashions, including leisure and sports wear. In spite of this, there are also make-up and hairstyles, which attract girls most . ",VERB ADP DET,DN VERB ADP DET,True,True
1257,60,MT,True,Chinese doesn't use the word in this context,"Thank goodness, I succeeded , | in saving that struggling child. When I got to the river bank, I saw some red-faced . ",ADP VERB DET,"Thank goodness, I succeeded , | saving that struggling child. When I got to the river bank, I saw some red-faced . ",VERB ADP VERB,MT VERB ADP VERB,True,True
1602,65,MP,True,Chinese uses commas to mark the end of a complete thought,"Even though I would like to travel, I am only available in July, because I am a high school student. Thus I have not got a long holiday. I just have one month . Personally, I would rather stay in log cabins than in tents. On account of the fact that staying in log cabins is much more interesting than staying in tents. As far as two activities are concerned | , I would choose singing and photography. I used to win a number of competitions in singing. I can sing plenty of songs . , which include English songs and the Japanese songs, and I have a part-time job singing at a restaurant. Although photography is not as good as singing, I am very interested in it. I have been studying photography since I was 15 years old. I got third prize in a competition last year and my level is professional now. Furthermore, I am going to enter a competition next year. ",PUNCT PRON VERB,"Even though I would like to travel, I am only available in July, because I am a high school student. Thus I have not got a long holiday. I just have one month . Personally, I would rather stay in log cabins than in tents. On account of the fact that staying in log cabins is much more interesting than staying in tents. As far as two activities are concerned | I would choose singing and photography. I used to win a number of competitions in singing. I can sing plenty of songs . , which include English songs and the Japanese songs, and I have a part-time job singing at a restaurant. Although photography is not as good as singing, I am very interested in it. I have been studying photography since I was 15 years old. I got third prize in a competition last year and my level is professional now. Furthermore, I am going to enter a competition next year. ",PRON VERB VERB,MP PRON VERB VERB,True,True
2457,209,RT,True,"""of"" maps to the gentive/possessive marker 的 in Chinese","I have booked a hotel not far from our school. The hotel is called the Epsom Down Hotel. Your plane will arrive in England by 9:00. There will be a coach waiting for you, and the driver will be next to the information desk. You should arrive at the hotel by 11:00. You will then have an hour to check in and unpack all your luggage. The conference will start on time at 12:30, so I would suggest you leave the hotel by 12:00. The best way to get to the conference is to follow the college road and turn left toward the end , you . You then keep going straight , you . You will eventually see the main entrance | to the college. When you get into the college you can just ask any boys in the college where to go from then. They all know where the conference is and when. ",ADP DET NOUN,"I have booked a hotel not far from our school. The hotel is called the Epsom Down Hotel. Your plane will arrive in England by 9:00. There will be a coach waiting for you, and the driver will be next to the information desk. You should arrive at the hotel by 11:00. You will then have an hour to check in and unpack all your luggage. The conference will start on time at 12:30, so I would suggest you leave the hotel by 12:00. The best way to get to the conference is to follow the college road and turn left toward the end , you . You then keep going straight , you . You will eventually see the main entrance | of the college. When you get into the college you can just ask any boys in the college where to go from then. They all know where the conference is and when. ",ADP DET NOUN,RT ADP DET NOUN,True,True
1455,188,TV,False,Overcorrection,And also I want to ask some questions. What clothes should I | take? How much money should I | take? And how can we meet at the airport? I am looking forward to your reply.,VERB PUNCT ADV,And also I want to ask some questions. What clothes should I | taken? How much money should I | taken? And how can we meet at the airport? I am looking forward to your reply.,VERB PUNCT ADV,TV VERB PUNCT ADV,True,False
2678,23,FV,False,"Using the infinitive form of the verb with ""to"" instead of using present tense or present progressive","I think people in the future will probably | wear helmets with oxygen gas well provided . It is because of the increasing size of the population and the shortage of oxygen gas in the atmosphere. They will also wear water-proof, ultra-violet proof ultra-violet-proof and other dangerous liquid-proof dangerous-liquid-proof clothes to protect themselves. These clothes have to be made of something light, comfortable to wear and protective. All the above ideas are needed to make them bear no burden when wearing these specially designed clothes. ",VERB NOUN ADP,"I think people in the future will probably | to wear helmets with oxygen gas well provided . It is because of the increasing size of the population and the shortage of oxygen gas in the atmosphere. They will also wear water-proof, ultra-violet proof ultra-violet-proof and other dangerous liquid-proof dangerous-liquid-proof clothes to protect themselves. These clothes have to be made of something light, comfortable to wear and protective. All the above ideas are needed to make them bear no burden when wearing these specially designed clothes. ",PART VERB NOUN,FV PART VERB NOUN,True,False
779,53,RA,False,general grammar rules confusion,Use the equipment and space | that we have to organise some activities.,DET PRON VERB,Use the equipment and space | what we have to organise some activities.,PRON PRON VERB,RA PRON PRON VERB,True,False
1709,21,MD,True,Chinese has no articles and doesn't use classifiers in this situation,"Second, modern technology makes communication much easier and more enjoyable. With the spreading use of | the Internet, people living in different parts of the world can chat with each other via the web. And , we can also share important information with other people. The development of information technology has changed the world into ""a global village"". ",DET NOUN PUNCT,"Second, modern technology makes communication much easier and more enjoyable. With the spreading use of | Internet, people living in different parts of the world can chat with each other via the web. And , we can also share important information with other people. The development of information technology has changed the world into ""a global village"". ",NOUN PUNCT NOUN,MD NOUN PUNCT NOUN,True,True
2655,0,FV,True,Progressive aspect not applied,"The idea of an ""International Art Festival"" was great. But I feel the word ""International"" was not really suitable; because you only had six countries' stars and artists . I think you should invite more than ten countries. The other problem was choosing space . As , as the hall of the classical concert was too small and crowded. Next year, you should calculate or examine how many people will come before you choose a hall, which I feel very good was plays and films. It can show more for next year's festival. The Dance Shows as well . And the offer of a ""weekend ticket"" was an excellent idea . Because , because the price was cheaper than | buying it separately and more convenient . ",VERB PRON ADV,"The idea of an ""International Art Festival"" was great. But I feel the word ""International"" was not really suitable; because you only had six countries' stars and artists . I think you should invite more than ten countries. The other problem was choosing space . As , as the hall of the classical concert was too small and crowded. Next year, you should calculate or examine how many people will come before you choose a hall, which I feel very good was plays and films. It can show more for next year's festival. The Dance Shows as well . And the offer of a ""weekend ticket"" was an excellent idea . Because , because the price was cheaper than | buy it separately and more convenient . ",VERB PRON ADV,FV VERB PRON ADV,True,True
2440,192,RT,True,Misusing about,"These are my suggestions | for this party. If you still have a problem, you can call me. ",ADP DET NOUN,"These are my suggestions | about this party. If you still have a problem, you can call me. ",ADP DET NOUN,RT ADP DET NOUN,True,True
4,4,FJ,True,Chinese would use word in this context,"I went there at 19.00 because the show started at 19.30 as the advertisement said but I queued for at least an hour because the ticket machine broke down. Finally, after an hour, when my turn came to buy the entrance ticket, your staff said I couldn't have a discount and so as anyone . However, I bought the ticket, even though it was | expensive, because I'd been queuing for ages and I really wanted to see my idol, Danny Brook. ",ADJ PUNCT ADP,"I went there at 19.00 because the show started at 19.30 as the advertisement said but I queued for at least an hour because the ticket machine broke down. Finally, after an hour, when my turn came to buy the entrance ticket, your staff said I couldn't have a discount and so as anyone . However, I bought the ticket, even though it was | more expensive, because I'd been queuing for ages and I really wanted to see my idol, Danny Brook. ",ADV ADJ PUNCT,FJ ADV ADJ PUNCT,True,True
1204,6,MT,True,Chinese doesn't use the word in this context,"I am writing this letter in order to complain | about my unpleasant experience at your theatre. Two days ago, I went to see the musical show ""Over the Rainbow"" at your theatre. The advertised starting time is 19:30 . But but for some unknown reason, the play didn't start until 20:15. The audience were anxious and bored. ",ADP DET ADJ,"I am writing this letter in order to complain | my unpleasant experience at your theatre. Two days ago, I went to see the musical show ""Over the Rainbow"" at your theatre. The advertised starting time is 19:30 . But but for some unknown reason, the play didn't start until 20:15. The audience were anxious and bored. ",DET ADJ NOUN,MT DET ADJ NOUN,True,True
577,13,AGV,False,3rd person plural verb form used instead of 3rd person singular form,"That evening we didn't want to have our supper before the show. Anyway I thought it would be too early to eat and also because the timetable or candidates you give me have say : ""visit our theatre restaurant after the show"". So we did, but unfortunately it was closed and I was so disappointed about it, not only because we had expected Danny Brook and Tina Truelove to be the actor of starring . Also I don't really mind that the show started late but the rute of that evening was rucented . And there were no discounts when you said there would be! Why is it everything that on the canidates | was wrong and different from what we experienced. We don't expect much bad to happen on our holiday, but this was a perfect show as well , it was the worst show and theatre I have ever been to in my life. ",VERB ADJ CCONJ,"That evening we didn't want to have our supper before the show. Anyway I thought it would be too early to eat and also because the timetable or candidates you give me have say : ""visit our theatre restaurant after the show"". So we did, but unfortunately it was closed and I was so disappointed about it, not only because we had expected Danny Brook and Tina Truelove to be the actor of starring . Also I don't really mind that the show started late but the rute of that evening was rucented . And there were no discounts when you said there would be! Why is it everything that on the canidates | were wrong and different from what we experienced. We don't expect much bad to happen on our holiday, but this was a perfect show as well , it was the worst show and theatre I have ever been to in my life. ",VERB ADJ CCONJ,AGV VERB ADJ CCONJ,True,False
2047,91,RV,False,,The Speaking and Listening class should be filmed because the purpose of this class is to encourage students to talk about some topics they choose and discuss them with others in order to | improve their speaking and listening skills.,VERB DET NOUN,The Speaking and Listening class should be filmed because the purpose of this class is to encourage students to talk about some topics they choose and discuss them with others in order to | prove their speaking and listening skills.,VERB DET NOUN,RV VERB DET NOUN,True,False
