1777,89,MD,True,Chinese has no articles and doesn't use classifiers in this situation,"Moreover, I am good at playing basketball , in . In fact, I am the captain in | the basketball team, which is one of the best teenage teams in my city, and I also like singing. I play piano very well. Two of my friends and I have a band , we . We sometimes perform in my school club. ",DET NOUN NOUN,"Moreover, I am good at playing basketball , in . In fact, I am the captain in | basketball team, which is one of the best teenage teams in my city, and I also like singing. I play piano very well. Two of my friends and I have a band , we . We sometimes perform in my school club. ",NOUN NOUN PUNCT,MD NOUN NOUN PUNCT,True,True
644,83,AGV,False,3rd person plural verb form used instead of 3rd person singular form,"Moreover, the TV is great company for people who live alone or feel alone. I like to turn on the TV when I stay at home. Someone | is talking, laughing, crying on there, so join them , you . You will feel much better than you would just by yourself. Some TV programmes are enjoyable! ",VERB VERB PUNCT,"Moreover, the TV is great company for people who live alone or feel alone. I like to turn on the TV when I stay at home. Someone | are talking, laughing, crying on there, so join them , you . You will feel much better than you would just by yourself. Some TV programmes are enjoyable! ",VERB VERB PUNCT,AGV VERB VERB PUNCT,True,False
1343,71,TV,False,Incorrect auxiliary used,I recently had a holiday in London and | went to your musical show 'Over the Rainbow' but found it very disappointing.,VERB ADP DET,I recently had a holiday in London and | had been to your musical show 'Over the Rainbow' but found it very disappointing.,VERB VERB ADP,TV VERB VERB ADP,True,False
253,16,RN,True,Chinese would use word in the given context,"Other than the Internet , there is also a lot of modern technology which is changing our daily life. For example, we can go to Mars and do some | research. So, we know much more about our universe. Some modern technology is also put into the transport system . For example, trains can go faster and aeroplanes can travel faster. ",NOUN PUNCT ADV,"Other than the Internet , there is also a lot of modern technology which is changing our daily life. For example, we can go to Mars and do some | investigation . So, we know much more about our universe. Some modern technology is also put into the transport system . For example, trains can go faster and aeroplanes can travel faster. ",NOUN PUNCT ADV,RN NOUN PUNCT ADV,True,True
2616,23,UV,False,Unnecessary auxiliary added,"I had an unpleasant experience. It was at lunchtime. Everybody | had gone to buy lunch in the supermarket , in . In fact, nobody likes crowds and queues, especially not in the summertime. I was queuing in the middle of row . I chose this aisle because I thought it was quicker than the others. Although there were finished two people, next was me, something was happened . Suddenly the customer thought the receipt was not right , she . She did not buy a lot of things but the shop assistant did not make a mistake , they . They argued about this thing. The shop manager came to solve it. Obviously, I had to try another aisle. It was the longest queue , I have ever been in. ",VERB VERB PART,"I had an unpleasant experience. It was at lunchtime. Everybody | was had gone to buy lunch in the supermarket , in . In fact, nobody likes crowds and queues, especially not in the summertime. I was queuing in the middle of row . I chose this aisle because I thought it was quicker than the others. Although there were finished two people, next was me, something was happened . Suddenly the customer thought the receipt was not right , she . She did not buy a lot of things but the shop assistant did not make a mistake , they . They argued about this thing. The shop manager came to solve it. Obviously, I had to try another aisle. It was the longest queue , I have ever been in. ",VERB VERB VERB,UV VERB VERB VERB,True,False
1556,19,MP,True,Chinese uses commas to mark the end of a complete thought,"What made things even worse was that the leading actor Danny Brook did not appear on the stage at all. A second-class actor An understudy took his place. We felt totally disappointed and cheated. After the show, I was hungry and tired. As your poster suggested, I intended to rest for a while at your restaurant. But when I got there, it had closed. In addition, the ticket office didn't offer me any discounts | , as you had advertised on the poster | , when I bought the ticket. ",PUNCT ADP PRON,"What made things even worse was that the leading actor Danny Brook did not appear on the stage at all. A second-class actor An understudy took his place. We felt totally disappointed and cheated. After the show, I was hungry and tired. As your poster suggested, I intended to rest for a while at your restaurant. But when I got there, it had closed. In addition, the ticket office didn't offer me any discounts | as you had advertised on the poster | when I bought the ticket. ",ADP PRON VERB,MP ADP PRON VERB,True,True
2103,147,RV,False,,"Finally, we would like to ask you to think about our suggestion , the . The show would be fantastic , we . We would | learn about the latest fashions, Leisure and sports wear, and also learn about how to make up . It's a great opportunity to | learn more about fashion. Please, let us go to the show, because students are admitted free. ",VERB ADP DET,"Finally, we would like to ask you to think about our suggestion , the . The show would be fantastic , we . We would | know about the latest fashions, Leisure and sports wear, and also learn about how to make up . It's a great opportunity to | know more about fashion. Please, let us go to the show, because students are admitted free. ",VERB ADP DET,RV VERB ADP DET,True,False
2384,135,RT,False,"Misuing ""for""; Learners have confused the two's meaning and usage","It is very kind | of you to give me the chance to do two activities while I am at the Camp. I'd like to do climbing and sailing. Actually I am quite good at climbing. I often go climbing in my town. As for sailing, well, I haven't tried it before , that . That is why I want to have a go. I think it must be fun. ",ADP PRON PART,"It is very kind | for you to give me the chance to do two activities while I am at the Camp. I'd like to do climbing and sailing. Actually I am quite good at climbing. I often go climbing in my town. As for sailing, well, I haven't tried it before , that . That is why I want to have a go. I think it must be fun. ",ADP PRON PART,RT ADP PRON PART,True,False
540,100,RP,False,Punctuation error related to Spelling errors (extra spaces),"We need light every day, not just at nighttime. We need | lamplight in offices and schools and other places during the daytime. How wonderful life is since the invention of electric light. Here we are just talking about the light we invented apart from natural light. ",NOUN ADP NOUN,"We need light every day, not just at nighttime. We need | lamp light in offices and schools and other places during the daytime. How wonderful life is since the invention of electric light. Here we are just talking about the light we invented apart from natural light. ",NOUN NOUN ADP,RP NOUN NOUN ADP,True,False
1687,150,MP,True,Chinese uses commas to mark the end of a complete thought,"The museum looks very old | , like some other buildings in London, but it is very modern inside. After going through the enormous main door, you can see a huge round white building | , which is a library. A lot of famous people have been to this library ! ",PUNCT ADP DET,"The museum looks very old | like some other buildings in London, but it is very modern inside. After going through the enormous main door, you can see a huge round white building | which is a library. A lot of famous people have been to this library ! ",ADP DET ADJ,MP ADP DET ADJ,True,True
2459,211,RT,False,"Misuing ""for""","Welcome to London. You asked me | about an interesting building to visit. In my opinion , I recommend the British Museum. One of the reasons is you can learn almost everything about British history there. ",ADP DET ADJ,"Welcome to London. You asked me | for an interesting building to visit. In my opinion , I recommend the British Museum. One of the reasons is you can learn almost everything about British history there. ",ADP DET ADJ,RT ADP DET ADJ,True,False
280,43,RN,True,Chinese would use word in the given context,"I'm happy to hear that I have won the first prize. Here is the information you want from me. Firstly, I can only go in July . Because , because I'm on holiday at that | time. I think I would prefer the accommodation at Camp California is in tents . Because , because it is more safe, and I wouldn't like to be in the log cabins. ",NOUN PUNCT PRON,"I'm happy to hear that I have won the first prize. Here is the information you want from me. Firstly, I can only go in July . Because , because I'm on holiday at that | moment. I think I would prefer the accommodation at Camp California is in tents . Because , because it is more safe, and I wouldn't like to be in the log cabins. ",NOUN PUNCT PRON,RN NOUN PUNCT PRON,True,True
2039,83,RV,False,,"If I get two choices, I would like to go swimming and take photographs. Because I grew up in a town that is a seaside city . , I started training in 1996, and I have never given it up. In particular, it was really good for my health during the growth period . Photography is my hobby . I can remember that I used to take photographs of the exhibitions or during the holidays. It | will be nice for my memories when I am older. In addition, it could show people how nice the places I have been are and the views I have got . Therefore, I would like to do those two activities. ",VERB VERB ADJ,"If I get two choices, I would like to go swimming and take photographs. Because I grew up in a town that is a seaside city . , I started training in 1996, and I have never given it up. In particular, it was really good for my health during the growth period . Photography is my hobby . I can remember that I used to take photographs of the exhibitions or during the holidays. It | must be nice for my memories when I am older. In addition, it could show people how nice the places I have been are and the views I have got . Therefore, I would like to do those two activities. ",VERB VERB ADJ,RV VERB VERB ADJ,True,False
365,15,U,False,Chinese phrase would be structured differently,"So I must find a way to help my great father. One day, I suddenly had a good idea. 'Why not go to the stock exchange?' I said to myself. Almost every day I went there and researched the exchange decline-line, which gave me lots of information | . Finally, I decided to join in the dangerous game, which meant losing everything or suddenly becoming a millionaire. With luck, I won by chance . ",PUNCT ADV PUNCT,"So I must find a way to help my great father. One day, I suddenly had a good idea. 'Why not go to the stock exchange?' I said to myself. Almost every day I went there and researched the exchange decline-line, which gave me lots of information | from there. Finally, I decided to join in the dangerous game, which meant losing everything or suddenly becoming a millionaire. With luck, I won by chance . ",ADP ADV PUNCT,U ADP ADV PUNCT,True,False
2292,41,RT,True,Chinese conventions conflict with English,"It said | in the leaflet that this would be a perfect evening out, while it was not that at all. I felt very disappointed after seeing the music show in your theatre. As I said the reasons above , I want to ask for my money back! I look forwards to hearing from you. ",ADP DET NOUN,"It said | on the leaflet that this would be a perfect evening out, while it was not that at all. I felt very disappointed after seeing the music show in your theatre. As I said the reasons above , I want to ask for my money back! I look forwards to hearing from you. ",ADP DET NOUN,RT ADP DET NOUN,True,True
290,53,RN,True,English words map to the same Chinese word,"But , during any peak season, like Christmas , holidays or even during weekends . Then , then I can say I definitely don't feel it is enjoyable . Because , because of the crowds. For me I think , it is not shopping but a kind of suffering . Especially , especially , queuing up for twenty minutes just to pay or waiting for the salesgirl to get the right size . So sometimes I don't think shopping is enjoyable, and if there is any big | holiday, I would rather stay at home and watch television. ",NOUN PUNCT PRON,"But , during any peak season, like Christmas , holidays or even during weekends . Then , then I can say I definitely don't feel it is enjoyable . Because , because of the crowds. For me I think , it is not shopping but a kind of suffering . Especially , especially , queuing up for twenty minutes just to pay or waiting for the salesgirl to get the right size . So sometimes I don't think shopping is enjoyable, and if there is any big | festival, I would rather stay at home and watch television. ",NOUN PUNCT PRON,RN NOUN PUNCT PRON,True,True
2134,178,RV,False,,I am sorry to | cause you inconvenience. I hope it doesn't | cause any trouble if you accept my suggestion.,VERB PRON NOUN,I am sorry to | make you inconvenience. I hope it doesn't | make any trouble if you accept my suggestion.,VERB PRON NOUN,RV VERB PRON NOUN,True,False
1820,132,MD,True,Chinese has no articles and doesn't use classifiers in this situation,"Some women spend their whole life shopping, and most of | the time, they don't buy many things. In my eyes they are wasting their lives, they are hopeless. ",DET NOUN PUNCT,"Some women spend their whole life shopping, and most of | time, they don't buy many things. In my eyes they are wasting their lives, they are hopeless. ",NOUN PUNCT PRON,MD NOUN PUNCT PRON,True,True
52,52,RJ,True,"Chinese verbs, adjectives, and nouns sometimes are the same","All of us want to go on this trip, but some of my classmates saw an advertisement for the London Fashion and Leisure Show, and we would all like to go there. It is from 10 am to 7 p.m. , it It is about the latest fashion, leisure and sports wear, make-up and hairstyles , all . All of us are really | interested, and it is free for students to get in as well. It is a really good opportunity to go because most of us are studying fashion design, and we can learn loads of things there. So would you please reschedule the visit to the Science Museum for Wednesday afternoon, and we can cancel our shopping and free time, so we can go to the fashion show on Tuesday. ",ADJ PUNCT CCONJ,"All of us want to go on this trip, but some of my classmates saw an advertisement for the London Fashion and Leisure Show, and we would all like to go there. It is from 10 am to 7 p.m. , it It is about the latest fashion, leisure and sports wear, make-up and hairstyles , all . All of us are really | interesting, and it is free for students to get in as well. It is a really good opportunity to go because most of us are studying fashion design, and we can learn loads of things there. So would you please reschedule the visit to the Science Museum for Wednesday afternoon, and we can cancel our shopping and free time, so we can go to the fashion show on Tuesday. ",ADJ PUNCT CCONJ,RJ ADJ PUNCT CCONJ,True,True
1347,75,TV,True,Chinese generally expresses actions in present tense,"Firstly, there was a different actor instead of the famous actor , Danny Brook. That left me so disappointed. Secondly, I | supposed the show would start at 19:30, but it started at 20:15. It caused me to miss the train and I went back to the hotel when it was nearly mid-night midnight . Another problem is , I thought that discounts were available. However, there wasn't any discount. Additionally, the advertisement said I could visit the theatre restaurant after the show. When I arrived, it was closed. It is so annoying that everything was changed without any notice. ",VERB DET NOUN,"Firstly, there was a different actor instead of the famous actor , Danny Brook. That left me so disappointed. Secondly, I | suppose the show would start at 19:30, but it started at 20:15. It caused me to miss the train and I went back to the hotel when it was nearly mid-night midnight . Another problem is , I thought that discounts were available. However, there wasn't any discount. Additionally, the advertisement said I could visit the theatre restaurant after the show. When I arrived, it was closed. It is so annoying that everything was changed without any notice. ",VERB DET NOUN,TV VERB DET NOUN,True,True
1745,57,MD,True,Chinese has no articles and doesn't use classifiers in this situation,"I had an unpleasant experience. It was at lunchtime. Everybody had gone to buy lunch in | the supermarket , in . In fact, nobody likes crowds and queues, especially not in the summertime. I was queuing in the middle of row . I chose this aisle because I thought it was quicker than | the others. Although there were finished two people, next was me, something was happened . Suddenly the customer thought the receipt was not right , she . She did not buy a lot of things but the shop assistant did not make a mistake , they . They argued about this thing. The shop manager came to solve it. Obviously, I had to try another aisle. It was the longest queue , I have ever been in. ",DET NOUN PUNCT,"I had an unpleasant experience. It was at lunchtime. Everybody had gone to buy lunch in | supermarket , in . In fact, nobody likes crowds and queues, especially not in the summertime. I was queuing in the middle of row . I chose this aisle because I thought it was quicker than | others. Although there were finished two people, next was me, something was happened . Suddenly the customer thought the receipt was not right , she . She did not buy a lot of things but the shop assistant did not make a mistake , they . They argued about this thing. The shop manager came to solve it. Obviously, I had to try another aisle. It was the longest queue , I have ever been in. ",NOUN PUNCT ADV,MD NOUN PUNCT ADV,True,True
2372,123,RT,True,Chinese conventions conflict with English,"Between the tent and log cabin, I think that I would prefer the tent. It will let me get up close | to nature, and experience life in the wild. Living in a tent will also enhance my survival skills, making this a trip to remember. ",ADP NOUN PUNCT,"Between the tent and log cabin, I think that I would prefer the tent. It will let me get up close | with nature, and experience life in the wild. Living in a tent will also enhance my survival skills, making this a trip to remember. ",ADP NOUN PUNCT,RT ADP NOUN PUNCT,True,True
2117,161,RV,False,,"One day, I passed by a river in accident , . I saw there were a lot of people playing in the river. Suddenly, I heard a cry of ""Help, help"" in the distance. In a while , lots of passed-by passersby crowded at the river-side riverside . To my surprise, nobody went in to save that boy who was shouting, but just stood there, like lots of "" champ "". I started thinking about it , after . After all, either had I never done this task before, or trained . I was just 15 years old. Finally, I jumped into the river , . I really knew that was dangerous, but I | didn't think about anything except ""justify"" this word . I also really hated those people who stood there all the time. ",VERB ADV VERB,"One day, I passed by a river in accident , . I saw there were a lot of people playing in the river. Suddenly, I heard a cry of ""Help, help"" in the distance. In a while , lots of passed-by passersby crowded at the river-side riverside . To my surprise, nobody went in to save that boy who was shouting, but just stood there, like lots of "" champ "". I started thinking about it , after . After all, either had I never done this task before, or trained . I was just 15 years old. Finally, I jumped into the river , . I really knew that was dangerous, but I | haven't think about anything except ""justify"" this word . I also really hated those people who stood there all the time. ",VERB ADV VERB,RV VERB ADV VERB,True,False
2348,99,RT,False,Overgeneralization,"But | in the breaks and after work, I had a chance to talk with the engineers, and I learnt something about setting up the equipment. ",ADP DET NOUN,"But | at the breaks and after work, I had a chance to talk with the engineers, and I learnt something about setting up the equipment. ",ADP DET NOUN,RT ADP DET NOUN,True,False
2415,166,RT,True,Misusing about,"I am writing to you about your advertisement | for the ""London Fashion"" and ""Leisure Show"". Thank you for organising this excellent programme, especially the Leisure show, which is very interesting to us. So all of our class would like to go to the show during their three days in London. But there is a problem which I hope you can solve. ",ADP DET PUNCT,"I am writing to you about your advertisement | about the ""London Fashion"" and ""Leisure Show"". Thank you for organising this excellent programme, especially the Leisure show, which is very interesting to us. So all of our class would like to go to the show during their three days in London. But there is a problem which I hope you can solve. ",ADP DET PUNCT,RT ADP DET PUNCT,True,True
1785,97,MD,True,Chinese has no articles and doesn't use classifiers in this situation,"You wanted to hear about my experience at the pop concert which I enjoyed helping at last month? I must say that was great fun , . I'd never had this kind of experience before. Before the concert actually started I had to give out lots of leaflets , they . They were lists of pop bands and groups which would appear in the concert in order, and some information about their performance and backgrounds. After that, I had to help people who had a ticket but couldn't find their seat. During the concert, I didn't have a lot to do, so I had | a chance to see most of the performance , that . That was excellent. I was excited that I had a closer look at so many famous pop stars. During the break time I did give a lot of directions to people who couldn't find the toilet, and gave people information such as where they could have a cup of coffee. That was | a bit boring, but it was part of my job. ",DET NOUN PART,"You wanted to hear about my experience at the pop concert which I enjoyed helping at last month? I must say that was great fun , . I'd never had this kind of experience before. Before the concert actually started I had to give out lots of leaflets , they . They were lists of pop bands and groups which would appear in the concert in order, and some information about their performance and backgrounds. After that, I had to help people who had a ticket but couldn't find their seat. During the concert, I didn't have a lot to do, so I had | chance to see most of the performance , that . That was excellent. I was excited that I had a closer look at so many famous pop stars. During the break time I did give a lot of directions to people who couldn't find the toilet, and gave people information such as where they could have a cup of coffee. That was | bit boring, but it was part of my job. ",NOUN PART VERB,MD NOUN PART VERB,True,True
483,41,RP,True,Word not capitalized,"The most important development is the | Internet , which is connected to the whole world's computers by telephone lines. You can send a letter to your friend by e-mail instead of writing it on a piece of paper and sending it by post. It just takes you a few minutes. How convenient it is! There are also many more advantages , you . You can buy something in a supermarket by only a mail order , you . You don't need to leave your home. ",NOUN PUNCT DET,"The most important development is the | internet , which is connected to the whole world's computers by telephone lines. You can send a letter to your friend by e-mail instead of writing it on a piece of paper and sending it by post. It just takes you a few minutes. How convenient it is! There are also many more advantages , you . You can buy something in a supermarket by only a mail order , you . You don't need to leave your home. ",NOUN PUNCT DET,RP NOUN PUNCT DET,True,True
2056,100,RV,True,,"According to a survey which has been conducted by other students . Every , every student in our school has one maths class every day. So, maths lessons | should be filmed. ",VERB VERB VERB,"According to a survey which has been conducted by other students . Every , every student in our school has one maths class every day. So, maths lessons | would be filmed. ",VERB VERB VERB,RV VERB VERB VERB,True,True
2689,34,FV,False,Incorrectly using progressive aspect,"Lily was one of her best friends for three years. She enjoyed sharing everything with Pat, whatever it was. Nick was Lily's husband. Her husband had been fired the previous year. Lily felt very nervous about their financial problems and their future . As as they wanted to | get a baby. She told Pat about what had happened in her family . And and that she was worried. Of course, she knew Nick didn't like her to tell other people about his private . She told Pat that she didn't want any other people to know about it except her. Pat also promised not to tell other people. ",VERB DET NOUN,"Lily was one of her best friends for three years. She enjoyed sharing everything with Pat, whatever it was. Nick was Lily's husband. Her husband had been fired the previous year. Lily felt very nervous about their financial problems and their future . As as they wanted to | getting a baby. She told Pat about what had happened in her family . And and that she was worried. Of course, she knew Nick didn't like her to tell other people about his private . She told Pat that she didn't want any other people to know about it except her. Pat also promised not to tell other people. ",VERB DET NOUN,FV VERB DET NOUN,True,False
