1821,133,MD,True,Chinese has no articles and doesn't use classifiers in this situation,"Shopping is not always enjoyable. I don't really like shopping. Sometimes when I'm bored and can't find something else to do . , I go look round | the shops. When I see some clothes in the window I like, I go in and try them on. But I always find they do not look nice on me. The other thing I don't like going shopping is at the weekend. All the shops are full of people, and people treat the items like rubbish . Hanging , hanging them everywhere after they have tried them on and found that they did not suit them. ",DET NOUN PUNCT,"Shopping is not always enjoyable. I don't really like shopping. Sometimes when I'm bored and can't find something else to do . , I go look round | shops. When I see some clothes in the window I like, I go in and try them on. But I always find they do not look nice on me. The other thing I don't like going shopping is at the weekend. All the shops are full of people, and people treat the items like rubbish . Hanging , hanging them everywhere after they have tried them on and found that they did not suit them. ",NOUN PUNCT ADV,MD NOUN PUNCT ADV,True,True
730,4,AGA,False,Using 'It' incorrectly,"As for the colours, I think metallic colours, especially silver, will be the most popular. As different kinds of fabrics will be invented &amp; and the clothings will never be just cotton as always been seen . Maybe paper can also be a fabric used to make clothing and for those who like to wear new clothes every day. They can be thrown away after wearing | them and are light enough to be carried around whenever you want to change what you're wearing. ",PRON CCONJ VERB,"As for the colours, I think metallic colours, especially silver, will be the most popular. As different kinds of fabrics will be invented &amp; and the clothings will never be just cotton as always been seen . Maybe paper can also be a fabric used to make clothing and for those who like to wear new clothes every day. They can be thrown away after wearing | it and are light enough to be carried around whenever you want to change what you're wearing. ",PRON CCONJ VERB,AGA PRON CCONJ VERB,True,False
1614,77,MP,True,Possessive structure would not be used in here in Chinese,"First of all, I am a high school student, so I only have four | weeks' vacation in July. I would like to travel in July. Secondly, for me, the best way to live in the outdoors is in tents, because that is a good chance to acquire a lot of knowledge about the planets and the animals as well. ",NOUN PART NOUN,"First of all, I am a high school student, so I only have four | weeks vacation in July. I would like to travel in July. Secondly, for me, the best way to live in the outdoors is in tents, because that is a good chance to acquire a lot of knowledge about the planets and the animals as well. ",NOUN NOUN ADP,MP NOUN NOUN ADP,True,True
1046,10,MV,True,Chinese conventions conflict with English	,"When I am at Camp, I will choose singing and photography. I can sing classical music and pop music, seem like rock &amp; roll. Maybe TITANIC. My mum likes me singing this song. And I can also take very good photographs, because I learned | to do this in China two years ago. ",PART VERB DET,"When I am at Camp, I will choose singing and photography. I can sing classical music and pop music, seem like rock &amp; roll. Maybe TITANIC. My mum likes me singing this song. And I can also take very good photographs, because I learned | this in China two years ago. ",DET ADP PROPN,MV DET ADP PROPN,True,True
1867,179,MD,True,Chinese uses classifiers instead of articles in this case,"It is the main building of LUTON University in Park Square. It is an academic building. It includes | a library . , II suit , academic rooms, a GYM Club and a restaurant. ",DET NOUN PUNCT,"It is the main building of LUTON University in Park Square. It is an academic building. It includes | library . , II suit , academic rooms, a GYM Club and a restaurant. ",NOUN PUNCT PUNCT,MD NOUN PUNCT PUNCT,True,True
340,0,MJ,False,Error,"Furthermore, the original actor was Danny Brook but it changed to a different actor who acted terribly and was very disappointing. Last of all, it says in your advertisement that there is a theatre restaurant | open after the show but it turned out to be closed because it was being redecorated and no announcement was made. ",ADJ ADP DET,"Furthermore, the original actor was Danny Brook but it changed to a different actor who acted terribly and was very disappointing. Last of all, it says in your advertisement that there is a theatre restaurant | after the show but it turned out to be closed because it was being redecorated and no announcement was made. ",ADP DET NOUN,MJ ADP DET NOUN,True,False
1708,20,MD,True,Chinese has no articles and doesn't use classifiers in this situation,"Modern technology has changed my daily life in two ways. First with a lot of advanced techniques being put to practical use, our living conditions are becoming more and more convenient and comfortable. When we look around the house, it is easy to find things like : | a microwave oven, TV set, computer , etc. All these items of equipment are applications of modern science. When you are planning to travel, you can choose | a train, car or even | a plane as your means of transportation. Without the development of modern technology, it may take you several years to reach your destination. ",DET NOUN NOUN,"Modern technology has changed my daily life in two ways. First with a lot of advanced techniques being put to practical use, our living conditions are becoming more and more convenient and comfortable. When we look around the house, it is easy to find things like : | microwave oven, TV set, computer , etc. All these items of equipment are applications of modern science. When you are planning to travel, you can choose | train, car or even | plane as your means of transportation. Without the development of modern technology, it may take you several years to reach your destination. ",NOUN NOUN PUNCT,MD NOUN NOUN PUNCT,True,True
967,85,ID,False,This expression doesn't exist in Chinese,"| Last but not least, it is a good kind of entertainment. Maybe you think that playing basketball , and going to cinemas and discos are much better than staying at home sitting in front of an object. However, televisions can bring you the fun that other activities can't. If sometimes I don't want to go out and I don't want to be lonely, it's easy, I just turn on the television and enjoy myself. ",ADJ CCONJ ADV,"| The last but not least, it is a good kind of entertainment. Maybe you think that playing basketball , and going to cinemas and discos are much better than staying at home sitting in front of an object. However, televisions can bring you the fun that other activities can't. If sometimes I don't want to go out and I don't want to be lonely, it's easy, I just turn on the television and enjoy myself. ",DET ADJ CCONJ,ID DET ADJ CCONJ,True,False
2730,75,FV,False,Incorrectly using progressive aspect,"But , during any peak season, like Christmas , holidays or even during weekends . Then , then I can say I definitely don't feel it is enjoyable . Because , because of the crowds. For me I think , it is not shopping but a kind of suffering . Especially , especially , queuing up for twenty minutes just | to pay or waiting for the salesgirl to get the right size . So sometimes I don't think shopping is enjoyable, and if there is any big holiday, I would rather stay at home and watch television. ",PART VERB CCONJ,"But , during any peak season, like Christmas , holidays or even during weekends . Then , then I can say I definitely don't feel it is enjoyable . Because , because of the crowds. For me I think , it is not shopping but a kind of suffering . Especially , especially , queuing up for twenty minutes just | paying or waiting for the salesgirl to get the right size . So sometimes I don't think shopping is enjoyable, and if there is any big holiday, I would rather stay at home and watch television. ",VERB CCONJ VERB,FV VERB CCONJ VERB,True,False
2438,190,RT,True,"""of"" maps to the gentive/possessive marker 的 in Chinese","The party will be in the Palace Hotel. The Hotel is very close to the Town Hall. From Park Square, just go straight. You can see the sign | for the hotel. ",ADP DET NOUN,"The party will be in the Palace Hotel. The Hotel is very close to the Town Hall. From Park Square, just go straight. You can see the sign | of the hotel. ",ADP DET NOUN,RT ADP DET NOUN,True,True
1705,17,MD,True,Chinese has no articles and doesn't use classifiers in this situation,I was not really satisfied with the show and I certainly believe that it was not a perfect evening out. I therefore would like to have a refund of | the £30 which I spent on the tickets.,DET SYM NUM,I was not really satisfied with the show and I certainly believe that it was not a perfect evening out. I therefore would like to have a refund of | £30 which I spent on the tickets.,SYM NUM DET,MD SYM NUM DET,True,True
151,66,FN,False,Number disagreement,"However, journalists should not only think about commercial value , because morality and principles are also concerned. Of course, if everyone paid less attention or interest , the | situation would be better. I remember in August 1997 Princess Diana dying in the car crash was one of the most disastrous examples. ",NOUN VERB VERB,"However, journalists should not only think about commercial value , because morality and principles are also concerned. Of course, if everyone paid less attention or interest , the | situations would be better. I remember in August 1997 Princess Diana dying in the car crash was one of the most disastrous examples. ",NOUN VERB VERB,FN NOUN VERB VERB,True,False
752,26,DA,False,Using your instead of yours for sign offs,"| Yours faithfully, ",DET ADV PUNCT,"| Your faithfully, ",DET ADV PUNCT,DA DET ADV PUNCT,True,False
1936,43,UT,False,Overcorrecting by introducing locations or time using prepositions,"I can only travel in July. As you know, I am a student and the nearest holiday is the summer holiday. But I have booked a flight | home at the beginning of August. And also I would like to go in summer. ",NOUN ADP DET,"I can only travel in July. As you know, I am a student and the nearest holiday is the summer holiday. But I have booked a flight | to home at the beginning of August. And also I would like to go in summer. ",ADP NOUN ADP,UT ADP NOUN ADP,True,False
2091,135,RV,False,,"It is very kind of you to give me the chance to do two activities while I am at the Camp. I'd like to do climbing and sailing. Actually I am quite good at climbing. I often go climbing in my town. As for sailing, well, I haven't tried it before , that . That is why I want to have a | go. I think it must be fun. ",NOUN PUNCT PRON,"It is very kind of you to give me the chance to do two activities while I am at the Camp. I'd like to do climbing and sailing. Actually I am quite good at climbing. I often go climbing in my town. As for sailing, well, I haven't tried it before , that . That is why I want to have a | try. I think it must be fun. ",NOUN PUNCT PRON,RV NOUN PUNCT PRON,True,False
2144,188,RV,False,,"Personally , here are some suggestions about how the programme could be changed. We can | follow the programme that you planned as usual and then we go to that fashion show on Tuesday. ",VERB DET NOUN,"Personally , here are some suggestions about how the programme could be changed. We can | join the programme that you planned as usual and then we go to that fashion show on Tuesday. ",VERB DET NOUN,RV VERB DET NOUN,True,False
2573,24,UC,False,Overcorrection,"Concerning the activities that you have listed . Some , some of them I am really interested in , especially painting. Since I was young, my dad has always taken me to life drawing, so now it has become one of my hobbies. And I think , it will be nice to draw beautiful landscapes of the place. Beside drawing, swimming is my favourite as well. When I was in high school, I joined the swimming club. And I also participated in a few swimming competitions. Although I'm not the best, | I have a lot of confidence at it. ",PRON VERB DET,"Concerning the activities that you have listed . Some , some of them I am really interested in , especially painting. Since I was young, my dad has always taken me to life drawing, so now it has become one of my hobbies. And I think , it will be nice to draw beautiful landscapes of the place. Beside drawing, swimming is my favourite as well. When I was in high school, I joined the swimming club. And I also participated in a few swimming competitions. Although I'm not the best, | but I have a lot of confidence at it. ",CCONJ PRON VERB,UC CCONJ PRON VERB,True,False
2490,34,M,True,Incorrect introduction of subordinate clause or modifiers,"Lastly | there are some things I need to clarify, that is, such as what type of clothes and how much money I need to bring. ",ADV VERB DET,"Lastly | some things I need to clarify, that is, such as what type of clothes and how much money I need to bring. ",DET NOUN PRON,M DET NOUN PRON,True,True
916,33,W,False,Order is incorrect in Chinese and English,"Shopping is enjoyable, if you are lucky. Even though I think | most of the time it is very interesting, sometimes it gets people upset. ",ADJ ADP DET,"Shopping is enjoyable, if you are lucky. Even though I think | it most of time is very interesting, sometimes it gets people upset. ",PRON ADJ ADP,W PRON ADJ ADP,True,False
2526,7,UY,False,Word pair misunderstanding,"Unfortunately, Pat wasn't very good at keeping secrets. He was so kind that he couldn't resist telling Janet that she was going to be killed by Mr Brown. After doing that, Pat left the room. Janet was so nervous that she couldn't stop her heart beating quickly. She went downstairs quietly and closed the door as soon as she went into her room. At that moment a lot of things appeared in her mind, which seemed like they had just happened yesterday. ""Why did Mr Brown want to kill me?"" she said to herself. ""I am just a servant in this castle , . I love him so much and I don't want anything from him although he is the owner of this castle."" It seemed as if a shadow came in through the window and disappeared quickly. Everything in the room was quiet except the sound of the clock, as if everything was going to die. She was so frightened and sad that she had no energy. She fell | onto the floor and wept, while nobody could help her. ",ADP DET NOUN,"Unfortunately, Pat wasn't very good at keeping secrets. He was so kind that he couldn't resist telling Janet that she was going to be killed by Mr Brown. After doing that, Pat left the room. Janet was so nervous that she couldn't stop her heart beating quickly. She went downstairs quietly and closed the door as soon as she went into her room. At that moment a lot of things appeared in her mind, which seemed like they had just happened yesterday. ""Why did Mr Brown want to kill me?"" she said to herself. ""I am just a servant in this castle , . I love him so much and I don't want anything from him although he is the owner of this castle."" It seemed as if a shadow came in through the window and disappeared quickly. Everything in the room was quiet except the sound of the clock, as if everything was going to die. She was so frightened and sad that she had no energy. She fell | down onto the floor and wept, while nobody could help her. ",PART ADP DET,UY PART ADP DET,True,False
1081,46,MV,True,Chinese conventions conflict with English	,"Shopping sounds very enjoyable and | is fantastic for women. You can find a lot of interesting things which were unexpected. Some people enjoy window shopping, but some people enjoy spending their money on clothes or shoes. Nowadays, in a family, shopping isn't a woman's job. ",VERB ADJ ADP,"Shopping sounds very enjoyable and | fantastic for women. You can find a lot of interesting things which were unexpected. Some people enjoy window shopping, but some people enjoy spending their money on clothes or shoes. Nowadays, in a family, shopping isn't a woman's job. ",ADJ ADP NOUN,MV ADJ ADP NOUN,True,True
326,89,RN,True,Chinese would use word in the given context,"First of all, the efficiency of society has been improved. When shopping, we don't need to wait for the cashier to take every article's note by hand. When booking a flight, we can just make a | phone call to any agency, and get it done in one minute. Secondly, instead of looking up tons of books to get the information that we need, we can very easily search for it on the Internet or on the local network. It's very often heard , that someone , who has a rare illness , has had an operation at a foreign institute , which he found via the Internet. Moreover, with computer networks, it is possible for people to work from home, making projects, controlling operations or having conferences. Lastly the way of communications has also changed. Instead of traditional telecommunications, we can talk by, e-mail or even see each other with the help of a computer network. ",NOUN NOUN ADP,"First of all, the efficiency of society has been improved. When shopping, we don't need to wait for the cashier to take every article's note by hand. When booking a flight, we can just make a | phone to any agency, and get it done in one minute. Secondly, instead of looking up tons of books to get the information that we need, we can very easily search for it on the Internet or on the local network. It's very often heard , that someone , who has a rare illness , has had an operation at a foreign institute , which he found via the Internet. Moreover, with computer networks, it is possible for people to work from home, making projects, controlling operations or having conferences. Lastly the way of communications has also changed. Instead of traditional telecommunications, we can talk by, e-mail or even see each other with the help of a computer network. ",NOUN ADP DET,RN NOUN ADP DET,True,True
1623,86,MP,True,Chinese sentence structure differs from English,"Firstly, I am a student , . I don't have a job, so, I have to ask for money from my parents. I can't ask for too much | . That's very bad for my parents. When I go shopping . , I always feel ashamed because I spend my parents' money. (Although I have got a part-time job, it provides just enough to pay my rent.) ",PUNCT DET VERB,"Firstly, I am a student , . I don't have a job, so, I have to ask for money from my parents. I can't ask for too much | that's very bad for my parents. When I go shopping . , I always feel ashamed because I spend my parents' money. (Although I have got a part-time job, it provides just enough to pay my rent.) ",DET VERB ADV,MP DET VERB ADV,True,True
2723,68,FV,True,"Missing ""to"" for to-infinitive non-finite subordinate clauses","Another thing is I would like to ask you some questions about the stay , . What's the weather like? What kind of clothes shall I take? And how much does it cost per night | to live in a Hotel? Thanks for your help. ",PART VERB ADP,"Another thing is I would like to ask you some questions about the stay , . What's the weather like? What kind of clothes shall I take? And how much does it cost per night | live in a Hotel? Thanks for your help. ",VERB ADP DET,FV VERB ADP DET,True,True
2654,61,UV,True,Chinese conventions conflict with English,"Welcome to Taiwan. This report is based on an interesting building, where you can take , your students | . This building is situated in Taipei, the capital. The building is called the Chiang Kei-shek Memorial Hall. Nearly everyone knows where this building is, so if you have a chance, just ask the local people in Taipei about this building. ",PUNCT DET NOUN,"Welcome to Taiwan. This report is based on an interesting building, where you can take , your students | to visit. This building is situated in Taipei, the capital. The building is called the Chiang Kei-shek Memorial Hall. Nearly everyone knows where this building is, so if you have a chance, just ask the local people in Taipei about this building. ",PART VERB PUNCT,UV PART VERB PUNCT,True,True
2737,82,FV,True,Progressive aspect not applied,"1. English lesson. Because students in the English class are from all over the world . We , we can talk about everybody's feelings about living and | studying in a foreign country. ",VERB ADP DET,"1. English lesson. Because students in the English class are from all over the world . We , we can talk about everybody's feelings about living and | study in a foreign country. ",VERB ADP DET,FV VERB ADP DET,True,True
750,24,DA,False,Using your instead of yours for sign offs,"| Yours Sincerely, ",PROPN ADV PUNCT,"| Your Sincerely, ",DET ADV PUNCT,DA DET ADV PUNCT,True,False
1374,103,TV,True,Present perfect used instead of past perfect,"In your advertisement, you | had written that Danny Brook and Tina Truelove would be performing. However, I noticed when I was watching it that a different actor was performing. I | had expected Danny Brook to perform and it was extremely disappointing. ",VERB VERB ADP,"In your advertisement, you | have written that Danny Brook and Tina Truelove would be performing. However, I noticed when I was watching it that a different actor was performing. I | have expected Danny Brook to perform and it was extremely disappointing. ",VERB VERB ADP,TV VERB VERB ADP,True,True
2387,138,RT,False,"Misuing ""for""; Learners have confused the two's meaning and usage","In addition, I choose painting and sailing for my activities. I can't wait to do my painting | of the rising sun, and can't imagine how wonderful sailing along the rivers will be. ",ADP DET VERB,"In addition, I choose painting and sailing for my activities. I can't wait to do my painting | for the rising sun, and can't imagine how wonderful sailing along the rivers will be. ",ADP DET VERB,RT ADP DET VERB,True,False
2279,28,RT,True,Chinese conventions conflict with English,"I am writing this letter in order to complain about my unpleasant experience at your theatre. Two days ago, I went to see the musical show ""Over the Rainbow"" at your theatre. The advertised starting time is 19:30 . But but | for some unknown reason, the play didn't start until 20:15. The audience were anxious and bored. ",ADP DET ADJ,"I am writing this letter in order to complain about my unpleasant experience at your theatre. Two days ago, I went to see the musical show ""Over the Rainbow"" at your theatre. The advertised starting time is 19:30 . But but | due to some unknown reason, the play didn't start until 20:15. The audience were anxious and bored. ",ADP ADP DET,RT ADP ADP DET,True,True
643,82,AGV,False,3rd person plural verb form used instead of 3rd person singular form,"First of all, in my opinion, TV has a great educational function, and it also makes the world smaller. You can just sit at home and you can know what is happening all over the world at that moment. I would rather watch the news on TV instead of reading a newspaper or listening to the radio because the news on TV | is vivid . ",VERB ADJ PUNCT,"First of all, in my opinion, TV has a great educational function, and it also makes the world smaller. You can just sit at home and you can know what is happening all over the world at that moment. I would rather watch the news on TV instead of reading a newspaper or listening to the radio because the news on TV | are vivid . ",VERB ADJ PUNCT,AGV VERB ADJ PUNCT,True,False
1899,2,UT,False,"Overcorrection by adding ""to"" to show the object of transitive verbs","You mentioned the rules at home and at school in the letter. This reminds me of what I experienced during my teenage years. In my country the children go to secondary school when they are in the first year of being a teenager. You know, this age is the troublesome age, boys have too much energy and girls want to fall in love with someone. They always annoy the schoolteacher and their parents. As a result of this, the teachers make very strict rules at school, such as students aren't allowed to speak to each other in class. They have to finish homework within a limited time. They cannot oppose | the teacher, girls are not allowed to wear make-up or wear any jewellery. At home, in my experience, my parents didn't allow me to go out in the evening and gave me a lot of homework to do, even in the holiday. They also forbade me to have a boyfriend. I think it is not just what happened in my home, many of my friends had the same experience. ",DET NOUN PUNCT,"You mentioned the rules at home and at school in the letter. This reminds me of what I experienced during my teenage years. In my country the children go to secondary school when they are in the first year of being a teenager. You know, this age is the troublesome age, boys have too much energy and girls want to fall in love with someone. They always annoy the schoolteacher and their parents. As a result of this, the teachers make very strict rules at school, such as students aren't allowed to speak to each other in class. They have to finish homework within a limited time. They cannot oppose | to the teacher, girls are not allowed to wear make-up or wear any jewellery. At home, in my experience, my parents didn't allow me to go out in the evening and gave me a lot of homework to do, even in the holiday. They also forbade me to have a boyfriend. I think it is not just what happened in my home, many of my friends had the same experience. ",ADP DET NOUN,UT ADP DET NOUN,True,False
