568,4,AGV,True,3rd person singular form used isntead of 3rd person plural verb form,"Although I enjoyed it, there were still some things that needed to be improved. For example, there were some concert halls which | were too small to hold so many people, the stars and artists were just from six countries, which is not enough for the audience. In addition, when you organize next year's international arts festival, could you arrange more plays and films . ? ",VERB ADV ADJ,"Although I enjoyed it, there were still some things that needed to be improved. For example, there were some concert halls which | was too small to hold so many people, the stars and artists were just from six countries, which is not enough for the audience. In addition, when you organize next year's international arts festival, could you arrange more plays and films . ? ",VERB ADV ADJ,AGV VERB ADV ADJ,True,True
7,7,RJ,True,The two words map to the same word in Chinese,"A week later, when I was still in a bad mood, my form teacher, Mrs Brown, talked about jobs in our English lesson. She told us there were numerous types of job in the world. Some offered a high salary while some did not. However, they are equally important for our society. 'Who wants to be a doctor?' She asked. Many students raised their hands. 'Who wants to be a lawyer?' Again, many students put up their hand. But when she asked who wanted to be a cleaner, nobody raised his hand and I felt so | ashamed that I lowered my head. 'Cleaner is a very good job.' Mrs Brown said in a loud voice. 'If there were no cleaners, who would clean the school for us , who ? Who would keep the environment nice and tidy . ? ' Suddenly, all my classmates applauded and smiled at me with respect. The teacher also grinned and I was so impressed and repeated the words in my heart: 'All jobs have the same importance.' ",ADJ ADP PRON,"A week later, when I was still in a bad mood, my form teacher, Mrs Brown, talked about jobs in our English lesson. She told us there were numerous types of job in the world. Some offered a high salary while some did not. However, they are equally important for our society. 'Who wants to be a doctor?' She asked. Many students raised their hands. 'Who wants to be a lawyer?' Again, many students put up their hand. But when she asked who wanted to be a cleaner, nobody raised his hand and I felt so | shameful that I lowered my head. 'Cleaner is a very good job.' Mrs Brown said in a loud voice. 'If there were no cleaners, who would clean the school for us , who ? Who would keep the environment nice and tidy . ? ' Suddenly, all my classmates applauded and smiled at me with respect. The teacher also grinned and I was so impressed and repeated the words in my heart: 'All jobs have the same importance.' ",ADJ ADP PRON,RJ ADJ ADP PRON,True,True
312,75,RN,True,Both the incorrect and corrected terms could be used,"So I must find a | way to help my great father. One day, I suddenly had a good idea. 'Why not go to the stock exchange?' I said to myself. Almost every day I went there and researched the exchange decline-line, which gave me lots of information . Finally, I decided to join in the dangerous game, which meant losing everything or suddenly becoming a millionaire. With luck, I won by chance . ",NOUN PART VERB,"So I must find a | solution to help my great father. One day, I suddenly had a good idea. 'Why not go to the stock exchange?' I said to myself. Almost every day I went there and researched the exchange decline-line, which gave me lots of information . Finally, I decided to join in the dangerous game, which meant losing everything or suddenly becoming a millionaire. With luck, I won by chance . ",NOUN PART VERB,RN NOUN PART VERB,True,True
994,20,MA,True,Chinese is a pro-drop language,"But at a party, their friends wanted to show their concern, and they went to ask about Nick and give him their sympathy. This made Nick very embarrassed and | he felt hurt. Finally, they got separated. ",PRON VERB VERB,"But at a party, their friends wanted to show their concern, and they went to ask about Nick and give him their sympathy. This made Nick very embarrassed and | felt hurt. Finally, they got separated. ",VERB VERB PUNCT,MA VERB VERB PUNCT,True,True
2163,207,RV,False,,"You can inform all the students that they can | take some traditional food to the party. After the meal, you can play some games and prepare a prize for the winner. At the end of the conference you can dance and sing together. ",VERB DET ADJ,"You can inform all the students that they can | make some traditional food to the party. After the meal, you can play some games and prepare a prize for the winner. At the end of the conference you can dance and sing together. ",VERB DET ADJ,RV VERB DET ADJ,True,False
2145,189,RV,True,,"And , there should be a robotic servant in everyone's home. So there'll be no need for people to do the housework. There | will be no beds at home because some pills will be invented to prevent people becoming sleepy. If you're tired, the pill can give you vitamins, proteins and make you refreshed. ",VERB VERB DET,"And , there should be a robotic servant in everyone's home. So there'll be no need for people to do the housework. There | should be no beds at home because some pills will be invented to prevent people becoming sleepy. If you're tired, the pill can give you vitamins, proteins and make you refreshed. ",VERB VERB DET,RV VERB VERB DET,True,True
1492,229,TV,True,Chinese generally expresses actions in present tense,"So I must find a way to help my great father. One day, I suddenly had a good idea. 'Why not go to the stock exchange?' I said to myself. Almost every day I went there and researched the exchange decline-line, which | gave me lots of information . Finally, I decided to join in the dangerous game, which meant losing everything or suddenly becoming a millionaire. With luck, I won by chance . ",VERB PRON NOUN,"So I must find a way to help my great father. One day, I suddenly had a good idea. 'Why not go to the stock exchange?' I said to myself. Almost every day I went there and researched the exchange decline-line, which | gives me lots of information . Finally, I decided to join in the dangerous game, which meant losing everything or suddenly becoming a millionaire. With luck, I won by chance . ",VERB PRON NOUN,TV VERB PRON NOUN,True,True
2368,119,RT,True,English words map to the same Chinese word,"Then, you can rest a little and examine the product a little closer but, unfortunately, it does not provide the satisfaction you may have wished for. Instead, you keep thinking about the initial product you could not afford, resulting | in more frustration and tiredness. ",ADP ADJ NOUN,"Then, you can rest a little and examine the product a little closer but, unfortunately, it does not provide the satisfaction you may have wished for. Instead, you keep thinking about the initial product you could not afford, resulting | into more frustration and tiredness. ",ADP ADJ NOUN,RT ADP ADJ NOUN,True,True
1722,34,MD,True,Chinese uses classifiers instead of articles in this case,"I have been a music enthusiast for a long time , . I used | a tape player and I felt it was excellent. Today, there are multi-choices many choices , such as | a discman (CD player) . , MD walkman and MP3 player, which are considered to be more portable and have | a better sound quality. ",DET NOUN NOUN,"I have been a music enthusiast for a long time , . I used | tape player and I felt it was excellent. Today, there are multi-choices many choices , such as | discman (CD player) . , MD walkman and MP3 player, which are considered to be more portable and have | better sound quality. ",NOUN NOUN CCONJ,MD NOUN NOUN CCONJ,True,True
2596,3,UV,False,Unnecessary auxiliary added,"Therefore, she came to the river every day and talked about everything with the golden fish. They were very close friends. After half a year, the golden fish suddenly disappeared. Sara was very sad. She sat and cried by the river. Then somebody called her name: ""Sara... Sara... look at me... I'm standing on your left-hand side."" Sara remembered the | golden fish. It had suddenly become human, a little boy. After a few days they got married. They had a wonderful life together. ",ADJ NOUN PUNCT,"Therefore, she came to the river every day and talked about everything with the golden fish. They were very close friends. After half a year, the golden fish suddenly disappeared. Sara was very sad. She sat and cried by the river. Then somebody called her name: ""Sara... Sara... look at me... I'm standing on your left-hand side."" Sara remembered the | was golden fish. It had suddenly become human, a little boy. After a few days they got married. They had a wonderful life together. ",VERB ADJ NOUN,UV VERB ADJ NOUN,True,False
2570,21,UC,False,Overcorrection,Would you tell me | how much money you will give to me and what the weather is like in the U.S.A. Thank you for everything!,ADV ADJ NOUN,Would you tell me | that how much money you will give to me and what the weather is like in the U.S.A. Thank you for everything!,ADP ADV ADJ,UC ADP ADV ADJ,True,False
1950,57,UT,False,Overcorrection,"Regarding | the end-of-conference party . We , we have planned a barbecue for 5 oo pm . on our most idyllic playing field, which overlooks the endless Countryside and farms. At 7:00pm . we can move to our student hall to have a disco dance until 10:00pm. ",DET NOUN PUNCT,"Regarding | to the end-of-conference party . We , we have planned a barbecue for 5 oo pm . on our most idyllic playing field, which overlooks the endless Countryside and farms. At 7:00pm . we can move to our student hall to have a disco dance until 10:00pm. ",ADP DET NOUN,UT ADP DET NOUN,True,False
1829,141,MD,True,Chinese has no articles and doesn't use classifiers in this situation,My name is Bao-yu Liao. I am | the representative of our class in your college to write to you.,DET NOUN ADP,My name is Bao-yu Liao. I am | representative of our class in your college to write to you.,ADJ ADP DET,MD ADJ ADP DET,True,True
1408,139,TV,True,Chinese generally expresses actions in present tense,"I mainly gave them a hand in setting up the stage. You know, although I'm a pop music fan, I'd never had any idea how it was prepared for opening . First, they asked me to put those instruments on the stage. I left the hi-fi system on the left side (it should | have been on the other side). Before his opening, the pop star noticed the mistake , otherwise . Otherwise it would | have been a disaster. ",VERB VERB ADP,"I mainly gave them a hand in setting up the stage. You know, although I'm a pop music fan, I'd never had any idea how it was prepared for opening . First, they asked me to put those instruments on the stage. I left the hi-fi system on the left side (it should | be on the other side). Before his opening, the pop star noticed the mistake , otherwise . Otherwise it would | be a disaster. ",VERB ADP DET,TV VERB ADP DET,True,True
65,65,RJ,False,Misunderstanding of word usage/meaning,"I was thinking 'what should I do?' I hadn't got my mobile phone with me and I was halfway between my school and home. At that time he was unconscious , . I kept asking myself 'Should I wake him up or try to use my | dubious first aid skills to help with him."" I was struggling because I knew if I didn't help him, he would die in a short time. ",ADJ ADJ NOUN,"I was thinking 'what should I do?' I hadn't got my mobile phone with me and I was halfway between my school and home. At that time he was unconscious , . I kept asking myself 'Should I wake him up or try to use my | unsure first aid skills to help with him."" I was struggling because I knew if I didn't help him, he would die in a short time. ",ADJ ADJ NOUN,RJ ADJ ADJ NOUN,True,False
556,116,UP,False,Incorrect modal contractions,"I'd like to complain about your ' best ' musical show, which I went to when | I had a week's holiday in London. I felt really disappointed because the things you said in the advertisement weren't true. ",PRON VERB DET,"I'd like to complain about your ' best ' musical show, which I went to when | I'd a week's holiday in London. I felt really disappointed because the things you said in the advertisement weren't true. ",PRON AUX DET,UP PRON AUX DET,True,False
2756,101,FV,True,Progressive aspect not applied,"Almost everyone hates other people | gossiping about their private lives. It's a natural reaction to be angry with somebody you don't trust for gossiping about you and bothering your personal thoughts . So I think famous people, no matter if they are politicians or film stars, don't deserve to be followed by journalists every time they are trying to have a good time. ",VERB ADP DET,"Almost everyone hates other people | gossip about their private lives. It's a natural reaction to be angry with somebody you don't trust for gossiping about you and bothering your personal thoughts . So I think famous people, no matter if they are politicians or film stars, don't deserve to be followed by journalists every time they are trying to have a good time. ",VERB ADP DET,FV VERB ADP DET,True,True
1935,41,UT,False,Overgeneralization of word pairs,Recently we had a class discussion about shopping. All of the students agree | that shopping is not always enjoyable.,ADP NOUN VERB,Recently we had a class discussion about shopping. All of the students agree | with that shopping is not always enjoyable.,ADP DET NOUN,UT ADP DET NOUN,True,False
1713,25,MD,True,Chinese has no articles and doesn't use classifiers in this situation,"By using the Internet we can make new pen friends overseas, and create clubs , and societies. Now | a message can travel quicker and it is also worldwide . sending letters takes about a week from Hong Kong to the U.K., but network , eg. e.g. E-mail . , is much faster. require Require the time The time required is only a few minutes. Now we can even create a club on Yahoo, which is free. Modern technology saves us a lot of time and brings us many benefits when we use it in the right way, but some bad way to e.g. send virus to break down network . ",DET NOUN VERB,"By using the Internet we can make new pen friends overseas, and create clubs , and societies. Now | message can travel quicker and it is also worldwide . sending letters takes about a week from Hong Kong to the U.K., but network , eg. e.g. E-mail . , is much faster. require Require the time The time required is only a few minutes. Now we can even create a club on Yahoo, which is free. Modern technology saves us a lot of time and brings us many benefits when we use it in the right way, but some bad way to e.g. send virus to break down network . ",NOUN VERB VERB,MD NOUN VERB VERB,True,True
342,2,MJ,True,Chinese equivalent maps to only a part of the English word,"The hotel that group has been booked into is the Palace Hotel (on the Victoria road). And you can catch the Bus in front of the hotel to go to the College. It is four bus stops | away. Then walk straight ahead for five minutes , you . You will see the college. ",ADV PUNCT ADV,"The hotel that group has been booked into is the Palace Hotel (on the Victoria road). And you can catch the Bus in front of the hotel to go to the College. It is four bus stops | . Then walk straight ahead for five minutes , you . You will see the college. ",PUNCT ADV VERB,MJ PUNCT ADV VERB,True,True
387,17,RD,False,Grammatical to exclude or include the word in Chinese,I would be grateful if you could give us our money back. If I cannot get | a satisfactory reply within a month I shall go to the consumer protection organisation to sue you.,DET ADJ NOUN,I would be grateful if you could give us our money back. If I cannot get | your satisfactory reply within a month I shall go to the consumer protection organisation to sue you.,DET ADJ NOUN,RD DET ADJ NOUN,True,False
567,3,AGV,True,Not applying the 3rd person present tense suffix -s,"At my school, we aren't allowed to smoke inside the building, because the building is made of wood , it . It | tends to catch fire easily, and we aren't allowed to use the Internet , there . There are only ten computers in the school , only . Only teachers can use them , if . If we used them, we would be sent to the head office of the school. ",VERB PART VERB,"At my school, we aren't allowed to smoke inside the building, because the building is made of wood , it . It | tend to catch fire easily, and we aren't allowed to use the Internet , there . There are only ten computers in the school , only . Only teachers can use them , if . If we used them, we would be sent to the head office of the school. ",VERB PART VERB,AGV VERB PART VERB,True,True
1622,85,MP,True,Chinese sentence structure differs from English,"When I am at Camp, I will choose singing and photography | . I can sing classical music and pop music, seem like rock &amp; roll. Maybe TITANIC. My mum likes me singing this song. And I can also take very good photographs, because I learned to do this in China two years ago. ",PUNCT PRON VERB,"When I am at Camp, I will choose singing and photography | I can sing classical music and pop music, seem like rock &amp; roll. Maybe TITANIC. My mum likes me singing this song. And I can also take very good photographs, because I learned to do this in China two years ago. ",PRON VERB VERB,MP PRON VERB VERB,True,True
192,16,R,False,Confusion of phrase meaning and usage,"Science and technology can give us a better lifestyle or better food. For example, once people had to walk from one place to another, but now we can use science and technology to produce a lot of petrol-powered vehicles and we can travel faster with them. We can also produce more and better food | by using science and technology . , e.g. by using science to put all the good parts of two plants into one plant. We can also use technology to produce more food and help them grow faster. ",ADP VERB NOUN,"Science and technology can give us a better lifestyle or better food. For example, once people had to walk from one place to another, but now we can use science and technology to produce a lot of petrol-powered vehicles and we can travel faster with them. We can also produce more and better food | or using science and technology . , e.g. by using science to put all the good parts of two plants into one plant. We can also use technology to produce more food and help them grow faster. ",CCONJ VERB NOUN,R CCONJ VERB NOUN,True,False
2332,82,RT,False,Overgeneralization,I really wish you had been there with me | on one of the exciting nights in my life. Now I can't wait to tell you every detail. Are you ready?,ADP NUM ADP,I really wish you had been there with me | at one of the exciting nights in my life. Now I can't wait to tell you every detail. Are you ready?,ADP NUM ADP,RT ADP NUM ADP,True,False
972,90,W,True,Adjective/modifier precedes described object,"The museum looks very old, like some other buildings in London, but it is very modern inside. After going through the enormous main door, you can see a huge | round white building, which is a library. A lot of famous people have been to this library ! ",ADJ ADJ NOUN,"The museum looks very old, like some other buildings in London, but it is very modern inside. After going through the enormous main door, you can see a huge | white round building, which is a library. A lot of famous people have been to this library ! ",ADJ NOUN NOUN,W ADJ NOUN NOUN,True,True
677,25,DY,False,Spelling error,"| Finally, I want to know what the weather is like in California in July. Do I need some special clothes for the camp and how much money shall I bring for other expenses . ? ",ADV PUNCT PRON,"| Finaly, I want to know what the weather is like in California in July. Do I need some special clothes for the camp and how much money shall I bring for other expenses . ? ",PROPN PUNCT PRON,DY PROPN PUNCT PRON,True,False
1347,75,TV,True,Chinese generally expresses actions in present tense,"Firstly, there was a different actor instead of the famous actor , Danny Brook. That left me so disappointed. Secondly, I | supposed the show would start at 19:30, but it started at 20:15. It caused me to miss the train and I went back to the hotel when it was nearly mid-night midnight . Another problem is , I thought that discounts were available. However, there wasn't any discount. Additionally, the advertisement said I could visit the theatre restaurant after the show. When I arrived, it was closed. It is so annoying that everything was changed without any notice. ",VERB DET NOUN,"Firstly, there was a different actor instead of the famous actor , Danny Brook. That left me so disappointed. Secondly, I | suppose the show would start at 19:30, but it started at 20:15. It caused me to miss the train and I went back to the hotel when it was nearly mid-night midnight . Another problem is , I thought that discounts were available. However, there wasn't any discount. Additionally, the advertisement said I could visit the theatre restaurant after the show. When I arrived, it was closed. It is so annoying that everything was changed without any notice. ",VERB DET NOUN,TV VERB DET NOUN,True,True
1870,182,MD,True,Chinese has no articles and doesn't use classifiers in this situation,"There is a very big library. You can find any information from it that you want. For the rest of | the time, you can go to | the IT suite to use | the Internet. If you feel hungry, you don't need to go out. Just in the same building, you can find a restaurant. ",DET NOUN PUNCT,"There is a very big library. You can find any information from it that you want. For the rest of | time, you can go to | IT suite to use | Internet. If you feel hungry, you don't need to go out. Just in the same building, you can find a restaurant. ",NOUN PUNCT PRON,MD NOUN PUNCT PRON,True,True
606,42,AGV,True,Not applying the 3rd person present tense suffix -s,"Everyone likes sales, but those so-called sale items are not really good value. In the fashion industry, sales begin at the end of each season and just last a short time, because those retailers want to make room for new stock. But you'll find your 'cool bargain' soon | gets out of date and you have to keep buying new ones. Also supermarket owners have invested a vast amount of money to find out the best way to place goods in order to get the most profit. Therefore, we become impulsive buyers easily under the influence of these tricks. The result , is we feel guilty after spending more than we expected, or even suffer from financial difficulty. ",VERB ADP ADP,"Everyone likes sales, but those so-called sale items are not really good value. In the fashion industry, sales begin at the end of each season and just last a short time, because those retailers want to make room for new stock. But you'll find your 'cool bargain' soon | get out of date and you have to keep buying new ones. Also supermarket owners have invested a vast amount of money to find out the best way to place goods in order to get the most profit. Therefore, we become impulsive buyers easily under the influence of these tricks. The result , is we feel guilty after spending more than we expected, or even suffer from financial difficulty. ",VERB ADP ADP,AGV VERB ADP ADP,True,True
1322,50,TV,False,Incorrect auxiliary used; Extra unecessary auxiliary added; Present perfect used instead of past tense,"First of all, when I went and bought my ticket, there was no discount, but in your advertisement it clearly said that discounts are available and as a result the ticket I | bought was more expensive. ",VERB VERB ADV,"First of all, when I went and bought my ticket, there was no discount, but in your advertisement it clearly said that discounts are available and as a result the ticket I | was bought was more expensive. ",VERB VERB VERB,TV VERB VERB VERB,True,False
1675,138,MP,True,Chinese uses commas to mark the end of a complete thought,"We have booked the hotel for the group. It is the ""Palace Hotel"" | , which is about 10 miles away from our College , the . The hotel will have a coach to pick the group up from the airport on the 19th of June and then take the group to the Conference and return to the hotel every day. ",PUNCT DET VERB,"We have booked the hotel for the group. It is the ""Palace Hotel"" | which is about 10 miles away from our College , the . The hotel will have a coach to pick the group up from the airport on the 19th of June and then take the group to the Conference and return to the hotel every day. ",DET VERB ADV,MP DET VERB ADV,True,True
1706,18,MD,True,Chinese has no articles and doesn't use classifiers in this situation,"Modern technology has changed my daily life in two ways. First with a lot of advanced techniques being put to practical use, our living conditions are becoming more and more convenient and comfortable. When we look around the house, it is easy to find things like : | a microwave oven, TV set, computer , etc. All these items of equipment are applications of modern science. When you are planning to travel, you can choose | a train, car or even | a plane as your means of transportation. Without the development of modern technology, it may take you several years to reach your destination. ",DET NOUN NOUN,"Modern technology has changed my daily life in two ways. First with a lot of advanced techniques being put to practical use, our living conditions are becoming more and more convenient and comfortable. When we look around the house, it is easy to find things like : | microwave oven, TV set, computer , etc. All these items of equipment are applications of modern science. When you are planning to travel, you can choose | train, car or even | plane as your means of transportation. Without the development of modern technology, it may take you several years to reach your destination. ",NOUN NOUN PUNCT,MD NOUN NOUN PUNCT,True,True
