,sentence,correct,tags,poss,en,es,model_result
0,The firemen arrived ten minutes later.,True,DT NNS VBD CD NNS RB . ,DET NOUN VERB NUM NOUN ADV PUNCT ,-10.690903515950664,-12.074775774417304,True
1,Arrived the firemen ten minutes later.,False,VBD DT NNS CD NNS RB . ,VERB DET NOUN NUM NOUN ADV PUNCT ,-12.087695715238562,-11.203490324183226,True
2,Yesterday played very well the children.,False,NN VBD RB RB DT NNS . ,NOUN VERB ADV ADV DET NOUN PUNCT ,-7.403868388361236,-7.779156218293942,False
3,Played very well the children yesterday.,False,VBN RB RB DT NNS NN . ,VERB ADV ADV DET NOUN NOUN PUNCT ,-8.374594833890072,-9.158400809917312,False
4,Yesterday the children played very well.,True,NN DT NNS VBD RB RB . ,NOUN DET NOUN VERB ADV ADV PUNCT ,-7.936345721667327,-8.825086617866319,True
5,The children played very well yesterday.,True,DT NNS VBD RB RB NN . ,DET NOUN VERB ADV ADV NOUN PUNCT ,-10.106433419070651,-12.459636541556373,True
6,Often she has helped.,False,RB PRP VBZ VBN . ,ADV PRON VERB VERB PUNCT ,-1.2633949668656932,-3.3878261283136433,False
7,She often has helped.,False,PRP RB VBZ VBN . ,PRON ADV VERB VERB PUNCT ,-2.4828873810090526,-3.863148901164152,False
8,They live in the house white.,False,PRP VBP IN DT NN JJ . ,PRON VERB ADP DET NOUN ADJ PUNCT ,-8.731202693902581,-3.6261644569841343,True
9,Can you lend me a ball of tennis?,False,MD PRP VB PRP DT NN IN NN . ,VERB PRON VERB PRON DET NOUN ADP NOUN PUNCT ,-10.681019764854486,-12.478651791168225,False
10,The Club of Bridge of the University of Cambridge.,False,DT NNP IN NNP IN DT NNP IN NNP . ,DET PROPN ADP PROPN ADP DET PROPN ADP PROPN PUNCT ,-11.300757874757855,-9.626954722498896,True
11,They gave to Sam the book.,False,PRP VBD IN NNP DT NN . ,PRON VERB ADP PROPN DET NOUN PUNCT ,-10.517011394735432,-8.687396835718106,True
12,They gave the book to Sam.,True,PRP VBD DT NN IN NNP . ,PRON VERB DET NOUN ADP PROPN PUNCT ,-6.1061637935687765,-5.215766789211216,False
13,They took to the hospital her mother.,False,PRP VBD IN DT NN PRP$ NN . ,PRON VERB ADP DET NOUN DET NOUN PUNCT ,-8.910499311349236,-7.269548295049863,True
14,Mrs Smith speaks very well English.,False,NNP NNP VBZ RB RB NNP . ,PROPN PROPN VERB ADV ADV PROPN PUNCT ,-11.071463144079996,-14.091976428869236,False
15,Keep tidy Britain.,False,VB JJ NNP . ,VERB ADJ PROPN PUNCT ,-5.229837109511059,-6.074037074620156,False
16,John has bought the books?,True,NNP VBZ VBN DT NNS . ,PROPN VERB VERB DET NOUN PUNCT ,-3.52934483152465,-4.096329794963473,True
17,Has bought the books John? Mary came?,False,VBZ VBN DT NNS NNP . NNP VBD . ,VERB VERB DET NOUN PROPN PUNCT PROPN VERB PUNCT ,-14.752284898551444,-11.949252304115507,True
18,When Mary came?,False,WRB NNP VBD . ,ADV PROPN VERB PUNCT ,-1.3533034841983091,-2.3082480405418733,False
19,Came Mary?,False,VBD NNP . ,VERB PROPN PUNCT ,-2.056317050247114,-0.9506649673144474,True
20,"Mary, when came?",False,"NNP , WRB VBD . ",PROPN PUNCT ADV VERB PUNCT ,-4.950157403244352,-5.286461815897201,False
21,Who did kill Oswald?,False,WP VBD VB NNP . ,PRON VERB VERB PROPN PUNCT ,-6.206721290835412,-8.937423243760001,False
22,Who Oswald killed?,False,WP NNP VBD . ,PRON PROPN VERB PUNCT ,-1.2476009708240663,-1.3662830006066915,False
23,Who killed to Kennedy?,False,WP VBD IN NNP . ,PRON VERB ADP PROPN PUNCT ,-4.8379178631798565,-4.064052446043009,True
24,Who Kennedy killed?,False,WP NNP VBD . ,PRON PROPN VERB PUNCT ,-1.2476009708240663,-1.3662830006066915,False
25,Did they went?,False,VBD PRP VBD . ,VERB PRON VERB PUNCT ,-1.323472383383713,-2.4066918233342633,False
26,Do they went?,False,VBP PRP VBD . ,VERB PRON VERB PUNCT ,-1.323472383383713,-2.4066918233342633,False
27,Do she goes?,False,VBP PRP VBZ . ,VERB PRON VERB PUNCT ,-1.323472383383713,-2.4066918233342633,False
28,Does she goes?,False,VBZ PRP VBZ . ,VERB PRON VERB PUNCT ,-1.323472383383713,-2.4066918233342633,False
29,"They're coming tomorrow, no?",False,"PRP VBP VBG NN , UH . ",PRON VERB VERB NOUN PUNCT INTJ PUNCT ,-13.48574359991063,-17.677075727405942,False
30,"You have a car, no?",False,"PRP VBP DT NN , UH . ",PRON VERB DET NOUN PUNCT INTJ PUNCT ,-12.143754003640444,-13.400215138400347,False
31,Peter not found the key.,False,NNP RB VBD DT NN . ,PROPN ADV VERB DET NOUN PUNCT ,-2.7630898764377085,-2.75541896526148,True
32,Peter not has found the key.,False,NNP RB VBZ VBN DT NN . ,PROPN ADV VERB VERB DET NOUN PUNCT ,-5.415614457086017,-5.098677206532602,True
33,I no understand.,False,PRP RB VBP . ,PRON ADV VERB PUNCT ,-0.3385345142225138,-1.1467539539908358,False
34,Those no.,False,DT UH . ,DET INTJ PUNCT ,-1.059772455351846,-0.2531958963806117,True
35,Green no.,False,NNP NN . ,PROPN NOUN PUNCT ,-0.989830301739878,-1.6090118870081398,False
36,Here no.,False,RB UH . ,ADV INTJ PUNCT ,-2.3139951597320767,-2.19722457733622,True
37,I not saw nobody.,False,PRP RB VBD NN . ,PRON ADV VERB NOUN PUNCT ,-2.980144130151081,-3.3178026156539486,False
38,I didn't see nobody.,False,PRP VBD RB VB NN . ,PRON VERB ADV VERB NOUN PUNCT ,-5.171944586080741,-8.344461247073843,False
39,Tom not helps her never.,False,NNP RB VBZ PRP RB . ,PROPN ADV VERB PRON ADV PUNCT ,-6.035449517900147,-7.2258646494344605,False
40,Tom doesn't help her never.,False,NNP VBZ RB VB PRP RB . ,PROPN VERB ADV VERB PRON ADV PUNCT ,-7.849771743992563,-12.031249522131967,False
41,I waited but anybody came.,False,PRP VBD CC NN VBD . ,PRON VERB CCONJ NOUN VERB PUNCT ,-11.005203441325431,-11.731990023016438,False
42,Maria cans cook.,False,NNP NNS VBP . ,PROPN NOUN VERB PUNCT ,-1.6787732980241783,-2.7855985080592967,False
43,Do you can swim?,False,VBP PRP MD VB . ,VERB PRON VERB VERB PUNCT ,-2.492323585987154,-5.230900615294258,False
44,May you come tomorrow?,False,MD PRP VB NN . ,VERB PRON VERB NOUN PUNCT ,-5.155328128675136,-5.3503067587724,False
45,She could find the key.,False,PRP MD VB DT NN . ,PRON VERB VERB DET NOUN PUNCT ,-3.682712575152892,-3.901912436763797,False
46,She had to win the match.,False,PRP VBD TO VB DT NN . ,PRON VERB PART VERB DET NOUN PUNCT ,-4.7466471425794925,-18.76241442056088,False
47,They will can do it next week.,False,PRP MD MD VB PRP JJ NN . ,PRON VERB VERB VERB PRON ADJ NOUN PUNCT ,-11.278786629738473,-17.705746322558987,False
48,She went up the stairs.,True,PRP VBD RP DT NNS . ,PRON VERB PART DET NOUN PUNCT ,-6.105538863714122,-13.369663423623994,True
49,She went up the book.,False,PRP VBD RP DT NN . ,PRON VERB PART DET NOUN PUNCT ,-6.105538863714122,-13.369663423623994,False
50,They were waiting.,True,PRP VBD VBG . ,PRON VERB VERB PUNCT ,-1.1688512026034417,-2.8242087919599954,True
51,They were waiting the bus.,False,PRP VBD VBG DT NN . ,PRON VERB VERB DET NOUN PUNCT ,-3.682712575152892,-3.901912436763797,False
52,Mary laughed. What did she laugh?,False,NNP VBD . WP VBD PRP VB . ,PROPN VERB PUNCT PRON VERB PRON VERB PUNCT ,-10.980270876930316,-14.699180748081991,False
53,Football likes me.,False,NN VBZ PRP . ,NOUN VERB PRON PUNCT ,-4.4015938467675735,-4.4976023379401395,False
54,"Do they want some money? Yes, they want.",False,"VBP PRP VB DT NN . UH , PRP VBP . ",VERB PRON VERB DET NOUN PUNCT INTJ PUNCT PRON VERB PUNCT ,-15.409252570268533,-19.59915558901302,False
55,"Do you want to go? No, I don't want.",False,"VBP PRP VB TO VB . UH , PRP VBP RB VB . ",VERB PRON VERB PART VERB PUNCT INTJ PUNCT PRON VERB ADV VERB PUNCT ,-17.539085574046354,-39.46574062198096,False
56,I like to get up early; I'm used.,False,PRP VBP TO VB RP RB : PRP VBP VBN . ,PRON VERB PART VERB PART ADV PUNCT PRON VERB VERB PUNCT ,-15.690206595936768,-30.587071362532612,False
57,"Are they coming? No, I don't think.",False,"VBP PRP VBG . UH , PRP VBP RB VB . ",VERB PRON VERB PUNCT INTJ PUNCT PRON VERB ADV VERB PUNCT ,-14.71421991550763,-23.429376331304148,False
58,Look! It rains!,False,VB . PRP VBZ . ,VERB PUNCT PRON VERB PUNCT ,-2.913971623375082,-4.29885076685551,False
59,Do I come tomorrow?,False,VBP PRP VB NN . ,VERB PRON VERB NOUN PUNCT ,-5.155328128675136,-5.3503067587724,False
60,I wait for you at home.,False,PRP VBP IN PRP IN NN . ,PRON VERB ADP PRON ADP NOUN PUNCT ,-9.847629162130364,-8.3656524006907,True
61,I see her this evening.,False,PRP VBP PRP DT NN . ,PRON VERB PRON DET NOUN PUNCT ,-7.034125073896984,-8.02166784785849,False
62,How long are you working in your present job?,False,WRB RB VBP PRP VBG IN PRP$ JJ NN . ,ADV ADV VERB PRON VERB ADP DET ADJ NOUN PUNCT ,-10.47069725427338,-13.258217551627894,False
63,It's a long time that I live here.,False,PRP VBZ DT JJ NN WDT PRP VBP RB . ,PRON VERB DET ADJ NOUN DET PRON VERB ADV PUNCT ,-11.08524662739171,-15.555466223746484,False
64,When has she received the letter?,False,WRB VBZ PRP VBD DT NN . ,ADV VERB PRON VERB DET NOUN PUNCT ,-7.197712621873097,-7.619084867793821,False
65,Today I've finished work early because I've started at seven o'clock this morning.,False,NN PRP VB VBN NN RB IN PRP VB VBN IN CD NN DT NN . ,NOUN PRON VERB VERB NOUN ADV ADP PRON VERB VERB ADP NUM NOUN DET NOUN PUNCT ,-25.365586118291212,-30.80266159021793,False
66,"When we were young, we were playing a lot of tennis.",False,"WRB PRP VBD JJ , PRP VBD VBG DT NN IN NN . ",ADV PRON VERB ADJ PUNCT PRON VERB VERB DET NOUN ADP NOUN PUNCT ,-13.909677363582606,-15.733638958780256,False
67,"When I was a teenager, I was having a motorbike.",False,"WRB PRP VBD DT NN , PRP VBD VBG DT NN . ",ADV PRON VERB DET NOUN PUNCT PRON VERB VERB DET NOUN PUNCT ,-11.079291191843538,-11.690244004801324,False
68,She wasn't knowing that he had died.,False,PRP VBD RB VBG IN PRP VBD VBN . ,PRON VERB ADV VERB ADP PRON VERB VERB PUNCT ,-8.221688004176325,-16.03027866248772,False
69,Come you tomorrow!,False,VB PRP NN . ,VERB PRON NOUN PUNCT ,-4.207534752964794,-3.9496540280818935,True
70,"When Mary will get here, tell her to come in.",False,"WRB NNP MD VB RB , VB PRP TO VB RP . ",ADV PROPN VERB VERB ADV PUNCT VERB PRON PART VERB PART PUNCT ,-18.31578257914374,-33.99045945335247,False
71,I use to do a lot of exercise.,False,PRP VBP TO VB DT NN IN NN . ,PRON VERB PART VERB DET NOUN ADP NOUN PUNCT ,-7.07006945015328,-20.81270654053635,False
72,The house built itself before the war.,False,DT NN VBD PRP IN DT NN . ,DET NOUN VERB PRON ADP DET NOUN PUNCT ,-9.380044683377326,-10.189628819851835,False
73,They were given bikes for Christmas.,True,PRP VBD VBN NNS IN NNP . ,PRON VERB VERB NOUN ADP PROPN PUNCT ,-7.656131366112358,-8.955328826138238,True
74,Polly was owed a lot of money.,True,NNP VBD VBN DT NN IN NN . ,PROPN VERB VERB DET NOUN ADP NOUN PUNCT ,-5.852767139098438,-6.146621914938941,True
75,The lecture was very bored.,False,DT NN VBD RB JJ . ,DET NOUN VERB ADV ADJ PUNCT ,-5.5694556726612126,-8.817504255508528,False
76,I'm very interesting in Polish films.,False,PRP VBP RB JJ IN JJ NNS . ,PRON VERB ADV ADJ ADP ADJ NOUN PUNCT ,-7.736176492657021,-10.701667374828821,False
77,To smoke is bad for you.,False,TO VB VBZ JJ IN PRP . ,PART VERB VERB ADJ ADP PRON PUNCT ,-8.839077434494945,-13.154336744281537,False
78,It's difficult learn English.,False,PRP VBZ JJ VBP NNP . ,PRON VERB ADJ VERB PROPN PUNCT ,-11.803482227490836,-13.205568863977089,False
79,Let us to see.,False,VB PRP TO VB . ,VERB PRON PART VERB PUNCT ,-2.4916785807446686,-13.786901683135632,False
80,The food is more important than the art.,False,DT NN VBZ RBR JJ IN DT NN . ,DET NOUN VERB ADV ADJ ADP DET NOUN PUNCT ,-8.369245338420244,-10.938620352954882,False
81,Do you like the big dogs?,False,VBP PRP VB DT JJ NNS . ,VERB PRON VERB DET ADJ NOUN PUNCT ,-5.014687592446392,-6.640633767081352,False
82,"That is the yours, and this is the mine.",False,"DT VBZ DT NNS , CC DT VBZ DT NN . ",DET VERB DET NOUN PUNCT CCONJ DET VERB DET NOUN PUNCT ,-12.928241301856362,-16.738802987417312,False
83,We used to live in one  flat; now we live in one house.,False,PRP VBD TO VB IN CD _SP JJ : RB PRP VBP IN CD NN . ,PRON VERB PART VERB ADP NUM SPACE ADJ PUNCT ADV PRON VERB ADP NUM NOUN PUNCT ,-32.508769048095786,-47.703625025200274,False
84,Do you have car?,False,VBP PRP VB NN . ,VERB PRON VERB NOUN PUNCT ,-5.155328128675136,-5.3503067587724,False
85,Her sister is dentist.,False,PRP$ NN VBZ NN . ,DET NOUN VERB NOUN PUNCT ,-5.459416189465888,-5.965471952315387,False
86,I have ones nice American friends.The table is dirty.,False,PRP VBP NNS JJ JJ NNS . DT NN VBZ JJ . ,PRON VERB NOUN ADJ ADJ NOUN PUNCT DET NOUN VERB ADJ PUNCT ,-21.570094969050785,-21.68033885237926,False
87,"Clean her, please.",False,"VB PRP , UH . ",VERB PRON PUNCT INTJ PUNCT ,-8.773068122623245,-9.687148777839028,False
88,"They showed me two models, and I bought the small.",False,"PRP VBD PRP CD NNS , CC PRP VBD DT JJ . ",PRON VERB PRON NUM NOUN PUNCT CCONJ PRON VERB DET ADJ PUNCT ,-18.82755200437584,-20.751812374394568,False
89,I am more old than my sister.,False,PRP VBP RBR JJ IN PRP$ NN . ,PRON VERB ADV ADJ ADP DET NOUN PUNCT ,-6.21125141834134,-7.3108612916958675,False
90,Barcelona is the more large city of Catalonia.,False,NNP VBZ DT RBR JJ NN IN NNP . ,PROPN VERB DET ADV ADJ NOUN ADP PROPN PUNCT ,-10.73736029465746,-13.739318939860592,False
91,Rosa isn't French. Is Spanish.,False,NNP VBZ RB NNP . VBZ JJ . ,PROPN VERB ADV PROPN PUNCT VERB ADJ PUNCT ,-15.198664656566233,-16.092738482123426,False
92,Have gone home because wanted to go to bed.,False,VBP VBN RB IN VBD TO VB IN NN . ,VERB VERB ADV ADP VERB PART VERB ADP NOUN PUNCT ,-14.785866132517741,-25.373366950608048,False
93,Was raining.,False,VBD VBG . ,VERB VERB PUNCT ,-2.312257273110269,-2.7784968682742983,False
94,That's the man who he lives next door to us.,False,DT VBZ DT NN WP PRP VBZ JJ NN IN PRP . ,DET VERB DET NOUN PRON PRON VERB ADJ NOUN ADP PRON PUNCT ,-19.748650324236365,-16.753620961643207,True
95,I saw she.,False,PRP VBD PRP . ,PRON VERB PRON PUNCT ,-3.413022690386052,-4.6068949649823745,False
96,They know we.,False,PRP VBP PRP . ,PRON VERB PRON PUNCT ,-3.413022690386052,-4.6068949649823745,False
97,How many cakes is it in the cupboard?,False,WRB JJ NNS VBZ PRP IN DT NN . ,ADV ADJ NOUN VERB PRON ADP DET NOUN PUNCT ,-10.631060093634671,-13.581335037419345,False
98,Who is it? Am I.,False,WP VBZ PRP . VBP NN ,PRON VERB PRON PUNCT VERB NOUN ,-8.530133766264871,-9.012068867717757,False
99,They enjoyed very much.,False,PRP VBD RB RB . ,PRON VERB ADV ADV PUNCT ,-3.680814650789293,-4.8781811145188625,False
100,She complained herself.,False,PRP VBD PRP . ,PRON VERB PRON PUNCT ,-3.413022690386052,-4.6068949649823745,False
101,I showered me and went out.,False,PRP VBD PRP CC VBD RP . ,PRON VERB PRON CCONJ VERB PART PUNCT ,-12.144033629708055,-18.290533910472924,False
102,Mary washed the hair.,False,NNP VBD DT NN . ,PROPN VERB DET NOUN PUNCT ,-2.53893044783309,-1.2532366161447888,True
103,Bill cut himself the finger.,False,NNP VBD PRP DT NN . ,PROPN VERB PRON DET NOUN PUNCT ,-7.7306762512739535,-8.0794579083211,False
104,Sara and Joe had both got his shoes wet.,False,NNP CC NNP VBD DT VBN PRP$ NNS JJ . ,PROPN CCONJ PROPN VERB DET VERB DET NOUN ADJ PUNCT ,-16.627547643387462,-16.779378350938792,False
105,The my cousin is in Portugal.,False,DT PRP$ NN VBZ IN NNP . ,DET DET NOUN VERB ADP PROPN PUNCT ,-7.180333095928687,-8.247971503129794,False
106,The girls we saw looked quite happy.,True,DT NNS PRP VBD VBD RB JJ . ,DET NOUN PRON VERB VERB ADV ADJ PUNCT ,-9.681785503444774,-12.010568930732555,True
107,Did you like the woman we spoke to?,True,VBD PRP VB DT NN PRP VBD IN . ,VERB PRON VERB DET NOUN PRON VERB ADP PUNCT ,-10.215991492462082,-9.024614557951754,False
108,They have gone for buy a film.,False,PRP VBP VBN IN VB DT NN . ,PRON VERB VERB ADP VERB DET NOUN PUNCT ,-7.48240807680089,-8.014243680693664,False
109,We are going to have the house painted.,True,PRP VBP VBG TO VB DT NN VBN . ,PRON VERB VERB PART VERB DET NOUN VERB PUNCT ,-7.32433814466987,-25.54206732492333,True
110,We are going to make paint the house.,False,PRP VBP VBG TO VB NN DT NN . ,PRON VERB VERB PART VERB NOUN DET NOUN PUNCT ,-11.3389040466285,-23.609883753041377,False
111,They refused helping their neighbours.,False,PRP VBD VBG PRP$ NNS . ,PRON VERB VERB DET NOUN PUNCT ,-3.682712575152892,-3.901912436763797,False
112,I'll never forget to see that accident.,False,PRP MD RB VB TO VB DT NN . ,PRON AUX ADV VERB PART VERB DET NOUN PUNCT ,-4.5236673751556244,-26.861476378228254,False
113,She explained me the problem.,False,PRP VBD PRP DT NN . ,PRON VERB PRON DET NOUN PUNCT ,-7.034125073896984,-8.02166784785849,False
114,They suggested Jim to take the job.,False,PRP VBD NNP TO VB DT NN . ,PRON VERB PROPN PART VERB DET NOUN PUNCT ,-9.971989417965776,-22.230021290619124,False
115,I am asking that they go.,False,PRP VBP VBG IN PRP VBP . ,PRON VERB VERB ADP PRON VERB PUNCT ,-5.3985213930767095,-9.57548957293538,False
116,They ordered her that she should go.,False,PRP VBD PRP IN PRP MD VB . ,PRON VERB PRON ADP PRON VERB VERB PUNCT ,-9.030375425637931,-13.261292304987796,False
117,They ordered her that she went.,False,PRP VBD PRP IN PRP VBD . ,PRON VERB PRON ADP PRON VERB PUNCT ,-7.8615242230344915,-10.437083513027801,False
118,I want that you don't go.,False,PRP VBP IN PRP VBP RB VB . ,PRON VERB ADP PRON VERB ADV VERB PUNCT ,-7.4452361325853404,-12.721413361219694,False
119,I want that you not go.,False,PRP VBP IN PRP RB VBP . ,PRON VERB ADP PRON ADV VERB PUNCT ,-8.037437811745862,-8.557341710461452,False
120,The captain ordered the soldiers that they didn't retreat.,False,DT NN VBD DT NNS IN PRP VBD RB VB . ,DET NOUN VERB DET NOUN ADP PRON VERB ADV VERB PUNCT ,-12.17206116523078,-18.434963291709508,False
121,I don't know where does Mary live.,False,PRP VBP RB VB WRB VBZ NNP VB . ,PRON VERB ADV VERB ADV VERB PROPN VERB PUNCT ,-13.743794685070448,-22.39411140538384,False
122,They asked me how much did I earn.,False,PRP VBD PRP WRB JJ VBD PRP VB . ,PRON VERB PRON ADV ADJ VERB PRON VERB PUNCT ,-18.177838711289407,-20.843624204580152,False
123,They took to their mother to the hospital.,False,PRP VBD IN PRP$ NN IN DT NN . ,PRON VERB ADP DET NOUN ADP DET NOUN PUNCT ,-5.7814892504465885,-4.228966169333393,True
124,For what have you come?,False,IN WP VBP PRP VB . ,ADP PRON VERB PRON VERB PUNCT ,-5.119505471797291,-9.208459776701327,False
125,I don't know who they're working for.,True,PRP VBP RB VB WP PRP VBP VBG IN . ,PRON VERB ADV VERB PRON PRON VERB VERB ADP PUNCT ,-11.657477989997384,-16.889779172437716,True
126,Who does Fred sit next to?,True,WP VBZ NNP VB RB IN . ,PRON VERB PROPN VERB ADV ADP PUNCT ,-12.244588858746088,-12.79976827851656,True
127,"After to see the film, we went for a meal.",False,"IN TO VB DT NN , PRP VBD IN DT NN . ",ADP PART VERB DET NOUN PUNCT PRON VERB ADP DET NOUN PUNCT ,-9.892541141386408,-14.942812842992568,False
128,They are into the room.,False,PRP VBP IN DT NN . ,PRON VERB ADP DET NOUN PUNCT ,-3.472424003243185,-2.120270008113215,True
129,We stopped in the crossroads.,False,PRP VBD IN DT NNS . ,PRON VERB ADP DET NOUN PUNCT ,-3.472424003243185,-2.120270008113215,True
130,She works like a waitress.,False,PRP VBZ IN DT NN . ,PRON VERB ADP DET NOUN PUNCT ,-3.472424003243185,-2.120270008113215,True
131,They seem as their mother.,False,PRP VBP IN PRP$ NN . ,PRON VERB ADP DET NOUN PUNCT ,-3.472424003243185,-2.120270008113215,True
132,This park was designed for the Catalan architect Gaudi.,False,DT NN VBD VBN IN DT JJ NN NNP . ,DET NOUN VERB VERB ADP DET ADJ NOUN PROPN PUNCT ,-13.541753085495985,-17.496918098714435,False
133,They stayed there during three months.,False,PRP VBD RB IN CD NNS . ,PRON VERB ADV ADP NUM NOUN PUNCT ,-9.014966102685618,-7.458650570628729,True
