2241,63,UN,True,Word prior or after contains the word in Chinese equivalent,"What a big person , who invented the light, Einstein was Einstein was, who invented light . He created another day after sunset , people . People use it to do anything they want to do , . We believe we can't live without light today, especially in the city | , we . We have a long time to spend on our activities after the Sun goes to bed. We definitely need light to keep on . I dare say, without light, our life would go into a dark, dark hell. ",PUNCT PRON PUNCT,"What a big person , who invented the light, Einstein was Einstein was, who invented light . He created another day after sunset , people . People use it to do anything they want to do , . We believe we can't live without light today, especially in the city | life , we . We have a long time to spend on our activities after the Sun goes to bed. We definitely need light to keep on . I dare say, without light, our life would go into a dark, dark hell. ",NOUN PUNCT PRON,UN NOUN PUNCT PRON,True,True
709,57,RY,False,Incorrect synonym used,Although all that may happen our houses may be still the same. The rooms and sizes should remain as they were and the living rooms and everything may still be decorated in the same style. We might still like that old carpet and couch. The furniture should not change that much on the outside and the number of rooms should not change | either.,ADV PUNCT _,Although all that may happen our houses may be still the same. The rooms and sizes should remain as they were and the living rooms and everything may still be decorated in the same style. We might still like that old carpet and couch. The furniture should not change that much on the outside and the number of rooms should not change | too.,ADV PUNCT _,RY ADV PUNCT _,True,False
1142,20,UD,False,Overcorrection,"I think people in the future will probably wear helmets with oxygen gas well provided . It is because of the increasing size of the population and the shortage of | oxygen gas in the atmosphere. They will also wear water-proof, ultra-violet proof ultra-violet-proof and other dangerous liquid-proof dangerous-liquid-proof clothes to protect themselves. These clothes have to be made of something light, comfortable to wear and protective. All the above ideas are needed to make them bear no burden when wearing these specially designed clothes. ",NOUN NOUN ADP,"I think people in the future will probably wear helmets with oxygen gas well provided . It is because of the increasing size of the population and the shortage of | the oxygen gas in the atmosphere. They will also wear water-proof, ultra-violet proof ultra-violet-proof and other dangerous liquid-proof dangerous-liquid-proof clothes to protect themselves. These clothes have to be made of something light, comfortable to wear and protective. All the above ideas are needed to make them bear no burden when wearing these specially designed clothes. ",DET NOUN NOUN,UD DET NOUN NOUN,True,False
2215,37,DN,True,English words map to the same Chinese word,"Finally, the day of the concert came. After the concert finished successfully, I was happier than ever because the | success included my work and that was the most enjoyable moment in my life. ",NOUN VERB DET,"Finally, the day of the concert came. After the concert finished successfully, I was happier than ever because the | succeed included my work and that was the most enjoyable moment in my life. ",NOUN VERB DET,DN NOUN VERB DET,True,True
193,17,R,False,Confusion of phrase meaning and usage,"Science and technology can also be used | to produce some materials, e.g. steel or iron, which are used in our buildings , they . They can make them stronger and hard to destroy. ",PART VERB DET,"Science and technology can also be used | for some materials, e.g. steel or iron, which are used in our buildings , they . They can make them stronger and hard to destroy. ",ADP DET NOUN,R ADP DET NOUN,True,False
2150,194,RV,False,,"The hotel that group has been booked into is the Palace Hotel (on the Victoria road). And you can | catch the Bus in front of the hotel to go to the College. It is four bus stops away. Then walk straight ahead for five minutes , you . You will see the college. ",VERB DET PROPN,"The hotel that group has been booked into is the Palace Hotel (on the Victoria road). And you can | take the Bus in front of the hotel to go to the College. It is four bus stops away. Then walk straight ahead for five minutes , you . You will see the college. ",VERB DET PROPN,RV VERB DET PROPN,True,False
1139,17,UD,False,Chinese doesn't distinguish indefinite and definite articles like English,"Considering all the above points, I would like to ask for some money back. I will consider taking this complaint to | court if I do not receive an acceptable explanation from the theatre. Thank You. ",NOUN ADP PRON,"Considering all the above points, I would like to ask for some money back. I will consider taking this complaint to | the court if I do not receive an acceptable explanation from the theatre. Thank You. ",DET NOUN ADP,UD DET NOUN ADP,True,False
2014,58,RV,True,,"Even though I would like to travel, I am only available in July, because I am a high school student. Thus I have not got a long holiday. I just have one month . Personally, I would rather stay in log cabins than in tents. On account of the fact that staying in log cabins is much more interesting than staying in tents. As far as two activities are concerned, I would choose singing and photography. I used to win a number of competitions in singing. I can sing plenty of songs . , which include English songs and the Japanese songs, and I have a part-time job singing at a restaurant. Although photography is not as good as singing, I am very interested in it. I have been | studying photography since I was 15 years old. I got third prize in a competition last year and my level is professional now. Furthermore, I am going to enter a competition next year. ",VERB NOUN ADP,"Even though I would like to travel, I am only available in July, because I am a high school student. Thus I have not got a long holiday. I just have one month . Personally, I would rather stay in log cabins than in tents. On account of the fact that staying in log cabins is much more interesting than staying in tents. As far as two activities are concerned, I would choose singing and photography. I used to win a number of competitions in singing. I can sing plenty of songs . , which include English songs and the Japanese songs, and I have a part-time job singing at a restaurant. Although photography is not as good as singing, I am very interested in it. I have been | learning photography since I was 15 years old. I got third prize in a competition last year and my level is professional now. Furthermore, I am going to enter a competition next year. ",VERB NOUN ADP,RV VERB NOUN ADP,True,True
534,94,RP,False,Inappropriate capitalization in the middle of sentence,"I ran back home for help. I phoned the police | and told them the whole story. A strange thing happened to me, when I got back to that man. The car and the man were not there anymore. Where could they be? I was wondering. ",CCONJ VERB PRON,"I ran back home for help. I phoned the police | And told them the whole story. A strange thing happened to me, when I got back to that man. The car and the man were not there anymore. Where could they be? I was wondering. ",CCONJ VERB PRON,RP CCONJ VERB PRON,True,False
1409,141,TV,True,Chinese generally expresses actions in present tense,"Thanks for your last letter; I knew you would be interested in my experience of helping at the pop concert last time , now . Now I | will tell you about it. ",VERB VERB PRON,"Thanks for your last letter; I knew you would be interested in my experience of helping at the pop concert last time , now . Now I | tell you about it. ",VERB PRON ADP,TV VERB PRON ADP,True,True
1143,21,UD,False,Chinese doesn't distinguish indefinite and definite articles like English,"Concerning the fashion of the future, I think it depends on | people's personalities and they develop their own styles which suit them the most. They can wear different kinds of clothing, like they design for themselves or those like history can wear those of Victorian times and in different countries . ",NOUN PART NOUN,"Concerning the fashion of the future, I think it depends on | the people's personalities and they develop their own styles which suit them the most. They can wear different kinds of clothing, like they design for themselves or those like history can wear those of Victorian times and in different countries . ",DET NOUN PART,UD DET NOUN PART,True,False
481,39,RP,True,Punctuation error related to Spelling errors (missing space),"As for the colours, I think metallic colours, especially silver, will be the most popular. As different kinds of fabrics will be invented &amp; and the clothings will never be just cotton as always been seen . Maybe paper can also be a fabric used to make clothing and for those who like to wear new clothes | every day. They can be thrown away after wearing them and are light enough to be carried around whenever you want to change what you're wearing. ",DET NOUN PUNCT,"As for the colours, I think metallic colours, especially silver, will be the most popular. As different kinds of fabrics will be invented &amp; and the clothings will never be just cotton as always been seen . Maybe paper can also be a fabric used to make clothing and for those who like to wear new clothes | everyday. They can be thrown away after wearing them and are light enough to be carried around whenever you want to change what you're wearing. ",ADV PUNCT PRON,RP ADV PUNCT PRON,True,True
1286,13,TV,True,English words map to the same Chinese word,"In your last letter you asked me something about our rules, both at home and at school in my country. I'd like to tell you that . In , in school, we have lots of rules, especially in class and some of them are quite strange. For example, we can't go to the toilet during lessons , we . We have to go there in the break. And we can't eat food or do any sports in our classroom. If you fail three subjects in your exam, you will be kicked out of school. It's too strict , . I don't like it. If I | could, I would like to change this, because I don't think everyone can succeed at once , we . We should give them a second chance to succeed. ",VERB PUNCT PRON,"In your last letter you asked me something about our rules, both at home and at school in my country. I'd like to tell you that . In , in school, we have lots of rules, especially in class and some of them are quite strange. For example, we can't go to the toilet during lessons , we . We have to go there in the break. And we can't eat food or do any sports in our classroom. If you fail three subjects in your exam, you will be kicked out of school. It's too strict , . I don't like it. If I | can, I would like to change this, because I don't think everyone can succeed at once , we . We should give them a second chance to succeed. ",VERB PUNCT PRON,TV VERB PUNCT PRON,True,True
1626,89,MP,True,Chinese uses commas to mark the end of a complete thought,"I would prefer a tent rather than a log cabin because I have been told that the Californian summer is hot and dry so | , because a tent's wind circulation is better, it would create a comfortable coolness. The two activities I would like to do are basketball and surfing. I have played basketball for 5 years in an amateur team and still play on a playground regularly so my skills are good. On the other hand, I am a complete beginner at surfing. This sport has always attracted me due to its contact with the sea and the great sensations it provides and I believe this is the perfect opportunity to introduce myself to this exciting sport , . I still have some questions to ask you: ",PUNCT ADP DET,"I would prefer a tent rather than a log cabin because I have been told that the Californian summer is hot and dry so | because a tent's wind circulation is better, it would create a comfortable coolness. The two activities I would like to do are basketball and surfing. I have played basketball for 5 years in an amateur team and still play on a playground regularly so my skills are good. On the other hand, I am a complete beginner at surfing. This sport has always attracted me due to its contact with the sea and the great sensations it provides and I believe this is the perfect opportunity to introduce myself to this exciting sport , . I still have some questions to ask you: ",ADP DET NOUN,MP ADP DET NOUN,True,True
775,49,RA,False,that vs which confusion,"I'd like to complain about your ' best ' musical show, | which I went to when I had a week's holiday in London. I felt really disappointed because the things you said in the advertisement weren't true. ",DET PRON VERB,"I'd like to complain about your ' best ' musical show, | that I went to when I had a week's holiday in London. I felt really disappointed because the things you said in the advertisement weren't true. ",ADP PRON VERB,RA ADP PRON VERB,True,False
371,1,RD,False,Wrong determiner used,"When I found the advertisement for the International Arts Festival, I was very excited. It is great to hold an annual international arts festival in | this place. Then I spent two days at the festival. I enjoyed it very much. There were so many exciting things I saw, such as stars and artists from around the world . Jazz , jazz , rock and classical concerts, plays and dance shows etc. The specified thing that is worth remembering here is the reasonably-priced ticket for all events, it is excellent because most tourists could offer what they liked. ",DET NOUN PUNCT,"When I found the advertisement for the International Arts Festival, I was very excited. It is great to hold an annual international arts festival in | the place. Then I spent two days at the festival. I enjoyed it very much. There were so many exciting things I saw, such as stars and artists from around the world . Jazz , jazz , rock and classical concerts, plays and dance shows etc. The specified thing that is worth remembering here is the reasonably-priced ticket for all events, it is excellent because most tourists could offer what they liked. ",DET NOUN PUNCT,RD DET NOUN PUNCT,True,False
2691,36,FV,False,Additional auxiliary added,"According to your advertisement, it stars DANNY BROOK and TINA TRUELOVE, but surprisingly, was performed by a different actor of whom I didn't even know the name. In addition, the show was supposed | to start at 19:30 but it started half an hour later, at 20:15. ",PART VERB ADP,"According to your advertisement, it stars DANNY BROOK and TINA TRUELOVE, but surprisingly, was performed by a different actor of whom I didn't even know the name. In addition, the show was supposed | to be started at 19:30 but it started half an hour later, at 20:15. ",PART VERB VERB,FV PART VERB VERB,True,False
2515,60,M,True,Incorrect introduction of subordinate clause or modifiers,"The purpose of this is to give information to the American students , describing Po Lin Temple | , which is worth visiting. ",PUNCT DET VERB,"The purpose of this is to give information to the American students , describing Po Lin Temple | is worth visiting. ",VERB ADJ VERB,M VERB ADJ VERB,True,True
970,88,W,True,Sentence could be valid in Chinese,"Firstly, for your information, the group has been booked into the Palace Hotel, which is located in the town centre. Students can take the airport bus | directly to the hotel when you arrive. And the best way to get from there to the conference is by coach, as there are about 35 international students, and they are all strangers here. Therefore it is no good taking a bus. I will help you to book the coach. ",ADV ADP DET,"Firstly, for your information, the group has been booked into the Palace Hotel, which is located in the town centre. Students can take the airport bus | to the hotel directly when you arrive. And the best way to get from there to the conference is by coach, as there are about 35 international students, and they are all strangers here. Therefore it is no good taking a bus. I will help you to book the coach. ",ADP DET NOUN,W ADP DET NOUN,True,True
1627,90,MP,True,Chinese uses commas to mark the end of a complete thought,"Do I need to bring any particular clothing | , like a wet suit, for instance? Is any ""pocket money"" required in case there is something I need to pay for? And finally, is somebody going to meet me at the airport or am I supposed to get to the camp on my own and get refunded afterwards? ",PUNCT ADP DET,"Do I need to bring any particular clothing | like a wet suit, for instance? Is any ""pocket money"" required in case there is something I need to pay for? And finally, is somebody going to meet me at the airport or am I supposed to get to the camp on my own and get refunded afterwards? ",ADP DET ADJ,MP ADP DET ADJ,True,True
2085,129,RV,True,,"Concerning the accommodation, I would like to stay in tents . Because , because I never | stay in a tent before. I think it will be great and I want to try it. ",VERB ADP DET,"Concerning the accommodation, I would like to stay in tents . Because , because I never | live in a tent before. I think it will be great and I want to try it. ",VERB ADP DET,RV VERB ADP DET,True,True
1696,8,MD,True,Chinese uses classifiers instead of articles in this case,"Firstly, the idea of holding this International Arts Festival is great. It allowed people to enjoy their weekend, relax , and also it brought a foreign culture to them, broadening their knowledge. In addition to this, one weekend ticket for all the events was only 10 , this . This was excellent , it . It meant people only spent pocket-money , and then they could watch all the events at the weekend , for . For them it is | a really economical way to spend their weekend. So my friends told me that this was their cheapest weekend. ",DET ADV ADJ,"Firstly, the idea of holding this International Arts Festival is great. It allowed people to enjoy their weekend, relax , and also it brought a foreign culture to them, broadening their knowledge. In addition to this, one weekend ticket for all the events was only 10 , this . This was excellent , it . It meant people only spent pocket-money , and then they could watch all the events at the weekend , for . For them it is | really economical way to spend their weekend. So my friends told me that this was their cheapest weekend. ",ADV ADJ NOUN,MD ADV ADJ NOUN,True,True
1050,14,MV,True,Chinese conventions conflict with English	,"In addition, I choose painting and sailing for my activities. I can't wait to do my painting of the rising sun, and can't imagine how wonderful sailing along the rivers | will be. ",VERB VERB PUNCT,"In addition, I choose painting and sailing for my activities. I can't wait to do my painting of the rising sun, and can't imagine how wonderful sailing along the rivers | . ",PUNCT _ _,MV PUNCT _ _,True,True
69,69,FJ,False,Misunderstanding of word usage/meaning,"What a | big person , who invented the light, Einstein was Einstein was, who invented light . He created another day after sunset , people . People use it to do anything they want to do , . We believe we can't live without light today, especially in the city , we . We have a long time to spend on our activities after the Sun goes to bed. We definitely need light to keep on . I dare say, without light, our life would go into a dark, dark hell. ",ADJ NOUN PUNCT,"What a | biggest person , who invented the light, Einstein was Einstein was, who invented light . He created another day after sunset , people . People use it to do anything they want to do , . We believe we can't live without light today, especially in the city , we . We have a long time to spend on our activities after the Sun goes to bed. We definitely need light to keep on . I dare say, without light, our life would go into a dark, dark hell. ",ADJ NOUN PUNCT,FJ ADJ NOUN PUNCT,True,False
1181,59,UD,False,Overcorrection,"Finally, we would like to ask you to think about our suggestion , the . The show would be fantastic , we . We would learn about the latest fashions, | Leisure and sports wear, and also learn about how to make up . It's a great opportunity to learn more about fashion. Please, let us go to the show, because students are admitted free. ",NOUN CCONJ NOUN,"Finally, we would like to ask you to think about our suggestion , the . The show would be fantastic , we . We would learn about the latest fashions, | the Leisure and sports wear, and also learn about how to make up . It's a great opportunity to learn more about fashion. Please, let us go to the show, because students are admitted free. ",DET NOUN CCONJ,UD DET NOUN CCONJ,True,False
1753,65,MD,True,Chinese has no articles and doesn't use classifiers in this situation,"The accommodation I prefer is | a tent. I haven't tried it before. I would like to know how interesting it is to live in tents. If I can only choose two activities while I am at the Camp, I would like climbing and Basketball. I started climbing when I was a child. I love it very much. About Basketball, I have been playing it for seven years. I would like to play basketball with local people at the Camp to see how good they are, if I can. ",DET NOUN PUNCT,"The accommodation I prefer is | tent. I haven't tried it before. I would like to know how interesting it is to live in tents. If I can only choose two activities while I am at the Camp, I would like climbing and Basketball. I started climbing when I was a child. I love it very much. About Basketball, I have been playing it for seven years. I would like to play basketball with local people at the Camp to see how good they are, if I can. ",NOUN PUNCT PRON,MD NOUN PUNCT PRON,True,True
1285,12,TV,True,Modal used for polite speech,"In your last letter you asked me something about our rules, both at home and at school in my country. I'd like to tell you that . In , in school, we have lots of rules, especially in class and some of them are quite strange. For example, we can't go to the toilet during lessons , we . We | have to go there in the break. And we can't eat food or do any sports in our classroom. If you fail three subjects in your exam, you will be kicked out of school. It's too strict , . I don't like it. If I could, I would like to change this, because I don't think everyone can succeed at once , we . We should give them a second chance to succeed. ",VERB PART VERB,"In your last letter you asked me something about our rules, both at home and at school in my country. I'd like to tell you that . In , in school, we have lots of rules, especially in class and some of them are quite strange. For example, we can't go to the toilet during lessons , we . We | should go there in the break. And we can't eat food or do any sports in our classroom. If you fail three subjects in your exam, you will be kicked out of school. It's too strict , . I don't like it. If I could, I would like to change this, because I don't think everyone can succeed at once , we . We should give them a second chance to succeed. ",VERB VERB ADV,TV VERB VERB ADV,True,True
407,37,RD,True,Chinese uses a character that maps a determiner in this case,I am writing to reply to | the letter you wrote to me on 10 June.,DET NOUN PRON,I am writing to reply to | your letter you wrote to me on 10 June.,DET NOUN PRON,RD DET NOUN PRON,True,True
336,99,RN,False,Spelling error,"I have booked a hotel not far from our school. The hotel is called the Epsom Down Hotel. Your plane will arrive in England by 9:00. There will be a coach waiting for you, and the driver will be next to the information desk. You should arrive at the hotel by 11:00. You will then have an hour to check in and unpack all your luggage. The conference will start on time at 12:30, so I would suggest you leave the hotel by 12:00. The best way to get to the conference is to follow the | college road and turn left toward the end , you . You then keep going straight , you . You will eventually see the main entrance to the | college. When you get into the college you can just ask any boys in the college where to go from then. They all know where the conference is and when. ",NOUN NOUN CCONJ,"I have booked a hotel not far from our school. The hotel is called the Epsom Down Hotel. Your plane will arrive in England by 9:00. There will be a coach waiting for you, and the driver will be next to the information desk. You should arrive at the hotel by 11:00. You will then have an hour to check in and unpack all your luggage. The conference will start on time at 12:30, so I would suggest you leave the hotel by 12:00. The best way to get to the conference is to follow the | collage road and turn left toward the end , you . You then keep going straight , you . You will eventually see the main entrance to the | collage. When you get into the college you can just ask any boys in the college where to go from then. They all know where the conference is and when. ",NOUN NOUN CCONJ,RN NOUN NOUN CCONJ,True,False
316,79,RN,False,Spelling error,"George was lying on the floor, surrounded by his own lake of blood. He had just been beaten by a | group of white men. And yet , he was too weak to resist the rats , coming from everywhere and eating his face, his legs and his arms, waiting with great impatience for his death. ",NOUN ADP ADJ,"George was lying on the floor, surrounded by his own lake of blood. He had just been beaten by a | ground of white men. And yet , he was too weak to resist the rats , coming from everywhere and eating his face, his legs and his arms, waiting with great impatience for his death. ",NOUN ADP ADJ,RN NOUN ADP ADJ,True,False
