787,61,RA,False,general grammar rules confusion,"This story happened two years ago. That was a very hot summer , all the . All the people in our city liked to swim in the river , perhaps . Perhaps they didn't think it was interesting if they swam in the pool. Personally, I'd like to say I was good at swimming. Not only was I a member of the swimming team in our school, but also I had been taught by my father since I was five years old , . So I had acquired some skills and learned how to protect | myself from my Dad, if you had an accident . ",PRON ADP DET,"This story happened two years ago. That was a very hot summer , all the . All the people in our city liked to swim in the river , perhaps . Perhaps they didn't think it was interesting if they swam in the pool. Personally, I'd like to say I was good at swimming. Not only was I a member of the swimming team in our school, but also I had been taught by my father since I was five years old , . So I had acquired some skills and learned how to protect | yourself from my Dad, if you had an accident . ",PRON ADP DET,RA PRON ADP DET,True,False
2690,35,FV,True,"Missing ""to"" for to-infinitive non-finite subordinate clauses","Lily was one of her best friends for three years. She enjoyed sharing everything with Pat, whatever it was. Nick was Lily's husband. Her husband had been fired the previous year. Lily felt very nervous about their financial problems and their future . As as they wanted to have a baby. She told Pat about what had happened in her family . And and that she was worried. Of course, she knew Nick didn't like her to tell other people about his private . She told Pat that she didn't want any other people | to know about it except her. Pat also promised not to tell other people. ",PART VERB ADP,"Lily was one of her best friends for three years. She enjoyed sharing everything with Pat, whatever it was. Nick was Lily's husband. Her husband had been fired the previous year. Lily felt very nervous about their financial problems and their future . As as they wanted to have a baby. She told Pat about what had happened in her family . And and that she was worried. Of course, she knew Nick didn't like her to tell other people about his private . She told Pat that she didn't want any other people | know about it except her. Pat also promised not to tell other people. ",VERB ADP PRON,FV VERB ADP PRON,True,True
1805,117,MD,True,Chinese has no articles and doesn't use classifiers in this situation,Thanks for your letter. I am so excited that I have won the first prize. I will give you all | the information you need and ask some questions.,DET NOUN PRON,Thanks for your letter. I am so excited that I have won the first prize. I will give you all | information you need and ask some questions.,NOUN PRON VERB,MD NOUN PRON VERB,True,True
1334,62,TV,True,Chinese generally expresses actions in present tense,"Actually, we were quite good friends before this event happened. Pat has been studying in the same class with me this year. She sat next to me , we . We started to chat more and more , then . Then we became good friends. One day, we were sitting in the dinning-hall as usual. Suddenly my heart was thumping so quickly because I saw him ? - a boy who was a new student. I know this is one right love , . I'm absolutely besotted with him. Then I told this to Pat and told her to keep it secret: I didn't want people gossiping about me then everyone would know I | fancied him. But the thing which I'd never expected happened, which is that Pat betrayed me. She told everyone that I fancy him and everybody always makes a joke of it , that . That makes me feel so embarrassed: I was very angry at that time! ",VERB PRON PUNCT,"Actually, we were quite good friends before this event happened. Pat has been studying in the same class with me this year. She sat next to me , we . We started to chat more and more , then . Then we became good friends. One day, we were sitting in the dinning-hall as usual. Suddenly my heart was thumping so quickly because I saw him ? - a boy who was a new student. I know this is one right love , . I'm absolutely besotted with him. Then I told this to Pat and told her to keep it secret: I didn't want people gossiping about me then everyone would know I | fancy him. But the thing which I'd never expected happened, which is that Pat betrayed me. She told everyone that I fancy him and everybody always makes a joke of it , that . That makes me feel so embarrassed: I was very angry at that time! ",VERB PRON PUNCT,TV VERB PRON PUNCT,True,True
143,58,FN,False,Number disagreement,"Shopping sounds very enjoyable and is fantastic for women. You can find a lot of interesting things which were unexpected. Some people enjoy window shopping, but some people enjoy spending their money on clothes or shoes. Nowadays, in a family, shopping isn't a | woman's job. ",NOUN PART NOUN,"Shopping sounds very enjoyable and is fantastic for women. You can find a lot of interesting things which were unexpected. Some people enjoy window shopping, but some people enjoy spending their money on clothes or shoes. Nowadays, in a family, shopping isn't a | women's job. ",NOUN PART NOUN,FN NOUN PART NOUN,True,False
1987,31,RV,True,,"Considering all the above points, I would like to ask for some money back. I will consider to | take this complaint to court if I do not receive an acceptable explanation from the theatre. Thank You. ",VERB DET NOUN,"Considering all the above points, I would like to ask for some money back. I will consider to | bring this complaint to court if I do not receive an acceptable explanation from the theatre. Thank You. ",VERB DET NOUN,RV VERB DET NOUN,True,True
273,36,RN,False,Spelling error,| Introduction:,NOUN PUNCT _,| Instruction:,NOUN PUNCT _,RN NOUN PUNCT _,True,False
692,40,RY,False,General grammar rules confusion,Yours | sincerely,ADV _ _,Yours | faithfully,ADV _ _,RY ADV _ _,True,False
1575,38,MP,True,Chinese sentence structure differs from English,"What will clothes be like 100 years from now? What do you think models will wear on the catwalks? Will they wear anything? Who knows? Nowadays, people look at fashion magazines or get opinions from their friends to help them to decide what to wear on different occasions | . ",PUNCT _ _,"What will clothes be like 100 years from now? What do you think models will wear on the catwalks? Will they wear anything? Who knows? Nowadays, people look at fashion magazines or get opinions from their friends to help them to decide what to wear on different occasions | ",_ _ _,MP _ _ _,True,True
934,51,ID,False,Wrong prepositional phrase used,"It is very kind of you to give me the chance to do two activities while I am at the Camp. I'd like to do climbing and sailing. Actually I am quite good at climbing. I often go climbing in my town. | As for sailing, well, I haven't tried it before , that . That is why I want to have a go. I think it must be fun. ",ADP ADP NOUN,"It is very kind of you to give me the chance to do two activities while I am at the Camp. I'd like to do climbing and sailing. Actually I am quite good at climbing. I often go climbing in my town. | For sailing, well, I haven't tried it before , that . That is why I want to have a go. I think it must be fun. ",ADP NOUN PUNCT,ID ADP NOUN PUNCT,True,False
1591,54,MP,True,Chinese uses commas to mark the end of a complete thought,"It is a very long time since I was in Year 7. I told Pat that my father and mother were going to separate. I told her because I wanted somebody to share my feelings. Maybe it was the wrong decision to tell her , she . She began to share that secret with everybody | , including the teachers. They tried to contact my parents. My parents were very angry when they realised what had happened. All my friends were trying to keep their distance from me. That was all because of Pat. ",PUNCT VERB DET,"It is a very long time since I was in Year 7. I told Pat that my father and mother were going to separate. I told her because I wanted somebody to share my feelings. Maybe it was the wrong decision to tell her , she . She began to share that secret with everybody | including the teachers. They tried to contact my parents. My parents were very angry when they realised what had happened. All my friends were trying to keep their distance from me. That was all because of Pat. ",VERB DET NOUN,MP VERB DET NOUN,True,True
809,83,UA,False,Overcorrection,Would you tell me how much money you will give | to me and what the weather is like in the U.S.A. Thank you for everything!,ADP PRON CCONJ,Would you tell me how much money you will give | it to me and what the weather is like in the U.S.A. Thank you for everything!,PRON ADP PRON,UA PRON ADP PRON,True,False
1034,60,MA,False,Pronoun can also be used here in Chinese,"Last but not least, it is a good kind of entertainment. Maybe you think that playing basketball , and going to cinemas and discos are much better than staying at home sitting in front of an object. However, televisions can bring you the fun that other activities can't. If sometimes I don't want to go out and I don't want to be lonely, it's easy, | I just turn on the television and enjoy myself. ",PRON ADV VERB,"Last but not least, it is a good kind of entertainment. Maybe you think that playing basketball , and going to cinemas and discos are much better than staying at home sitting in front of an object. However, televisions can bring you the fun that other activities can't. If sometimes I don't want to go out and I don't want to be lonely, it's easy, | just turn on the television and enjoy myself. ",ADV VERB ADP,MA ADV VERB ADP,True,False
2115,159,RV,False,,"One day, I passed by a river in accident , . I saw there were a lot of people playing in the river. Suddenly, I heard a cry of ""Help, help"" in the distance. In a while , lots of passed-by passersby | crowded at the river-side riverside . To my surprise, nobody went in to save that boy who was shouting, but just stood there, like lots of "" champ "". I started thinking about it , after . After all, either had I never done this task before, or trained . I was just 15 years old. Finally, I jumped into the river , . I really knew that was dangerous, but I didn't think about anything except ""justify"" this word . I also really hated those people who stood there all the time. ",VERB ADP DET,"One day, I passed by a river in accident , . I saw there were a lot of people playing in the river. Suddenly, I heard a cry of ""Help, help"" in the distance. In a while , lots of passed-by passersby | crowed at the river-side riverside . To my surprise, nobody went in to save that boy who was shouting, but just stood there, like lots of "" champ "". I started thinking about it , after . After all, either had I never done this task before, or trained . I was just 15 years old. Finally, I jumped into the river , . I really knew that was dangerous, but I didn't think about anything except ""justify"" this word . I also really hated those people who stood there all the time. ",VERB ADP DET,RV VERB ADP DET,True,False
1380,109,TV,True,Chinese generally expresses actions in present tense,"I | had an unpleasant experience. It was at lunchtime. Everybody had gone to buy lunch in the supermarket , in . In fact, nobody likes crowds and queues, especially not in the summertime. I was queuing in the middle of row . I chose this aisle because I thought it was quicker than the others. Although there were finished two people, next was me, something was happened . Suddenly the customer thought the receipt was not right , she . She did not buy a lot of things but the shop assistant did not make a mistake , they . They argued about this thing. The shop manager came to solve it. Obviously, I | had to try another aisle. It was the longest queue , I have ever been in. ",VERB DET ADJ,"I | have an unpleasant experience. It was at lunchtime. Everybody had gone to buy lunch in the supermarket , in . In fact, nobody likes crowds and queues, especially not in the summertime. I was queuing in the middle of row . I chose this aisle because I thought it was quicker than the others. Although there were finished two people, next was me, something was happened . Suddenly the customer thought the receipt was not right , she . She did not buy a lot of things but the shop assistant did not make a mistake , they . They argued about this thing. The shop manager came to solve it. Obviously, I | have to try another aisle. It was the longest queue , I have ever been in. ",VERB DET ADJ,TV VERB DET ADJ,True,True
803,77,UA,False,general grammar rules confusion,"Modern technology has changed my daily life in two ways. First with a lot of advanced techniques being put to practical use, our living conditions are becoming more and more convenient and comfortable. When we look around the house, it is easy to find things like | : a microwave oven, TV set, computer , etc. All these items of equipment are applications of modern science. When you are planning to travel, you can choose a train, car or even a plane as your means of transportation. Without the development of modern technology, it may take you several years to reach your destination. ",PUNCT DET NOUN,"Modern technology has changed my daily life in two ways. First with a lot of advanced techniques being put to practical use, our living conditions are becoming more and more convenient and comfortable. When we look around the house, it is easy to find things like | these : a microwave oven, TV set, computer , etc. All these items of equipment are applications of modern science. When you are planning to travel, you can choose a train, car or even a plane as your means of transportation. Without the development of modern technology, it may take you several years to reach your destination. ",DET PUNCT DET,UA DET PUNCT DET,True,False
2048,92,RV,False,,"The topical class is similar to speaking and listening but the materials are more up-dated up to date . The teacher uses video , and pictures to | teach students about festivals, sports, museums, etc. It is popular with the students. ",VERB NOUN ADP,"The topical class is similar to speaking and listening but the materials are more up-dated up to date . The teacher uses video , and pictures to | show students about festivals, sports, museums, etc. It is popular with the students. ",VERB NOUN ADP,RV VERB NOUN ADP,True,False
1393,123,TV,True,Modal used for polite speech,"Finally, may I ask for some more information . ? What kinds of clothes should I take? . How about the weather there? | Will you give me some pocket-money during the trip . ? Also, may I take a friend with me , how ? How much should she pay? ",VERB PRON VERB,"Finally, may I ask for some more information . ? What kinds of clothes should I take? . How about the weather there? | Would you give me some pocket-money during the trip . ? Also, may I take a friend with me , how ? How much should she pay? ",VERB PRON VERB,TV VERB PRON VERB,True,True
1302,29,TV,True,Chinese generally expresses actions in present tense,"During the week we decided where we | wanted to go , we . We all agreed to listen to music so then we decided to go to your musical show and listen to ""Over the Rainbow"". ",VERB PART VERB,"During the week we decided where we | want to go , we . We all agreed to listen to music so then we decided to go to your musical show and listen to ""Over the Rainbow"". ",VERB PART VERB,TV VERB PART VERB,True,True
2426,178,RT,True,Chinese conventions conflict with English,"Oh, sorry they were not | on this road , they . They were | on the next road. ",ADP DET NOUN,"Oh, sorry they were not | in this road , they . They were | in the next road. ",ADP DET NOUN,RT ADP DET NOUN,True,True
142,57,FN,True,Missing plural,"Taking | photographs during the holiday is a very good memory for me, and I can share my adventures with my friends. So while I am at the Camp I want to take a lot of photographs and climb a mountain. Fresh-air Fresh air , flowers and meeting some interesting people while you are climbing you have . By the way, I wonder if I need a lot of money and what kind of clothes I should bring. Finally, thanks for giving me this opportunity. I look forward to hearing from you. ",NOUN ADP DET,"Taking | photograph during the holiday is a very good memory for me, and I can share my adventures with my friends. So while I am at the Camp I want to take a lot of photographs and climb a mountain. Fresh-air Fresh air , flowers and meeting some interesting people while you are climbing you have . By the way, I wonder if I need a lot of money and what kind of clothes I should bring. Finally, thanks for giving me this opportunity. I look forward to hearing from you. ",NOUN ADP DET,FN NOUN ADP DET,True,True
1540,3,MP,True,Chinese sentence structure differs from English,"Therefore, she came to the river every day and talked about everything with the golden fish. They were very close friends. After half a year, the golden fish suddenly disappeared. Sara was very sad. She sat and cried by the river. Then somebody called her name: ""Sara... Sara.. | . look at me.. | . I'm standing on your left-hand side."" Sara remembered the golden fish. It had suddenly become human, a little boy. After a few days they got married. They had a wonderful life together. ",PUNCT VERB ADP,"Therefore, she came to the river every day and talked about everything with the golden fish. They were very close friends. After half a year, the golden fish suddenly disappeared. Sara was very sad. She sat and cried by the river. Then somebody called her name: ""Sara... Sara.. | look at me.. | I'm standing on your left-hand side."" Sara remembered the golden fish. It had suddenly become human, a little boy. After a few days they got married. They had a wonderful life together. ",VERB ADP PRON,MP VERB ADP PRON,True,True
1467,200,TV,False,Past perfect used instead of past tense,"First of all, we want to say thanks to you because we know the effort you have made organising this excellent programme, but we would really like to go to the London fashion and leisure show we saw in the advertisement. We think that perhaps on Tuesday March 14 , we could change the time when we go to the Science Museum, and (we) go to the Museum earlier, perhaps at half past eight in the morning, so we could go later, at ten o'clock, to the show, and we could also delay going shopping on that afternoon, because the show lasts till seven o'clock in the evening. And we | thought that we could go shopping the next day, because we do not have anything to do on that afternoon. ",VERB ADP PRON,"First of all, we want to say thanks to you because we know the effort you have made organising this excellent programme, but we would really like to go to the London fashion and leisure show we saw in the advertisement. We think that perhaps on Tuesday March 14 , we could change the time when we go to the Science Museum, and (we) go to the Museum earlier, perhaps at half past eight in the morning, so we could go later, at ten o'clock, to the show, and we could also delay going shopping on that afternoon, because the show lasts till seven o'clock in the evening. And we | have thought that we could go shopping the next day, because we do not have anything to do on that afternoon. ",VERB VERB ADP,TV VERB VERB ADP,True,False
1831,143,MD,True,Chinese has no articles and doesn't use classifiers in this situation,"Although we cannot deny it is our nature - we are curious , - we can improve our sense of morality and try to think about the importance of privacy for them. Actually, I am happy to hear that journalists have learned their lesson from the death of Princess Diana and try to let her children and | the Royal family have more privacy. Let's all leave them more freedom to enjoy their private lives. ",DET ADJ NOUN,"Although we cannot deny it is our nature - we are curious , - we can improve our sense of morality and try to think about the importance of privacy for them. Actually, I am happy to hear that journalists have learned their lesson from the death of Princess Diana and try to let her children and | Royal family have more privacy. Let's all leave them more freedom to enjoy their private lives. ",ADJ NOUN VERB,MD ADJ NOUN VERB,True,True
1516,254,TV,True,"Chinese generally expresses actions in present tense; Buildings are stationary, action verbs don't apply to them.","Firstly, I would like to tell you , that the group has been booked into the Palace Hotel, which | is located beside the congress house in the centre. You can make contact with Mrs Brackenbury using the number 06 8793888. Secondly, the best way to get from the hotel to the conference is to take the bus, which has been specially organized by us. The bus leaves at 8:00 every morning and gets back to the hotel at 6 o'clock in the evening. Of course there's also a number 8 bus, in front of the hotel, which is also suitable, but it leaves only every half an hour. ",VERB VERB ADP,"Firstly, I would like to tell you , that the group has been booked into the Palace Hotel, which | locates beside the congress house in the centre. You can make contact with Mrs Brackenbury using the number 06 8793888. Secondly, the best way to get from the hotel to the conference is to take the bus, which has been specially organized by us. The bus leaves at 8:00 every morning and gets back to the hotel at 6 o'clock in the evening. Of course there's also a number 8 bus, in front of the hotel, which is also suitable, but it leaves only every half an hour. ",VERB ADP DET,TV VERB ADP DET,True,True
161,76,FN,True,Missing plural,"Last night, when I went into my house it was quite silent. I felt there might be something that had gone wrong. I found my parents sitting in an armchair . I could see sadness in my father's eyes. My mother came over to me and said softly, ; "" My dear, your father's company has just gone bankrupt', then she couldn't help crying. When I heard this bad news, I was very depressed because father worked quite hard for his company. My father always remembered his responsibility was to provide a good salary to his | workers to provide his workers with a good salary , which is the aim of his life. ",NOUN PART VERB,"Last night, when I went into my house it was quite silent. I felt there might be something that had gone wrong. I found my parents sitting in an armchair . I could see sadness in my father's eyes. My mother came over to me and said softly, ; "" My dear, your father's company has just gone bankrupt', then she couldn't help crying. When I heard this bad news, I was very depressed because father worked quite hard for his company. My father always remembered his responsibility was to provide a good salary to his | worker to provide his workers with a good salary , which is the aim of his life. ",NOUN PART VERB,FN NOUN PART VERB,True,True
1793,105,MD,True,Chinese has no articles and doesn't use classifiers in this situation,"Firstly, I am a student , . I don't have | a job, so, I have to ask for money from my parents. I can't ask for too much. That's very bad for my parents. When I go shopping . , I always feel ashamed because I spend my parents' money. (Although I have got | a part-time job, it provides just enough to pay my rent.) ",DET NOUN PUNCT,"Firstly, I am a student , . I don't have | job, so, I have to ask for money from my parents. I can't ask for too much. That's very bad for my parents. When I go shopping . , I always feel ashamed because I spend my parents' money. (Although I have got | part-time job, it provides just enough to pay my rent.) ",NOUN PUNCT ADV,MD NOUN PUNCT ADV,True,True
1150,28,UD,False,Overcorrection,| Modern technology has changed our daily life. It aims to improve our standard of life and allows us to live more comfortably. So I think the changes are good.,ADJ NOUN VERB,| The modern technology has changed our daily life. It aims to improve our standard of life and allows us to live more comfortably. So I think the changes are good.,DET ADJ NOUN,UD DET ADJ NOUN,True,False
124,39,FN,False,Number disagreement,"2. Speaking , : it makes you more confident when you talk with other people. It lets you get more | practice. ",NOUN PUNCT _,"2. Speaking , : it makes you more confident when you talk with other people. It lets you get more | practices . ",NOUN PUNCT _,FN NOUN PUNCT _,True,False
501,61,RP,True,Word not capitalized,Would it be possible for you to send me a map of | California so I know where the campsite is situated? I would be grateful if you could send me some information. I look forward to hearing from you.,PROPN ADV PRON,Would it be possible for you to send me a map of | california so I know where the campsite is situated? I would be grateful if you could send me some information. I look forward to hearing from you.,NOUN ADV PRON,RP NOUN ADV PRON,True,True
