,Unnamed: 0,error_type,Negative transfer?,Likely reason for mistake,correct_sentence,correct_trigram_ud,incorrect_sentence,incorrect_trigram_ud,type_and_trigram_ud,nlt,result
1620,83,MP,True,Chinese uses commas to mark the end of a complete thought,"Shopping, for most the people it is very important Shopping is very important for most people because you need to get the stuff you need or you want. For some people it may be a way to relax , after you have been to work or school. So it is a thing you will enjoy most of the time, but still have something you will not enjoy it . It depends on what is the place and the aim you are shopping . For example | , some people always shop to get food or stuff they need in everyday life , they . They won't enjoy this kind of shopping, because it is not getting what they want. The place where you are shopping is also very important. For example | , in HK all the areas have lots of people it won't let you feel good of the noise and times when you are shopping . Because , because there are too many people it makes you want to stay home and you won't enjoy shopping. ",PUNCT DET NOUN,"Shopping, for most the people it is very important Shopping is very important for most people because you need to get the stuff you need or you want. For some people it may be a way to relax , after you have been to work or school. So it is a thing you will enjoy most of the time, but still have something you will not enjoy it . It depends on what is the place and the aim you are shopping . For example | some people always shop to get food or stuff they need in everyday life , they . They won't enjoy this kind of shopping, because it is not getting what they want. The place where you are shopping is also very important. For example | in HK all the areas have lots of people it won't let you feel good of the noise and times when you are shopping . Because , because there are too many people it makes you want to stay home and you won't enjoy shopping. ",DET NOUN ADV,MP DET NOUN ADV,True,True
471,29,RP,True,Word not capitalized,I am writing to you to complain about the show which I saw last Friday at your theatre. The show was called 'Over the | Rainbow'. I was not pleased with the way that it was set out .,PROPN PUNCT PUNCT,I am writing to you to complain about the show which I saw last Friday at your theatre. The show was called 'Over the | rainbow'. I was not pleased with the way that it was set out .,NOUN PUNCT PUNCT,RP NOUN PUNCT PUNCT,True,True
2253,2,RT,True,Chinese conventions conflict with English,Looking forward | to next year's festival.,ADP ADJ NOUN,Looking forward | for next year's festival.,ADP ADJ NOUN,RT ADP ADJ NOUN,True,True
2238,60,UN,True,Chinese conventions conflict with English,It is a pleasure to write to you and we want to thank you for organising a school trip to London. We have seen the programme | and we all think it will be enjoyable. Especially to the science museum because we are all doing science in school.,CCONJ PRON DET,It is a pleasure to write to you and we want to thank you for organising a school trip to London. We have seen the programme | list and we all think it will be enjoyable. Especially to the science museum because we are all doing science in school.,NOUN CCONJ PRON,UN NOUN CCONJ PRON,True,True
1350,78,TV,False,Present perfect used instead of past tense,"Firstly, there was a different actor instead of the famous actor , Danny Brook. That left me so disappointed. Secondly, I thought the show would start at 19:30, but it started at 20:15. It caused me to miss the train and I went back to the hotel when it was nearly mid-night midnight . Another problem is , I thought that discounts were available. However, there wasn't any discount. Additionally, the advertisement said I could visit the theatre restaurant after the show. When I arrived, it was closed. It is so annoying that everything | was changed without any notice. ",VERB VERB ADP,"Firstly, there was a different actor instead of the famous actor , Danny Brook. That left me so disappointed. Secondly, I thought the show would start at 19:30, but it started at 20:15. It caused me to miss the train and I went back to the hotel when it was nearly mid-night midnight . Another problem is , I thought that discounts were available. However, there wasn't any discount. Additionally, the advertisement said I could visit the theatre restaurant after the show. When I arrived, it was closed. It is so annoying that everything | had been changed without any notice. ",VERB VERB VERB,TV VERB VERB VERB,True,False
141,56,FN,True,Missing plural,"But , during any peak season, like Christmas , holidays or even during weekends . Then , then I can say I definitely don't feel it is enjoyable . Because , because of the | crowds. For me I think , it is not shopping but a kind of suffering . Especially , especially , queuing up for twenty minutes just to pay or waiting for the salesgirl to get the right size . So sometimes I don't think shopping is enjoyable, and if there is any big holiday, I would rather stay at home and watch television. ",NOUN PUNCT ADP,"But , during any peak season, like Christmas , holidays or even during weekends . Then , then I can say I definitely don't feel it is enjoyable . Because , because of the | crowd. For me I think , it is not shopping but a kind of suffering . Especially , especially , queuing up for twenty minutes just to pay or waiting for the salesgirl to get the right size . So sometimes I don't think shopping is enjoyable, and if there is any big holiday, I would rather stay at home and watch television. ",NOUN PUNCT ADP,FN NOUN PUNCT ADP,True,True
2655,0,FV,True,Progressive aspect not applied,"The idea of an ""International Art Festival"" was great. But I feel the word ""International"" was not really suitable; because you only had six countries' stars and artists . I think you should invite more than ten countries. The other problem was choosing space . As , as the hall of the classical concert was too small and crowded. Next year, you should calculate or examine how many people will come before you choose a hall, which I feel very good was plays and films. It can show more for next year's festival. The Dance Shows as well . And the offer of a ""weekend ticket"" was an excellent idea . Because , because the price was cheaper than | buying it separately and more convenient . ",VERB PRON ADV,"The idea of an ""International Art Festival"" was great. But I feel the word ""International"" was not really suitable; because you only had six countries' stars and artists . I think you should invite more than ten countries. The other problem was choosing space . As , as the hall of the classical concert was too small and crowded. Next year, you should calculate or examine how many people will come before you choose a hall, which I feel very good was plays and films. It can show more for next year's festival. The Dance Shows as well . And the offer of a ""weekend ticket"" was an excellent idea . Because , because the price was cheaper than | buy it separately and more convenient . ",VERB PRON ADV,FV VERB PRON ADV,True,True
693,41,RY,True,English words map to the same Chinese word,"I would like to ask what is the weather in the USA like and what kind of clothes should I wear ? . And I was wondering how much money I have to take ? . Also, if I can go climbing, what do I have to bring? | Lastly thank you very much for answering my questions. ",ADV VERB PRON,"I would like to ask what is the weather in the USA like and what kind of clothes should I wear ? . And I was wondering how much money I have to take ? . Also, if I can go climbing, what do I have to bring? | At last thank you very much for answering my questions. ",ADP ADJ VERB,RY ADP ADJ VERB,True,True
2548,30,UY,True,Chinese sentence structure differs from English,"The museum looks very old, like some other buildings in London, but it is very modern inside. After going through the enormous main door, you can see a huge round white building, which is a library. A lot of famous people have been to this library | ! ",PUNCT _ _,"The museum looks very old, like some other buildings in London, but it is very modern inside. After going through the enormous main door, you can see a huge round white building, which is a library. A lot of famous people have been to this library | before! ",ADV PUNCT _,UY ADV PUNCT _,True,True
1221,23,MT,True,Chinese doesn't use the word in this context,I would like to ask | for some information about what kind of clothes I have to wear and how much you charge.,ADP DET NOUN,I would like to ask | some information about what kind of clothes I have to wear and how much you charge.,DET NOUN ADP,MT DET NOUN ADP,True,True
1324,52,TV,True,Present tense used instead of present progressive; Chinese would use word in the given context; Missing Auxiliary,"Furthermore, the original actor was Danny Brook but it changed to a different actor who acted terribly and was very disappointing. Last of all, it says in your advertisement that there is a theatre restaurant open after the show but it turned out to be closed because it was | being redecorated and no announcement was made. ",VERB VERB CCONJ,"Furthermore, the original actor was Danny Brook but it changed to a different actor who acted terribly and was very disappointing. Last of all, it says in your advertisement that there is a theatre restaurant open after the show but it turned out to be closed because it was | redecorating and no announcement was made. ",VERB CCONJ DET,TV VERB CCONJ DET,True,True
2724,69,FV,False,Incorrectly using past tense,"Firstly, I am a student , . I don't have a job, so, I have to | ask for money from my parents. I can't | ask for too much. That's very bad for my parents. When I go shopping . , I always feel ashamed because I spend my parents' money. (Although I have got a part-time job, it provides just enough to pay my rent.) ",VERB ADP NOUN,"Firstly, I am a student , . I don't have a job, so, I have to | asked for money from my parents. I can't | asked for too much. That's very bad for my parents. When I go shopping . , I always feel ashamed because I spend my parents' money. (Although I have got a part-time job, it provides just enough to pay my rent.) ",VERB ADP NOUN,FV VERB ADP NOUN,True,False
1099,10,RQ,True,Phrases map to the same Chinese phrase,"How are you? I went to the musical show ""Over the Rainbow"" at your theatre last week. I have got a few things to complain about regarding your theatre. The first thing is in your note it says that you have Danny Brook in the show. But in the show, there was another actor. I was so disappointed, because I came from far away to see Danny Broke. In the note it also says that the show starts at 19:30, and so I went in at 19:25. The show started at 20:15, which means it wasted one hour of my time. The note says that are discounts available there are discounts available on tickets , but I bought my ticket and your people told me that there is no discount on the tickets. When the show had finished . , I decided to go and visit your theatre restaurant , . But I went there and it was closed for some reason. I was really hungry and I went to | another restaurant as soon as I could. The note says that your perfect evening out, I thought I could get my money back, with your poor service and all my reasons, but it was not ask for money back . ",DET NOUN ADV,"How are you? I went to the musical show ""Over the Rainbow"" at your theatre last week. I have got a few things to complain about regarding your theatre. The first thing is in your note it says that you have Danny Brook in the show. But in the show, there was another actor. I was so disappointed, because I came from far away to see Danny Broke. In the note it also says that the show starts at 19:30, and so I went in at 19:25. The show started at 20:15, which means it wasted one hour of my time. The note says that are discounts available there are discounts available on tickets , but I bought my ticket and your people told me that there is no discount on the tickets. When the show had finished . , I decided to go and visit your theatre restaurant , . But I went there and it was closed for some reason. I was really hungry and I went to | other restaurant as soon as I could. The note says that your perfect evening out, I thought I could get my money back, with your poor service and all my reasons, but it was not ask for money back . ",ADJ NOUN ADV,RQ ADJ NOUN ADV,True,True
736,10,AGA,False,Using 'It' incorrectly,"Sometimes, when you shop on the street , you will see a lot of things that you like, and you can't buy | them once , then maybe you will feel very sad. And then, you may save money for the things you like, nothing to do, just for the poor things what you like so funny, isn't it? ",PRON ADV PUNCT,"Sometimes, when you shop on the street , you will see a lot of things that you like, and you can't buy | it once , then maybe you will feel very sad. And then, you may save money for the things you like, nothing to do, just for the poor things what you like so funny, isn't it? ",PRON ADV PUNCT,AGA PRON ADV PUNCT,True,False
2692,37,FV,False,Incorrectly using progressive aspect,"The first and most important thing is that modern technology has made our life easier, for instance the rice cooker is a great invention, all you have to do is | put rice in it and switch it on, it makes cooking more efficient. Furthermore, we use the computer and telephone a lot. Wherever you are, you can get in touch with people whenever you want. ",VERB NOUN ADP,"The first and most important thing is that modern technology has made our life easier, for instance the rice cooker is a great invention, all you have to do is | putting rice in it and switch it on, it makes cooking more efficient. Furthermore, we use the computer and telephone a lot. Wherever you are, you can get in touch with people whenever you want. ",VERB NOUN ADP,FV VERB NOUN ADP,True,False
1288,15,TV,True,Chinese generally expresses actions in present tense,"Firstly, the idea of holding this International Arts Festival is great. It allowed people to enjoy their weekend, relax , and also it brought a foreign culture to them, broadening their knowledge. In addition to this, one weekend ticket for all the events was only £10 , this . This was excellent , it . It meant people only | spent pocket-money , and then they could watch all the events at the weekend , for . For them it is a really economical way to spend their weekend. So my friends told me that this was their cheapest weekend. ",VERB NOUN PUNCT,"Firstly, the idea of holding this International Arts Festival is great. It allowed people to enjoy their weekend, relax , and also it brought a foreign culture to them, broadening their knowledge. In addition to this, one weekend ticket for all the events was only £10 , this . This was excellent , it . It meant people only | spend pocket-money , and then they could watch all the events at the weekend , for . For them it is a really economical way to spend their weekend. So my friends told me that this was their cheapest weekend. ",VERB NOUN PUNCT,TV VERB NOUN PUNCT,True,True
2406,157,RT,False,Misusing preposition,"All of us want to go | on this trip, but some of my classmates saw an advertisement for the London Fashion and Leisure Show, and we would all like to go there. It is from 10 am to 7 p.m. , it It is about the latest fashion, leisure and sports wear, make-up and hairstyles , all . All of us are really interested, and it is free for students to get in as well. It is a really good opportunity to go because most of us are studying fashion design, and we can learn loads of things there. So would you please reschedule the visit to the Science Museum for Wednesday afternoon, and we can cancel our shopping and free time, so we can go to the fashion show on Tuesday. ",ADP DET NOUN,"All of us want to go | to this trip, but some of my classmates saw an advertisement for the London Fashion and Leisure Show, and we would all like to go there. It is from 10 am to 7 p.m. , it It is about the latest fashion, leisure and sports wear, make-up and hairstyles , all . All of us are really interested, and it is free for students to get in as well. It is a really good opportunity to go because most of us are studying fashion design, and we can learn loads of things there. So would you please reschedule the visit to the Science Museum for Wednesday afternoon, and we can cancel our shopping and free time, so we can go to the fashion show on Tuesday. ",ADP DET NOUN,RT ADP DET NOUN,True,False
612,48,AGV,False,3rd person plural verb form used instead of 3rd person singular form,"According to a survey which | has been conducted by other students . Every , every student in our school has one maths class every day. So, maths lessons should be filmed. ",VERB VERB VERB,"According to a survey which | have been conducted by other students . Every , every student in our school has one maths class every day. So, maths lessons should be filmed. ",VERB VERB VERB,AGV VERB VERB VERB,True,False
181,3,R,True,Chinese does not use conjunctions to join clauses,"By using the Internet we can make new pen friends overseas, and create clubs | and societies. Now a message can travel quicker and it is also worldwide . sending letters takes about a week from Hong Kong to the U.K., but network , eg. e.g. E-mail . , is much faster. require Require the time The time required is | only a few minutes. Now we can even create a club on Yahoo, which is free. Modern technology saves us a lot of time and brings us many benefits when we use it in the right way, but some bad way to e.g. send virus to break down network . ",ADV DET ADJ,"By using the Internet we can make new pen friends overseas, and create clubs | , societies. Now a message can travel quicker and it is also worldwide . sending letters takes about a week from Hong Kong to the U.K., but network , eg. e.g. E-mail . , is much faster. require Require the time The time required is | about few minutes. Now we can even create a club on Yahoo, which is free. Modern technology saves us a lot of time and brings us many benefits when we use it in the right way, but some bad way to e.g. send virus to break down network . ",ADP ADJ NOUN,R ADP ADJ NOUN,True,True
607,43,AGV,True,Not applying the 3rd person present tense suffix -s,"In conclusion, I believe that shopping only | wastes time . And you couldn't get back any more . ",VERB NOUN PUNCT,"In conclusion, I believe that shopping only | waste time . And you couldn't get back any more . ",NOUN NOUN PUNCT,AGV NOUN NOUN PUNCT,True,True
1653,116,MP,True,Chinese sentence structure differs from English,This will be a great opportunity for us because we will be able to find out more about the people of London and their fashions and style | . We might also get a chance to meet new people and interact with them. The whole class is also very excited about this fashion show and would really appreciate your giving them a chance to go.,PUNCT PRON VERB,This will be a great opportunity for us because we will be able to find out more about the people of London and their fashions and style | we might also get a chance to meet new people and interact with them. The whole class is also very excited about this fashion show and would really appreciate your giving them a chance to go.,PRON VERB ADV,MP PRON VERB ADV,True,True
2079,123,RV,False,,I also helped with the lighting and studio equipment. I fixed the lighting on the ceiling and attached several spotlights to the walls. This produced a stunning effect during the concert. I also got to | install new speakers so that the music could be heard clearly throughout the hall.,VERB ADJ NOUN,I also helped with the lighting and studio equipment. I fixed the lighting on the ceiling and attached several spotlights to the walls. This produced a stunning effect during the concert. I also got to | fix new speakers so that the music could be heard clearly throughout the hall.,VERB ADJ NOUN,RV VERB ADJ NOUN,True,False
2275,24,RT,False,"Misuing ""for""","I went to the theatre to buy the ticket and expected to get a discount as I was a student. However, the salesman in the box office told me the discount tickets had sold out. I could not understand why but I still bought the ticket because I was crazy about Danny Brook. Then, I went into the theatre on time but became a little bit angry | after waiting until 20:15, forty-five minutes after the expected starting time. Furthermore, I was so disappointed to find out that Danny Brook was not on the stage and the leading actor sang so badly that I left the theatre before it finished. Last, I went to the theatre restaurant but it was closed because it needed cleaning. ",ADP VERB ADP,"I went to the theatre to buy the ticket and expected to get a discount as I was a student. However, the salesman in the box office told me the discount tickets had sold out. I could not understand why but I still bought the ticket because I was crazy about Danny Brook. Then, I went into the theatre on time but became a little bit angry | for waiting until 20:15, forty-five minutes after the expected starting time. Furthermore, I was so disappointed to find out that Danny Brook was not on the stage and the leading actor sang so badly that I left the theatre before it finished. Last, I went to the theatre restaurant but it was closed because it needed cleaning. ",ADP VERB ADP,RT ADP VERB ADP,True,False
2454,206,RT,True,Chinese conventions conflict with English,"The location of Po Lin Temple is | on Lotus Island, which is the second biggest island in Hong Kong. ",ADP PROPN PROPN,"The location of Po Lin Temple is | in Lotus Island, which is the second biggest island in Hong Kong. ",ADP PROPN PROPN,RT ADP PROPN PROPN,True,True
389,19,RD,True,Chinese could use a classifier in this context,"It is a very long time since I was in Year 7. I told Pat that my father and mother were going to separate. I told her because I wanted somebody to share my feelings. Maybe it was | the wrong decision to tell her , she . She began to share that secret with everybody, including the teachers. They tried to contact my parents. My parents were very angry when they realised what had happened. All my friends were trying to keep their distance from me. That was all because of Pat. ",DET ADJ NOUN,"It is a very long time since I was in Year 7. I told Pat that my father and mother were going to separate. I told her because I wanted somebody to share my feelings. Maybe it was | a wrong decision to tell her , she . She began to share that secret with everybody, including the teachers. They tried to contact my parents. My parents were very angry when they realised what had happened. All my friends were trying to keep their distance from me. That was all because of Pat. ",DET ADJ NOUN,RD DET ADJ NOUN,True,True
662,10,DY,True,English words map to the same Chinese word,"I think people in the future will | probably wear helmets with oxygen gas well provided . It is because of the increasing size of the population and the shortage of oxygen gas in the atmosphere. They will also wear water-proof, ultra-violet proof ultra-violet-proof and other dangerous liquid-proof dangerous-liquid-proof clothes to protect themselves. These clothes have to be made of something light, comfortable to wear and protective. All the above ideas are needed to make them bear no burden when wearing these specially designed clothes. ",ADV VERB NOUN,"I think people in the future will | likely wear helmets with oxygen gas well provided . It is because of the increasing size of the population and the shortage of oxygen gas in the atmosphere. They will also wear water-proof, ultra-violet proof ultra-violet-proof and other dangerous liquid-proof dangerous-liquid-proof clothes to protect themselves. These clothes have to be made of something light, comfortable to wear and protective. All the above ideas are needed to make them bear no burden when wearing these specially designed clothes. ",ADV VERB NOUN,DY ADV VERB NOUN,True,True
1743,55,MD,True,Chinese uses classifiers instead of articles in this case,"I had | an unpleasant experience. It was at lunchtime. Everybody had gone to buy lunch in the supermarket , in . In fact, nobody likes crowds and queues, especially not in the summertime. I was queuing in the middle of row . I chose this aisle because I thought it was quicker than the others. Although there were finished two people, next was me, something was happened . Suddenly the customer thought the receipt was not right , she . She did not buy a lot of things but the shop assistant did not make a mistake , they . They argued about this thing. The shop manager came to solve it. Obviously, I had to try another aisle. It was the longest queue , I have ever been in. ",DET ADJ NOUN,"I had | unpleasant experience. It was at lunchtime. Everybody had gone to buy lunch in the supermarket , in . In fact, nobody likes crowds and queues, especially not in the summertime. I was queuing in the middle of row . I chose this aisle because I thought it was quicker than the others. Although there were finished two people, next was me, something was happened . Suddenly the customer thought the receipt was not right , she . She did not buy a lot of things but the shop assistant did not make a mistake , they . They argued about this thing. The shop manager came to solve it. Obviously, I had to try another aisle. It was the longest queue , I have ever been in. ",ADJ NOUN PUNCT,MD ADJ NOUN PUNCT,True,True
