,Unnamed: 0,error_type,Negative transfer?,Likely reason for mistake,correct_sentence,correct_trigram_ud,incorrect_sentence,incorrect_trigram_ud,type_and_trigram_ud,nlt,result
395,25,RD,True,Grammatical to exclude or include the word in Chinese,"As far as I know, English people are really surprised at the Chinese students' advanced level in Maths, as well as | their knowledge of politics. This is a good opportunity to see how they learn in class. As it is expected, painting lesson is an amazing one . You can find students using traditional Chinese ink to draw and write. ",DET NOUN ADP,"As far as I know, English people are really surprised at the Chinese students' advanced level in Maths, as well as | the knowledge of politics. This is a good opportunity to see how they learn in class. As it is expected, painting lesson is an amazing one . You can find students using traditional Chinese ink to draw and write. ",DET NOUN ADP,RD DET NOUN ADP,True,True
1383,112,TV,True,Chinese generally expresses actions in present tense,"I had an unpleasant experience. It was at lunchtime. Everybody had gone to buy lunch in the supermarket , in . In fact, nobody likes crowds and queues, especially not in the summertime. I was queuing in the middle of row . I | chose this aisle because I thought it was quicker than the others. Although there were finished two people, next was me, something was happened . Suddenly the customer thought the receipt was not right , she . She did not buy a lot of things but the shop assistant did not make a mistake , they . They argued about this thing. The shop manager came to solve it. Obviously, I had to try another aisle. It was the longest queue , I have ever been in. ",VERB DET NOUN,"I had an unpleasant experience. It was at lunchtime. Everybody had gone to buy lunch in the supermarket , in . In fact, nobody likes crowds and queues, especially not in the summertime. I was queuing in the middle of row . I | choose this aisle because I thought it was quicker than the others. Although there were finished two people, next was me, something was happened . Suddenly the customer thought the receipt was not right , she . She did not buy a lot of things but the shop assistant did not make a mistake , they . They argued about this thing. The shop manager came to solve it. Obviously, I had to try another aisle. It was the longest queue , I have ever been in. ",VERB DET NOUN,TV VERB DET NOUN,True,True
923,40,W,False,Order is incorrect in Chinese and English,"Sometimes, when you shop on the street , you will see a lot of things that you like, and you can't buy them once , then | maybe you will feel very sad. And then, you may save money for the things you like, nothing to do, just for the poor things what you like so funny, isn't it? ",ADV PRON VERB,"Sometimes, when you shop on the street , you will see a lot of things that you like, and you can't buy them once , then | you will feel very sad maybe. And then, you may save money for the things you like, nothing to do, just for the poor things what you like so funny, isn't it? ",PRON VERB VERB,W PRON VERB VERB,True,False
1994,38,RV,False,,The real show is really very different to what is | described in the advertisement. I am unsatisfied and would like to ask for some money back. Please would you also change the advertisement to the level of the actual facts.,VERB ADP DET,The real show is really very different to what is | mentioned in the advertisement. I am unsatisfied and would like to ask for some money back. Please would you also change the advertisement to the level of the actual facts.,VERB ADP DET,RV VERB ADP DET,True,False
535,95,RP,False,Inappropriate capitalization in the middle of sentence,"The hotel that group has been booked into is the Palace Hotel ( | in the Victoria road). And you can catch the Bus in front of the hotel to go to the College. It is four bus stops away. Then walk straight ahead for five minutes , you . You will see the college. ",ADP DET PROPN,"The hotel that group has been booked into is the Palace Hotel ( | In the Victoria road). And you can catch the Bus in front of the hotel to go to the College. It is four bus stops away. Then walk straight ahead for five minutes , you . You will see the college. ",ADP DET PROPN,RP ADP DET PROPN,True,False
1606,69,MP,True,Chinese uses commas to mark the end of a complete thought,"As I was asked, I spoke to a number of students about their opinions concerning this short video. I found that most of them suggested that four lessons should be filmed | , which are as follow: ",PUNCT DET VERB,"As I was asked, I spoke to a number of students about their opinions concerning this short video. I found that most of them suggested that four lessons should be filmed | which are as follow: ",DET VERB ADP,MP DET VERB ADP,True,True
1009,35,MA,True,Chinese is a pro-drop language,The Speaking and Listening class should be filmed because the purpose of this class is to encourage students to talk about some topics they choose and discuss | them with others in order to improve their speaking and listening skills.,PRON ADP NOUN,The Speaking and Listening class should be filmed because the purpose of this class is to encourage students to talk about some topics they choose and discuss | with others in order to improve their speaking and listening skills.,ADP NOUN ADP,MA ADP NOUN ADP,True,True
1544,7,MP,False,Semantic issue,"The plays and films were really wonderful , people . People liked them very much, so could you have more next year | ? ",PUNCT _ _,"The plays and films were really wonderful , people . People liked them very much, so could you have more next year | ",_ _ _,MP _ _ _,True,False
1586,49,MP,True,Chinese uses commas to mark the end of a complete thought,"It said in the advertisement that the singers are Danny Brook and Tina Truelove. However, there was a different | , unknown actor in that. The show started late | , at 20:15 | , which was very different from '19.30' as shown . There was no discount at all | , which was in contrast with 'Discounts Available'. After the show, I wanted to have something in the theatre restaurant and found it was closed for no reason. ",PUNCT ADJ NOUN,"It said in the advertisement that the singers are Danny Brook and Tina Truelove. However, there was a different | unknown actor in that. The show started late | at 20:15 | which was very different from '19.30' as shown . There was no discount at all | which was in contrast with 'Discounts Available'. After the show, I wanted to have something in the theatre restaurant and found it was closed for no reason. ",ADJ NOUN ADP,MP ADJ NOUN ADP,True,True
1669,132,MP,True,Chinese uses commas to mark the end of a complete thought,"Firstly, I am being the representative of my class to thank you for organising a good programme in London, especially the visit to the Science Museum and National Art Gallery. We know that it is a good chance for us to learn more different things and we can widen our knowledge in the Science Museum. In addition, we can appreciate and enjoy the art in the National Art Gallery. Unfortunately, I know that most of the students have already visited these two places before. So we decided to choose another event which have seen as an entertainment . It is the LONDON FASHION AND LEISURE SHOW. The show will be held at the Central Exhibition Hall, London. The date is Tuesday March 14, from 10.00-19.00. It shows the latest fashions | , including leisure and sports wear. In spite of this, there are also make-up and hairstyles | , which attract girls most . ",PUNCT VERB NOUN,"Firstly, I am being the representative of my class to thank you for organising a good programme in London, especially the visit to the Science Museum and National Art Gallery. We know that it is a good chance for us to learn more different things and we can widen our knowledge in the Science Museum. In addition, we can appreciate and enjoy the art in the National Art Gallery. Unfortunately, I know that most of the students have already visited these two places before. So we decided to choose another event which have seen as an entertainment . It is the LONDON FASHION AND LEISURE SHOW. The show will be held at the Central Exhibition Hall, London. The date is Tuesday March 14, from 10.00-19.00. It shows the latest fashions | including leisure and sports wear. In spite of this, there are also make-up and hairstyles | which attract girls most . ",VERB NOUN CCONJ,MP VERB NOUN CCONJ,True,True
2068,112,RV,True,,"Secondly, if you live in a big city, things are always expensive. You spend more money on buying clothes and food, you think you will be very happy when you | shop , but , when you come back home and take out your purse, you will be sad , your . Your purse is nearly empty , (when you don't have enough money .) ). ",VERB PUNCT CCONJ,"Secondly, if you live in a big city, things are always expensive. You spend more money on buying clothes and food, you think you will be very happy when you | buy , but , when you come back home and take out your purse, you will be sad , your . Your purse is nearly empty , (when you don't have enough money .) ). ",VERB PUNCT CCONJ,RV VERB PUNCT CCONJ,True,True
449,7,RP,False,Punctuation error related to Spelling errors (extra spaces),"You mentioned the rules at home and at school in the letter. This reminds me of what I experienced during my teenage years. In my country the children go to secondary school when they are in the first year of being a teenager. You know, this age is the troublesome age, boys have too much energy and girls want to fall in love with someone. They always annoy the | schoolteacher and their parents. As a result of this, the teachers make very strict rules at school, such as students aren't allowed to speak to each other in class. They have to finish homework within a limited time. They cannot oppose the teacher, girls are not allowed to wear make-up or wear any jewellery. At home, in my experience, my parents didn't allow me to go out in the evening and gave me a lot of homework to do, even in the holiday. They also forbade me to have a boyfriend. I think it is not just what happened in my home, many of my friends had the same experience. ",NOUN CCONJ DET,"You mentioned the rules at home and at school in the letter. This reminds me of what I experienced during my teenage years. In my country the children go to secondary school when they are in the first year of being a teenager. You know, this age is the troublesome age, boys have too much energy and girls want to fall in love with someone. They always annoy the | school teacher and their parents. As a result of this, the teachers make very strict rules at school, such as students aren't allowed to speak to each other in class. They have to finish homework within a limited time. They cannot oppose the teacher, girls are not allowed to wear make-up or wear any jewellery. At home, in my experience, my parents didn't allow me to go out in the evening and gave me a lot of homework to do, even in the holiday. They also forbade me to have a boyfriend. I think it is not just what happened in my home, many of my friends had the same experience. ",NOUN NOUN CCONJ,RP NOUN NOUN CCONJ,True,False
2605,12,UV,False,Unnecessary auxiliary added,"Communication technology, e.g. internet (networks) , and mobile phones . In wars soilors | communicate with mobile phones though places to place to get or give information about themselves and the enemies enemy . ",VERB ADP ADJ,"Communication technology, e.g. internet (networks) , and mobile phones . In wars soilors | were communicate with mobile phones though places to place to get or give information about themselves and the enemies enemy . ",VERB VERB ADP,UV VERB VERB ADP,True,False
1090,0,CQ,True,Phrases map to the same Chinese phrase,"Although I enjoyed it, there were still some things that needed to be improved. For example, there were some concert halls which were too small to hold so | many people, the stars and artists were just from six countries, which is not enough for the audience. In addition, when you organize next year's international arts festival, could you arrange more plays and films . ? ",ADJ NOUN PUNCT,"Although I enjoyed it, there were still some things that needed to be improved. For example, there were some concert halls which were too small to hold so | much people, the stars and artists were just from six countries, which is not enough for the audience. In addition, when you organize next year's international arts festival, could you arrange more plays and films . ? ",ADJ NOUN PUNCT,CQ ADJ NOUN PUNCT,True,True
368,18,U,False,Wordiness,"In conclusion, computers have become a | necessity in our life, and it's still a young invention, which needs to be improved. ",NOUN ADP DET,"In conclusion, computers have become a | very essential necessity in our life, and it's still a young invention, which needs to be improved. ",ADV ADJ NOUN,U ADV ADJ NOUN,True,False
2676,21,FV,False,Incorrectly using past tense,"With reference to the advertisement published in the New Strait Times newspaper on the 22nd of MAY 2000, I, as a customer, who is a musical-show addict and a great fan of Danny Brook, who was said to be | starring in the show, would like to complain about the presentation. ",VERB ADP DET,"With reference to the advertisement published in the New Strait Times newspaper on the 22nd of MAY 2000, I, as a customer, who is a musical-show addict and a great fan of Danny Brook, who was said to be | starred in the show, would like to complain about the presentation. ",VERB ADP DET,FV VERB ADP DET,True,False
1439,171,TV,False,Using past tense instead of past participle,"Concerning the activities that you have listed . Some , some of them I am really interested in , especially painting. Since I was young, my dad | has always taken me to life drawing, so now it has become one of my hobbies. And I think , it will be nice to draw beautiful landscapes of the place. Beside drawing, swimming is my favourite as well. When I was in high school, I joined the swimming club. And I also participated in a few swimming competitions. Although I'm not the best, I have a lot of confidence at it. ",VERB ADV VERB,"Concerning the activities that you have listed . Some , some of them I am really interested in , especially painting. Since I was young, my dad | always took me to life drawing, so now it has become one of my hobbies. And I think , it will be nice to draw beautiful landscapes of the place. Beside drawing, swimming is my favourite as well. When I was in high school, I joined the swimming club. And I also participated in a few swimming competitions. Although I'm not the best, I have a lot of confidence at it. ",ADV VERB PRON,TV ADV VERB PRON,True,False
1495,232,TV,True,Chinese generally expresses actions in present tense,"Firstly, I am being the representative of my class to thank you for organising a good programme in London, especially the visit to the Science Museum and National Art Gallery. We know that it is a good chance for us to learn more different things and we can widen our knowledge in the Science Museum. In addition, we can appreciate and enjoy the art in the National Art Gallery. Unfortunately, I know that most of the students have already visited these two places before. So we | decided to choose another event which have seen as an entertainment . It is the LONDON FASHION AND LEISURE SHOW. The show will be held at the Central Exhibition Hall, London. The date is Tuesday March 14, from 10.00-19.00. It shows the latest fashions, including leisure and sports wear. In spite of this, there are also make-up and hairstyles, which attract girls most . ",VERB PART VERB,"Firstly, I am being the representative of my class to thank you for organising a good programme in London, especially the visit to the Science Museum and National Art Gallery. We know that it is a good chance for us to learn more different things and we can widen our knowledge in the Science Museum. In addition, we can appreciate and enjoy the art in the National Art Gallery. Unfortunately, I know that most of the students have already visited these two places before. So we | decide to choose another event which have seen as an entertainment . It is the LONDON FASHION AND LEISURE SHOW. The show will be held at the Central Exhibition Hall, London. The date is Tuesday March 14, from 10.00-19.00. It shows the latest fashions, including leisure and sports wear. In spite of this, there are also make-up and hairstyles, which attract girls most . ",VERB PART VERB,TV VERB PART VERB,True,True
306,69,RN,True,Both the incorrect and corrected terms could be used,"Every day, something changes and we become more modern. Companies use computers instead of books, dentists use modernized electric | tool instead of just a pair of pliers , even . Even homes are affected. From letters to emails, from gas stoves to electric stoves and microwaves , but . But we aren't just going to stop here are we? No, in the future, the present will be the past and those things now new to us will be old, outdated and changed. ",NOUN ADV ADP,"Every day, something changes and we become more modern. Companies use computers instead of books, dentists use modernized electric | item instead of just a pair of pliers , even . Even homes are affected. From letters to emails, from gas stoves to electric stoves and microwaves , but . But we aren't just going to stop here are we? No, in the future, the present will be the past and those things now new to us will be old, outdated and changed. ",NOUN ADV ADP,RN NOUN ADV ADP,True,True
2228,50,UN,True,Word prior or after contains the word in Chinese equivalent,Women always enjoy shopping. But a lot of inconveniences annoy them. So they said they do not always enjoy shopping. First of all the | parking is not convenient and is expensive. Sometimes you can't find a place to park your car. Sometimes you have to park your car in a further place then walk to the supermarket.,NOUN VERB ADV,Women always enjoy shopping. But a lot of inconveniences annoy them. So they said they do not always enjoy shopping. First of all the | car parking is not convenient and is expensive. Sometimes you can't find a place to park your car. Sometimes you have to park your car in a further place then walk to the supermarket.,NOUN NOUN VERB,UN NOUN NOUN VERB,True,True
1026,52,MA,False,Chinese expresses this in a different order/structure,"Last night, when I went into my house it was quite silent. I felt there might be something | that had gone wrong. I found my parents sitting in an armchair . I could see sadness in my father's eyes. My mother came over to me and said softly, ; "" My dear, your father's company has just gone bankrupt', then she couldn't help crying. When I heard this bad news, I was very depressed because father worked quite hard for his company. My father always remembered his responsibility was to provide a good salary to his workers to provide his workers with a good salary , which is the aim of his life. ",DET VERB VERB,"Last night, when I went into my house it was quite silent. I felt there might be something | had gone wrong. I found my parents sitting in an armchair . I could see sadness in my father's eyes. My mother came over to me and said softly, ; "" My dear, your father's company has just gone bankrupt', then she couldn't help crying. When I heard this bad news, I was very depressed because father worked quite hard for his company. My father always remembered his responsibility was to provide a good salary to his workers to provide his workers with a good salary , which is the aim of his life. ",VERB VERB ADJ,MA VERB VERB ADJ,True,False
479,37,RP,True,Word not capitalized,"Communication has been more conventional, we can simply make a phone call, and send e-mails or faxes instead of writing letters and waiting for a long time. In particular the improvement in the sophistication of personal computers has greatly helped the spread of information. By using the | Internet, you can book newspapers , and magazines, and even go shopping online. ",NOUN PUNCT PRON,"Communication has been more conventional, we can simply make a phone call, and send e-mails or faxes instead of writing letters and waiting for a long time. In particular the improvement in the sophistication of personal computers has greatly helped the spread of information. By using the | internet, you can book newspapers , and magazines, and even go shopping online. ",NOUN PUNCT PRON,RP NOUN PUNCT PRON,True,True
2721,66,FV,False,"Using the infinitive form of the verb with ""to"" instead of using present tense or present progressive","I would prefer staying in tents to log cabins. I have never had any experience of | staying in a tent, so I would like to give it a go. I think I will enjoy myself in a tent. ",VERB ADP DET,"I would prefer staying in tents to log cabins. I have never had any experience of | to stay in a tent, so I would like to give it a go. I think I will enjoy myself in a tent. ",PART VERB ADP,FV PART VERB ADP,True,False
1252,55,MT,True,Chinese doesn't use the word in this context,"It was lovely to hear that you want to hear about my experience. I helped | at the concert, which was my favourite singer's concert. ",ADP DET NOUN,"It was lovely to hear that you want to hear about my experience. I helped | the concert, which was my favourite singer's concert. ",DET NOUN PUNCT,MT DET NOUN PUNCT,True,True
165,80,FN,True,Missing plural,"For me, I think people's | homes may not be built on the ground. The | homes will be built in the sky - so as to save more land to build the other buildings. As the | homes will be built in the sky . It , it will save a lot of electricity as solar energy will be used. ",NOUN VERB ADV,"For me, I think people's | home may not be built on the ground. The | home will be built in the sky - so as to save more land to build the other buildings. As the | home will be built in the sky . It , it will save a lot of electricity as solar energy will be used. ",NOUN VERB ADV,FN NOUN VERB ADV,True,True
553,113,RP,True,Word not capitalized,"The | Memorial Hall is surrounded by large playgrounds. As you go into the main Hall, you will see a huge statue of Chiang Kei-shek , this . This is because the building is the remembrance of how well Chiang did in History . The statue is about 20 feet high. The statue is protected by guards , the . The guards will change every four hours. ",PROPN PROPN VERB,"The | memorial Hall is surrounded by large playgrounds. As you go into the main Hall, you will see a huge statue of Chiang Kei-shek , this . This is because the building is the remembrance of how well Chiang did in History . The statue is about 20 feet high. The statue is protected by guards , the . The guards will change every four hours. ",ADJ PROPN VERB,RP ADJ PROPN VERB,True,True
318,81,RN,False,Equivalent word exists but is not used,"Firstly, I am being the representative of my class to thank you for organising a good programme in London, especially the visit to the Science Museum and National Art Gallery. We know that it is a good chance for us to learn more different things and we can widen our knowledge in the Science Museum. In addition, we can appreciate and enjoy the art in the National Art Gallery. Unfortunately, I know that most of the students have already visited these two places before. So we decided to choose another | event which have seen as an entertainment . It is the LONDON FASHION AND LEISURE SHOW. The show will be held at the Central Exhibition Hall, London. The date is Tuesday March 14, from 10.00-19.00. It shows the latest fashions, including leisure and sports wear. In spite of this, there are also make-up and hairstyles, which attract girls most . ",NOUN DET VERB,"Firstly, I am being the representative of my class to thank you for organising a good programme in London, especially the visit to the Science Museum and National Art Gallery. We know that it is a good chance for us to learn more different things and we can widen our knowledge in the Science Museum. In addition, we can appreciate and enjoy the art in the National Art Gallery. Unfortunately, I know that most of the students have already visited these two places before. So we decided to choose another | programme which have seen as an entertainment . It is the LONDON FASHION AND LEISURE SHOW. The show will be held at the Central Exhibition Hall, London. The date is Tuesday March 14, from 10.00-19.00. It shows the latest fashions, including leisure and sports wear. In spite of this, there are also make-up and hairstyles, which attract girls most . ",NOUN DET VERB,RN NOUN DET VERB,True,False
