,sentence,correct,error_type,penn,penn_trigram,ud,ud_trigram,en,es,model_result,has_detected_error,has_detected_correct
0,The firemen arrived ten minutes later.,True,_,DT NNS VBD CD NNS RB . ,DT NNS VBD,DET NOUN VERB NUM NOUN ADV PUNCT ,DET NOUN VERB,-4.180839933087594,-5.445462672779648,True,False,False
1,Arrived the firemen ten minutes later.,False,W,VBD DT NNS CD NNS RB . ,VBD DT NNS,VERB DET NOUN NUM NOUN ADV PUNCT ,VERB DET NOUN,-2.8784785637099968,-2.0904557741158163,True,False,False
2,Yesterday played very well the children.,False,W,NN VBD RB RB DT NNS . ,VBD RB RB,NOUN VERB ADV ADV DET NOUN PUNCT ,VERB ADV ADV,-2.0961919273718665,-2.555147182073107,False,False,False
3,Played very well the children yesterday.,False,W,VBN RB RB DT NNS NN . ,VBN RB RB,VERB ADV ADV DET NOUN NOUN PUNCT ,VERB ADV ADV,-1.7961897004464684,-2.4680624491645817,False,False,False
4,The children played very well yesterday.,True,_,DT NNS VBD RB RB NN . ,DT NNS VBD,DET NOUN VERB ADV ADV NOUN PUNCT ,DET NOUN VERB,-4.180839933087594,-5.445462672779648,True,False,False
5,Often she has helped.,False,W,RB PRP VBZ VBN . ,RB PRP VBZ,ADV PRON VERB VERB PUNCT ,ADV PRON VERB,-2.0656967037556178,-0.7093997930448399,True,False,False
6,She often has helped.,False,W,PRP RB VBZ VBN . ,RB VBZ VBN,PRON ADV VERB VERB PUNCT ,PRON ADV VERB,-3.859102730790732,-2.107166927485167,True,False,False
7,They live in the house white.,False,W,PRP VBP IN DT NN JJ . ,NN JJ .,PRON VERB ADP DET NOUN ADJ PUNCT ,NOUN ADJ PUNCT,-2.500108500193658,-1.8475230690007816,True,False,False
8,Can you lend me a ball of tennis?,False,UT,MD PRP VB PRP DT NN IN NN . ,NN IN NN,VERB PRON VERB PRON DET NOUN ADP NOUN PUNCT ,NOUN ADP NOUN,-1.867002897019336,-1.5270320671588085,True,False,False
9,The Club of Bridge of the University of Cambridge.,False,UT,DT NNP IN NNP IN DT NNP IN NNP . ,NNP IN NNP,DET PROPN ADP PROPN ADP DET PROPN ADP PROPN PUNCT ,PROPN ADP PROPN,-1.2456582871571438,-1.2626531243295942,False,False,False
10,They gave to Sam the book.,False,W,PRP VBD IN NNP DT NN . ,IN NNP DT,PRON VERB ADP PROPN DET NOUN PUNCT ,ADP PROPN DET,-4.588140413160279,-3.5076318171059424,True,False,False
11,They gave the book to Sam.,True,_,PRP VBD DT NN IN NNP . ,IN NNP .,PRON VERB DET NOUN ADP PROPN PUNCT ,ADP PROPN PUNCT,-2.1485775743929443,-2.294107459015733,True,False,False
12,They took to the hospital her mother.,False,W,PRP VBD IN DT NN PRP$ NN . ,NN PRP$ NN,PRON VERB ADP DET NOUN DET NOUN PUNCT ,NOUN DET NOUN,-0.7922380832041762,-0.6673661268997712,True,False,False
13,Mrs Smith speaks very well English.,False,W,NNP NNP VBZ RB RB NNP . ,RB RB NNP,PROPN PROPN VERB ADV ADV PROPN PUNCT ,ADV ADV PROPN,-5.7207611138425625,-5.377073262679926,True,False,False
14,Keep tidy Britain.,False,W,VB JJ NNP . ,VB JJ NNP,VERB ADJ PROPN PUNCT ,VERB ADJ PROPN,-5.559572802672457,-5.540565287599983,True,False,False
15,John has bought the books?,True,_,NNP VBZ VBN DT NNS . ,NNP VBZ VBN,PROPN VERB VERB DET NOUN PUNCT ,PROPN VERB VERB,-1.4657940242479544,-1.643270632904405,True,False,False
16,Has bought the books John?,False,W,VBZ VBN DT NNS NNP . ,VBZ VBN DT,VERB VERB DET NOUN PROPN PUNCT ,VERB VERB DET,-2.070118330607329,-1.2689815119382233,True,False,False
17,Mary came?,True,_,NNP VBD . ,NNP VBD .,PROPN VERB PUNCT ,PROPN VERB PUNCT,-3.9113880976373037,-5.613680331078658,True,False,False
18,When Mary came?,False,W,WRB NNP VBD . ,WRB NNP VBD,ADV PROPN VERB PUNCT ,ADV PROPN VERB,-2.164108295689112,-4.0342406381523945,False,False,False
19,Came Mary?,False,W,VBD NNP . ,VBD NNP .,VERB PROPN PUNCT ,VERB PROPN PUNCT,-3.196985068534038,-2.47463393993228,True,False,False
20,"Mary, when came?",False,W,"NNP , WRB VBD . ",WRB VBD .,PROPN PUNCT ADV VERB PUNCT ,ADV VERB PUNCT,-6.700731109547808,-4.174387269895637,True,False,False
21,Who did kill Oswald?,False,UV,WP VBD VB NNP . ,VBD VB NNP,PRON VERB VERB PROPN PUNCT ,VERB VERB PROPN,-4.109447330407857,-4.174387269895637,False,False,False
22,Who Oswald killed?,False,MV,WP NNP VBD . ,WP NNP VB,PRON PROPN VERB PUNCT ,PRON PROPN VERB,-8.29254851397576,-6.588926477533518,True,False,False
23,Who killed to Kennedy?,False,UT,WP VBD IN NNP . ,VBD IN NNP,PRON VERB ADP PROPN PUNCT ,VERB ADP PROPN,-2.494320900498189,-1.9601313751533065,True,False,False
24,Who Kennedy killed?,False,W,WP NNP VBD . ,WP NNP VBD,PRON PROPN VERB PUNCT ,PRON PROPN VERB,-3.0350531419479787,-3.29308961152919,False,False,False
25,Did they went?,False,TV,VBD PRP VBD . ,VBD PRP VBD,VERB PRON VERB PUNCT ,VERB PRON VERB,-2.807305159197551,-2.863665010034358,False,False,False
26,Do they went?,False,TV,VBP PRP VBD . ,VBP PRP VBD,VERB PRON VERB PUNCT ,VERB PRON VERB,-4.327982306914442,-4.35593152389103,False,False,False
27,Do she goes?,False,AGV,VBP PRP VBZ . ,VBP PRP VBZ,VERB PRON VERB PUNCT ,VERB PRON VERB,-2.2255918322490604,-2.103046099449257,True,False,False
28,Does she goes?,False,AGV,VBZ PRP VBZ . ,VBZ . _,VERB PRON VERB PUNCT ,VERB PUNCT _,-0.04062892949417278,-0.04222906054360672,False,False,False
29,"They're coming tomorrow, no?",False,_,"PRP VBP VBG NN , UH . ",UH . _,PRON VERB VERB NOUN PUNCT INTJ PUNCT ,INTJ PUNCT _,-0.14421629272453892,-0.4155154439616658,False,False,False
30,"You have a car, no?",False,_,"PRP VBP DT NN , UH . ",", UH .",PRON VERB DET NOUN PUNCT INTJ PUNCT ,PUNCT INTJ PUNCT,-2.7316066823244904,-2.3470368555648795,True,False,False
31,Peter not found the key.,False,X,NNP RB VBD DT NN . ,RB VBD DT,PROPN ADV VERB DET NOUN PUNCT ,ADV VERB DET,-1.4204648988152158,-1.6302653438736388,False,False,False
32,Peter not has found the key.,False,X,NNP RB VBZ VBN DT NN . ,RB VBZ VBN,PROPN ADV VERB VERB DET NOUN PUNCT ,ADV VERB VERB,-3.859102730790732,-2.107166927485167,True,False,False
33,Those no.,False,X,DT UH . ,DT UH .,DET INTJ PUNCT ,DET INTJ PUNCT,-3.1403135023650988,-0.6505875661411494,True,False,False
34,Green no.,False,X,NNP NN . ,NNP NN .,PROPN NOUN PUNCT ,PROPN NOUN PUNCT,-1.7807008926995478,-2.1710116516733087,False,False,False
35,Here no.,False,X,RB UH . ,RB UH .,ADV INTJ PUNCT ,ADV INTJ PUNCT,-4.093550596320925,-2.772588722239781,True,False,False
36,Maria cans cook.,False,AGV,NNP NNS VBP . ,NNS VBP .,PROPN NOUN VERB PUNCT ,NOUN VERB PUNCT,-4.277626088370759,-5.091191490456732,False,False,False
37,Do you can swim?,False,UV,VBP PRP MD VB . ,VBP PRP MD,VERB PRON VERB VERB PUNCT ,VERB PRON VERB,-2.17468792766576,-3.398091789104002,False,False,False
38,They will can do it next week.,False,UV,PRP MD MD VB PRP JJ NN . ,MD MD VB,PRON VERB VERB VERB PRON ADJ NOUN PUNCT ,VERB VERB VERB,-0.9279867716373464,-3.4339872044851463,False,False,False
39,She went up the stairs.,True,_,PRP VBD RP DT NNS . ,VBD RP DT,PRON VERB PART DET NOUN PUNCT ,VERB PART DET,-1.2769017609919362,-3.4339872044851463,True,False,False
40,She went up the book.,False,MT,PRP VBD RP DT NN . ,VBD RP DT,PRON VERB PART DET NOUN PUNCT ,VERB PART DET,-1.2769017609919362,-3.4339872044851463,False,False,False
41,They were waiting.,True,_,PRP VBD VBG . ,PRP VBD VBG,PRON VERB VERB PUNCT ,PRON VERB VERB,-3.6476175241819786,-4.672745479421483,True,False,False
42,Mary laughed.,True,_,NNP VBD . ,NNP VBD .,PROPN VERB PUNCT ,PROPN VERB PUNCT,-3.9113880976373037,-5.613680331078658,True,False,False
43,What did she laugh?,False,MT,WP VBD PRP VB . ,VB . _,PRON VERB PRON VERB PUNCT ,VERB PUNCT _,-0.02922005383462355,-0.02014547197531592,True,False,False
44,Football likes me.,False,_,NN VBZ PRP . ,NN VBZ PRP,NOUN VERB PRON PUNCT ,NOUN VERB PRON,-4.548033917231658,-7.202034965983522,False,False,False
45,"Do you want to go? No, I don't want.",False,MT,"VBP PRP VB TO VB . UH , PRP VBP RB VB . ",VB . _,VERB PRON VERB PART VERB PUNCT INTJ PUNCT PRON VERB ADV VERB PUNCT ,VERB PUNCT _,-0.02922005383462355,-0.02014547197531592,True,False,False
46,I like to get up early; I'm used.,False,MA,PRP VBP TO VB RP RB : PRP VBP VBN . ,VBN . _,PRON VERB PART VERB PART ADV PUNCT PRON VERB VERB PUNCT ,VERB PUNCT _,-0.027612629870681537,-0.019272945267451585,True,False,False
47,"Are they coming? No, I don't think.",False,MA,"VBP PRP VBG . UH , PRP VBP RB VB . ",VB . _,VERB PRON VERB PUNCT INTJ PUNCT PRON VERB ADV VERB PUNCT ,VERB PUNCT _,-0.02922005383462355,-0.02014547197531592,True,False,False
48,Look! It rains!,False,TV,VB . PRP VBZ . ,PRP VBZ .,VERB PUNCT PRON VERB PUNCT ,PRON VERB PUNCT,-4.737264354674495,-3.800063366236485,True,False,False
49,I wait for you at home.,False,MV,PRP VBP IN PRP IN NN . ,VBP IN PRP,PRON VERB ADP PRON ADP NOUN PUNCT ,VERB ADP PRON,-1.9865287398330589,-3.150738796591104,False,False,False
50,I see her this evening.,False,MV,PRP VBP PRP DT NN . ,VBP PRP DT,PRON VERB PRON DET NOUN PUNCT ,VERB PRON DET,-3.596037156813513,-1.655994957562989,True,False,False
51,How long are you working in your present job?,False,TV,WRB RB VBP PRP VBG IN PRP$ JJ NN . ,VBP PRP VBG,ADV ADV VERB PRON VERB ADP DET ADJ NOUN PUNCT ,VERB PRON VERB,-3.4543467506422023,-6.2430011729234085,False,False,False
52,It's a long time that I live here.,False,TV,PRP VBZ DT JJ NN WDT PRP VBP RB . ,VBP RB .,PRON VERB DET ADJ NOUN DET PRON VERB ADV PUNCT ,VERB ADV PUNCT,-4.587774862890292,-3.3055413047520417,True,False,False
53,When has she received the letter?,False,TV,WRB VBZ PRP VBD DT NN . ,VBZ PRP VBD,ADV VERB PRON VERB DET NOUN PUNCT ,VERB PRON VERB,-5.287475220235203,-5.003442823514751,True,False,False
54,Today I've finished work early because I've started at seven o'clock this morning.,False,UV,NN PRP VB VBN NN RB IN PRP VB VBN IN CD NN DT NN . ,VB VBN NN,NOUN PRON VERB VERB NOUN ADV ADP PRON VERB VERB ADP NUM NOUN DET NOUN PUNCT ,VERB VERB NOUN,-4.285502747672899,-4.075778628099567,True,False,False
55,"When we were young, we were playing a lot of tennis.",False,TV,"WRB PRP VBD JJ , PRP VBD VBG DT NN IN NN . ",VBD VBG DT,ADV PRON VERB ADJ PUNCT PRON VERB VERB DET NOUN ADP NOUN PUNCT ,VERB VERB DET,-1.8562550636201107,-1.3953389158468446,True,False,False
56,"When I was a teenager, I was having a motorbike.",False,TV,"WRB PRP VBD DT NN , PRP VBD VBG DT NN . ",VBD VBG DT,ADV PRON VERB DET NOUN PUNCT PRON VERB VERB DET NOUN PUNCT ,VERB VERB DET,-1.8562550636201107,-1.3953389158468446,True,False,False
57,She wasn't knowing that he had died.,False,TV,PRP VBD RB VBG IN PRP VBD VBN . ,VBD RB VBG,PRON VERB ADV VERB ADP PRON VERB VERB PUNCT ,VERB ADV VERB,-3.7801902873025854,-6.350636371245304,False,False,False
58,Come you tomorrow!,False,UA,VB PRP NN . ,PRP NN .,VERB PRON NOUN PUNCT ,PRON NOUN PUNCT,-1.6404115708995413,-2.3408106161497817,False,False,False
59,"When Mary will get here, tell her to come in.",False,TV,"WRB NNP MD VB RB , VB PRP TO VB RP . ",MD VB RB,ADV PROPN VERB VERB ADV PUNCT VERB PRON PART VERB PART PUNCT ,VERB VERB ADV,-2.930184815828411,-2.5345958648096283,True,False,False
60,I use to do a lot of exercise.,False,TV,PRP VBP TO VB DT NN IN NN . ,VBP TO VB,PRON VERB PART VERB DET NOUN ADP NOUN PUNCT ,VERB PART VERB,-0.009572579840812927,-0.00012235808516707474,True,False,False
61,The house built itself before the war.,False,MV,DT NN VBD PRP IN DT NN . ,VBD PRP IN,DET NOUN VERB PRON ADP DET NOUN PUNCT ,VERB PRON ADP,-1.3345229075195395,-1.4182554613468867,False,False,False
62,They were given bikes for Christmas.,True,_,PRP VBD VBN NNS IN NNP . ,PRP VBD VBN,PRON VERB VERB NOUN ADP PROPN PUNCT ,PRON VERB VERB,-2.489694050341188,-2.581666233661437,True,False,False
63,Polly was owed a lot of money.,True,_,NNP VBD VBN DT NN IN NN . ,VBD VBN DT,PROPN VERB VERB DET NOUN ADP NOUN PUNCT ,VERB VERB DET,-3.071023366655502,-1.8800242987787008,False,False,False
64,To smoke is bad for you.,False,FV,TO VB VBZ JJ IN PRP . ,TO VB VBZ,PART VERB VERB ADJ ADP PRON PUNCT ,PART VERB VERB,-5.933147126113441,-5.551612839029354,True,False,False
65,It's difficult learn English.,False,FV,PRP VBZ JJ VBP NNP . ,VBP NNP .,PRON VERB ADJ VERB PROPN PUNCT ,VERB PROPN PUNCT,-3.8789957560477166,-2.6336722869843707,True,False,False
66,Let us to see.,False,FV,VB PRP TO VB . ,TO VB .,VERB PRON PART VERB PUNCT ,PART VERB PUNCT,-3.870185425051941,-3.7779839391691006,True,False,False
67,The food is more important than the art.,False,UD,DT NN VBZ RBR JJ IN DT NN . ,DT NN .,DET NOUN VERB ADV ADJ ADP DET NOUN PUNCT ,DET NOUN PUNCT,-2.5578020289433483,-2.750807357943754,False,False,False
68,Do you like the big dogs?,False,UD,VBP PRP VB DT JJ NNS . ,DT JJ NNS,VERB PRON VERB DET ADJ NOUN PUNCT ,DET ADJ NOUN,-1.8822015672841002,-1.7052032767148857,True,False,False
69,"That is the yours, and this is the mine.",False,UD,"DT VBZ DT NNS , CC DT VBZ DT NN . ",DT NN .,DET VERB DET NOUN PUNCT CCONJ DET VERB DET NOUN PUNCT ,DET NOUN PUNCT,-2.5578020289433483,-2.750807357943754,False,False,False
70,Do you have car?,False,MD,VBP PRP VB NN . ,VB NN .,VERB PRON VERB NOUN PUNCT ,VERB NOUN PUNCT,-2.559074601542493,-2.82161391215944,False,False,False
71,Her sister is dentist.,False,MD,PRP$ NN VBZ NN . ,NN . _,DET NOUN VERB NOUN PUNCT ,NOUN PUNCT _,-0.04247899923335473,-0.02322247524330005,True,False,False
72,I have ones nice American friends.,False,RQ,PRP VBP NNS JJ JJ NNS . ,NNS JJ JJ,PRON VERB NOUN ADJ ADJ NOUN PUNCT ,NOUN ADJ ADJ,-4.935413443209193,-2.8129518566272456,True,False,False
73,The table is dirty.,True,_,DT NN VBZ JJ . ,NN VBZ JJ,DET NOUN VERB ADJ PUNCT ,NOUN VERB ADJ,-2.5209526304081766,-2.0977507824760337,False,False,False
74,"Clean her, please.",False,RA,"VB PRP , UH . ","VB PRP ,",VERB PRON PUNCT INTJ PUNCT ,VERB PRON PUNCT,-2.84525408714294,-3.1687810125470017,False,False,False
75,"They showed me two models, and I bought the small.",False,M,"PRP VBD PRP CD NNS , CC PRP VBD DT JJ . ",JJ . _,PRON VERB PRON NUM NOUN PUNCT CCONJ PRON VERB DET ADJ PUNCT ,ADJ PUNCT _,-0.031902919765896286,-0.018695555220040776,True,False,False
76,I am more old than my sister.,False,IJ,PRP VBP RBR JJ IN PRP$ NN . ,RBR JJ IN,PRON VERB ADV ADJ ADP DET NOUN PUNCT ,ADV ADJ ADP,-1.456561547834944,-2.468099531471619,False,False,False
77,Barcelona is the more large city of Catalonia.,False,IJ,NNP VBZ DT RBR JJ NN IN NNP . ,RBR JJ NN,PROPN VERB DET ADV ADJ NOUN ADP PROPN PUNCT ,ADV ADJ NOUN,-1.4756443622513848,-2.9789251552376097,False,False,False
78,Rosa isn't French. Is Spanish.,False,MA,NNP VBZ RB NNP . VBZ JJ . ,VBZ JJ .,PROPN VERB ADV PROPN PUNCT VERB ADJ PUNCT ,VERB ADJ PUNCT,-2.42720580944963,-2.185719545481791,True,False,False
79,Have gone home because wanted to go to bed.,False,MA,VBP VBN RB IN VBD TO VB IN NN . ,VBP VBN RB,VERB VERB ADV ADP VERB PART VERB ADP NOUN PUNCT ,VERB VERB ADV,-2.708558058504676,-2.324997696738881,True,False,False
80,Was raining.,False,MA,VBD VBG . ,VBD VBG .,VERB VERB PUNCT ,VERB VERB PUNCT,-3.3558781100470045,-2.845781096790488,True,False,False
81,That's the man who he lives next door to us.,False,UA,DT VBZ DT NN WP PRP VBZ JJ NN IN PRP . ,IN PRP .,DET VERB DET NOUN PRON PRON VERB ADJ NOUN ADP PRON PUNCT ,ADP PRON PUNCT,-2.7620176585778577,-2.62693042204822,True,False,False
82,I saw she.,False,RA,PRP VBD PRP . ,VBD PRP .,PRON VERB PRON PUNCT ,VERB PRON PUNCT,-2.8762980306845027,-3.308350831295804,False,False,False
83,They know we.,False,RA,PRP VBP PRP . ,PRP . _,PRON VERB PRON PUNCT ,PRON PUNCT _,-0.03193856020345538,-0.02220353703466408,True,False,False
84,How many cakes is it in the cupboard?,False,AGV,WRB JJ NNS VBZ PRP IN DT NN . ,PRP IN DT,ADV ADJ NOUN VERB PRON ADP DET NOUN PUNCT ,PRON ADP DET,-0.7935885640671416,-0.9264941250479216,False,False,False
85,Who is it? Am I.,False,RA,WP VBZ PRP . VBP NN . ,VBP NN .,PRON VERB PRON PUNCT VERB NOUN PUNCT,VERB NOUN PUNCT,-2.6111006021669265,-2.54121919463754,True,False,False
86,They enjoyed very much.,False,MA,PRP VBD RB RB . ,RB RB .,PRON VERB ADV ADV PUNCT ,ADV ADV PUNCT,-2.5810257820430738,-3.01465780041129,False,False,False
87,She complained herself.,False,UA,PRP VBD PRP . ,PRP . _,PRON VERB PRON PUNCT ,PRON PUNCT _,-0.03193856020345538,-0.02220353703466408,True,False,False
88,I showered me and went out.,False,UA,PRP VBD PRP CC VBD RP . ,PRP CC VBD,PRON VERB PRON CCONJ VERB PART PUNCT ,PRON CCONJ VERB,-3.783842061706636,-4.483084428625875,False,False,False
89,Bill cut himself the finger.,False,RA,NNP VBD PRP DT NN . ,PRP DT NN,PROPN VERB PRON DET NOUN PUNCT ,PRON DET NOUN,-1.1235713522539332,-1.2751007390942897,False,False,False
90,Sara and Joe had both got his shoes wet.,False,RA,NNP CC NNP VBD DT VBN PRP$ NNS JJ . ,PRP$ NNS JJ,PROPN CCONJ PROPN VERB DET VERB DET NOUN ADJ PUNCT ,DET NOUN ADJ,-5.365520430304744,-1.8817551754031208,True,False,False
91,The my cousin is in Portugal.,False,UD,DT PRP$ NN VBZ IN NNP . ,DT PRP$ NN,DET DET NOUN VERB ADP PROPN PUNCT ,DET DET NOUN,-1.2568091480010324,-1.1130540821473864,True,False,False
92,The girls we saw looked quite happy.,True,_,DT NNS PRP VBD VBD RB JJ . ,NNS PRP VBD,DET NOUN PRON VERB VERB ADV ADJ PUNCT ,NOUN PRON VERB,-2.1385793381445835,-2.183078819399344,True,False,False
93,Did you like the woman we spoke to?,True,_,VBD PRP VB DT NN PRP VBD IN . ,VBD IN .,VERB PRON VERB DET NOUN PRON VERB ADP PUNCT ,VERB ADP PUNCT,-4.984011320479528,-10.087890275533908,True,False,False
94,We are going to have the house painted.,True,_,PRP VBP VBG TO VB DT NN VBN . ,TO VB DT,PRON VERB VERB PART VERB DET NOUN VERB PUNCT ,PART VERB DET,-1.2644931919327027,-1.0582464595739782,False,False,False
95,We are going to make paint the house.,False,MT,PRP VBP VBG TO VB NN DT NN . ,TO VB NN,PRON VERB VERB PART VERB NOUN DET NOUN PUNCT ,PART VERB NOUN,-2.7165559785883704,-3.3580510777813166,False,False,False
96,They refused helping their neighbours.,False,FV,PRP VBD VBG PRP$ NNS . ,VBG PRP$ NNS,PRON VERB VERB DET NOUN PUNCT ,VERB DET NOUN,-1.2936708680363722,-1.2362245031190524,True,False,False
97,I'll never forget to see that accident.,False,FV,PRP MD RB VB TO VB DT NN . ,TO VB DT,PRON AUX ADV VERB PART VERB DET NOUN PUNCT ,PART VERB DET,-1.2644931919327027,-1.0582464595739782,True,False,False
98,She explained me the problem.,False,MT,PRP VBD PRP DT NN . ,PRP DT NN,PRON VERB PRON DET NOUN PUNCT ,PRON DET NOUN,-1.1235713522539332,-1.2751007390942897,False,False,False
99,They suggested Jim to take the job.,False,W,PRP VBD NNP TO VB DT NN . ,NNP TO VB,PRON VERB PROPN PART VERB DET NOUN PUNCT ,PROPN PART VERB,-0.02745811479286234,-0.003175613973886551,True,False,False
100,I am asking that they go.,False,W,PRP VBP VBG IN PRP VBP . ,IN PRP VBP,PRON VERB VERB ADP PRON VERB PUNCT ,ADP PRON VERB,-1.1467691803872608,-1.6731217607606963,False,False,False
101,They ordered her that she should go.,False,W,PRP VBD PRP IN PRP MD VB . ,PRP IN PRP,PRON VERB PRON ADP PRON VERB VERB PUNCT ,PRON ADP PRON,-2.47070127898992,-3.549908338193596,False,False,False
102,They ordered her that she went.,False,W,PRP VBD PRP IN PRP VBD . ,PRP IN PRP,PRON VERB PRON ADP PRON VERB PUNCT ,PRON ADP PRON,-2.47070127898992,-3.549908338193596,False,False,False
103,I want that you don't go.,False,X,PRP VBP IN PRP VBP RB VB . ,IN PRP VBP,PRON VERB ADP PRON VERB ADV VERB PUNCT ,ADP PRON VERB,-1.1467691803872608,-1.6731217607606963,False,False,False
104,I want that you not go.,False,X,PRP VBP IN PRP RB VBP . ,IN PRP RB,PRON VERB ADP PRON ADV VERB PUNCT ,ADP PRON ADV,-3.175318042947163,-3.699890923940141,False,False,False
105,The captain ordered the soldiers that they didn't retreat.,False,X,DT NN VBD DT NNS IN PRP VBD RB VB . ,IN PRP VBD,DET NOUN VERB DET NOUN ADP PRON VERB ADV VERB PUNCT ,ADP PRON VERB,-2.5153887275133173,-2.659934428977484,False,False,False
106,I don't know where does Mary live.,False,UV,PRP VBP RB VB WRB VBZ NNP VB . ,VBZ NNP VB,PRON VERB ADV VERB ADV VERB PROPN VERB PUNCT ,VERB PROPN VERB,-4.063150251357407,-8.857372832825774,False,False,False
107,They asked me how much did I earn.,False,UV,PRP VBD PRP WRB JJ VBD PRP VB . ,VBD PRP VB,PRON VERB PRON ADV ADJ VERB PRON VERB PUNCT ,VERB PRON VERB,-2.9684042389608414,-7.220373836723947,False,False,False
108,They took to their mother to the hospital.,False,UT,PRP VBD IN PRP$ NN IN DT NN . ,IN PRP$ NN,PRON VERB ADP DET NOUN ADP DET NOUN PUNCT ,ADP DET NOUN,-0.7307594053953478,-0.6120322350840798,True,False,False
109,For what have you come?,False,W,IN WP VBP PRP VB . ,IN WP VBP,ADP PRON VERB PRON VERB PUNCT ,ADP PRON VERB,-3.4349652656413423,-1.4519519626936974,True,False,False
110,I don't know who they're working for.,True,_,PRP VBP RB VB WP PRP VBP VBG IN . ,VBG IN .,PRON VERB ADV VERB PRON PRON VERB VERB ADP PUNCT ,VERB ADP PUNCT,-4.7314225188410965,-10.400102683833005,True,False,False
111,Who does Fred sit next to?,True,_,WP VBZ NNP VB RB IN . ,RB IN .,PRON VERB PROPN VERB ADV ADP PUNCT ,ADV ADP PUNCT,-6.463647232524253,-8.456081325915875,True,False,False
112,"After to see the film, we went for a meal.",False,FV,"IN TO VB DT NN , PRP VBD IN DT NN . ",TO VB DT,ADP PART VERB DET NOUN PUNCT PRON VERB ADP DET NOUN PUNCT ,PART VERB DET,-1.2644931919327027,-1.0582464595739782,True,False,False
113,I've got two news for you.,False,CN,PRP VB VBN CD NN IN PRP . ,CD NN IN,PRON VERB VERB NUM NOUN ADP PRON PUNCT ,NUM NOUN ADP,-1.0540780280565576,-0.5060233746731441,True,False,False
