1978,22,RV,True,,"Unfortunately, Pat wasn't very good at keeping secrets. He was so kind that he couldn't resist telling Janet that she was going to be killed by Mr Brown. After | doing that, Pat left the room. Janet was so nervous that she couldn't stop her heart beating quickly. She went downstairs quietly and closed the door as soon as she went into her room. At that moment a lot of things appeared in her mind, which seemed like they had just happened yesterday. ""Why did Mr Brown want to kill me?"" she said to herself. ""I am just a servant in this castle , . I love him so much and I don't want anything from him although he is the owner of this castle."" It seemed as if a shadow came in through the window and disappeared quickly. Everything in the room was quiet except the sound of the clock, as if everything was going to die. She was so frightened and sad that she had no energy. She fell onto the floor and wept, while nobody could help her. ",VERB DET PUNCT,"Unfortunately, Pat wasn't very good at keeping secrets. He was so kind that he couldn't resist telling Janet that she was going to be killed by Mr Brown. After | finishing that, Pat left the room. Janet was so nervous that she couldn't stop her heart beating quickly. She went downstairs quietly and closed the door as soon as she went into her room. At that moment a lot of things appeared in her mind, which seemed like they had just happened yesterday. ""Why did Mr Brown want to kill me?"" she said to herself. ""I am just a servant in this castle , . I love him so much and I don't want anything from him although he is the owner of this castle."" It seemed as if a shadow came in through the window and disappeared quickly. Everything in the room was quiet except the sound of the clock, as if everything was going to die. She was so frightened and sad that she had no energy. She fell onto the floor and wept, while nobody could help her. ",VERB DET PUNCT,RV VERB DET PUNCT,True,True
1048,12,MV,True,Chinese does not have auxiliary verbs,"Shopping is not always enjoyable. I don't really like shopping. Sometimes when I'm bored and can't find something else to do . , I go look round the shops. When I see some clothes in the window I like, I go in and try them on. But I always find they | do not look nice on me. The other thing I don't like going shopping is at the weekend. All the shops are full of people, and people treat the items like rubbish . Hanging , hanging them everywhere after they have tried them on and found that they did not suit them. ",VERB ADV VERB,"Shopping is not always enjoyable. I don't really like shopping. Sometimes when I'm bored and can't find something else to do . , I go look round the shops. When I see some clothes in the window I like, I go in and try them on. But I always find they | not look nice on me. The other thing I don't like going shopping is at the weekend. All the shops are full of people, and people treat the items like rubbish . Hanging , hanging them everywhere after they have tried them on and found that they did not suit them. ",ADV VERB ADJ,MV ADV VERB ADJ,True,True
241,1,RN,False,Spelling error,"In your last letter you asked me something about our rules, both at home and at school in my country. I'd like to tell you that . In , in school, we have lots of rules, especially in class and some of them are quite strange. For example, we can't go to the toilet during lessons , we . We have to go there in the | break. And we can't eat food or do any sports in our classroom. If you fail three subjects in your exam, you will be kicked out of school. It's too strict , . I don't like it. If I could, I would like to change this, because I don't think everyone can succeed at once , we . We should give them a second chance to succeed. ",NOUN PUNCT CCONJ,"In your last letter you asked me something about our rules, both at home and at school in my country. I'd like to tell you that . In , in school, we have lots of rules, especially in class and some of them are quite strange. For example, we can't go to the toilet during lessons , we . We have to go there in the | brake. And we can't eat food or do any sports in our classroom. If you fail three subjects in your exam, you will be kicked out of school. It's too strict , . I don't like it. If I could, I would like to change this, because I don't think everyone can succeed at once , we . We should give them a second chance to succeed. ",NOUN PUNCT CCONJ,RN NOUN PUNCT CCONJ,True,False
2046,90,RV,False,,Thank you for sending me this wonderful news. I was really happy when I | learned I won the first prize. I am writing to give you my details and ask for some more information.,VERB PRON VERB,Thank you for sending me this wonderful news. I was really happy when I | knew I won the first prize. I am writing to give you my details and ask for some more information.,VERB PRON VERB,RV VERB PRON VERB,True,False
2757,102,FV,False,Incorrectly using progressive aspect,"Almost everyone hates other people gossiping about their private lives. It's a natural reaction to be angry with somebody you don't trust for gossiping about you and bothering your personal thoughts . So I think famous people, no matter if they are politicians or film stars, don't deserve | to be followed by journalists every time they are trying to have a good time. ",PART VERB VERB,"Almost everyone hates other people gossiping about their private lives. It's a natural reaction to be angry with somebody you don't trust for gossiping about you and bothering your personal thoughts . So I think famous people, no matter if they are politicians or film stars, don't deserve | being followed by journalists every time they are trying to have a good time. ",VERB VERB ADP,FV VERB VERB ADP,True,False
1609,72,MP,True,Chinese sentence structure differs from English,"In my opinion, women really enjoy shopping. It seems a human activity during their spare time . However, we are going to change from the traditional system to ""e-shopping"". It is new for customers | . With technology they can switch on the computer and click everything they want. Therefore, it looks like a service and is also boring for the customer. I think most men dislike shopping. They are always waiting for a long time for women to finish their shopping. ",PUNCT ADP NOUN,"In my opinion, women really enjoy shopping. It seems a human activity during their spare time . However, we are going to change from the traditional system to ""e-shopping"". It is new for customers | with technology they can switch on the computer and click everything they want. Therefore, it looks like a service and is also boring for the customer. I think most men dislike shopping. They are always waiting for a long time for women to finish their shopping. ",ADP NOUN PRON,MP ADP NOUN PRON,True,True
2216,38,DN,True,Missing plural,"First of all, I am a high school student, so I only have four weeks' vacation in July. I would like to travel in July. Secondly, for me, the best way to live in the | outdoors is in tents, because that is a good chance to acquire a lot of knowledge about the planets and the animals as well. ",NOUN VERB ADP,"First of all, I am a high school student, so I only have four weeks' vacation in July. I would like to travel in July. Secondly, for me, the best way to live in the | outdoor is in tents, because that is a good chance to acquire a lot of knowledge about the planets and the animals as well. ",NOUN VERB ADP,DN NOUN VERB ADP,True,True
1832,144,MD,True,Chinese has no articles and doesn't use classifiers in this situation,"Firstly, I would like to thank you for the programme that you have provided. It is | a very good programme, especially the river trip to Greenwich, which I am sure the whole class will enjoy. ",DET ADV ADJ,"Firstly, I would like to thank you for the programme that you have provided. It is | very good programme, especially the river trip to Greenwich, which I am sure the whole class will enjoy. ",ADV ADJ NOUN,MD ADV ADJ NOUN,True,True
1979,23,RV,False,,"Unfortunately, Pat wasn't very good at keeping secrets. He was so kind that he couldn't resist telling Janet that she was going to be killed by Mr Brown. After doing that, Pat left the room. Janet was so nervous that she couldn't stop her heart | beating quickly. She went downstairs quietly and closed the door as soon as she went into her room. At that moment a lot of things appeared in her mind, which seemed like they had just happened yesterday. ""Why did Mr Brown want to kill me?"" she said to herself. ""I am just a servant in this castle , . I love him so much and I don't want anything from him although he is the owner of this castle."" It seemed as if a shadow came in through the window and disappeared quickly. Everything in the room was quiet except the sound of the clock, as if everything was going to die. She was so frightened and sad that she had no energy. She fell onto the floor and wept, while nobody could help her. ",VERB ADV PUNCT,"Unfortunately, Pat wasn't very good at keeping secrets. He was so kind that he couldn't resist telling Janet that she was going to be killed by Mr Brown. After doing that, Pat left the room. Janet was so nervous that she couldn't stop her heart | throbbing quickly. She went downstairs quietly and closed the door as soon as she went into her room. At that moment a lot of things appeared in her mind, which seemed like they had just happened yesterday. ""Why did Mr Brown want to kill me?"" she said to herself. ""I am just a servant in this castle , . I love him so much and I don't want anything from him although he is the owner of this castle."" It seemed as if a shadow came in through the window and disappeared quickly. Everything in the room was quiet except the sound of the clock, as if everything was going to die. She was so frightened and sad that she had no energy. She fell onto the floor and wept, while nobody could help her. ",VERB ADV PUNCT,RV VERB ADV PUNCT,True,False
2725,70,FV,False,Incorrectly using past tense,"Firstly, I am a student , . I don't have a job, so, I have to | ask for money from my parents. I can't | ask for too much. That's very bad for my parents. When I go shopping . , I always feel ashamed because I spend my parents' money. (Although I have got a part-time job, it provides just enough to pay my rent.) ",VERB ADP NOUN,"Firstly, I am a student , . I don't have a job, so, I have to | asked for money from my parents. I can't | asked for too much. That's very bad for my parents. When I go shopping . , I always feel ashamed because I spend my parents' money. (Although I have got a part-time job, it provides just enough to pay my rent.) ",VERB ADP NOUN,FV VERB ADP NOUN,True,False
2617,24,DV,True,"Chinese verbs, adjectives, and nouns sometimes are the same","I had an unpleasant experience. It was at lunchtime. Everybody had gone to buy lunch in the supermarket , in . In fact, nobody likes crowds and queues, especially not in the summertime. I was queuing in the middle of row . I chose this aisle because I thought it was quicker than the others. Although there were finished two people, next was me, something was happened . Suddenly the customer thought the receipt was not right , she . She did not buy a lot of things but the shop assistant did not make a mistake , they . They argued about this thing. The shop manager came | to solve it. Obviously, I had to try another aisle. It was the longest queue , I have ever been in. ",PART VERB PRON,"I had an unpleasant experience. It was at lunchtime. Everybody had gone to buy lunch in the supermarket , in . In fact, nobody likes crowds and queues, especially not in the summertime. I was queuing in the middle of row . I chose this aisle because I thought it was quicker than the others. Although there were finished two people, next was me, something was happened . Suddenly the customer thought the receipt was not right , she . She did not buy a lot of things but the shop assistant did not make a mistake , they . They argued about this thing. The shop manager came | solution it. Obviously, I had to try another aisle. It was the longest queue , I have ever been in. ",NOUN PRON PUNCT,DV NOUN PRON PUNCT,True,True
1766,78,MD,True,Chinese has no articles and doesn't use classifiers in this situation,| The Speaking and Listening class should be filmed because the purpose of this class is to encourage students to talk about some topics they choose and discuss them with others in order to improve their speaking and listening skills.,DET PROPN CCONJ,| Speaking and Listening class should be filmed because the purpose of this class is to encourage students to talk about some topics they choose and discuss them with others in order to improve their speaking and listening skills.,VERB CCONJ NOUN,MD VERB CCONJ NOUN,True,True
1932,36,UT,False,Overcorrection,"Lastly there are some | things I need to clarify, that is, such as what type of clothes and how much money I need to bring. ",NOUN PRON VERB,"Lastly there are some | of things I need to clarify, that is, such as what type of clothes and how much money I need to bring. ",ADP NOUN PRON,UT ADP NOUN PRON,True,False
907,24,W,False,Sentence could be valid in Chinese,"According to your advertisement, it stars DANNY BROOK and TINA TRUELOVE, but surprisingly, was performed by a different actor of whom I | didn't even know the name. In addition, the show was supposed to start at 19:30 but it started half an hour later, at 20:15. ",VERB ADV ADV,"According to your advertisement, it stars DANNY BROOK and TINA TRUELOVE, but surprisingly, was performed by a different actor of whom I | even didn't know the name. In addition, the show was supposed to start at 19:30 but it started half an hour later, at 20:15. ",ADV VERB ADV,W ADV VERB ADV,True,False
187,10,R,False,Incorrect structure used,"First of all, the performers should have been Danny Brook and Tina Truelove. However, there were two unknown actors in the show. I feel most disappointed about this. The show started at 20.15 but actually it should have started at 19.30. Moreover, I bought a £20 ticket without any discount | and the advertisement mentioned that a discount was available. And after the show, we went to visit the theatre restaurant. Unfortunately, it was closed because that day was their day-off. But I am wondering why it said we could visit the restaurant if you knew it would be closed. ",CCONJ DET NOUN,"First of all, the performers should have been Danny Brook and Tina Truelove. However, there were two unknown actors in the show. I feel most disappointed about this. The show started at 20.15 but actually it should have started at 19.30. Moreover, I bought a £20 ticket without any discount | even the advertisement mentioned that a discount was available. And after the show, we went to visit the theatre restaurant. Unfortunately, it was closed because that day was their day-off. But I am wondering why it said we could visit the restaurant if you knew it would be closed. ",ADV DET NOUN,R ADV DET NOUN,True,False
2403,154,RT,True,"Using ""in"" to show something taking place somewhere instead of ""at""","Secondly, I wonder if you know that the ""London fashion and Leisure Show"" will be held on Tuesday | at the Central Exhibition Hall. In other words, what they will introduce , is very interesting to us , . I mean it's conflict with your plan , what . What a pity! ",ADP DET PROPN,"Secondly, I wonder if you know that the ""London fashion and Leisure Show"" will be held on Tuesday | in the Central Exhibition Hall. In other words, what they will introduce , is very interesting to us , . I mean it's conflict with your plan , what . What a pity! ",ADP DET PROPN,RT ADP DET PROPN,True,True
896,13,CL,False,Wordiness,"By using the Internet we can make new pen friends overseas, and create clubs , and societies. Now a message can travel quicker and it is also worldwide . sending letters takes about a week from Hong Kong to the U.K., but network , eg. e.g. E-mail . , is much faster. require Require the time The time required is only a few minutes. Now we can even create a club on Yahoo, which is free. Modern technology saves us a lot of time and brings us many benefits when we use it in the | right way, but some bad way to e.g. send virus to break down network . ",ADJ NOUN PUNCT,"By using the Internet we can make new pen friends overseas, and create clubs , and societies. Now a message can travel quicker and it is also worldwide . sending letters takes about a week from Hong Kong to the U.K., but network , eg. e.g. E-mail . , is much faster. require Require the time The time required is only a few minutes. Now we can even create a club on Yahoo, which is free. Modern technology saves us a lot of time and brings us many benefits when we use it in the | right correct way, but some bad way to e.g. send virus to break down network . ",ADJ ADJ NOUN,CL ADJ ADJ NOUN,True,False
2629,36,UV,False,Unnecessary auxiliary added,"Lastly there are some things I need to clarify, that is, such as what type of clothes and how much money | I need to bring. ",PRON VERB PART,"Lastly there are some things I need to clarify, that is, such as what type of clothes and how much money | do I need to bring. ",VERB PRON VERB,UV VERB PRON VERB,True,False
399,29,RD,False,Chinese has no articles and doesn't use classifiers in this situation,"One day, I passed by a river in accident , . I saw there were a lot of people playing in the river. Suddenly, I heard a cry of ""Help, help"" in | the distance. In a while , lots of passed-by passersby crowded at the river-side riverside . To my surprise, nobody went in to save that boy who was shouting, but just stood there, like lots of "" champ "". I started thinking about it , after . After all, either had I never done this task before, or trained . I was just 15 years old. Finally, I jumped into the river , . I really knew that was dangerous, but I didn't think about anything except ""justify"" this word . I also really hated those people who stood there all the time. ",DET NOUN PUNCT,"One day, I passed by a river in accident , . I saw there were a lot of people playing in the river. Suddenly, I heard a cry of ""Help, help"" in | my distance. In a while , lots of passed-by passersby crowded at the river-side riverside . To my surprise, nobody went in to save that boy who was shouting, but just stood there, like lots of "" champ "". I started thinking about it , after . After all, either had I never done this task before, or trained . I was just 15 years old. Finally, I jumped into the river , . I really knew that was dangerous, but I didn't think about anything except ""justify"" this word . I also really hated those people who stood there all the time. ",DET NOUN PUNCT,RD DET NOUN PUNCT,True,False
189,13,R,False,Chinese phrase would be structured differently,"The most important development is the Internet , which is connected to the whole world's computers by telephone lines. You can send a letter to your friend by e-mail | instead of writing it on a piece of paper and sending it by post. It just takes you a few minutes. How convenient it is! There are also many more advantages , you . You can buy something in a supermarket by only a mail order , you . You don't need to leave your home. ",ADV ADP VERB,"The most important development is the Internet , which is connected to the whole world's computers by telephone lines. You can send a letter to your friend by e-mail | but not writing it on a piece of paper and sending it by post. It just takes you a few minutes. How convenient it is! There are also many more advantages , you . You can buy something in a supermarket by only a mail order , you . You don't need to leave your home. ",CCONJ ADV VERB,R CCONJ ADV VERB,True,False
735,9,AGA,False,Using 'It' incorrectly,"Accommodation at Camp California is in tents or log cabins , . I think I like both of them, because I've never been there before, and never heard of these two places . I am very interested in both places but, I can just choose one place , . I think I will choose log cabins , ; | they sound good and if I have time, maybe I can stay in tents next time (maybe next year .) ). ",PRON VERB ADJ,"Accommodation at Camp California is in tents or log cabins , . I think I like both of them, because I've never been there before, and never heard of these two places . I am very interested in both places but, I can just choose one place , . I think I will choose log cabins , ; | it sound good and if I have time, maybe I can stay in tents next time (maybe next year .) ). ",PRON VERB ADJ,AGA PRON VERB ADJ,True,False
368,18,U,False,Wordiness,"In conclusion, computers have become a | necessity in our life, and it's still a young invention, which needs to be improved. ",NOUN ADP DET,"In conclusion, computers have become a | very essential necessity in our life, and it's still a young invention, which needs to be improved. ",ADV ADJ NOUN,U ADV ADJ NOUN,True,False
239,69,R,True,Chinese conventions conflict with English,"You could go sightseeing around the Temple and take photos. Of course, you may acquire | a greater knowledge of Hong Kong, as the temple has been here for nearly 100 years. famous Big Buddha you mustn't miss it You mustn't miss the famous Big Buddha , or you will be sorry. The temple also provides free Chinese traditional-style meals for visitors. ",DET ADJ NOUN,"You could go sightseeing around the Temple and take photos. Of course, you may acquire | more knowledge of Hong Kong, as the temple has been here for nearly 100 years. famous Big Buddha you mustn't miss it You mustn't miss the famous Big Buddha , or you will be sorry. The temple also provides free Chinese traditional-style meals for visitors. ",ADJ NOUN ADP,R ADJ NOUN ADP,True,True
811,85,UA,False,Overcorrection,"Concerning the activities that you have listed . Some , some of them I am really interested in | , especially painting. Since I was young, my dad has always taken me to life drawing, so now it has become one of my hobbies. And I think , it will be nice to draw beautiful landscapes of the place. Beside drawing, swimming is my favourite as well. When I was in high school, I joined the swimming club. And I also participated in a few swimming competitions. Although I'm not the best, I have a lot of confidence at it. ",PUNCT ADV VERB,"Concerning the activities that you have listed . Some , some of them I am really interested in | it, especially painting. Since I was young, my dad has always taken me to life drawing, so now it has become one of my hobbies. And I think , it will be nice to draw beautiful landscapes of the place. Beside drawing, swimming is my favourite as well. When I was in high school, I joined the swimming club. And I also participated in a few swimming competitions. Although I'm not the best, I have a lot of confidence at it. ",PRON PUNCT ADV,UA PRON PUNCT ADV,True,False
898,15,W,False,Order is incorrect in Chinese and English,"First of all, when I went and bought my ticket, there was no discount, but in your advertisement it | clearly said that discounts are available and as a result the ticket I bought was more expensive. ",ADV VERB ADP,"First of all, when I went and bought my ticket, there was no discount, but in your advertisement it | said clearly that discounts are available and as a result the ticket I bought was more expensive. ",VERB ADV ADP,W VERB ADV ADP,True,False
1889,201,MD,True,Chinese has no articles and doesn't use classifiers in this situation,"Finally, if you want to visit this building I would recommend you stay at a hotel not far from the memorial Hall called | the Hyatt Hotel. It only takes about five minutes if you walk. I hope you will all have a great time in Taiwan and I hope you will enjoy the building. ",DET PROPN PROPN,"Finally, if you want to visit this building I would recommend you stay at a hotel not far from the memorial Hall called | Hyatt Hotel. It only takes about five minutes if you walk. I hope you will all have a great time in Taiwan and I hope you will enjoy the building. ",PROPN PROPN PUNCT,MD PROPN PROPN PUNCT,True,True
1820,132,MD,True,Chinese has no articles and doesn't use classifiers in this situation,"Some women spend their whole life shopping, and most of | the time, they don't buy many things. In my eyes they are wasting their lives, they are hopeless. ",DET NOUN PUNCT,"Some women spend their whole life shopping, and most of | time, they don't buy many things. In my eyes they are wasting their lives, they are hopeless. ",NOUN PUNCT PRON,MD NOUN PUNCT PRON,True,True
