,Unnamed: 0,error_type,Negative transfer?,Likely reason for mistake,correct_sentence,correct_trigram_ud,incorrect_sentence,incorrect_trigram_ud,type_and_trigram_ud,nlt,result
1302,29,TV,True,Chinese generally expresses actions in present tense,"During the week we decided where we | wanted to go , we . We all agreed to listen to music so then we decided to go to your musical show and listen to ""Over the Rainbow"". ",VERB PART VERB,"During the week we decided where we | want to go , we . We all agreed to listen to music so then we decided to go to your musical show and listen to ""Over the Rainbow"". ",VERB PART VERB,TV VERB PART VERB,True,True
1946,53,UT,False,Chinese would use word in the given context,"So I must find a way to help my great father. One day, I suddenly had a good idea. 'Why not go to the stock exchange?' I said to myself. Almost every day I went | there and researched the exchange decline-line, which gave me lots of information . Finally, I decided to join in the dangerous game, which meant losing everything or suddenly becoming a millionaire. With luck, I won by chance . ",ADV CCONJ VERB,"So I must find a way to help my great father. One day, I suddenly had a good idea. 'Why not go to the stock exchange?' I said to myself. Almost every day I went | in there and researched the exchange decline-line, which gave me lots of information . Finally, I decided to join in the dangerous game, which meant losing everything or suddenly becoming a millionaire. With luck, I won by chance . ",ADV ADV CCONJ,UT ADV ADV CCONJ,True,False
1544,7,MP,False,Semantic issue,"The plays and films were really wonderful , people . People liked them very much, so could you have more next year | ? ",PUNCT _ _,"The plays and films were really wonderful , people . People liked them very much, so could you have more next year | ",_ _ _,MP _ _ _,True,False
2752,97,FV,False,Incorrectly using past tense,"On the second day, we had to climb up a twenty-metre hill with our hands. It was so difficult for me because I had been really scared to stand on a high place since I was young. I did not want to climb up but I did not have any choice. So I started to climb really slow and carefully, and I climbed about 15 metres quite successfully, so I tried to climb quicker because the destination was not far away. But after I climbed two steps more, my right foot slipped , . I nearly fell , but luckily my hand caught a rock , it . It was dangerous, but I didn't | have any choice , finally . Finally I did it. ",VERB DET NOUN,"On the second day, we had to climb up a twenty-metre hill with our hands. It was so difficult for me because I had been really scared to stand on a high place since I was young. I did not want to climb up but I did not have any choice. So I started to climb really slow and carefully, and I climbed about 15 metres quite successfully, so I tried to climb quicker because the destination was not far away. But after I climbed two steps more, my right foot slipped , . I nearly fell , but luckily my hand caught a rock , it . It was dangerous, but I didn't | had any choice , finally . Finally I did it. ",VERB DET NOUN,FV VERB DET NOUN,True,False
113,28,FN,True,Missing plural,"Nowadays, we use a lot of modern technology both at home and in the office but it has its | advantages and disadvantages. ",NOUN CCONJ NOUN,"Nowadays, we use a lot of modern technology both at home and in the office but it has its | advantage and disadvantages. ",NOUN CCONJ NOUN,FN NOUN CCONJ NOUN,True,True
2783,130,FV,False,"Using the infinitive form of the verb with ""to"" instead of using present tense or present progressive","At the end of the conference, we will have a party. The party is to let all the students get to know each other better. The party will be in the dance hall next to the conference room. I would suggest they | wear formal clothing, such as tie, trousers and blazer. ",VERB ADJ NOUN,"At the end of the conference, we will have a party. The party is to let all the students get to know each other better. The party will be in the dance hall next to the conference room. I would suggest they | to wear formal clothing, such as tie, trousers and blazer. ",PART VERB ADJ,FV PART VERB ADJ,True,False
1314,42,TV,True,Missing Auxiliary,"Poisonous chemical compounds, e.g. gases , and liquids, are created too , they . They | have been used to kill people , most . Most of them produce radiation, which can disable a person, mostly harming their brain and their bodies, and it can also cause death. ",VERB VERB VERB,"Poisonous chemical compounds, e.g. gases , and liquids, are created too , they . They | were used to kill people , most . Most of them produce radiation, which can disable a person, mostly harming their brain and their bodies, and it can also cause death. ",VERB VERB PART,TV VERB VERB PART,True,True
846,25,AGN,False,Overcorrection,"Music is a traditional subject in our school , everyone . Everyone in our school can play at least one | instrument, so music lessons should be filmed to show music is part of our school's daily life. ",NOUN PUNCT ADV,"Music is a traditional subject in our school , everyone . Everyone in our school can play at least one | instruments, so music lessons should be filmed to show music is part of our school's daily life. ",NOUN PUNCT ADV,AGN NOUN PUNCT ADV,True,False
2025,69,RV,False,,"A few minutes after the concert began, a backstage assistant called in sick who was responsible for checking whether everything was going well according to the timetable , if . If something comes up, she should inform the other staff. I was then taken on to cover her job. I couldn't find my feet at first as I was so nervous. I was given lots of paper with many different times on it. I did manage to ""study"" them though, thanks to the other staff. They were very helpful and nice. They patiently explained to me my job even though they were fairly busy themselves. Then I found it was not as complicated as I thought at first. And I guess I did a good job as everything was | going quite well. ",VERB ADV ADV,"A few minutes after the concert began, a backstage assistant called in sick who was responsible for checking whether everything was going well according to the timetable , if . If something comes up, she should inform the other staff. I was then taken on to cover her job. I couldn't find my feet at first as I was so nervous. I was given lots of paper with many different times on it. I did manage to ""study"" them though, thanks to the other staff. They were very helpful and nice. They patiently explained to me my job even though they were fairly busy themselves. Then I found it was not as complicated as I thought at first. And I guess I did a good job as everything was | getting on quite well. ",VERB ADP ADV,RV VERB ADP ADV,True,False
821,0,AGN,False,Overcorrection,"One day, a little | girl called Sara . She was walking over a bridge. Suddenly, she heard a man's voice calling her: ""Sara...Sara.. look down to the river."" Then Sara looked into the river. She was very scared . Because , because she saw a golden fish who was smiling at her and talking to her. After a few seconds, Sara felt that the golden fish was lovely. She had never seen any fish that had that wonderful colour and could talk with her. Because Sara didn't have any brothers and sisters, and her Mom and Dad needed to work every day, she was very lonely. ",NOUN VERB PROPN,"One day, a little | girls called Sara . She was walking over a bridge. Suddenly, she heard a man's voice calling her: ""Sara...Sara.. look down to the river."" Then Sara looked into the river. She was very scared . Because , because she saw a golden fish who was smiling at her and talking to her. After a few seconds, Sara felt that the golden fish was lovely. She had never seen any fish that had that wonderful colour and could talk with her. Because Sara didn't have any brothers and sisters, and her Mom and Dad needed to work every day, she was very lonely. ",NOUN VERB PROPN,AGN NOUN VERB PROPN,True,False
170,85,FN,True,Missing plural,"I decided to do something for this man , my . My first move was to check whether there was any solid or liquid which could have blocked his airways. And I checked his body condition . After that I turned on the car's | lights in order to warn the passing cars. ",NOUN ADP NOUN,"I decided to do something for this man , my . My first move was to check whether there was any solid or liquid which could have blocked his airways. And I checked his body condition . After that I turned on the car's | light in order to warn the passing cars. ",NOUN ADP NOUN,FN NOUN ADP NOUN,True,True
1908,12,UT,False,Overcorrecting for prepositions introducing subordinate phrases,"As for the colours, I think metallic colours, especially silver, will be the most popular. As different kinds of fabrics will be invented &amp; and the clothings will never be just cotton as always been seen . Maybe paper can also be a fabric used | to make clothing and for those who like to wear new clothes every day. They can be thrown away after wearing them and are light enough to be carried around whenever you want to change what you're wearing. ",PART VERB NOUN,"As for the colours, I think metallic colours, especially silver, will be the most popular. As different kinds of fabrics will be invented &amp; and the clothings will never be just cotton as always been seen . Maybe paper can also be a fabric used | for to make clothing and for those who like to wear new clothes every day. They can be thrown away after wearing them and are light enough to be carried around whenever you want to change what you're wearing. ",ADP PART VERB,UT ADP PART VERB,True,False
1629,92,MP,True,Chinese uses commas to mark the end of a complete thought,"I agree! Sometimes shopping is not always enjoyable. Most people might think, why would I say that , ? because shopping is a very good entertainment | , especially for women, like me. ",PUNCT ADV ADP,"I agree! Sometimes shopping is not always enjoyable. Most people might think, why would I say that , ? because shopping is a very good entertainment | especially for women, like me. ",ADV ADP NOUN,MP ADV ADP NOUN,True,True
756,30,DA,False,Using possessive case inappropriately,I would like to ask for some information about what kind of clothes I have to wear and how much | you charge.,PRON VERB PUNCT,I would like to ask for some information about what kind of clothes I have to wear and how much | your charge.,DET NOUN PUNCT,DA DET NOUN PUNCT,True,False
715,63,RY,False,Incorrect synonym used,"And the last three hours before you return, we can go to the ""Imax"" cinema to watch a 3-D film! | Afterwards we will eat in the KFC. Then we will all take you and the students to the airport. That's everything. I wait you. ",ADV PRON VERB,"And the last three hours before you return, we can go to the ""Imax"" cinema to watch a 3-D film! | After we will eat in the KFC. Then we will all take you and the students to the airport. That's everything. I wait you. ",ADP PRON VERB,RY ADP PRON VERB,True,False
1698,10,MD,True,Chinese has no articles and doesn't use classifiers in this situation,"At my home, there are many rules, because I'm careless, so I am not allowed to smoke at home either: and I'm not allowed to use | the telephone, because last year I ran up a £1000 bill for one month , my . My parents were very angry with me, so they told me I am not to use | the telephone any more , oh . Oh , how poor ! ",DET NOUN PUNCT,"At my home, there are many rules, because I'm careless, so I am not allowed to smoke at home either: and I'm not allowed to use | telephone, because last year I ran up a £1000 bill for one month , my . My parents were very angry with me, so they told me I am not to use | telephone any more , oh . Oh , how poor ! ",NOUN PUNCT ADP,MD NOUN PUNCT ADP,True,True
2399,150,RT,False,Chinese doesn't use the word in this context; Word omitted even though in the Chinese translation it would be there,"First of all, we want to say thanks to you because we know the effort you have made organising this excellent programme, but we would really like to go to the London fashion and leisure show we saw in the advertisement. We think that perhaps on Tuesday March 14 , we could change the time when we go to the Science Museum, and (we) go to the Museum earlier, perhaps at half past eight | in the morning, so we could go later, at ten o'clock, to the show, and we could also delay going shopping on that afternoon, because the show lasts till seven o'clock | in the evening. And we thought that we could go shopping the next day, because we do not have anything to do on that afternoon. ",ADP DET NOUN,"First of all, we want to say thanks to you because we know the effort you have made organising this excellent programme, but we would really like to go to the London fashion and leisure show we saw in the advertisement. We think that perhaps on Tuesday March 14 , we could change the time when we go to the Science Museum, and (we) go to the Museum earlier, perhaps at half past eight | on the morning, so we could go later, at ten o'clock, to the show, and we could also delay going shopping on that afternoon, because the show lasts till seven o'clock | on the evening. And we thought that we could go shopping the next day, because we do not have anything to do on that afternoon. ",ADP DET NOUN,RT ADP DET NOUN,True,False
707,55,DY,False,Spelling error,"In fact, some of my classmates have seen an advertisement for the 'London Fashion and Leisure Show'. | Coincidentally the show is in London and on Tuesday March 14, which is during the period we are in London for the three-day programme. We think it is a great opportunity because we are very interested in art and fashion. Of course, we are interested in leisure as well. Therefore, if it is possible, we would like to see the show in the afternoon on 14 March instead of going shopping. ",ADV DET NOUN,"In fact, some of my classmates have seen an advertisement for the 'London Fashion and Leisure Show'. | Concidently the show is in London and on Tuesday March 14, which is during the period we are in London for the three-day programme. We think it is a great opportunity because we are very interested in art and fashion. Of course, we are interested in leisure as well. Therefore, if it is possible, we would like to see the show in the afternoon on 14 March instead of going shopping. ",ADV DET NOUN,DY ADV DET NOUN,True,False
537,97,RP,True,Word not capitalized,"We have booked the hotel for the group. It is the "" | Palace Hotel"", which is about 10 miles away from our College , the . The hotel will have a coach to pick the group up from the airport on the 19th of June and then take the group to the Conference and return to the hotel every day. ",PROPN PROPN PUNCT,"We have booked the hotel for the group. It is the "" | palace Hotel"", which is about 10 miles away from our College , the . The hotel will have a coach to pick the group up from the airport on the 19th of June and then take the group to the Conference and return to the hotel every day. ",NOUN PROPN PUNCT,RP NOUN PROPN PUNCT,True,True
1273,0,TV,False,Using past participle instead of past tense,"I | went to your annual international art festival. Most of the events I went to were good, but I feel that the festival could be even better next year. So, I am writing to you with some of my opinions and suggestions. I hope it might help with next year's festival. ",VERB ADP DET,"I | had been to your annual international art festival. Most of the events I went to were good, but I feel that the festival could be even better next year. So, I am writing to you with some of my opinions and suggestions. I hope it might help with next year's festival. ",VERB VERB ADP,TV VERB VERB ADP,True,False
1560,23,MP,True,Chinese uses commas to mark the end of a complete thought,"To help us to live happily | , scientists can easily predict the changes on earth , so that we can have time to prepare or defend ourselves from natural disasters. ",PUNCT NOUN VERB,"To help us to live happily | scientists can easily predict the changes on earth , so that we can have time to prepare or defend ourselves from natural disasters. ",NOUN VERB ADV,MP NOUN VERB ADV,True,True
1227,29,MT,True,Grammatical to exclude or include the word in Chinese,"Finally, I would like to know | about the weather in California. Do I need to take very many clothes? Could you tell me the amount of money I should have during the holiday? ",ADP DET NOUN,"Finally, I would like to know | the weather in California. Do I need to take very many clothes? Could you tell me the amount of money I should have during the holiday? ",DET NOUN ADP,MT DET NOUN ADP,True,True
2346,97,RT,True,"""of"" maps to the gentive/possessive marker 的 in Chinese","Above is all the information you asked for , however . However , there are some things I'd like to know; the first is about the clothes , what . What kind of clothes do I need to take with me? And another question is what are the prices of things like there, which I want to know so that I can make a better budget | for my trip. ",ADP DET NOUN,"Above is all the information you asked for , however . However , there are some things I'd like to know; the first is about the clothes , what . What kind of clothes do I need to take with me? And another question is what are the prices of things like there, which I want to know so that I can make a better budget | of my trip. ",ADP DET NOUN,RT ADP DET NOUN,True,True
955,73,W,False,Order is incorrect in Chinese and English,"Around it, there are many restaurants and shops as the building attracts a lot of people. Inside, there are fast-food restaurants and shops as well. And it is easy to get to. Just take the | 83 bus or the sub-way subway . In here, you can find everything that you want. Hope you like it. ",NUM NOUN CCONJ,"Around it, there are many restaurants and shops as the building attracts a lot of people. Inside, there are fast-food restaurants and shops as well. And it is easy to get to. Just take the | bus 83 or the sub-way subway . In here, you can find everything that you want. Hope you like it. ",NOUN NUM CCONJ,W NOUN NUM CCONJ,True,False
1360,89,TV,False,Overcorrection,"Today, Pat and Lily are still friends. But Lily never tells her what she really wants and what she really | thinks about things. Pat felt very sorry about that but it was too late. ",VERB ADP NOUN,"Today, Pat and Lily are still friends. But Lily never tells her what she really wants and what she really | thought about things. Pat felt very sorry about that but it was too late. ",VERB ADP NOUN,TV VERB ADP NOUN,True,False
2518,63,M,False,Incorrect/incomplete expression used,"For the afternoon free time on the last day . There , there are a wide variety of choices | in the things that they can do. They can play tennis, do athletics, swim... and many other sports activities in our school, if they want to. Or they can also visit Epsom Town. There are shops which sell clothes, food, and books ... They can decide what they want to do , it's . It's entirely up to them. ",ADP DET NOUN,"For the afternoon free time on the last day . There , there are a wide variety of choices | that they can do. They can play tennis, do athletics, swim... and many other sports activities in our school, if they want to. Or they can also visit Epsom Town. There are shops which sell clothes, food, and books ... They can decide what they want to do , it's . It's entirely up to them. ",DET PRON VERB,M DET PRON VERB,True,False
298,61,RN,False,Spelling error,"I am writing to inform you that I can only go in July, the summer holiday, because I have got a place at university and it will start in August. Is the time I request available? I would also like to ask accommodation you offer is in | tents or log cabins. If I can choose I would prefer | tents. I like to sleep on open land and see the sun come up in the morning. ",NOUN CCONJ NOUN,"I am writing to inform you that I can only go in July, the summer holiday, because I have got a place at university and it will start in August. Is the time I request available? I would also like to ask accommodation you offer is in | tens or log cabins. If I can choose I would prefer | tens. I like to sleep on open land and see the sun come up in the morning. ",NOUN CCONJ NOUN,RN NOUN CCONJ NOUN,True,False
668,16,DY,False,Spelling error,"I felt very upset about your advertisement was | totally different from the musical show. Firstly, I could not buy a discount ticket as you mentioned. Secondly, the show started at 20:15 p.m. instead of 19:30 p.m . Thirdly, the theatre restaurant was closed. But the worst thing is the actors were not Danny Brook and Tina Truelove. , It was really a letdown!! ",ADV ADJ ADP,"I felt very upset about your advertisement was | totaly different from the musical show. Firstly, I could not buy a discount ticket as you mentioned. Secondly, the show started at 20:15 p.m. instead of 19:30 p.m . Thirdly, the theatre restaurant was closed. But the worst thing is the actors were not Danny Brook and Tina Truelove. , It was really a letdown!! ",ADV ADJ ADP,DY ADV ADJ ADP,True,False
1467,200,TV,False,Past perfect used instead of past tense,"First of all, we want to say thanks to you because we know the effort you have made organising this excellent programme, but we would really like to go to the London fashion and leisure show we saw in the advertisement. We think that perhaps on Tuesday March 14 , we could change the time when we go to the Science Museum, and (we) go to the Museum earlier, perhaps at half past eight in the morning, so we could go later, at ten o'clock, to the show, and we could also delay going shopping on that afternoon, because the show lasts till seven o'clock in the evening. And we | thought that we could go shopping the next day, because we do not have anything to do on that afternoon. ",VERB ADP PRON,"First of all, we want to say thanks to you because we know the effort you have made organising this excellent programme, but we would really like to go to the London fashion and leisure show we saw in the advertisement. We think that perhaps on Tuesday March 14 , we could change the time when we go to the Science Museum, and (we) go to the Museum earlier, perhaps at half past eight in the morning, so we could go later, at ten o'clock, to the show, and we could also delay going shopping on that afternoon, because the show lasts till seven o'clock in the evening. And we | have thought that we could go shopping the next day, because we do not have anything to do on that afternoon. ",VERB VERB ADP,TV VERB VERB ADP,True,False
2480,23,M,True,Chinese does not have one verb direclty following another,"I was glad to hear the news from you and thank you very much! When you mentioned the period of my travelling I'm afraid I am only free in July . Because , because I go on holiday in July, naturally, and I have two terms in June and August. Therefore, I hope that you can agree to a suitable arrangement between you and me. Furthermore, I would like to stay in log cabins, which I feel | are a more American style of accommodation. In addition, it should not be too hot inside during July. ",VERB DET ADV,"I was glad to hear the news from you and thank you very much! When you mentioned the period of my travelling I'm afraid I am only free in July . Because , because I go on holiday in July, naturally, and I have two terms in June and August. Therefore, I hope that you can agree to a suitable arrangement between you and me. Furthermore, I would like to stay in log cabins, which I feel | more American style of accommodation. In addition, it should not be too hot inside during July. ",ADJ ADJ NOUN,M ADJ ADJ NOUN,True,True
1911,15,UT,False,"Overcorrection by adding ""to"" to show the object of transitive verbs","Lily was one of her best friends for three years. She enjoyed sharing everything with Pat, whatever it was. Nick was Lily's husband. Her husband had been fired the previous year. Lily felt very nervous about their financial problems and their future . As as they wanted to have a baby. She told | Pat about what had happened in her family . And and that she was worried. Of course, she knew Nick didn't like her to tell other people about his private . She told | Pat that she didn't want any other people to know about it except her. Pat also promised not to tell other people. ",PROPN ADP PRON,"Lily was one of her best friends for three years. She enjoyed sharing everything with Pat, whatever it was. Nick was Lily's husband. Her husband had been fired the previous year. Lily felt very nervous about their financial problems and their future . As as they wanted to have a baby. She told | to Pat about what had happened in her family . And and that she was worried. Of course, she knew Nick didn't like her to tell other people about his private . She told | to Pat that she didn't want any other people to know about it except her. Pat also promised not to tell other people. ",ADP PROPN ADP,UT ADP PROPN ADP,True,False
2228,50,UN,True,Word prior or after contains the word in Chinese equivalent,Women always enjoy shopping. But a lot of inconveniences annoy them. So they said they do not always enjoy shopping. First of all the | parking is not convenient and is expensive. Sometimes you can't find a place to park your car. Sometimes you have to park your car in a further place then walk to the supermarket.,NOUN VERB ADV,Women always enjoy shopping. But a lot of inconveniences annoy them. So they said they do not always enjoy shopping. First of all the | car parking is not convenient and is expensive. Sometimes you can't find a place to park your car. Sometimes you have to park your car in a further place then walk to the supermarket.,NOUN NOUN VERB,UN NOUN NOUN VERB,True,True
