,english,spanish,en_pos,es_pos
643,Can you see a woman over there?,¿Aló? ¿Puedo hablar a Hyean?,VERB PRON VERB DET NOUN ADV ADV PUNCT ,PUNCT ADV PUNCT PUNCT AUX VERB ADP PROPN PUNCT 
644,My class has more female students than male students.,¿Puedes ver a una mujer allá?,DET NOUN VERB ADJ ADJ NOUN ADP ADJ NOUN PUNCT ,PUNCT AUX VERB ADP DET NOUN ADV PUNCT 
645,I decided to travel to Busan this summer.,Mi clase tiene más estudiantes mujeres que estudiantes varones.,PRON VERB PART VERB ADP PROPN DET NOUN PUNCT ,DET NOUN VERB ADV NOUN NOUN PRON NOUN ADJ PUNCT 
646,This stop is Jonggak. The exit doors are on your left.,En estas vacaciones decidimos viajar a Busan.,DET NOUN VERB PROPN PUNCT DET NOUN NOUN VERB ADP DET NOUN PUNCT ,ADP DET NOUN VERB VERB ADP PROPN PUNCT 
647,I studied all day long for the history test .,Esta parada es Jonggak. Las puertas de la salida están a su izquierda.,PRON VERB DET NOUN ADV ADP DET NOUN NOUN PUNCT ,DET NOUN AUX PROPN PUNCT DET NOUN ADP DET NOUN AUX ADP DET NOUN PUNCT 
648,I got kicked off the basketball team because I didn't go to the practice this week.,Estudié todo el dia para la prueba de la historia.,PRON VERB VERB PART DET NOUN NOUN ADP PRON VERB ADV VERB ADP DET NOUN DET NOUN PUNCT ,VERB DET DET NOUN ADP DET NOUN ADP DET NOUN PUNCT 
649,Hold on. I'll get some paper and a pencil.,Fui eliminado del equipo de baloncesto porque no asistí al ensayo.,VERB PART PUNCT PRON AUX VERB DET NOUN CCONJ DET NOUN PUNCT ,AUX VERB ADP NOUN ADP NOUN SCONJ ADV VERB ADP NOUN PUNCT 
650,Open it up. It's a surprise gift.,Un momento. Conseguiré un papel y un lápiz.,VERB PRON PART PUNCT PRON VERB DET NOUN NOUN PUNCT ,DET NOUN PUNCT VERB DET NOUN CONJ DET NOUN PUNCT 
651,The door opened by itself.,"Ábrelo, es una sorpresa.",DET NOUN VERB ADP PRON PUNCT ,PROPN PUNCT AUX DET NOUN PUNCT 
652,I've lost my car keys.,La puerta se abrió por sí mismo.,PRON VERB VERB DET NOUN NOUN PUNCT ,DET NOUN PRON VERB ADP PRON ADJ PUNCT 
653,I studied very hard for the test.,He perdido mis llaves del coche.,PRON VERB ADV ADV ADP DET NOUN PUNCT ,AUX VERB DET NOUN ADP NOUN PUNCT 
654,I'll be living in England for a year.,Estudié muy duro para la prueba.,PRON AUX VERB VERB ADP PROPN ADP DET NOUN PUNCT ,VERB ADV ADJ ADP DET NOUN PUNCT 
655,How did you study English?,Viviré en Inglaterra por un año.,ADV VERB PRON VERB PROPN PUNCT ,VERB ADP PROPN ADP DET NOUN PUNCT 
656,"The movie was stupid, but the scenery was nice!",¿Cómo estudiaste inglés?,DET NOUN VERB ADJ PUNCT CCONJ DET NOUN VERB ADJ PUNCT ,PUNCT PRON DET NOUN PUNCT 
657,The bank is next to the building.,"¡La película era estúpida, pero el paisaje era agradable!",DET NOUN VERB ADJ ADP DET NOUN PUNCT ,PUNCT DET NOUN AUX ADJ PUNCT CONJ DET NOUN AUX ADJ PUNCT 
658,Give me an example.,El banco está al lado del edificio.,VERB PRON DET NOUN PUNCT ,DET NOUN AUX ADP NOUN ADP NOUN PUNCT 
659,Today I saw a really pretty girl.,Dame un ejemplo.,NOUN PRON VERB DET ADV ADJ NOUN PUNCT ,VERB DET NOUN PUNCT 
660,Are you going to arrive on schedule?,Hoy vi a muchacha realmente bonita.,VERB PRON VERB PART VERB ADP NOUN PUNCT ,ADV VERB ADP NOUN ADV ADJ PUNCT 
661,That song reminds me of the old days.,¿Vas a llegar en horario?,DET NOUN VERB PRON ADP DET ADJ NOUN PUNCT ,PUNCT AUX ADP VERB ADP NOUN PUNCT 
662,Today is my day off.,Esa canción me recuerda los viejos días.,NOUN VERB DET NOUN PART PUNCT ,DET NOUN PRON VERB DET ADJ NOUN PUNCT 
663,When are you coming?,Hoy es mi día franco.,ADV VERB PRON VERB PUNCT ,ADV AUX DET NOUN ADJ PUNCT 
664,I'm sorry to have kept you waiting for so long.,¿Cuándo vienes?,PRON VERB ADJ PART VERB VERB PRON VERB ADP ADV ADV PUNCT ,PUNCT PRON NOUN PUNCT 
665,Has it been a while since you've been back to your hometown?,Estoy apesadumbrado de haberte hecho esperar por tanto tiempo.,VERB PRON VERB DET NOUN ADP PRON VERB VERB ADV ADP DET NOUN PUNCT ,AUX ADJ ADP NOUN ADJ VERB ADP DET NOUN PUNCT 
666,Are these oranges fresh?,¿Hace mucho tiempo que no visita su ciudad natal?,VERB DET NOUN ADJ PUNCT ,PUNCT AUX DET NOUN SCONJ ADV VERB DET NOUN ADJ PUNCT 
667,The price of gasoline has gone up again.,¿Las naranjas están frescas?,DET NOUN ADP NOUN VERB VERB PART ADV PUNCT ,PUNCT DET NOUN AUX ADJ PUNCT 
668,Turn right at the park.,El precio de la gasolina ha aumentado otra vez.,VERB ADV ADP DET NOUN PUNCT ,DET NOUN ADP DET NOUN AUX VERB DET NOUN PUNCT 
669,Does your brother wear glasses?,Dar vuelta a la derecha en el parque.,VERB DET NOUN VERB NOUN PUNCT ,VERB NOUN ADP DET NOUN ADP DET NOUN PUNCT 
670,I work from 9 a.m. to 6 p.m.,¿Tu hermano usa anteojos?,PRON VERB ADP NUM NOUN ADP NUM NOUN ,PUNCT DET NOUN VERB NOUN PUNCT 
671,Come by this afternoon.,Trabajo a partir de las nueve de la mañana hasta las seis de la tarde.,VERB ADP DET NOUN PUNCT ,VERB ADP NOUN ADP DET NOUN ADP DET NOUN ADP DET NUM ADP DET NOUN PUNCT 
672,How many flights of stairs should I go up?,Venga luego a la tarde.,ADV ADJ NOUN ADP NOUN VERB PRON VERB PART PUNCT ,NOUN ADV ADP DET NOUN PUNCT 
673,I've decided to quit smoking this year.,¿Cuántos escalones tengo que subir?,PRON VERB VERB PART VERB NOUN DET NOUN PUNCT ,PUNCT NOUN NOUN VERB SCONJ VERB PUNCT 
674,"I read the book, 'Who moved my cheese?' today.",He decidido parar de fumar este año.,PRON VERB DET NOUN PUNCT PUNCT PRON VERB DET NOUN PUNCT PUNCT NOUN PUNCT ,AUX VERB AUX ADP VERB DET NOUN PUNCT 
675,Do you think these clothes will fit me?,"Hoy leí el libro, “¿Quién movió mi queso?”.",VERB PRON VERB DET NOUN VERB VERB PRON PUNCT ,ADV VERB DET NOUN PUNCT PROPN PUNCT PRON VERB DET NOUN PUNCT NOUN PUNCT 
676,You were completely drunk last night.,¿Piensas que estas ropas me quedarán bien?,PRON VERB ADV ADJ ADJ NOUN PUNCT ,PUNCT VERB SCONJ DET NOUN PRON VERB ADV PUNCT 
677,Why did you do that?,Ayer por la noche estabas totalmente tomado.,ADV VERB PRON VERB DET PUNCT ,ADV ADP DET NOUN NOUN ADV ADJ PUNCT 
678,I wake up late in the morning because I have nothing to do.,¿Por qué hiciste eso?,PRON VERB PART ADV ADP DET NOUN ADP PRON VERB NOUN PART VERB PUNCT ,PUNCT ADP PRON DET PRON PUNCT 
679,I wish I had been born in a foreign country.,Me desperté tarde por la mañana porque no tenía nada para hacer.,PRON VERB PRON VERB VERB VERB ADP DET ADJ NOUN PUNCT ,PRON VERB ADV ADP DET NOUN SCONJ ADV VERB PRON ADP VERB PUNCT 
680,Can you speak any foreign languages?,Me hubiese gustado ser nato en un país extranjero.,VERB PRON VERB DET ADJ NOUN PUNCT ,PRON AUX VERB AUX VERB ADP DET NOUN ADJ PUNCT 
681,There are many foreigners in Itaewon.,¿Sabes hablar idiomas extranjeros?,ADV VERB ADJ NOUN ADP PROPN PUNCT ,PUNCT VERB VERB NOUN ADJ PUNCT 
682,Press the red button on your left.,Hay muchos extranjeros en Itaewon.,VERB DET ADJ NOUN ADP DET NOUN PUNCT ,AUX DET NOUN ADP PROPN PUNCT 
683,Did you cook all these?,Presionar el botón rojo en su izquierda.,VERB PRON VERB DET DET PUNCT ,VERB DET NOUN ADJ ADP DET NOUN PUNCT 
684,I'm gaining weight these days.,¿Cocinaste todo ésto tú solo?,PRON VERB VERB NOUN DET NOUN PUNCT ,PUNCT VERB DET PRON PRON ADV PUNCT 
685,Greed has no limits.,Estoy aumentando de peso actualmente.,PROPN VERB DET NOUN PUNCT ,AUX VERB ADP NOUN ADV PUNCT 
686,Have we met before?,La avaricia no tiene límites.,VERB PRON VERB ADV PUNCT ,DET NOUN ADV VERB NOUN PUNCT 
687,"In my country, we are regarded as being one year old as soon as we're born.",¿Nos hemos visto anteriormente?,ADP DET NOUN PUNCT PRON VERB VERB ADP VERB NUM NOUN ADJ ADV ADV ADP PRON VERB VERB PUNCT ,PUNCT PRON AUX VERB ADV PUNCT 
688,Didn't you bring your umbrella?,"En nuestro país, cumplimos un año apenas nacemos.",VERB ADV PRON VERB DET NOUN PUNCT ,ADP DET NOUN PUNCT VERB DET NOUN ADV VERB PUNCT 
689,I have to ask my brother(sister) first.,¿No trajiste tu paraguas?,PRON VERB PART VERB DET NOUN PUNCT ADV PUNCT ,PUNCT ADV VERB DET NOUN PUNCT 
690,This milk seems to have gone bad.,Tengo que preguntar a mi hermano (hermana) primero.,DET NOUN VERB PART VERB VERB ADJ PUNCT ,VERB SCONJ VERB ADP DET NOUN PUNCT NOUN PUNCT ADV PUNCT 
691,I'm on the way to the post office.,Esta leche parece estar vencido.,PRON VERB ADP DET NOUN ADP DET NOUN NOUN PUNCT ,DET NOUN AUX AUX ADJ PUNCT 
692,"For exercise, I jog a kilometer everyday.",Estoy llendo a la oficina de correo.,ADP NOUN PUNCT PRON VERB DET NOUN ADV PUNCT ,AUX VERB ADP DET NOUN ADP NOUN PUNCT 
693,Kids probably play at the playground.,"Para ejercitar, corro un kilómetro diario todos lo días.",NOUN ADV VERB ADP DET NOUN PUNCT ,ADP VERB PUNCT NOUN DET NOUN ADJ DET PRON NOUN PUNCT 
694,Jeans and sneakers are not allowed.,Los niños están jugando probablemente en el patio.,PROPN CCONJ NOUN VERB ADV VERB PUNCT ,DET NOUN AUX VERB ADV ADP DET NOUN PUNCT 
695,Drive carefully.,Los pantalones vaqueros y las zapatillas de deporte no se permiten.,VERB ADV PUNCT ,DET NOUN ADJ CONJ DET NOUN ADP NOUN ADV PRON VERB PUNCT 
696,"My baby kept crying, so I took her out.",Maneje cuidadosamente.,DET NOUN VERB VERB PUNCT CCONJ PRON VERB PRON PART PUNCT ,PROPN ADV PUNCT 
697,"I tried to move my arms, but strangely they didn’t move.",Mi bebé lloraba tanto que lo traje conmigo.,PRON VERB PART VERB DET NOUN PUNCT CCONJ ADV PRON VERB ADV VERB PUNCT ,DET NOUN VERB ADV SCONJ PRON VERB PRON PUNCT 
698,I like the way you smile.,"Intenté moverme los brazos, pero extrañamente no se movieron.",PRON VERB DET NOUN PRON VERB PUNCT ,PROPN VERB DET NOUN PUNCT CONJ ADV ADV PRON VERB PUNCT 
699,"As soon as he saw me, he burst out in laughter.",Me gusta cuando sonríes.,ADV ADV ADP PRON VERB PRON PUNCT PRON VERB PART ADP NOUN PUNCT ,PRON VERB SCONJ ADJ PUNCT 
700,I bought this pair of shoes for thiry thousand won.,"Apenas me vió, comenzó a reir a carcajadas.",PRON VERB DET NOUN ADP NOUN ADP NOUN NUM NOUN PUNCT ,ADV PRON VERB PUNCT AUX ADP VERB ADP NOUN PUNCT 
701,He originally had such a pleasant personality.,Compré este par de los zapatos a tres mil wons.,PRON ADV VERB DET DET ADJ NOUN PUNCT ,VERB DET NOUN ADP DET NOUN ADP NUM NUM PROPN PUNCT 
702,I'll do it if you want.,"Originalmente, él tenía una personalidad muy agradable.",PRON AUX VERB PRON ADP PRON VERB PUNCT ,ADV PUNCT PRON VERB DET NOUN ADV ADJ PUNCT 
703,"They were on top of the table, not in the drawer.",Lo haré si lo deseas.,PRON VERB ADP NOUN ADP DET NOUN PUNCT ADV ADP DET NOUN PUNCT ,PRON VERB SCONJ PRON NOUN PUNCT 
704,I think that store has a bad location.,"Estaban encima de la tabla, no en el cajón.",PRON VERB ADP NOUN VERB DET ADJ NOUN PUNCT ,VERB ADV ADP DET NOUN PUNCT ADV ADP DET NOUN PUNCT 
705,Here's a little present for you.,Pienso que el almacén tiene una mala localización.,ADV VERB DET ADJ ADJ ADP PRON PUNCT ,VERB SCONJ DET NOUN VERB DET ADJ NOUN PUNCT 
706,That sounds difficult and dangerous.,Esto es un pequeño regalo para tí. ,DET VERB ADJ CCONJ ADJ PUNCT ,PRON AUX DET ADJ NOUN ADP NOUN PUNCT 
707,Busan is famous for its seafood.,Eso suena difícil y peligroso.,PROPN VERB ADJ ADP DET NOUN PUNCT ,PRON VERB ADJ CONJ ADJ PUNCT 
708,Do you have an account with our bank?,Busan es famoso por sus mariscos.,VERB PRON VERB DET NOUN ADP DET NOUN PUNCT ,PROPN AUX ADJ ADP DET NOUN PUNCT 
709,You don't mind spicy food?,¿Tiene una cuenta en nuestro banco?,PRON VERB ADV VERB ADJ NOUN PUNCT ,PUNCT VERB DET NOUN ADP DET NOUN PUNCT 
710,Do you listen to much music at home?,¿No importa si el alimento es picante?,VERB PRON VERB ADP ADJ NOUN ADP NOUN PUNCT ,PUNCT ADV VERB SCONJ DET NOUN AUX ADV PUNCT 
711,Why don't you tell him your opinion?,¿Escuchas mucha música en tu casa?,ADV VERB ADV PRON VERB PRON DET NOUN PUNCT ,PUNCT DET DET NOUN ADP DET NOUN PUNCT 
712,Marriage without love doesn't mean anything.,¿Por qué no le dices tu opinión?,NOUN ADP NOUN VERB ADV VERB NOUN PUNCT ,PUNCT ADP PRON ADV PRON VERB DET NOUN PUNCT 
713,Have you been to the doctor?,Un matrimonio sin amor no significa nada.,VERB PRON VERB ADP DET NOUN PUNCT ,DET NOUN ADP NOUN ADV VERB PRON PUNCT 
714,There are only ten chairs.,¿Has tenido una revisación con el doctor?,ADV VERB ADV NUM NOUN PUNCT ,PUNCT AUX VERB DET NOUN ADP DET NOUN PUNCT 
715,Maybe you have to have a tooth pulled out.,Hay solamente diez sillas.,ADV PRON VERB PART VERB DET NOUN VERB PART PUNCT ,AUX ADV NUM NOUN PUNCT 
716,Is this book yours?,Seguramente me tienen que sacar el diente.,VERB DET NOUN DET PUNCT ,ADV PRON VERB SCONJ VERB DET NOUN PUNCT 
717,Could you give this to Hyean?,¿Éste libro es tuyo?,VERB PRON VERB DET ADP PROPN PUNCT ,PUNCT DET NOUN AUX DET PUNCT 
718,The dishes here are pretty expensive.,¿Podrías darle esto a Hyean?,DET NOUN ADV VERB ADV ADJ PUNCT ,PUNCT PROPN VERB PRON ADP PROPN PUNCT 
719,Who won the baseball game last night?,Las comidas de aquí son bastante costosos.,PRON VERB DET NOUN NOUN ADJ NOUN PUNCT ,DET NOUN ADP ADV AUX ADV ADJ PUNCT 
720,"To this day, I have never had a girlfriend.",¿Quién ganó el juego del béisbol ayer por la noche?,ADP DET NOUN PUNCT PRON VERB ADV VERB DET NOUN PUNCT ,PUNCT PRON VERB DET NOUN ADP NOUN ADV ADP DET NOUN PUNCT 
721,Have you ever done this kind of work?,"Hasta ahora, nunca he tenido una novia.",VERB PRON ADV VERB DET NOUN ADP NOUN PUNCT ,ADP ADV PUNCT ADV AUX VERB DET NOUN PUNCT 
722,My opinion is this.,¿Alguna vez has hecho esta clase de trabajo?,DET NOUN VERB DET PUNCT ,PUNCT DET NOUN AUX VERB DET NOUN ADP NOUN PUNCT 
723,Koreans write their surname first and then their given name.,Mi opinión es ésta.,NOUN VERB DET NOUN ADV CCONJ ADV DET VERB NOUN PUNCT ,DET NOUN AUX PRON PUNCT 
724,I already went there last weekend.,Los coreanos primero escriben su apellido y luego su nombre.,PRON ADV VERB ADV ADJ NOUN PUNCT ,DET NOUN ADV VERB DET NOUN CONJ ADV DET NOUN PUNCT 
725,I like girls who look pure.,Ya he estado allí el fin de semana pasado.,PRON VERB NOUN PRON VERB ADJ PUNCT ,ADV AUX AUX ADV DET NOUN ADP NOUN ADJ PUNCT 
726,Not this time!,Me gustan las mujeres que tienen una imagen pura.,ADV DET NOUN PUNCT ,PRON VERB DET NOUN PRON VERB DET NOUN ADJ PUNCT 
727,This is my English teacher.,¡No esta vez!,DET VERB DET ADJ NOUN PUNCT ,PUNCT ADV DET NOUN PUNCT 
728,I have to score over 900 on the TOEIC exam.,Esta persona es mi profesor inglés.,PRON VERB PART VERB ADP NUM ADP DET PROPN NOUN PUNCT ,DET NOUN AUX DET NOUN ADJ PUNCT 
729,I had a strange dream last night.,Tengo que anotar sobre 900 en el examen de TOEIC.,PRON VERB DET ADJ NOUN ADJ NOUN PUNCT ,VERB SCONJ VERB ADP NUM ADP DET NOUN ADP NOUN PUNCT 
730,I don't want to talk about that anymore.,Ayer tuve un sueño extraño.,PRON VERB ADV VERB PART VERB ADP DET ADV PUNCT ,ADV VERB DET NOUN ADJ PUNCT 
731,What sites are you using to watch movies on the internet?,No deseo hablar más sobre el tema.,DET NOUN VERB PRON VERB PART VERB NOUN ADP DET NOUN PUNCT ,ADV VERB VERB ADV ADP DET NOUN PUNCT 
732,My husband went over to our neighbor's house after lunch.,¿Qué sitios de Internet estás utilizando para mirar películas?,DET NOUN VERB PART ADP DET NOUN PART NOUN ADP NOUN PUNCT ,PUNCT DET NOUN ADP PROPN AUX VERB ADP VERB NOUN PUNCT 
733,I don't think you have a reason to get angry.,Mi marido pasó a la casa de nuestro vecino después del almuerzo.,PRON VERB ADV VERB PRON VERB DET NOUN PART VERB ADJ PUNCT ,DET NOUN VERB ADP DET NOUN ADP DET NOUN ADV ADP NOUN PUNCT 
734,I have to leave now.,Pienso que no tienes motivos para estar enojado.,PRON VERB PART VERB ADV PUNCT ,VERB SCONJ ADV VERB NOUN ADP AUX ADJ PUNCT 
735,Come this way.,Ahora tengo que irme.,VERB DET NOUN PUNCT ,ADV VERB SCONJ NOUN PUNCT 
736,"I can't understand this memo, can you?",Venga por este lado.,PRON AUX ADV VERB DET NOUN PUNCT VERB PRON PUNCT ,VERB ADP DET NOUN PUNCT 
737,The computer defeated the human in the chess.,"No puedo entender esta nota, ¿y tú?",DET NOUN VERB DET NOUN ADP DET NOUN PUNCT ,ADV AUX VERB DET NOUN PUNCT PUNCT CONJ PRON PUNCT 
738,"After the scandal, the actor lost his popularity.",La computadora derrotó a un ser humano en el juego de ajedrez.,ADP DET NOUN PUNCT DET NOUN VERB DET NOUN PUNCT ,DET NOUN VERB ADP DET NOUN ADJ ADP DET NOUN ADP NOUN PUNCT 
739,It's time for us to say goodbye.,"Después del escándalo, el agente perdió su popularidad.",PRON VERB NOUN ADP PRON PART VERB NOUN PUNCT ,ADV ADP NOUN PUNCT DET NOUN VERB DET NOUN PUNCT 
740,It was the best day of my life.,Es hora de decir adiós.,PRON VERB DET ADJ NOUN ADP DET NOUN PUNCT ,AUX NOUN ADP VERB NOUN PUNCT 
741,How can I access the internet?,Fue el mejor día de mi vida.,ADV VERB PRON VERB DET NOUN PUNCT ,AUX DET ADJ NOUN ADP DET NOUN PUNCT 
742,Stop working sometimes and have fun.,¿Cómo puedo tener acceso a Internet?,VERB VERB ADV CCONJ VERB NOUN PUNCT ,PUNCT PRON AUX VERB NOUN ADP PROPN PUNCT 
743,You need a tourist visa to go to Japan.,"No sólo trabajes, también disfruta.",PRON VERB DET NOUN NOUN PART VERB ADP PROPN PUNCT ,PART ADV NOUN PUNCT ADV VERB PUNCT 
744,How are you doing with learning Japanese?,Necesita una visa turística para ir a Japón.,ADV VERB PRON VERB ADP VERB PROPN PUNCT ,VERB DET NOUN ADJ ADP VERB ADP PROPN PUNCT 
745,Did you get up late today?,¿Cómo le está llendo con el japonés ?,VERB PRON VERB PART ADJ NOUN PUNCT ,PUNCT PRON PRON AUX VERB ADP DET NOUN PUNCT 
746,I didn't mean to cause any trouble.,¿Se levantó tarde hoy?,PRON VERB ADV VERB PART VERB DET NOUN PUNCT ,PUNCT PRON VERB ADV ADV PUNCT 
747,I go to bed late at night and wake up early in the morning.,No tenia pensado causar problemas.,PRON VERB ADP NOUN ADV ADP NOUN CCONJ VERB PART ADV ADP DET NOUN PUNCT ,ADV VERB ADJ VERB NOUN PUNCT 
748,What was the last book you've read?,Yo duermo tarde y me despierto temprano.,PRON VERB DET ADJ NOUN PRON VERB VERB PUNCT ,PRON VERB ADV CONJ PRON VERB ADV PUNCT 
749,You seem to be lost.,¿Cuál el el libro más reciente que ha leído?,PRON VERB PART VERB VERB PUNCT ,PUNCT PRON DET DET NOUN ADV ADJ PRON AUX VERB PUNCT 
750,I lost my wallet in the store.,Me parece que se ha perdido.,PRON VERB DET NOUN ADP DET NOUN PUNCT ,PRON VERB SCONJ PRON AUX VERB PUNCT 
751,Don't talk with your mouth full.,Perdí mi billetera en el almacén.,VERB ADV VERB ADP DET NOUN ADJ PUNCT ,VERB DET NOUN ADP DET NOUN PUNCT 
752,When do you usually wear a hanbok?,No hablar con la boca llena.,ADV VERB PRON ADV VERB DET NOUN PUNCT ,ADV VERB ADP DET NOUN ADJ PUNCT 
753,It is on the table next to the bed.,¿Cuándo se usa generalmente el hanbok?,PRON VERB ADP DET NOUN ADV ADP DET NOUN PUNCT ,PUNCT PRON PRON VERB ADV DET NOUN PUNCT 
754,Promise you won't forget me.,"Está al lado de la cama, arriba de la mesa.",VERB PRON AUX ADV VERB PRON PUNCT ,AUX ADP NOUN ADP DET NOUN PUNCT ADV ADP DET NOUN PUNCT 
755,"Oh, I completely forgot.",Prométeme que no te olvidarás de mí.,INTJ PUNCT PRON ADV VERB PUNCT ,VERB SCONJ ADV PRON VERB ADP PRON PUNCT 
756,She always talks only about herself.,"Oh, me olvidé totalmente.",PRON ADV VERB ADV ADP PRON PUNCT ,INTJ PUNCT PRON VERB ADV PUNCT 
757,Don't ask me over and over again.,Ella habla solamente sobre ella misma.,VERB ADV VERB PRON PART CCONJ ADV ADV PUNCT ,PRON VERB ADV ADP PRON ADJ PUNCT 
758,I always sleep on my side.,No preguntes lo mismo constantemente.,PRON ADV VERB ADP DET NOUN PUNCT ,ADV PRON DET PRON ADV PUNCT 
759,Do you have problems with your car again?,Yo duermo siempre de costasdo.,VERB PRON VERB NOUN ADP DET NOUN ADV PUNCT ,PRON VERB ADV ADP NOUN PUNCT 
760,I grew up in the countryside.,¿El coche tiene otra vez problemas?,PRON VERB PART ADP DET NOUN PUNCT ,PUNCT DET NOUN VERB DET NOUN NOUN PUNCT 
761,Is this seat taken?,Yo  crecí en el campo.,VERB DET NOUN VERB PUNCT ,PRON SPACE VERB ADP DET NOUN PUNCT 
762,"Socrates said, 'Know yourself.'",¿Hay lugar aquí?,NOUN VERB PUNCT PUNCT VERB PRON PUNCT PUNCT ,PUNCT AUX NOUN ADV PUNCT 
763,Don't be shy. Just act natural.,"Socrates dijo, “conócete a ti mismo. ”",VERB ADV VERB ADJ PUNCT ADV VERB ADJ PUNCT ,PROPN VERB PUNCT PROPN VERB ADP PRON DET PUNCT NOUN 
764,Do you feel you lost your freedom after getting married?,No seas tímido. Actuá de forma natural.,VERB PRON VERB PRON VERB DET NOUN ADP VERB VERB PUNCT ,ADV VERB ADJ PUNCT NOUN ADP NOUN ADJ PUNCT 
765,Jajangmyeon is a very popular Chinese dish.,¿Siente que ha perdido la livertad después de haberse casado?,PROPN VERB DET ADV ADJ ADJ NOUN PUNCT ,PUNCT VERB SCONJ AUX VERB DET NOUN ADV ADP NOUN ADJ PUNCT 
766,Can I ride my bicycle outside?,Jajangmyeon es un plato chino muy popular.,VERB PRON VERB DET NOUN ADV PUNCT ,PROPN AUX DET NOUN ADJ ADV ADJ PUNCT 
767,Do you often go to the movies?,¿Puedo andar en bicicleta afuera?,VERB PRON ADV VERB ADP DET NOUN PUNCT ,PUNCT AUX VERB ADP NOUN ADJ PUNCT 
768,"You graduated last year, didn't you?",¿Va a menudo a ver películas?,PRON VERB ADJ NOUN PUNCT VERB ADV PRON PUNCT ,PUNCT AUX ADP NOUN ADP VERB NOUN PUNCT 
769,Two big suitcases and a small one.,"¿Te graduastes el año pasado, no?",NUM ADJ NOUN CCONJ DET ADJ NUM PUNCT ,PUNCT DET ADJ DET NOUN ADJ PUNCT ADV PUNCT 
770,Would you like a cup of coffee?,Dos maletas grandes y uno pequeño.,VERB PRON VERB DET NOUN ADP NOUN PUNCT ,NUM NOUN ADJ CONJ PRON ADJ PUNCT 
771,Can you hear me well?,¿Tendria el gusto de tomar una taza de café?,VERB PRON VERB PRON ADJ PUNCT ,PUNCT VERB DET NOUN ADP VERB DET NOUN ADP NOUN PUNCT 
772,He speaks English very well.,Él habla inglés muy bien.,PRON VERB PROPN ADV ADV PUNCT ,PRON VERB ADJ ADV ADV PUNCT 
773,I feel so sleepy.,Siento tanto sueño.,PRON VERB ADV ADJ PUNCT ,VERB ADV NOUN PUNCT 
774,Stay here for a moment.,Permanece aquí por un momento.,VERB ADV ADP DET NOUN PUNCT ,VERB ADV ADP DET NOUN PUNCT 
775,Let me think for a while.,Déjeme pensar por un instante.,VERB PRON VERB ADP DET NOUN PUNCT ,VERB VERB ADP DET NOUN PUNCT 
776,Brush your teeth before sleeping.,Antes de dormir cepíllate los dientes.,PROPN DET NOUN ADP VERB PUNCT ,ADV ADP VERB ADP DET NOUN PUNCT 
777,Hold my hand.,Sostenga de mi mano.,VERB DET NOUN PUNCT ,VERB ADP DET NOUN PUNCT 
778,I came across it in a magazine.,Lo vi de casualidad en la revista.,PRON VERB ADP PRON ADP DET NOUN PUNCT ,DET VERB ADP NOUN ADP DET NOUN PUNCT 
779,I turned the page of the calendar.,Di vuelta la página del calendario.,PRON VERB DET NOUN ADP DET NOUN PUNCT ,VERB VERB DET NOUN ADP NOUN PUNCT 
780,Don't be angry. It was just for fun.,No se enoje. Era solo una broma.,VERB ADV VERB ADJ PUNCT PRON VERB ADV ADP NOUN PUNCT ,ADV PRON VERB PUNCT AUX ADV DET NOUN PUNCT 
781,I prefer red roses to yellow ones.,Prefiero rosas rojas en vez de amarillas.,PRON VERB ADJ NOUN ADP ADJ NOUN PUNCT ,VERB NOUN ADJ ADP NOUN ADP NOUN PUNCT 
782,Have you decided on the time and the place?,¿Has decidido el tiempo y el lugar?,VERB PRON VERB ADP DET NOUN CCONJ DET NOUN PUNCT ,PUNCT AUX VERB DET NOUN CONJ DET NOUN PUNCT 
783,My restaurant uses only fresh ingredients.,Nuestro restaurante utiliza solo ingredientes frescos.,DET NOUN VERB ADJ ADJ NOUN PUNCT ,DET NOUN VERB ADV NOUN ADJ PUNCT 
784,I'm finding this movie extremely boring.,Esta película es realmente aburrida.,PRON VERB VERB DET NOUN ADV ADJ PUNCT ,DET NOUN AUX ADV ADJ PUNCT 
785,This is so fun!,¡Esto está realmente divertido!,DET VERB ADV ADJ PUNCT ,PUNCT PRON AUX ADV ADJ PUNCT 
786,I inherited a huge property from my parents.,Heredé mucha herencia por parte de mis padres.,PRON VERB DET ADJ NOUN ADP DET NOUN PUNCT ,PROPN DET NOUN ADP NOUN ADP DET NOUN PUNCT 
787,Do I know you?,¿Me conoce?,VERB PRON VERB PRON PUNCT ,PUNCT PRON VERB PUNCT 
788,Look at that man over there.,Mire a esa persona.,VERB ADP DET NOUN ADV ADV PUNCT ,NOUN ADP DET NOUN PUNCT 
789,Look at that. A puppy with an injured leg!,Mira eso. ¡Un perrito se ha lastimado la pata!,VERB ADP DET PUNCT DET NOUN ADP DET ADJ NOUN PUNCT ,VERB PRON PUNCT PUNCT DET NOUN PRON AUX VERB DET NOUN PUNCT 
790,That place is always crowded with people.,Allí siempre se llena de gente.,DET NOUN VERB ADV VERB ADP NOUN PUNCT ,ADV ADV PRON VERB ADP NOUN PUNCT 
791,There's a gas station over there.,Allí hay una gasolinera. ,ADV VERB DET NOUN NOUN ADP ADV PUNCT ,ADV AUX DET NOUN PUNCT 
792,What are you going to do tomorrow evening?,¿Qué va a hacer mañana por la noche?,PRON VERB PRON VERB PART VERB NOUN NOUN PUNCT ,PUNCT PRON AUX ADP VERB ADV ADP DET NOUN PUNCT 
793,Put it down in that corner over there.,"Póngalo allí, en la esquina.",VERB PRON PART ADP DET NOUN ADP ADV PUNCT ,NOUN ADV PUNCT ADP DET NOUN PUNCT 
794,"Write down your name here, please.","Escriba su nombre aquí, por favor.",VERB PART DET NOUN ADV PUNCT INTJ PUNCT ,ADV DET NOUN ADV PUNCT ADP NOUN PUNCT 
795,There are few men working at my company.,Hay pocas personas que trabajan en mi compañía.,ADV VERB ADJ NOUN VERB ADP DET NOUN PUNCT ,AUX DET NOUN PRON VERB ADP DET NOUN PUNCT 
796,The store that was here before is now gone.,El almacén que estaba antes aquí desapereció.,DET NOUN DET VERB ADV ADV VERB ADV VERB PUNCT ,DET NOUN PRON AUX ADV ADV VERB PUNCT 
797,Our university boasts a tradition that goes back 100 years.,Nuestra universidad se enorgullese de sus 100 años de tradición.,DET NOUN VERB DET NOUN DET VERB ADV NUM NOUN PUNCT ,DET NOUN PRON VERB ADP PRON NUM NOUN ADP NOUN PUNCT 
798,Please tell him Hyean called.,Por favor dígale que  Hyean la ha llamado.,INTJ VERB PRON PROPN VERB PUNCT ,ADP NOUN VERB SCONJ SPACE PROPN PRON AUX VERB PUNCT 
799,He seemed to be a completely different person.,Él parecía ser una persona totalmente diferente.,PRON VERB PART VERB DET ADV ADJ NOUN PUNCT ,PRON AUX AUX DET NOUN ADV ADJ PUNCT 
800,Call 911!,¡Llamá al 911!,VERB NUM PUNCT ,PUNCT PROPN ADP NUM PUNCT 
801,Can I have your phone number?,¿Me enseñas tu número de teléfono?,VERB PRON VERB DET NOUN NOUN PUNCT ,PUNCT PRON VERB DET NOUN ADP NOUN PUNCT 
802,"When she was young, she was really beautiful.","Cuando ella era joven, era realmente hermosa.",ADV PRON VERB ADJ PUNCT PRON VERB ADV ADJ PUNCT ,SCONJ PRON AUX ADJ PUNCT AUX ADV ADJ PUNCT 
