,english,spanish,en_pos,es_pos
0,The store opens at 10 A.M.,El almacén abre a las 10 de la mañana.,DET NOUN VERB ADP NUM PROPN ,DET NOUN VERB ADP DET NUM ADP DET NOUN PUNCT 
1,Do you like it? What's the price?,¿Te gusta? ¿Cuál es el precio?,VERB PRON VERB PRON PUNCT PRON VERB DET NOUN PUNCT ,PUNCT PRON VERB PUNCT PUNCT PRON AUX DET NOUN PUNCT 
2,My house is near my school.,Mi casa está cerca de mi escuela.,DET NOUN VERB ADP DET NOUN PUNCT ,DET NOUN AUX ADV ADP DET NOUN PUNCT 
3,I sometimes drink beer.,A veces bebo cerveza.,PRON ADV VERB NOUN PUNCT ,ADP NOUN ADJ NOUN PUNCT 
4,"Come tomorrow, if possible.","Venga mañana, si es posible.",VERB NOUN PUNCT ADP ADJ PUNCT ,VERB ADV PUNCT SCONJ AUX ADJ PUNCT 
5,My father went to Seoul early in the morning.,Mi padre fue a Seul temprano por la mañana.,DET NOUN VERB ADP PROPN ADV ADP DET NOUN PUNCT ,DET NOUN AUX ADP PROPN ADV ADP DET NOUN PUNCT 
6,I taught her how to drive.,Le enseñé cómo conducir.,PRON VERB PRON ADV PART VERB PUNCT ,PRON VERB PRON VERB PUNCT 
7,Have you looked inside your bag?,¿Has mirado dentro de tu bolso?,VERB PRON VERB ADP DET NOUN PUNCT ,PUNCT VERB ADJ ADV ADP DET NOUN PUNCT 
8,Oil is lighter than water.,El aceite es más ligero que el agua.,NOUN VERB ADJ ADP NOUN PUNCT ,DET NOUN AUX ADV ADJ SCONJ DET NOUN PUNCT 
9,My favorite singer is Yongpil Jo.,Mi cantante preferido es Yongpil Jo.,DET ADJ NOUN VERB PROPN PROPN PUNCT ,DET NOUN ADJ AUX PROPN PROPN PUNCT 
10,My chest was hurting since last night.,Me duele el pecho desde el ayer por la noche.,DET NOUN VERB VERB ADP ADJ NOUN PUNCT ,PRON VERB DET NOUN ADP DET NOUN ADP DET NOUN PUNCT 
11,"Sit there, in the middle.","Sientate allí, en el centro.",VERB ADV PUNCT ADP DET NOUN PUNCT ,PROPN ADV PUNCT ADP DET NOUN PUNCT 
12,It is good to read books in the fall.,Es bueno leer los libros en otoño.,PRON VERB ADJ PART VERB NOUN ADP DET NOUN PUNCT ,AUX ADJ VERB DET NOUN ADP NOUN PUNCT 
13,I like skiing the most.,Me gusta más el esquí.,PRON VERB VERB DET ADV PUNCT ,PRON VERB ADV DET NOUN PUNCT 
14,Almost every home is hooked up to the internet now.,Ahora casi todos los hogares estan conectados al internet.,ADV DET NOUN VERB VERB PART ADP DET NOUN ADV PUNCT ,ADV ADV DET DET NOUN VERB ADJ ADP NOUN PUNCT 
15,Did you bring towels?,¿Trajiste las toallas?,VERB PRON VERB NOUN PUNCT ,PUNCT VERB DET NOUN PUNCT 
16,The whole family has caught a cold.,La familia entera se ha resfriado.,DET ADJ NOUN VERB VERB DET NOUN PUNCT ,DET NOUN ADJ PRON AUX VERB PUNCT 
17,They sell various kinds of things at the shop.,Venden varias clases de cosas en la tienda.,PRON VERB ADJ NOUN ADP NOUN ADP DET NOUN PUNCT ,VERB DET NOUN ADP NOUN ADP DET NOUN PUNCT 
18,She has a beautiful voice.,Ella tiene una voz hermosa.,PRON VERB DET ADJ NOUN PUNCT ,PRON VERB DET NOUN ADJ PUNCT 
19,The other three classes are one hour each.,Las otras tres clases restantes son de una hora cada una.,DET ADJ NUM NOUN VERB NUM NOUN DET PUNCT ,DET DET NUM NOUN ADJ AUX ADP DET NOUN DET PRON PUNCT 
20,I wanted to be a nurse when I was younger.,Deseé ser enfermera cuando era más joven.,PRON VERB PART VERB DET NOUN ADV PRON VERB ADJ PUNCT ,VERB AUX NOUN SCONJ AUX ADV ADJ PUNCT 
21,Do you like ribs?,¿Te gustan las costillas?,VERB PRON ADP NOUN PUNCT ,PUNCT PRON VERB DET NOUN PUNCT 
22,I think I have a cold.,Creo que me he resfriado.,PRON VERB PRON VERB DET NOUN PUNCT ,VERB SCONJ PRON AUX VERB PUNCT 
23,Thank you.,Gracias.,VERB PRON PUNCT ,NOUN PUNCT 
24,I got a strange feeling when I saw him.,Tuve una sensación extraña cuando lo vi.,PRON VERB DET ADJ NOUN ADV PRON VERB PRON PUNCT ,VERB DET NOUN ADJ SCONJ PRON VERB PUNCT 
25,It's getting cold suddenly.,De repente está haciendo frío.,PRON VERB VERB ADJ ADV PUNCT ,ADP NOUN AUX VERB NOUN PUNCT 
26,The price of vegetables rose this year.,El precio de los vegetales ha subido este año.,DET NOUN ADP NOUN VERB DET NOUN PUNCT ,DET NOUN ADP DET NOUN AUX VERB DET NOUN PUNCT 
27,The Han river is the biggest river in Korea.,El río de Han es el río más grande de Corea.,DET PROPN NOUN VERB DET ADJ NOUN ADP PROPN PUNCT ,DET NOUN ADP PROPN AUX DET NOUN ADV ADJ ADP PROPN PUNCT 
28,My teacher emphasized process over results.,Mi profesor acentuó más el proceso que los resultados.,DET NOUN VERB NOUN ADP NOUN PUNCT ,DET NOUN VERB ADV DET NOUN PRON DET NOUN PUNCT 
29,Wow! she has a very strong serve.,¡Waw! Ella tiene un saque muy fuerte.,INTJ PUNCT PRON VERB DET ADV ADJ NOUN PUNCT ,PUNCT INTJ PUNCT PRON VERB DET NOUN ADV ADJ PUNCT 
30,We went to the same school as children.,Fuimos a la misma escuela de niños.,PRON VERB ADP DET ADJ NOUN ADP NOUN PUNCT ,VERB ADP DET DET NOUN ADP NOUN PUNCT 
31,Let's do it together.,Hagámoslo juntos.,VERB PRON VERB PRON ADV PUNCT ,CONJ ADJ PUNCT 
32,I'd like to raise a dog.,Quisiera criar un perro.,PRON AUX VERB PART VERB DET NOUN PUNCT ,VERB VERB DET NOUN PUNCT 
33,These candies cost a hundred won a piece.,Estos caramelos costaron cien won cada uno.,DET NOUN VERB DET NUM VERB DET NOUN PUNCT ,DET NOUN VERB NUM NOUN DET PRON PUNCT 
34,Hyean and I have been married for three months.,Hyean y yo nos casamos hace tres meses.,PROPN CCONJ PRON VERB VERB VERB ADP NUM NOUN PUNCT ,VERB CONJ PRON PRON VERB AUX NUM NOUN PUNCT 
35,See you there.,Te veo allí.,VERB PRON ADV PUNCT ,PRON VERB ADV PUNCT 
36,There are many cars in this street.,Hay muchos coches en esta calle.,ADV VERB ADJ NOUN ADP DET NOUN PUNCT ,AUX DET NOUN ADP DET NOUN PUNCT 
37,Look at yourself in the mirror.,Mirar se en el espejo.,VERB ADP PRON ADP DET NOUN PUNCT ,VERB PRON ADP DET NOUN PUNCT 
38,It's almost finished.,Casi listo.,PRON VERB ADV VERB PUNCT ,ADV ADJ PUNCT 
39,I'm not telling a lie.,No estoy mintiendo.,PRON VERB ADV VERB DET NOUN PUNCT ,ADV AUX VERB PUNCT 
40,You look worried today.,Hoy pareces preocupado.,PRON VERB ADJ NOUN PUNCT ,ADV NOUN ADJ PUNCT 
41,Alcohol is bad for your health.,El alcohol es malo para tu salud.,NOUN VERB ADJ ADP DET NOUN PUNCT ,DET NOUN AUX ADJ ADP DET NOUN PUNCT 
42,It is at the back of this building.,Está en la parte posterior de este edificio.,PRON VERB ADP DET NOUN ADP DET NOUN PUNCT ,AUX ADP DET NOUN ADJ ADP DET NOUN PUNCT 
43,Why are you walking so fast?,¿Por qué estás caminando tan rápido?,ADV VERB PRON VERB ADV ADV PUNCT ,PUNCT ADP PRON AUX VERB ADV ADJ PUNCT 
44,Hang clothes on a hanger.,Cuelga la ropa en la percha.,VERB NOUN ADP DET NOUN PUNCT ,VERB DET NOUN ADP DET NOUN PUNCT 
45,A picture is hanging on the wall.,El cuadro está colgado en la pared.,DET NOUN VERB VERB ADP DET NOUN PUNCT ,DET NOUN AUX ADJ ADP DET NOUN PUNCT 
46,Would you like to go on foot or by car?,¿Prefieres ir a pie o en coche?,VERB PRON VERB PART VERB ADP NOUN CCONJ ADP NOUN PUNCT ,PUNCT NOUN VERB ADP NOUN CONJ ADP NOUN PUNCT 
47,How far have we come on foot?,¿Cuánto hemos venido a pie?,ADV ADV VERB PRON VERB ADP NOUN PUNCT ,PUNCT PRON AUX VERB ADP NOUN PUNCT 
48,A man was carrying a black bag.,Un hombre llevaba un bolso negro.,DET NOUN VERB VERB DET ADJ NOUN PUNCT ,DET NOUN VERB DET NOUN ADJ PUNCT 
49,Show me another one in the same color.,Muéstrame otro en el mismo color.,VERB PRON DET NOUN ADP DET ADJ NOUN PUNCT ,NOUN PRON ADP DET DET NOUN PUNCT 
50,Do you like computer games?,¿A ti te gustan los juegos de computadora?,VERB PRON ADP NOUN NOUN PUNCT ,PUNCT ADP PRON PRON VERB DET NOUN ADP NOUN PUNCT 
51,Winter in Korea sure is cold. ,El invierno en Corea es muy frío.,NOUN ADP PROPN ADV VERB ADJ PUNCT ,DET NOUN ADP PROPN AUX ADV ADJ PUNCT 
52,The married couple next door finally got divorced.,"La pareja de la puerta de al lado, finalmente se divorciaron.",DET ADJ NOUN ADJ NOUN ADV VERB VERB PUNCT ,DET NOUN ADP DET NOUN ADP ADP NOUN PUNCT ADV PRON VERB PUNCT 
53,I haven't decided yet.,No lo he decidido todavía.,PRON VERB ADV VERB ADV PUNCT ,ADV PRON AUX VERB ADV PUNCT 
54,Will you marry me?,¿Te casarías conmigo?,VERB PRON VERB PRON PUNCT ,PUNCT DET NOUN ADJ PUNCT 
55,Where is he going to have the wedding ceremony?,¿En dónde se va a realizar la boda?,ADV VERB PRON VERB PART VERB DET NOUN NOUN PUNCT ,PUNCT ADP PRON PRON AUX ADP VERB DET NOUN PUNCT 
56,The soccer game ended in a tie.,El partido del fútbol terminó en un empate.,DET NOUN NOUN VERB ADP DET NOUN PUNCT ,DET NOUN ADP NOUN VERB ADP DET NOUN PUNCT 
57,"In some cases, I tend to jump to conclusions.",En ciertos casos tomo las decisiones muy rápido.,ADP DET NOUN PUNCT PRON VERB PART VERB ADP NOUN PUNCT ,ADP DET NOUN SCONJ DET NOUN ADV ADJ PUNCT 
58,Did you call the police?,¿Llamaste a policía?,VERB PRON VERB DET NOUN PUNCT ,PUNCT VERB ADP NOUN PUNCT 
59,The scenery is really beautiful.,El paisaje es realmente hermoso.,DET NOUN VERB ADV ADJ PUNCT ,DET NOUN AUX ADV ADJ PUNCT 
60,It would be a good experience.,Sería una buena experiencia.,PRON VERB VERB DET ADJ NOUN PUNCT ,AUX DET ADJ NOUN PUNCT 
61,How many eggs are there in the refrigerator?,¿Cuántos huevos hay en el refrigerador?,ADV ADJ NOUN VERB ADV ADP DET NOUN PUNCT ,PUNCT NOUN NOUN AUX ADP DET NOUN PUNCT 
62,My nose bleeds continuously.,Mi nariz está sangrando continuamente.,DET NOUN VERB ADV PUNCT ,DET NOUN AUX VERB ADV PUNCT 
63,Goodbye.,Adiós.,INTJ PUNCT ,INTJ PUNCT 
64,What season do you like best?,¿Qué estación te gusta más?,DET NOUN VERB PRON VERB ADJ PUNCT ,PUNCT DET NOUN PRON VERB ADV PUNCT 
65,Any special plans?,¿Algún plan en especial?,DET ADJ NOUN PUNCT ,PUNCT DET NOUN ADP ADJ PUNCT 
66,Let's go have some meat.,Vayamos a comer carne.,VERB PRON VERB VERB DET NOUN PUNCT ,AUX ADP VERB NOUN PUNCT 
67,I learned Japanese as a second foreign language in high school.,Aprendí japonés como segundo idioma extranjero en la secundaria.,PRON VERB PROPN ADP DET ADJ ADJ NOUN ADP ADJ NOUN PUNCT ,PROPN ADJ SCONJ ADJ NOUN ADJ ADP DET NOUN PUNCT 
68,I'll be in high school next year.,Seré un estudiante secundario el próximo año.,PRON AUX VERB ADP ADJ NOUN ADJ NOUN PUNCT ,VERB DET NOUN ADJ DET ADJ NOUN PUNCT 
69,Thank you.,Gracias.,VERB PRON PUNCT ,NOUN PUNCT 
70,I think it is the cat.,Yo pienso que es el gato.,PRON VERB PRON VERB DET NOUN PUNCT ,PRON VERB SCONJ AUX DET NOUN PUNCT 
71,I couldn’t endure the pain.,No puedo aguantar el dolor.,PRON AUX ADV VERB DET NOUN PUNCT ,ADV AUX VERB DET NOUN PUNCT 
72,"I'm really hungry, too.",Yo también tengo hambre.,PRON VERB ADV ADJ PUNCT ADV PUNCT ,PRON ADV VERB NOUN PUNCT 
73,Many Koreans return to their hometown during Chusok.,Muchos coreanos vuelven a su ciudad natal durante Chusok.,ADJ PROPN VERB ADP DET NOUN ADP PROPN PUNCT ,DET NOUN VERB ADP DET NOUN ADJ ADP PROPN PUNCT 
74,I'll be there soon.,Estaré allí pronto.,PRON AUX VERB ADV ADV PUNCT ,VERB ADV ADV PUNCT 
75,This city is a good place to live.,Esta ciudad es un buen lugar a vivir.,DET NOUN VERB DET ADJ NOUN PART VERB PUNCT ,DET NOUN AUX DET ADJ NOUN ADP VERB PUNCT 
76,"Sorry, I threw the ball too hard.","Perdón, lancé la bola demasiado fuerte.",INTJ PUNCT PRON VERB DET NOUN ADV ADV PUNCT ,NOUN PUNCT VERB DET NOUN ADV ADJ PUNCT 
77,Wow! There's a lot to study.,¡Waw! Hay mucho para estudiar.,INTJ PUNCT ADV VERB DET NOUN PART VERB PUNCT ,PUNCT INTJ PUNCT AUX ADV ADP VERB PUNCT 
78,How big is the park?,¿Qué tan grande es el parque?,ADV ADJ VERB DET NOUN PUNCT ,PUNCT PRON ADV ADJ AUX DET NOUN PUNCT 
79,I worked in a shoe factory.,Trabajé en una fábrica de zapato.,PRON VERB ADP DET NOUN NOUN PUNCT ,NOUN ADP DET NOUN ADP NOUN PUNCT 
80,"These days, it is hard to find a pay phone.","Actualmente, es duro encontrar un teléfono público.",DET NOUN PUNCT PRON VERB ADJ PART VERB DET NOUN NOUN PUNCT ,ADV PUNCT AUX ADJ VERB DET NOUN ADJ PUNCT 
81,Can I borrow your notebook?,¿Me prestas tu cuaderno?,VERB PRON VERB DET NOUN PUNCT ,PUNCT PRON VERB DET NOUN PUNCT 
82,Can you give me a ride to Incheon airport?,¿Puede llevarme hasta el aeropuerto de Incheon?,VERB PRON VERB PRON DET NOUN ADP PROPN NOUN PUNCT ,PUNCT AUX ADJ ADP DET NOUN ADP PROPN PUNCT 
83,March 1 is a national holiday in Korea.,El 1 de marzo es feriado nacional en Corea.,PROPN NUM VERB DET ADJ NOUN ADP PROPN PUNCT ,DET NUM ADP NOUN AUX VERB ADJ ADP PROPN PUNCT 
84,What lesson are we on today?,¿Qué lección nos toca hoy?,DET NOUN VERB PRON ADP NOUN PUNCT ,PUNCT DET NOUN PRON VERB ADV PUNCT 
85,Is the tomato a fruit or a vegetable?,¿Es el tomate una fruta o un vegetal?,VERB DET NOUN DET NOUN CCONJ DET NOUN PUNCT ,PUNCT AUX DET NOUN DET NOUN CONJ DET NOUN PUNCT 
86,Leave some cookies for me.,Déjame algunas galletas para mí.,VERB DET NOUN ADP PRON PUNCT ,NOUN DET NOUN ADP PRON PUNCT 
87,Our relationship is over.,Nuestra relación se terminó. ,DET NOUN VERB ADV PUNCT ,DET NOUN PRON VERB PUNCT 
88,I'm OK.,Estoy bien.,PRON VERB ADJ PUNCT ,AUX ADV PUNCT 
89,Open your English textbook to page 10.,Abra su libro de inglés en la página 10.,VERB DET ADJ NOUN ADP NOUN NUM PUNCT ,VERB DET NOUN ADP NOUN ADP DET NOUN NUM PUNCT 
90,I want to be a history professor.,Deseo ser profesor de Historia.,PRON VERB PART VERB DET NOUN NOUN PUNCT ,VERB AUX NOUN ADP PROPN PUNCT 
91,"Oops, I left my wallet in the classroom.","Oops, dejé mi billetera en la sala de clases.",INTJ PUNCT PRON VERB DET NOUN ADP DET NOUN PUNCT ,ADV PUNCT VERB DET NOUN ADP DET NOUN ADP NOUN PUNCT 
92,It is better to use public transportation.,Es mejor utilizar el transporte público.,PRON VERB ADJ PART VERB ADJ NOUN PUNCT ,AUX ADJ VERB DET NOUN ADJ PUNCT 
93,I go to church every Sunday morning.,Voy a la iglesia cada domingo por la mañana..,PRON VERB ADP NOUN DET PROPN NOUN PUNCT ,AUX ADP DET NOUN DET NOUN ADP DET NOUN PUNCT 
94,The man was looking around the shop.,El hombre miraba alrededor de la tienda.,DET NOUN VERB VERB ADP DET NOUN PUNCT ,DET NOUN VERB ADV ADP DET NOUN PUNCT 
95,Please shine my shoes.,"Lústreme los zapatos, por favor.",INTJ VERB DET NOUN PUNCT ,VERB DET NOUN PUNCT ADP NOUN PUNCT 
96,There are no clouds in the sky.,No hay nubes en el cielo.,ADV VERB DET NOUN ADP DET NOUN PUNCT ,ADV AUX NOUN ADP DET NOUN PUNCT 
97,How many soldiers are there in Korea?,¿Cuántos soldados hay en Corea?,ADV ADJ NOUN VERB ADV ADP PROPN PUNCT ,PUNCT NOUN NOUN AUX ADP PROPN PUNCT 
98,How many books have you published?,¿Cuántos tomos has publicado?,ADV ADJ NOUN VERB PRON VERB PUNCT ,PUNCT NOUN VERB AUX VERB PUNCT 
99,Why are you plugging your ears?,¿Por qué estás tapando tus oídos?,ADV VERB PRON VERB DET NOUN PUNCT ,PUNCT ADP PRON AUX VERB DET NOUN PUNCT 
100,You're cute when you smile.,Eres lindo cuando sonríes.,PRON VERB ADJ ADV PRON VERB PUNCT ,AUX VERB SCONJ ADJ PUNCT 
101,Give me that book.,Dame ese libro.,VERB PRON DET NOUN PUNCT ,VERB DET NOUN PUNCT 
102,Will he come?,¿Él vendrá?,VERB PRON VERB PUNCT ,PUNCT PRON VERB PUNCT 
103,It sounds fun.,Eso suena divertido.,PRON VERB ADJ PUNCT ,PRON VERB ADJ PUNCT 
104,How's the weather over there?,¿Cómo está el tiempo allí?,ADV VERB DET NOUN ADV ADV PUNCT ,PUNCT PRON VERB DET NOUN ADV PUNCT 
105,What were you doing that night?,¿Qué hacías ese día por la noche?,PRON VERB PRON VERB DET NOUN PUNCT ,PUNCT DET NOUN DET NOUN ADP DET NOUN PUNCT 
106,We're just friends.,Somos solo amigos.,PRON VERB ADV NOUN PUNCT ,AUX ADV NOUN PUNCT 
107,Leave it as it is.,Dejarlo como es.,VERB PRON ADP PRON VERB PUNCT ,PROPN SCONJ AUX PUNCT 
108,Long time no see! How have you been?,¡Tanto tiempo sin verte! ¿Cómo has estado durante este tiempo?,ADJ NOUN DET INTJ PUNCT ADV VERB PRON VERB PUNCT ,PUNCT DET NOUN ADP NOUN PUNCT PUNCT PRON AUX VERB ADP DET NOUN PUNCT 
109,I have not seen her since then.,No la he visto desde entonces.,PRON VERB ADV VERB PRON ADP ADV PUNCT ,ADV PRON AUX VERB ADP ADV PUNCT 
110,"Why not come along? - Oh, OK.","¿Quieres venir? - Sí, está bien.",ADV ADV VERB PART PUNCT PUNCT INTJ PUNCT INTJ PUNCT ,PUNCT ADJ VERB PUNCT PUNCT ADV PUNCT AUX ADV PUNCT 
111,"She is short, but still taller than me.","Ella es baja, pero todavia es más alta que yo. ",PRON VERB ADJ PUNCT CCONJ ADV ADJ ADP PRON PUNCT ,PRON AUX ADJ PUNCT CONJ NOUN AUX ADV ADJ SCONJ PRON PUNCT 
112,So what did you say at that time?,"Por lo tanto, ¿qué es lo que has dicho?",ADV PRON VERB PRON VERB ADP DET NOUN PUNCT ,ADP DET NOUN PUNCT PUNCT PRON AUX DET PRON AUX VERB PUNCT 
113,I'll be back late. So don't wait up for me.,Regresaré tarde asi que no me esperen.,PRON AUX VERB ADV ADV PUNCT ADV VERB ADV VERB PART ADP PRON PUNCT ,VERB ADV NOUN PRON ADV PRON VERB PUNCT 
114,"Well then, let's go there on Friday.",Entonces vayamos allí el viernes.,INTJ ADV PUNCT VERB PRON VERB ADV ADP PROPN PUNCT ,ADV VERB ADV DET NOUN PUNCT 
115,Nobody can do such a thing.,Nadie puede hacer tal cosa.,NOUN VERB VERB DET DET NOUN PUNCT ,PRON AUX VERB DET NOUN PUNCT 
116,"By the way, what brings you here?","¿A propósito, qué te trae por aquí?",ADP DET NOUN PUNCT PRON VERB PRON ADV PUNCT ,PUNCT ADP NOUN PUNCT PRON PRON VERB ADP ADV PUNCT 
117,Then I'll see you there.,Entonces te veré allí.,ADV PRON AUX VERB PRON ADV PUNCT ,ADV PRON VERB ADV PUNCT 
118,"Yes, it is.","Sí, lo es.",INTJ PUNCT PRON VERB PUNCT ,ADV PUNCT PRON AUX PUNCT 
119,"It looks really good on you, though.",Pero te queda bien.,PRON VERB ADV ADJ ADP PRON PUNCT ADV PUNCT ,CONJ PRON VERB ADV PUNCT 
120,Work in groups of six.,Divídansen en grupos de seis.,NOUN ADP NOUN ADP NUM PUNCT ,VERB ADP NOUN ADP NUM PUNCT 
121,"This costs 5,000 won per bowl.",Esto cuesta 5.000 won por vajilla.,DET VERB NUM VERB ADP NOUN PUNCT ,PRON VERB NUM VERB ADP NOUN PUNCT 
122,"We need milk, butter and jam.","Necesitamos leche, mantequilla y jamón.",PRON VERB NOUN PUNCT NOUN CCONJ NOUN PUNCT ,VERB NOUN PUNCT NOUN CONJ NOUN PUNCT 
123,How did you draw this?,¿Cómo dibujaste esto?,ADV VERB PRON VERB DET PUNCT ,PUNCT PRON VERB PRON PUNCT 
124,My mom bought me a picture book.,Mi mamá me compró un libro de dibujos.,DET NOUN VERB PRON DET NOUN NOUN PUNCT ,DET NOUN PRON VERB DET NOUN ADP NOUN PUNCT 
125,Stop crying.,Para de gritar.,VERB VERB PUNCT ,ADP ADP VERB PUNCT 
126,Does he know you?,¿Él te conoce?,VERB PRON VERB PRON PUNCT ,PUNCT PRON PRON VERB PUNCT 
127,Is there a bus going that way?,¿Hay un autobús que va por esa dirección?,VERB ADV DET NOUN VERB DET NOUN PUNCT ,PUNCT AUX DET NOUN PRON VERB ADP DET NOUN PUNCT 
128,I want to go to the movie theater.,Quireo ir al cine.,PRON VERB PART VERB ADP DET NOUN NOUN PUNCT ,VERB VERB ADP NOUN PUNCT 
129,Do you live in this neighborhood?,¿Vives en esta vecindad?,VERB PRON VERB ADP DET NOUN PUNCT ,PUNCT NOUN ADP DET NOUN PUNCT 
130,Which one is more important between speaking and writing?,¿Qué es más importante enre leer y redactar?,DET NOUN VERB ADV ADJ ADP VERB CCONJ NOUN PUNCT ,PUNCT PRON AUX ADV ADJ VERB VERB CONJ VERB PUNCT 
131,This machine seems to be broken.,Esta máquina parece estar rota.,DET NOUN VERB PART VERB VERB PUNCT ,DET NOUN AUX AUX ADJ PUNCT 
132,I'll wait here.,Esperaré aquí.,PRON AUX VERB ADV PUNCT ,VERB ADV PUNCT 
133,My mom raised two children by herself.,Mi mamá crió a dos niños ella misma.,DET NOUN VERB NUM NOUN ADP PRON PUNCT ,DET NOUN VERB ADP NUM NOUN PRON PRON PUNCT 
134,What is the basics of a healthy life?,¿Cuáles son las bases para una vida sana?,PRON VERB DET NOUN ADP DET ADJ NOUN PUNCT ,PUNCT VERB AUX DET NOUN ADP DET NOUN ADJ PUNCT 
135,I'm not in the mood.,No estoy de humor.,PRON VERB ADV ADP DET NOUN PUNCT ,ADV AUX ADP NOUN PUNCT 
136,How's life in your dormitory?,¿Cómo es tu vida en el nuevo refugio universitario?,ADV VERB NOUN ADP DET NOUN PUNCT ,PUNCT PRON AUX DET NOUN ADP DET ADJ NOUN ADJ PUNCT 
137,It's a painful memory for me.,Es un recuerdo doloroso para mí.,PRON VERB DET ADJ NOUN ADP PRON PUNCT ,AUX DET NOUN ADJ ADP PRON PUNCT 
138,I just missed train.,Acabo de perder el tren.,PRON ADV VERB NOUN PUNCT ,AUX ADP VERB DET NOUN PUNCT 
139,"Give me another chance, please.","Déme otra oportunidad, por favor.",VERB PRON DET NOUN PUNCT INTJ PUNCT ,VERB DET NOUN PUNCT ADP NOUN PUNCT 
140,Let's cross the street.,Crucemos la calle.,VERB PRON VERB DET NOUN PUNCT ,VERB DET NOUN PUNCT 
141,"In the winter, night is longer than day.","En el invierno, la noche es más larga que día.",ADP DET NOUN PUNCT NOUN VERB ADJ ADP NOUN PUNCT ,ADP DET NOUN PUNCT DET NOUN AUX ADV ADJ SCONJ NOUN PUNCT 
142,He ordered cheese gimbap.,Él pidió el gimbap de queso.,PRON VERB NOUN NOUN PUNCT ,PRON VERB DET NOUN ADP NOUN PUNCT 
143,I love Kimchi more than anything else.,Amo el kimchi más que cualquier otra cosa.,PRON VERB PROPN ADV ADP NOUN ADV PUNCT ,VERB DET NOUN ADV SCONJ DET DET NOUN PUNCT 
144,I didn't know that the water was so deep.,No sabía que el agua era tan profundo.,PRON VERB ADV VERB ADP DET NOUN VERB ADV ADJ PUNCT ,ADV VERB SCONJ DET NOUN AUX ADV ADJ PUNCT 
145,Please peel me an apple.,"Córtame una manzana, por favor.",INTJ VERB PRON DET NOUN PUNCT ,VERB DET NOUN PUNCT ADP NOUN PUNCT 
146,Do you think this room is clean?,¿Piensas que este sitio está limpio?,VERB PRON VERB DET NOUN VERB ADJ PUNCT ,PUNCT VERB SCONJ DET NOUN AUX ADJ PUNCT 
147,I pretended to take out some money from my purse.,Fingí tomar dinero de mi monedero.,PRON VERB PART VERB PART DET NOUN ADP DET NOUN PUNCT ,VERB VERB NOUN ADP DET NOUN PUNCT 
148,I'll be there for sure.,"Estaré allí, sin lugar a dudas.",PRON AUX VERB ADV ADP ADJ PUNCT ,VERB ADV PUNCT ADP NOUN ADP NOUN PUNCT 
149,Water the flowers in an hour.,Regar las flores en una hora.,NOUN DET NOUN ADP DET NOUN PUNCT ,VERB DET NOUN ADP DET NOUN PUNCT 
150,I had a dream about eating pizza last night.,Ayer por la noche soñé que estaba comiendo pizza.,PRON VERB DET NOUN ADP VERB NOUN ADJ NOUN PUNCT ,ADV ADP DET NOUN NOUN SCONJ AUX VERB NOUN PUNCT 
151,Did you put out the fire? (or Did you switch off the light?),¿Apagaste la luz?,VERB PRON VERB PART DET NOUN PUNCT PUNCT CCONJ VERB PRON VERB PART DET NOUN PUNCT PUNCT ,PUNCT VERB DET NOUN PUNCT 
152,The building is at the end of this street.,El edificio está a lo último de esta calle.,DET NOUN VERB ADP DET NOUN ADP DET NOUN PUNCT ,DET NOUN VERB ADP DET ADJ ADP DET NOUN PUNCT 
153,School vacation ends tomorrow.,Las vacaciones (de la escuela) terminan mañana.,NOUN NOUN VERB NOUN PUNCT ,DET NOUN PUNCT ADP DET NOUN PUNCT VERB ADV PUNCT 
154,We have to finish all the work today.,Tenemos que acabar todo el trabajo hoy.,PRON VERB PART VERB DET DET NOUN NOUN PUNCT ,VERB SCONJ VERB DET DET NOUN ADV PUNCT 
155,Who's there? - It's me.,¿Quién está allí? - Soy yo.,PRON VERB ADV PUNCT PUNCT PRON VERB PRON PUNCT ,PUNCT PRON VERB ADV PUNCT PUNCT AUX PRON PUNCT 
156,Let's go out for lunch.,Salgamos para el almuerzo.,VERB PRON VERB PART ADP NOUN PUNCT ,VERB ADP DET NOUN PUNCT 
157,He split the apple into two with his bare hands.,Él partió la manzana en dos sólo con sus manos.,PRON VERB DET NOUN ADP NUM ADP DET ADJ NOUN PUNCT ,PRON VERB DET NOUN ADP NUM ADV ADP DET NOUN PUNCT 
158,I guess an accident has happened up ahead.,Presiento que un accidente ha sucedido alli adelante. ,PRON VERB DET NOUN VERB VERB PART ADV PUNCT ,VERB SCONJ DET NOUN AUX VERB VERB ADV PUNCT 
159,which country do you want to visit?,¿qué país deseas visitar?,DET NOUN VERB PRON VERB PART VERB PUNCT ,PUNCT DET NOUN NOUN VERB PUNCT 
160,He is sitting under the tree.,Él está sentando debajo del árbol.,PRON VERB VERB ADP DET NOUN PUNCT ,PRON AUX VERB ADV ADP NOUN PUNCT 
161,How's that? - Not bad.,¿Cómo estuvo? - No tan malo.,ADV VERB DET PUNCT PUNCT ADV ADJ PUNCT ,PUNCT PRON VERB PUNCT PUNCT ADV ADV ADJ PUNCT 
162,Don't come out of your room.,No salgas de tu habitación.,VERB ADV VERB ADP ADP DET NOUN PUNCT ,ADV VERB ADP DET NOUN PUNCT 
163,She looks younger than her age.,Ella parece más joven a comparación de la edad que tiene.,PRON VERB ADJ ADP DET NOUN PUNCT ,PRON AUX ADV ADJ ADP NOUN ADP DET NOUN PRON VERB PUNCT 
164,See you later.,Nos vemos después.,VERB PRON ADV PUNCT ,PRON VERB ADV PUNCT 
165,My ex-girlfriend appeared in my dream last night.,Mi ex-novia apareció en mis sueños ayer por la noche.,DET NOUN NOUN NOUN VERB ADP DET NOUN ADJ NOUN PUNCT ,DET ADJ PUNCT NOUN VERB ADP DET NOUN ADV ADP DET NOUN PUNCT 
166,Her eyes expressed her true feelings.,Sus ojos expresaron sus verdaderos sentimientos.,DET NOUN VERB DET ADJ NOUN PUNCT ,DET NOUN VERB DET ADJ NOUN PUNCT 
167,Tomorrow is a special day. ,Mañana es un día especial.,NOUN VERB DET ADJ NOUN PUNCT ,ADV AUX DET NOUN ADJ PUNCT 
168,"The highter a bird flies, the farther it can see.","Más alto vuela el pajaro, más lejos puede ver.",DET NOUN DET NOUN VERB PUNCT DET ADV PRON VERB VERB PUNCT ,ADV ADJ VERB DET NOUN PUNCT ADV ADV AUX VERB PUNCT 
169,How is the weather? ,¿Cómo está el clima?,ADV VERB DET NOUN PUNCT ,PUNCT PRON VERB DET NOUN PUNCT 
170,What's the date today? ,¿Qué fecha hoy?,PRON VERB DET NOUN NOUN PUNCT ,PUNCT DET NOUN ADV PUNCT 
171,Leave a message.,Déjame un mensaje.,VERB DET NOUN PUNCT ,VERB DET NOUN PUNCT 
172,No one can know the relationship between a man and a woman.,Nadie pueden saber la relación entre un hombre y una mujer.,DET NOUN VERB VERB DET NOUN ADP DET NOUN CCONJ DET NOUN PUNCT ,PRON AUX VERB DET NOUN ADP DET NOUN CONJ DET NOUN PUNCT 
173,There's no food left over.,No sobró comida.,ADV VERB DET NOUN VERB PART PUNCT ,ADV VERB NOUN PUNCT 
174,This is my younger brother.,Éste es mi hermano menor.,DET VERB DET ADJ NOUN PUNCT ,PRON AUX DET NOUN ADJ PUNCT 
175,"Generally speaking, a woman will live longer than a man.","Generalmente, la mujer vive más que el hombre.",ADV VERB PUNCT DET NOUN VERB VERB ADV ADP DET NOUN PUNCT ,ADV PUNCT DET NOUN VERB ADV SCONJ DET NOUN PUNCT 
176,She is looking for a family man.,Ella está buscando un hombre de hogar.,PRON VERB VERB ADP DET NOUN NOUN PUNCT ,PRON AUX VERB DET NOUN ADP NOUN PUNCT 
177,Which way is south?,¿En qué dirección está el Sur?,DET NOUN VERB ADJ PUNCT ,PUNCT ADP DET NOUN AUX DET PROPN PUNCT 
178,Hyean wants a perfect husband.,Hyean desea a marido perfecto.,PROPN VERB DET ADJ NOUN PUNCT ,PROPN VERB ADP NOUN ADJ PUNCT 
