,english,spanish,en_pos,es_pos
494,This is a farewell present.,Es un regalo de despedida,DET VERB DET ADJ NOUN PUNCT ,AUX DET NOUN ADP NOUN 
495,She quit the job to become a teacher.,Ella renunció el trabajo de profesor.,PRON VERB DET NOUN PART VERB DET NOUN PUNCT ,PRON VERB DET NOUN ADP NOUN PUNCT 
496,Can you explain what happened?,¿Puedes explicar qué sucedió?,VERB PRON VERB PRON VERB PUNCT ,PUNCT AUX VERB PRON VERB PUNCT 
497,Do you take sugar in your coffee?,¿Tomas el azúcar en tu café?,VERB PRON VERB NOUN ADP DET NOUN PUNCT ,PUNCT VERB DET NOUN ADP DET NOUN PUNCT 
498,Many couples get divorced because of their personality differences.,Muchas parejas consiguen divorciarse porque tienen diferentes personalidades.,ADJ NOUN VERB VERB ADP ADP DET NOUN NOUN PUNCT ,DET NOUN VERB VERB SCONJ VERB DET NOUN PUNCT 
499,"At the age of 15, he entered university.","En la edad de 15, él entró en la universidad.",ADP DET NOUN ADP NUM PUNCT PRON VERB NOUN PUNCT ,ADP DET NOUN ADP NUM PUNCT PRON VERB ADP DET NOUN PUNCT 
500,The First World War,La  primera Guerra Mundial.,DET PROPN PROPN PROPN ,DET SPACE ADJ PROPN PROPN PUNCT 
501,What a small world!,¡Qué mundo pequeño!,DET DET ADJ NOUN PUNCT ,PUNCT DET NOUN ADJ PUNCT 
502,You need to go wash your face.,Ve a lavarte la cara.,PRON VERB PART VERB VERB DET NOUN PUNCT ,VERB ADP NOUN DET NOUN PUNCT 
503,Make the students stand in a row.,Para a los estudiantes en una fila. ,VERB DET NOUN VERB ADP DET NOUN PUNCT ,ADP ADP DET NOUN ADP DET NOUN PUNCT 
504,This washing machine doesn't work. Did you turn it on?,Esta lavadora no funciona. ¿La prendiste?,DET NOUN NOUN VERB ADV VERB PUNCT VERB PRON VERB PRON PART PUNCT ,DET NOUN ADV VERB PUNCT PUNCT DET NOUN PUNCT 
505,"Those shoes make you look 5 centimeters taller, sir.",Estos zapatos hacen verte unos cinco centímetros más alta.,DET NOUN VERB PRON VERB NUM NOUN ADJ PUNCT NOUN PUNCT ,DET NOUN VERB NOUN DET NUM NOUN ADV ADJ PUNCT 
506,Let me introduce myself.,Déjenme introducirme.,VERB PRON VERB PRON PUNCT ,VERB VERB PUNCT 
507,"If it's too bland, add some salt.","Está demasiado aguado, agrégale un poco mas de sal. ",ADP PRON VERB ADV ADJ PUNCT VERB DET NOUN PUNCT ,AUX ADV ADJ PUNCT VERB DET ADV NOUN ADP NOUN PUNCT 
508,"When the concert starts, please don't make any sounds.","Cuando comienze el concierto, haga el favor de no hacer ruido.",ADV DET NOUN VERB PUNCT INTJ VERB ADV VERB DET NOUN PUNCT ,SCONJ VERB DET NOUN PUNCT VERB DET NOUN ADP ADV VERB NOUN PUNCT 
509,I usually read novels in my free time.,"Generalmente, en mi tiempo libre suelo leer novelas.",PRON ADV VERB NOUN ADP DET ADJ NOUN PUNCT ,ADV PUNCT ADP DET NOUN ADJ AUX VERB NOUN PUNCT 
510,I have some good news for you.,Tengo algunas buenas noticias para ti.,PRON VERB DET ADJ NOUN ADP PRON PUNCT ,VERB DET ADJ NOUN ADP PRON PUNCT 
511,"When I returned home, my husband was cleaning the sofa.","Cuando volví a casa, mi marido limpiaba el sofá.",ADV PRON VERB ADV PUNCT DET NOUN VERB VERB DET NOUN PUNCT ,SCONJ VERB ADP NOUN PUNCT DET NOUN VERB DET NOUN PUNCT 
512,Where would you like to go for a picnic?,¿Dónde quieres ir de picnic?,ADV VERB PRON VERB PART VERB ADP DET NOUN PUNCT ,PUNCT PRON NOUN VERB ADP NOUN PUNCT 
513,The author signed the inside cover of the book.,El autor firmó la cubierta interior del libro.,DET NOUN VERB DET ADJ NOUN ADP DET NOUN PUNCT ,DET NOUN VERB DET NOUN ADJ ADP NOUN PUNCT 
514,They are walking hand in hand. I'm sure they are dating.,Están caminando de la mano. Es obvio que los dos están saliendo. ,PRON VERB VERB NOUN ADP NOUN PUNCT PRON VERB ADJ PRON VERB VERB PUNCT ,AUX VERB ADP DET NOUN PUNCT AUX ADJ SCONJ DET NUM AUX VERB PUNCT 
515,My mother pointed out the mountain with her finger.,Mi madre precisó la montaña con su dedo.,DET NOUN VERB PART DET NOUN ADP DET NOUN PUNCT ,DET NOUN VERB DET NOUN ADP DET NOUN PUNCT 
516,The customer is always right.,El cliente siempre tiene la razón.,DET NOUN VERB ADV ADJ PUNCT ,DET NOUN ADV VERB DET NOUN PUNCT 
517,"Which is cheaper, beef or pork?","¿Cuál es más barato, la carne de vaca o la de cerdo?",DET VERB ADJ PUNCT NOUN CCONJ NOUN PUNCT ,PUNCT PRON AUX ADV ADJ PUNCT DET NOUN ADP NOUN CONJ DET ADP NOUN PUNCT 
518,It's hard for me to go shopping with my girlfriend.,Es duro que vaya a hacer compras con mi novia.,PRON VERB ADJ ADP PRON PART VERB VERB ADP DET NOUN PUNCT ,AUX ADJ PRON AUX ADP VERB NOUN ADP DET NOUN PUNCT 
519,There's no other way but to just wait.,No hay otra posibilidad que esperar.,ADV VERB DET ADJ NOUN CCONJ PART ADV VERB PUNCT ,ADV AUX DET NOUN SCONJ VERB PUNCT 
520,Do you have a towel to dry your hair with?,¿Tienes una toalla para secarme el pelo?,VERB PRON VERB DET NOUN PART VERB DET NOUN ADP PUNCT ,PUNCT VERB DET NOUN ADP NOUN DET NOUN PUNCT 
521,"In the summer, eating watermelon is very refreshing.",Es bueno comer una fría sandía en verano.,ADP DET NOUN PUNCT VERB NOUN VERB ADV ADJ PUNCT ,AUX ADJ VERB DET ADJ VERB ADP NOUN PUNCT 
522,I have class in an hour.,Tengo clase en una hora.,PRON VERB NOUN ADP DET NOUN PUNCT ,VERB NOUN ADP DET NOUN PUNCT 
523,Let's go swimming somewhere else. ,Vayamos a nadar a otro lugar.,VERB PRON VERB VERB ADV ADV PUNCT ,AUX ADP VERB ADP DET NOUN PUNCT 
524,Wow! I heard you have a swimming pool at your house.,¡Wow! Te oí tener una piscina en tu casa.,INTJ PUNCT PRON VERB PRON VERB DET NOUN NOUN ADP DET NOUN PUNCT ,PUNCT INTJ PUNCT PRON VERB VERB DET NOUN ADP DET NOUN PUNCT 
525,Did you do your homework?,¿Hiciste tu preparación?,VERB PRON VERB DET NOUN PUNCT ,PUNCT VERB DET NOUN PUNCT 
526,Are you sure? Don't change your mind at the last moment.,¿Estás seguro? No cambies tu parecer a último momento.,VERB PRON ADJ PUNCT VERB ADV VERB DET NOUN ADP DET ADJ NOUN PUNCT ,PUNCT VERB ADJ PUNCT ADV VERB DET NOUN ADP ADJ NOUN PUNCT 
527,Usually Koreans use spoons for rice and chopsticks for side dishes.,Los coreanos utilizan generalmente las cucharas para el arroz y los palillos para los platos laterales.,ADV PROPN VERB NOUN ADP NOUN CCONJ NOUN ADP NOUN NOUN PUNCT ,DET NOUN VERB ADV DET NOUN ADP DET NOUN CONJ DET NOUN ADP DET NOUN ADJ PUNCT 
528,I think you have had enough alcohol.,Pienso que has tenido bastante alcohol.,PRON VERB PRON VERB VERB ADJ NOUN PUNCT ,VERB SCONJ AUX VERB ADV NOUN PUNCT 
529,I got lost in the forest.,Me perdí en el bosque.,PRON VERB VERB ADP DET NOUN PUNCT ,PRON VERB ADP DET NOUN PUNCT 
530,You look tired. Why don't you rest for a while?,Pareces cansado. ¿Por qué no descansas por algún tiempo?,PRON VERB ADJ PUNCT ADV VERB ADV PRON VERB ADP DET NOUN PUNCT ,NOUN ADJ PUNCT PUNCT ADP PRON ADV ADJ ADP DET NOUN PUNCT 
531,It's easy for you to say. Do it yourself.,"Es fácil decirlo, por qué no lo haces tú mismo.",PRON VERB ADJ ADP PRON PART VERB PUNCT VERB PRON PRON PUNCT ,AUX ADJ NOUN PUNCT ADP PRON ADV PRON VERB PRON PRON PUNCT 
532,I'm going to the supermarket. Do you want anything?,Voy al supermercado. ¿Deseas algo?,PRON VERB VERB ADP DET NOUN PUNCT VERB PRON VERB NOUN PUNCT ,VERB ADP NOUN PUNCT PUNCT NOUN PRON PUNCT 
533,Figure out the solution by yourself.,Busca tú mismo la solución.,VERB PART DET NOUN ADP PRON PUNCT ,PROPN PRON DET DET NOUN PUNCT 
534,Our ski trip has been canceled because of the snow.,El viaje de esquí ha sido cancelado debido a la nieve.,DET NOUN NOUN VERB VERB VERB ADP ADP DET NOUN PUNCT ,DET NOUN ADP NOUN AUX AUX VERB ADJ ADP DET NOUN PUNCT 
535,Get a massage to reduce your stress.,Toma cursos de masajes para reducir el estres.,VERB DET NOUN PART VERB DET NOUN PUNCT ,VERB NOUN ADP NOUN ADP VERB DET NOUN PUNCT 
536,I only read the sports section in the newspaper.,Leí solamente la sección de los deportes en el periódico.,PRON ADV VERB DET NOUN NOUN ADP DET NOUN PUNCT ,NOUN ADV DET NOUN ADP DET NOUN ADP DET NOUN PUNCT 
537,"I am crying not because I'm sad, but because I'm happy. ","Estoy llorando no de tristeza, sino de alegría.",PRON VERB VERB ADV ADP PRON VERB ADJ PUNCT CCONJ ADP PRON VERB ADJ PUNCT ,AUX VERB ADV ADP NOUN PUNCT CONJ ADP NOUN PUNCT 
538,The Han River flows through the city of Seoul.,El río de Han atraviesa la ciudad de Seul.,DET PROPN PROPN VERB ADP DET NOUN ADP PROPN PUNCT ,DET NOUN ADP PROPN VERB DET NOUN ADP PROPN PUNCT 
539,What time is it now? - Half past three.,¿Qué hora es?- Son las tres y media.,DET NOUN VERB PRON ADV PUNCT PUNCT NOUN NOUN NUM PUNCT ,PUNCT DET NOUN NOUN AUX DET NUM CONJ NUM PUNCT 
540,I work twelve hours a day and do not have time to rest.,Trabajo doce horas por día y no tengo tiempo para descansar.,PRON VERB NUM NOUN DET NOUN CCONJ VERB ADV VERB NOUN PART VERB PUNCT ,VERB NUM NOUN ADP NOUN CONJ ADV VERB NOUN ADP VERB PUNCT 
541,My watch is 5 minutes behind.,Mi reloj está 5 minutos atrazado.,DET NOUN VERB NUM NOUN ADV PUNCT ,DET NOUN AUX NUM NOUN ADJ PUNCT 
542,"With the air conditioner on, it is going to be cool.","Con el acondicionador de aire encendido, va a estar fresco.",ADP DET NOUN NOUN ADV PUNCT PRON VERB VERB PART VERB ADJ PUNCT ,ADP DET NOUN ADP NOUN ADJ PUNCT AUX ADP VERB ADJ PUNCT 
543,The class begins at 8 a.m.,La clase comienza a las ocho horas de la mañana.,DET NOUN VERB ADP NUM NOUN ,DET NOUN VERB ADP DET NUM NOUN ADP DET NOUN PUNCT 
544,The concert started and the musician began to play.,El concierto comenzó y el músico empezor a tocar. ,DET NOUN VERB CCONJ DET NOUN VERB PART VERB PUNCT ,DET NOUN VERB CONJ DET NOUN AUX ADP VERB PUNCT 
545,I want to go to Dongdaemun Market.,Deseo ir al mercado de Dongdaemun.,PRON VERB PART VERB ADP PROPN PROPN PUNCT ,VERB VERB ADP NOUN ADP PROPN PUNCT 
546,The CEO makes me work on holidays.,El CEO me hace el trabajo el días de fiesta.,DET NOUN VERB PRON VERB ADP NOUN PUNCT ,DET PROPN PRON VERB DET NOUN DET NOUN ADP NOUN PUNCT 
547,I took a vocabulary test yesterday. It was easier than I thought it would be.,Ayer tuve la prueba de vocabularios. Fue más fácil de lo que me imaginé,PRON VERB DET ADJ NOUN NOUN PUNCT PRON VERB ADJ ADP PRON VERB PRON VERB VERB PUNCT ,ADV VERB DET NOUN ADP NOUN PUNCT AUX ADV ADJ ADP DET PRON PRON VERB 
548,They serve really nice food in that restaurant.,En este restaurante sirven buena comida.,PRON VERB ADV ADJ NOUN ADP DET NOUN PUNCT ,ADP DET NOUN VERB ADJ NOUN PUNCT 
549,Take this pill 30 minutes after meals.,Tomar a esta píldora 30 minutos después de las comidas.,VERB DET NOUN NUM NOUN ADP NOUN PUNCT ,VERB ADP DET NOUN NUM NOUN ADV ADP DET NOUN PUNCT 
550,"After meals, please clear the dining table.","Luego de las comidas, limpie la mesa.",ADP NOUN PUNCT INTJ VERB DET NOUN NOUN PUNCT ,ADV ADP DET NOUN PUNCT VERB DET NOUN PUNCT 
551,Put on slippers when you come into this room.,"Cuando entre a esta habitación, póngase las apargatas.",VERB PART NOUN ADV PRON VERB ADP DET NOUN PUNCT ,SCONJ VERB ADP DET NOUN PUNCT VERB DET NOUN PUNCT 
552,Which newspaper do you read?,¿Qué periódico lees?,DET NOUN VERB PRON VERB PUNCT ,PUNCT DET NOUN ADJ PUNCT 
553,"Your shoes are wet, put on my shoes.","Tus zapatos están mojados, pónte los mios.",DET NOUN VERB ADJ PUNCT VERB ADP DET NOUN PUNCT ,AUX NOUN AUX ADJ PUNCT ADV DET NOUN PUNCT 
554,"Excuse me, but do you have the time?","¿Perdóneme, sabe qué hora es?",VERB PRON PUNCT CCONJ VERB PRON VERB DET NOUN PUNCT ,PUNCT PROPN PUNCT VERB DET NOUN AUX PUNCT 
555,I really hate getting up early in the morning.,Realmente odio levantarme temprano por la mañana.,PRON ADV VERB VERB PART ADV ADP DET NOUN PUNCT ,ADV NOUN ADJ ADV ADP DET NOUN PUNCT 
556,Why do you hate jazz?,¿Por qué odias el jazz?,ADV VERB PRON VERB NOUN PUNCT ,PUNCT ADP PRON NOUN DET NOUN PUNCT 
557,"When the car hit me, I went into severe shock.","Cuando el coche me golpeó, tuve una herida severa.",ADV DET NOUN VERB PRON PUNCT PRON VERB ADP ADJ NOUN PUNCT ,SCONJ DET NOUN PRON VERB PUNCT VERB DET NOUN ADJ PUNCT 
558,Buying online is cheaper than buying from shops.,Comprar via Internet es mas barato que comprarlo en las tiendas.,VERB ADV VERB ADJ ADP VERB ADP NOUN PUNCT ,VERB ADJ PROPN AUX ADV ADJ PRON VERB ADP DET NOUN PUNCT 
559,Why are you quarreling?,¿Por qué estás peleando?,ADV VERB PRON VERB PUNCT ,PUNCT ADP PRON AUX VERB PUNCT 
560,He can't tell rice from barley.,Él no puede distinguir entre el arroz de la cebada.,PRON AUX ADV VERB NOUN ADP NOUN PUNCT ,PRON ADV AUX VERB ADP DET NOUN ADP DET ADJ PUNCT 
561,"Although he can't read or write, he is the president of a big company.","Aunque no pueda leer o escribir, él es el presidente de una compañía grande.",ADP PRON AUX ADV VERB CCONJ VERB PUNCT PRON VERB DET NOUN ADP DET ADJ NOUN PUNCT ,SCONJ ADV AUX VERB CONJ VERB PUNCT PRON AUX DET NOUN ADP DET NOUN ADJ PUNCT 
562,Isn't it funny that the dog is wearing a hat?,¿No es divertido que el perro esté usando un sombrero?,VERB ADV PRON ADJ ADP DET NOUN VERB VERB DET NOUN PUNCT ,PUNCT ADV AUX VERB SCONJ DET NOUN AUX VERB DET NOUN PUNCT 
563,What brand of shampoo do you use?,¿Qué marca de champú utilizas?,DET NOUN ADP NOUN VERB PRON VERB PUNCT ,PUNCT DET NOUN ADP NOUN NOUN PUNCT 
564,Could you throw out the garbage?,¿Podrías sacar la basura?,VERB PRON VERB PART DET NOUN PUNCT ,PUNCT VERB VERB DET NOUN PUNCT 
565,Can I speak to Ms. Hyean?,¿Puedo hablar con el señor Hyean?,VERB PRON VERB ADP PROPN PROPN PUNCT ,PUNCT AUX VERB ADP DET NOUN PROPN PUNCT 
566,"As soon as I came home, I washed my hands.","Tan pronto como viniera a casa, me lavé las manos.",ADV ADV ADP PRON VERB ADV PUNCT PRON VERB DET NOUN PUNCT ,NOUN NOUN SCONJ VERB ADP NOUN PUNCT PRON VERB DET NOUN PUNCT 
567,"Ah, no!","¡Ah, no!",INTJ PUNCT INTJ PUNCT ,PUNCT INTJ PUNCT ADV PUNCT 
568,I'm expecting a baby this month.,Estoy contando con un bebé para este mes.,PRON VERB VERB DET NOUN DET NOUN PUNCT ,AUX VERB ADP DET NOUN ADP DET NOUN PUNCT 
569,My wife is the one I've dreamed of all my life.,Mi esposa es la que he soñado toda mi vida.,DET NOUN VERB DET NOUN PRON VERB VERB ADP DET DET NOUN PUNCT ,DET NOUN AUX DET PRON AUX VERB DET DET NOUN PUNCT 
570,"Do you want some more? - No, I'm full.","¿Deseas más? - No, gracias. Estoy lleno.",VERB PRON VERB DET ADJ PUNCT PUNCT INTJ PUNCT PRON VERB ADJ PUNCT ,PUNCT NOUN ADV PUNCT PUNCT ADV PUNCT NOUN PUNCT AUX ADJ PUNCT 
571,Billie Jean is not my lover.,Billie Jean no es mi amante.,PROPN PROPN VERB ADV DET NOUN PUNCT ,PROPN PROPN ADV AUX DET NOUN PUNCT 
572,"No, the kid is not my son.","No, el niño no es mi hijo.",INTJ PUNCT DET NOUN VERB ADV DET NOUN PUNCT ,ADV PUNCT DET NOUN ADV AUX DET NOUN PUNCT 
573,I have to go now. My son is home alone.,Me tengo que ir ahora. Mi hijo está en casa solo.,PRON VERB PART VERB ADV PUNCT DET NOUN VERB ADV ADV PUNCT ,PRON VERB SCONJ VERB ADV PUNCT DET NOUN VERB ADP NOUN ADJ PUNCT 
574,Please sign your name below.,"Por favor, firme abajo.",INTJ VERB DET NOUN ADV PUNCT ,ADP NOUN PUNCT ADJ ADV PUNCT 
575,You are so beautiful. ,Eres tan hermoso.,PRON VERB ADV ADJ PUNCT ,PROPN ADV ADJ PUNCT 
576,He is probably late. He was up until 4 a.m.,"Probablemente llegará tarde, estuvo madrugando hasta las cuatro.",PRON VERB ADV ADJ PUNCT PRON VERB ADP ADP NUM NOUN ,ADV VERB ADV PUNCT AUX VERB ADP DET NUM PUNCT 
577,The president didn’t say anything about the issue.,El presidente no mencionó nada sobre ese tema. ,DET NOUN VERB ADV VERB NOUN ADP DET NOUN PUNCT ,DET NOUN ADV VERB PRON ADP DET NOUN PUNCT 
578,"No matter how much you eat, you never gain a pound.","Por más que tú comas, no engordas.",ADV ADV ADV ADV PRON VERB PUNCT PRON ADV VERB DET NOUN PUNCT ,ADP ADV SCONJ PRON NOUN PUNCT ADV ADJ PUNCT 
579,What does your father do for a living?,¿Qué profesión tiene tu padre?,PRON VERB DET NOUN VERB ADP DET NOUN PUNCT ,PUNCT DET NOUN VERB DET NOUN PUNCT 
580,"Dad, please buy me this camera.","Papá, por favor, cómprame  esta cámara fotográfica.",PROPN PUNCT INTJ VERB PRON DET NOUN PUNCT ,PROPN PUNCT ADP NOUN PUNCT VERB SPACE DET NOUN ADJ PUNCT 
581,We only have one child.,Tenemos solamente un hijo.,PRON ADV VERB NUM NOUN PUNCT ,VERB ADV DET NOUN PUNCT 
582,Vanilla is my favorite ice cream flavor.,Mi sabor preferido de helado es el vainilla.,PROPN VERB DET ADJ NOUN NOUN NOUN PUNCT ,DET NOUN ADJ ADP NOUN AUX DET NOUN PUNCT 
583,"Even though he is seventeen, he looks like a middle-aged man. ",Tiene sólo diecisiete pero parece un caballero.,ADV ADP PRON VERB NUM PUNCT PRON VERB ADP DET ADJ PUNCT ADJ NOUN PUNCT ,VERB ADV NOUN CONJ AUX DET NOUN PUNCT 
584,It's very easy.,Es muy fácil.,PRON VERB ADV ADJ PUNCT ,AUX ADV ADJ PUNCT 
585,"Madam, where am I?","Señora, ¿En dónde estoy yo?",PROPN PUNCT ADV VERB PRON PUNCT ,NOUN PUNCT PUNCT ADP PRON AUX PRON PUNCT 
586,These still seem to be okay.,Éstos todavía parecen ser aceptables.,DET ADV VERB PART VERB ADJ PUNCT ,PRON ADV AUX AUX NOUN PUNCT 
587,I usually sleep in without having breakfast on Sunday mornings.,Generalmente los domingos no desayuno.,PRON ADV VERB PART ADP VERB NOUN ADP PROPN NOUN PUNCT ,ADV DET NOUN ADV VERB PUNCT 
588,What apartment are you looking for?,¿Qué apartamento estás buscando?,DET NOUN VERB PRON VERB ADP PUNCT ,PUNCT PRON NOUN AUX VERB PUNCT 
589,My knees are so painful that I can't walk.,Me duelen tanto las rodillas que no puedo caminar.,DET NOUN VERB ADV ADJ ADP PRON AUX ADV VERB PUNCT ,PRON VERB ADV DET NOUN PRON ADV AUX VERB PUNCT 
590,I will be there within 15 minutes.,Estaré allí en menos de 15 minutos.,PRON VERB VERB ADV ADP NUM NOUN PUNCT ,VERB ADV ADP ADV ADP NUM NOUN PUNCT 
591,Why didn't you go?,¿Por qué no fuiste?,ADV VERB ADV PRON VERB PUNCT ,PUNCT ADP PRON ADV VERB PUNCT 
592,You mean the girl who wears glasses?,¿Sabes quién es esa muchacha con cristales?,PRON VERB DET NOUN PRON VERB NOUN PUNCT ,PUNCT VERB PRON AUX DET NOUN ADP NOUN PUNCT 
593,Hello? ,¿Hola?,INTJ PUNCT ,PUNCT NOUN PUNCT 
594,Take care.,Adiós.,VERB NOUN PUNCT ,INTJ PUNCT 
595,Give me a big hug.,Abrázame,VERB PRON DET ADJ NOUN PUNCT ,PROPN 
596,I'm so sorry for that.,Es una lástima.,PRON VERB ADV ADJ ADP DET PUNCT ,AUX DET NOUN PUNCT 
597,They sat side by side in the car.,Se sentaron uno al lado del otro en el coche.,PRON VERB NOUN ADP NOUN ADP DET NOUN PUNCT ,PRON VERB PRON ADP NOUN ADP PRON ADP DET NOUN PUNCT 
598,"Not good, but not bad.","No es malo, pero tampoco bueno.",ADV ADJ PUNCT CCONJ ADV ADJ PUNCT ,ADV AUX ADJ PUNCT CONJ ADV ADJ PUNCT 
599,Do you know what I mean?,¿Sabes a lo que me refiero?,VERB PRON VERB PRON PRON VERB PUNCT ,PUNCT VERB ADP DET PRON PRON VERB PUNCT 
600,The story became known to everyone through the internet.,Ésta historia es sabido por todos via internet. ,DET NOUN VERB ADJ ADP NOUN ADP DET NOUN PUNCT ,DET NOUN AUX VERB ADP DET NOUN NOUN PUNCT 
601,Let me know when you finish it.,Avísame cuándo termines.,VERB PRON VERB ADV PRON VERB PRON PUNCT ,VERB PRON NOUN PUNCT 
602,Please come to the front when it's your turn.,Venga al frente cuando sea tu turno.,INTJ VERB ADP DET NOUN ADV PRON VERB DET NOUN PUNCT ,VERB ADP NOUN SCONJ AUX DET NOUN PUNCT 
603,Chanho Park is my favorite baseball player.,Park Chanho es mi jugador preferido de béisbol.,PROPN PROPN VERB DET ADJ NOUN NOUN PUNCT ,PROPN PROPN AUX DET NOUN ADJ ADP NOUN PUNCT 
604,Did you get hurt? Take this medicine.,¿Estás lastimado? Toma esta medicina.,VERB PRON VERB VERB PUNCT VERB DET NOUN PUNCT ,PUNCT AUX ADJ PUNCT VERB DET NOUN PUNCT 
605,"It's a little chilly today, isn't it? ","Hoy hace un poco de frío, ¿no lo crees?",PRON VERB DET ADJ ADJ NOUN PUNCT VERB ADV PRON PUNCT ,ADV AUX DET PRON ADP NOUN PUNCT PUNCT ADV PRON VERB PUNCT 
606,There is a pharmacy on the second floor.,Hay una farmacia en el segundo piso.,ADV VERB DET NOUN ADP DET ADJ NOUN PUNCT ,AUX DET NOUN ADP DET ADJ NOUN PUNCT 
607,"If you break your promise this time, I'll never see you again.","Si rompes tu promesa este vez, nunca te veré otra vez.",ADP PRON VERB DET NOUN DET NOUN PUNCT PRON AUX ADV VERB PRON ADV PUNCT ,SCONJ VERB DET NOUN DET NOUN PUNCT ADV PRON VERB DET NOUN PUNCT 
608,That's why your socks keep getting holes.,Es por eso que surgen agujeros en tus calzetines.,DET VERB ADV DET NOUN VERB VERB NOUN PUNCT ,AUX ADP PRON SCONJ VERB NOUN ADP DET NOUN PUNCT 
609,I guess this tie will go with your suit.,Esta corbata ira muy bien con tu traje.,PRON VERB DET NOUN VERB VERB ADP DET NOUN PUNCT ,DET NOUN NOUN ADV ADV ADP DET NOUN PUNCT 
610,Don't worry. Just lean against my shoulder.,"Perdóneme, he estado hablando solamente sobre mí.",VERB ADV VERB PUNCT ADV VERB ADP DET NOUN PUNCT ,PROPN PUNCT AUX AUX VERB ADV ADP PRON PUNCT 
611,Which part hurts the most?,"No te preocupes, solo apoyate en mis hombros.",DET NOUN VERB DET ADJ PUNCT ,ADV PRON VERB PUNCT ADJ NOUN ADP DET NOUN PUNCT 
612,Where do you live? ,¿Qué parte te duele más?,ADV VERB PRON VERB PUNCT ,PUNCT DET NOUN PRON VERB ADV PUNCT 
613,How do you feel these days?,¿Dónde vives?,ADV VERB PRON VERB DET NOUN PUNCT ,PUNCT DET NOUN PUNCT 
614,What kind of person do you like? asked a certain guy.,¿Cómo te sientes actualmente?,DET NOUN ADP NOUN VERB PRON VERB PUNCT VERB DET ADJ NOUN PUNCT ,PUNCT PRON PRON VERB ADV PUNCT 
615,This math test was more difficult than the last one.,“Qué clase de persona le gusta?” preguntó cierto individuo.,DET NOUN NOUN VERB ADV ADJ ADP DET ADJ NOUN PUNCT ,PROPN DET NOUN ADP NOUN PRON VERB PUNCT PROPN VERB DET NOUN PUNCT 
616,"May I help you? - Two adults and one child, please.",Esta prueba de matemáticas fue más difícil que la pasada.,VERB PRON VERB PRON PUNCT PUNCT NUM NOUN CCONJ NUM NOUN PUNCT INTJ PUNCT ,DET NOUN ADP ADJ AUX ADV ADJ SCONJ DET ADJ PUNCT 
617,I've heard many times that I look younger than my age.,"¿Puedo ayudarte? - Dos adultos y un niño, por favor.",PRON VERB VERB ADJ NOUN ADP PRON VERB ADJ ADP DET NOUN PUNCT ,PUNCT AUX VERB PUNCT PUNCT NUM NOUN CONJ DET NOUN PUNCT ADP NOUN PUNCT 
618,Do children have to pay money?,He oído muchas veces que parezco más joven de lo que parezco.,VERB NOUN VERB PART VERB NOUN PUNCT ,AUX VERB DET NOUN PRON VERB ADV ADJ ADP DET PRON VERB PUNCT 
619,My mother has been sick for three years.,¿Los niños tienen que pagar dinero?,DET NOUN VERB VERB ADJ ADP NUM NOUN PUNCT ,PUNCT DET NOUN VERB SCONJ VERB NOUN PUNCT 
620,I told him to get the work done quickly.,Mi madre ha estado enferma por tres años.,PRON VERB PRON PART VERB DET NOUN VERB ADV PUNCT ,DET NOUN AUX AUX VERB ADP NUM NOUN PUNCT 
621,The dress suits you well.,Le dije que termine rápidamente con el trabajo.,DET NOUN VERB PRON ADV PUNCT ,PRON VERB SCONJ VERB ADV ADP DET NOUN PUNCT 
622,"I called you yesterday more than ten times, but you didn't answer.",Esa ropa te queda bien.,PRON VERB PRON NOUN ADJ ADP NUM NOUN PUNCT CCONJ PRON VERB ADV VERB PUNCT ,DET NOUN PRON VERB ADV PUNCT 
623,I wish I had an older sister.,"Te llamé ayer más de diez veces, pero no contestaste.",PRON VERB PRON VERB DET ADJ NOUN PUNCT ,PRON VERB ADV ADV ADP NUM NOUN PUNCT CONJ ADV VERB PUNCT 
624,When are you free?,Me hubiese gustado tener un hermana mayor.,ADV VERB PRON ADJ PUNCT ,PRON AUX VERB VERB DET NOUN ADJ PUNCT 
625,It's always hard to live with someone.,¿Cuándo estás libre?,PRON VERB ADV ADJ PART VERB ADP NOUN PUNCT ,PUNCT PRON AUX ADJ PUNCT 
626,You can't always get what you want.,Es siempre duro vivir con otra persona.,PRON AUX ADV ADV VERB PRON PRON VERB PUNCT ,AUX ADV ADJ VERB ADP DET NOUN PUNCT 
627,Why is your face suddenly turning red?,No puedes conseguir siempre lo que deseas.,ADV VERB DET NOUN ADV VERB ADJ PUNCT ,ADV AUX VERB ADV DET PRON NOUN PUNCT 
628,Answer me right away.,¿Por qué se te pone la cara roja tan repentinamente ?,VERB PRON ADV ADV PUNCT ,PUNCT ADP PRON PRON PRON VERB DET NOUN ADJ ADV ADJ PUNCT 
629,How much is this?,Contéstame enseguida.,ADV ADJ VERB DET PUNCT ,VERB ADV PUNCT 
630,How long have you been in Korea?,¿Cuánto es ésto?,ADV ADV VERB PRON VERB ADP PROPN PUNCT ,PUNCT PROPN AUX VERB PUNCT 
631,I'm going to meet my mom for lunch downtown.,¿Cuánto tiempo has estado en Corea?,PRON VERB VERB PART VERB DET NOUN ADP NOUN NOUN PUNCT ,PUNCT VERB NOUN AUX VERB ADP PROPN PUNCT 
632,Nowadays there is no one who does not have a cell phone.,Voy a comer afuera con mi madre.,ADV ADV VERB DET NOUN PRON VERB ADV VERB DET NOUN NOUN PUNCT ,AUX ADP VERB VERB ADP DET NOUN PUNCT 
633,My bag is gone!,Estos días no hay persona que no tenga celular.                                                                                                                                ,DET NOUN VERB VERB PUNCT ,DET NOUN ADV AUX NOUN PRON ADV VERB VERB PUNCT SPACE 
634,"I can live without water, but I can't live without music.",¡Desapareció mi bolso!,PRON VERB VERB ADP NOUN PUNCT CCONJ PRON AUX ADV VERB ADP NOUN PUNCT ,PUNCT VERB DET NOUN PUNCT 
635,Would you mind if I turned on the air conditioner?,"Puedo vivir sin agua, pero no puedo vivir sin música.",VERB PRON VERB ADP PRON VERB PART DET NOUN NOUN PUNCT ,AUX VERB ADP NOUN PUNCT CONJ ADV AUX VERB ADP NOUN PUNCT 
636,Can I see your passport?,¿Puedo prender el acondicionador de aire?,VERB PRON VERB DET NOUN PUNCT ,PUNCT AUX VERB DET NOUN ADP NOUN PUNCT 
637,"I'm over here, in the bookstore.",¿Puedo ver tu pasaporte?,PRON VERB ADV ADV PUNCT ADP DET NOUN PUNCT ,PUNCT AUX VERB DET NOUN PUNCT 
638,How old is your younger sister?,"Estoy aquí, en la librería.",ADV ADJ VERB DET ADJ NOUN PUNCT ,VERB ADV PUNCT ADP DET NOUN PUNCT 
639,I'd like to travel to many countries.,¿Cuántos años tiene tu hermana menor?,PRON AUX VERB PART VERB ADP ADJ NOUN PUNCT ,PUNCT NOUN NOUN VERB DET NOUN ADJ PUNCT 
640,"Ok, everyone, let's get down to business.",Quisiera viajar a muchos países.,INTJ PUNCT NOUN PUNCT VERB PRON VERB PART ADP NOUN PUNCT ,VERB VERB ADP DET NOUN PUNCT 
641,I love summer because I can go swimming.,"Bueno, señores, ¿vamos a comenzar?",PRON VERB NOUN ADP PRON VERB VERB NOUN PUNCT ,INTJ PUNCT NOUN PUNCT PUNCT AUX ADP VERB PUNCT 
642,Hello? Can I speak to Hyean?,Amo el verano porque puedo ir a nadar.,INTJ PUNCT VERB PRON VERB ADP PROPN PUNCT ,VERB DET NOUN SCONJ AUX AUX ADP VERB PUNCT 
